"721128978363367425 ","2016-04-16","00:12","JoJo","FurryJoJo","Auburn Graduate, Fox, Sports Fan, Shapeshifter, & Ineffably Optimistic. Is also @DaxelTheDeer! Made @GamingFurever & Co-owns @AlphaSuits! FA: JoJoJoshua","#WarEagle (@ Samford Stadium Hitchcock Field at Plainsman Park in Auburn, AL) https://t.co/wBbmZWc4AL",,,"32.59965014","-85.48964024","US","Auburn, AL","http://pbs.twimg.com/profile_images/705056102036148224/K2voT6SN_normal.jpg","2126","1124","47","en","http://www.twitter.com/FurryJoJo/status/721128978363367425"
"721128977952337920 ","2016-04-16","00:12","Susana Guzman Garza","susaguzmangarza","It's a challenge, but i like that shit.","Si, podría acostumbrarme a esto. (@ Malecón in La Paz, BCS) https://t.co/KuRqSKSLf4 https://t.co/6aO5UiyCmm",,,"24.16355225","-110.31633854","MX","La Paz, Baja California Sur","http://pbs.twimg.com/profile_images/716748602689781760/t3vrAjym_normal.jpg","90","221","5","es","http://www.twitter.com/susaguzmangarza/status/721128977952337920"
"721128975804837888 ","2016-04-16","00:12","Kimberlee","JellsRotten","Now available without a prescription. I'm in Hell & there's no Cheez-Its® I am twisted. You don't want none of this.","The Coop built by The Goop. Hoping to get it painted this weekend.… https://t.co/mhdvnghfc1",,,"38.7776","-95.1874","US","Baldwin City, KS","http://pbs.twimg.com/profile_images/652172624181616640/iWXyMw9t_normal.jpg","82","244","5","en","http://www.twitter.com/JellsRotten/status/721128975804837888"
"721129473052184576 ","2016-04-16","00:13","1/2 of REEFERmadness","CityboiCleve",,"So alone I'll remain. Seems like that's the only way to go out… https://t.co/Q0Oe6jDKpf",,,"39.7486","-75.55159999999999","US","Delaware, USA","http://pbs.twimg.com/profile_images/585578084423831552/UQSv3i3y_normal.jpg","170","203","1","en","http://www.twitter.com/CityboiCleve/status/721129473052184576"
"721129472536285184 ","2016-04-16","00:13","Xtreme Kustom Wheels","XKWheels","708-713-4447, 518 East 162nd st(159th) Street","Stay Tune! Doing another Jeep with a complete  JLAudio System &amp; New Fenders #xk4life #xkrimguys… https://t.co/CeKQvmwUe7",,,"41.601038","-87.604022","US","South Holland, IL","http://pbs.twimg.com/profile_images/81519688/xk_logo_from_below_zero_gold_normal.jpg","538","1097","13","en","http://www.twitter.com/XKWheels/status/721129472536285184"
"721129470745296896 ","2016-04-16","00:13","Nigel Mouncey","LordMounce",,"Drinking a Double IPA by @CedarCreek_Brew at @speakeasyindy — https://t.co/ZVldUai9Bm",,,"39.8488","-86.1414","US","Indianapolis, IN","http://pbs.twimg.com/profile_images/489470758/image_normal.jpg","160","435","14","en","http://www.twitter.com/LordMounce/status/721129470745296896"
"721129470028066817 ","2016-04-16","00:13","City Royals","CityRoyalsMens",,"Navy &amp; Olive stripe tees currently available with our white joggers! Sizes S-2XL // Shop OPEN… https://t.co/k2YxtMfcN9",,,"33.4980342","-111.9293223","US","Scottsdale, AZ","http://pbs.twimg.com/profile_images/702266375406923777/-XxTKsMx_normal.jpg","24","69","7","en","http://www.twitter.com/CityRoyalsMens/status/721129470028066817"
"721129467603718145 ","2016-04-16","00:13","LaMont Mann","MannKrafted",,"The final four day push before a few days out of commission.   The faces keep me guessing.  This… https://t.co/HSvNIOwLCd",,,"33.605292","-111.756463","US","Fountain Hills, AZ","http://pbs.twimg.com/profile_images/531661210459320320/JHZGr0bw_normal.jpeg","496","293","9","en","http://www.twitter.com/MannKrafted/status/721129467603718145"
"721129467234660352 ","2016-04-16","00:13","ERIK FOREY","Erik_Forey","Modelo, Consultor de imagen y Social Media Manager. Amante de la moda el LifeStyle y el marketing. Seguirme es un riesgo... Estas dispuest@ a tomarlo?","I'm at Hospital Ángeles del Pedregal - @hospitalangeles in Magdalena Contreras, DF https://t.co/BrdPufvItp",,,"19.31207487","-99.22104836","MX","Tlalpan, Distrito Federal","http://pbs.twimg.com/profile_images/593878523867111424/mYS-Negf_normal.jpg","4996","1735","29","es","http://www.twitter.com/Erik_Forey/status/721129467234660352"
"721129464428634112 ","2016-04-16","00:13","BIG SWOLE","DavidGRose1","CEO/Founder of Big Swole Productions,LLC & Big Green Egg Culinary Partner, TV personality, food columnist & Le Cordon Bleu Culinary School trained Chef.","#bikerchef. #bigswole #cheflife @biggreenegginc @chef_works #findthefork #chefworks… https://t.co/PYmexQSNdE",,,"33.85961416","-84.45528969999999","US","Vinings, GA","http://pbs.twimg.com/profile_images/678281547552849920/XQcLLaC4_normal.jpg","468","606","23","es","http://www.twitter.com/DavidGRose1/status/721129464428634112"
"721129463073939456 ","2016-04-16","00:13","Wayne Gross Jr.","campingsk8er","Just a college student trying to get by","YCP Formal w/ Cory :) (@ The Country Club Of York in York, PA) https://t.co/fUa0jSOETH",,,"39.92781058","-76.7454458","US","Pennsylvania, USA","http://pbs.twimg.com/profile_images/446772870430339073/MzdyI-M4_normal.jpeg","296","337","3","en","http://www.twitter.com/campingsk8er/status/721129463073939456"
"721129458229501953 ","2016-04-16","00:13","Travvvv","trawilson102","I'm not perfect, but everything I'm not made me everything that I am #NCAT16 #AggiesforChrist #Business Minded #Success Oriented","John 14:14🙏🏾 ..God, thank you. Without you I couldn't have done it.… https://t.co/skjj5agzYl",,,"36.05968","-79.88534","US","Greensboro, NC","http://pbs.twimg.com/profile_images/647478275720257536/9XwrKJPj_normal.jpg","451","439","5","en","http://www.twitter.com/trawilson102/status/721129458229501953"
"721129457092816896 ","2016-04-16","00:13","Great Googly Moogly","Mutiny32","Network Security, geek, Smartass, lover of nachos, marathon runner, giant Chiefs fan, Royals fan, beer.","Wichita! (@ Springhill Suites by Marriott in Wichita, KS) https://t.co/MEostuKPCT",,,"37.67171023","-97.41924830000001","US","Wichita, KS","http://pbs.twimg.com/profile_images/674759414251843584/VJD3kGX7_normal.jpg","994","2157","70","en","http://www.twitter.com/Mutiny32/status/721129457092816896"
"721129456790732800 ","2016-04-16","00:13","IG:: chiltyme","Chil_Fifthy","BEAUTIFUL :: KIND :: & PAINFULLY HONEST :: JUST LOVE/RESPECT HOW MY MIND WORKS! :: #THEALPHAFEMALE :: #CSFC","😍😜😝😛🤑😳😞😟😠😡☺️😗😙😘 @ Lithonia, Georgia https://t.co/VSNORbYnGN",,,"33.7127","-84.10590000000001","US","Lithonia, GA","http://pbs.twimg.com/profile_images/646334887251845121/mzs6uRWU_normal.jpg","821","687","23","es","http://www.twitter.com/Chil_Fifthy/status/721129456790732800"
"721129456606117889 ","2016-04-16","00:13","Chelsea Nicole Jones","Chelsea_NJ","Sigma Kappa. Feminist. Animal Lover. Pizza enthusiast. Netflix guru. @Gazbartone is my guy.","Relay for life with my favorite survivor ☺️ @ University of Memphis https://t.co/hyDugCLbJD",,,"35.119","-89.937","US","Memphis, TN","http://pbs.twimg.com/profile_images/718465814752583681/A1h3KCUl_normal.jpg","329","542","4","en","http://www.twitter.com/Chelsea_NJ/status/721129456606117889"
"721129455805042689 ","2016-04-16","00:13","City of Hope JOBS","cityofhopejobs","Open house event on 4/23/16 for #nurses - Register Now! https://t.co/i9nkgAEgc2 - Science Day #postdoc event on 5/12/16 - Register Now! https://t.co/tL2OVqQz5B","#Nursing alert: Patient Care Assistant - East Unit A: Full Time/Nights (2... | City of Hope | #LosAngeles, CA https://t.co/WP0kKtnmLC",,,"34.0522342","-118.2436849","US","Los Angeles, CA","http://pbs.twimg.com/profile_images/605870037077868544/DSqpt4WG_normal.png","1108","1541","161","en","http://www.twitter.com/cityofhopejobs/status/721129455805042689"
"721129455444307968 ","2016-04-16","00:13","Speedway Jobs","SpeedwayJobs","Rethink Speedway. It's more than a convenience store... It's your career opportunity!","#Retail #Job alert: Shift/Team Leader-Retail Sales | Speedway | #Advance, NC https://t.co/CzGCZUaLBd #Jobs #Hiring",,,"35.9412419","-80.4096909","US","North Carolina, USA","http://pbs.twimg.com/profile_images/588378982485110784/CoHZRLK7_normal.png","217","27","381","en","http://www.twitter.com/SpeedwayJobs/status/721129455444307968"
"721129454945181697 ","2016-04-16","00:13","TTN Modesto","TotalTrafficMOD","Traffic for Stockton/Modesto, powered by Total Traffic Network.","Vehicle on fire in #Keyes on Hwy 99 SB after Keyes Rd, slow traffic back to EL Camino Ave, delay of 4 mins #traffic https://t.co/9aGjDSDqqO",,,"37.54492","-120.9013","US","California, USA","http://pbs.twimg.com/profile_images/439097203009658880/d3zU32Nm_normal.png","37","8","7","en","http://www.twitter.com/TotalTrafficMOD/status/721129454945181697"
"721129453208879104 ","2016-04-16","00:13","Robert Smith","TwistedThistle",,"Great SMaSH nice aroma great balance tastes like a much bigger beer. Cheers!... (S.M.A.S.H. Citra) https://t.co/B2ZYGxPVB5",,,"38.5824","-90.4058","US","Kirkwood, MO","http://pbs.twimg.com/profile_images/491416842146025472/PBSVVZQ1_normal.jpeg","161","878","18","en","http://www.twitter.com/TwistedThistle/status/721129453208879104"
"721129452709683201 ","2016-04-16","00:13","Adventist Health NCN","JoinAHNCN",,"Can you recommend anyone for this #Nursing #job? https://t.co/xLJLpG83Bx #StHelena, CA #Hiring",,,"38.539515","-122.474054","US","Deer Park, CA","http://pbs.twimg.com/profile_images/2658886627/c6991b13bf0a9572842dc8d1f93c3425_normal.jpeg","66","40","49","en","http://www.twitter.com/JoinAHNCN/status/721129452709683201"
"721129452202291200 ","2016-04-16","00:13","Cris Mueller","CrisMueller","Food, Beverage, and Travel keep me busy writing. Copywriter, Storyteller, Wanderluster, Austinite - EatGrazeLove","Time for some bells! #stuffed #stuffedpeppers #tacostuffedpeppers… https://t.co/vMA8clyjeg",,,"30.2672","-97.76390000000001","US","Austin, TX","http://pbs.twimg.com/profile_images/532234047452246016/87RxhOaQ_normal.jpeg","506","263","42","en","http://www.twitter.com/CrisMueller/status/721129452202291200"
"721129452068028417 ","2016-04-16","00:13","סטיבן סילבה","medixsteve","Specialized in providing emergency medical treatment, limited primary health care protection and evacuation from a point of injury or illness.","That pull up life 👍🏼👍🏼👍🏼                                                         #medixsteve… https://t.co/f8Q4sIeS4l",,,"34.1400693","-118.3837522","US","Los Angeles, CA","http://pbs.twimg.com/profile_images/718685066503688193/R1XxHRdj_normal.jpg","374","399","43","en","http://www.twitter.com/medixsteve/status/721129452068028417"
"721129450449080320 ","2016-04-16","00:13","Grant Stern","grantstern","#Miami native @MiamiHeat STH, Mortgage Broker @morningsidemtg #RealEstate consultant @condoterminator writes @HuffingtonPost & #OnlyinMiami show host @880thebiz","Chicken, peanut, mixed green bowl with coconut rice #foodporn @ Sakaya https://t.co/fCYkhgPeFh",,,"25.80905","-80.19353","US","Miami, FL","http://pbs.twimg.com/profile_images/558678497908899841/nc4UAaMQ_normal.jpeg","6642","6477","247","en","http://www.twitter.com/grantstern/status/721129450449080320"
"721129449849241600 ","2016-04-16","00:13","Jamie Albanese","GettinCraftyGrl","I LOVE Craftin' and Stampin'! A Manger, Team Leader and Craft Coach incl Sales of AMAZING Award Winning Craft Supplies! I post on my blog Daily, come by often","Oh yeah!! I'm playing and #CardMaking #PaperCrafting #RubberStamping at #OnStage2016… https://t.co/KIclIvI6tu",,"1","40.76695058","-111.89494931","US","Salt Lake City, UT","http://pbs.twimg.com/profile_images/673868307804479489/wizDIH4K_normal.jpg","705","962","39","en","http://www.twitter.com/GettinCraftyGrl/status/721129449849241600"
"721129448767098880 ","2016-04-16","00:13","♕Christian Cabrera♔","KristhianCabMX","El más intelectual de los frívolos y el más frívolo de los intelectuales. Actor, cantante, standopero, locutor en Muy Malos Radio & conductor en Canal G TV.","Visitando al mejor patrocinador d'l mundo mundial!!! (@ Estetica Gerlini in Mexico DF) https://t.co/0pxbIV1Xf6",,,"19.39421215","-99.17741645","MX","Benito Juárez, Distrito Federal","http://pbs.twimg.com/profile_images/717100584709435392/5y3Kyne5_normal.jpg","1528","2322","12","es","http://www.twitter.com/KristhianCabMX/status/721129448767098880"
"721129448200777728 ","2016-04-16","00:13","TTWN Sacramento","TotalTrafficSMF",,"Disabled vehicle, center lane blocked in #Sacramento on Hwy 99 SB before Florin Rd, stop and go traffic back to Fruitridge Rd #traffic",,,"38.4961","-121.4458","US","Florin, CA","http://pbs.twimg.com/profile_images/439100701575086080/SIA7AAGG_normal.png","319","266","32","en","http://www.twitter.com/TotalTrafficSMF/status/721129448200777728"
"721129445503934465 ","2016-04-16","00:13","monicaⓋ","Monicerz","don't be mad get glad","fuzzy @ Edinboro, Pennsylvania https://t.co/sTj2ouGyX6",,,"41.8766","-80.1317","US","Edinboro, PA","http://pbs.twimg.com/profile_images/720781149476405252/BvTt8Xy1_normal.jpg","376","345","4","es","http://www.twitter.com/Monicerz/status/721129445503934465"
"721129445415919616 ","2016-04-16","00:13","miguel angel soto","miguelangelso28","im a latino who likez 2 parti n hav fun n new t2 diz twitter shyt,letz make sum friendz n","#Saludos_Mi_Gente🍓🍓🍓🍫🍫🍫💙💙🌙🌙🌹🐬🌹🐬🌙🌙 @ Grand Concourse https://t.co/33fUaLUXWe",,,"40.83055556","-73.92083332999999","US","Bronx, NY","http://pbs.twimg.com/profile_images/717892843243700224/ZiK9Mvhm_normal.jpg","67","508","7","en","http://www.twitter.com/miguelangelso28/status/721129445415919616"
"721129445365387264 ","2016-04-16","00:13","Loli Santanelli","DStnelli81","I love to laugh mostly at myself, I'm addicted to books and coffee. Crosswords, jigzaw puzzles, music and movies are my hobbies.","#polloconmolepoblano #yummy #spicy 😋😋 @ Las Fuentes Morton Grove Restaurant https://t.co/v13qOS8pTO",,,"42.04354","-87.79868","US","Morton Grove, IL","http://pbs.twimg.com/profile_images/709041372083265536/Axy_Sbk1_normal.jpg","42","133","9","es","http://www.twitter.com/DStnelli81/status/721129445365387264"
"721129444501360640 ","2016-04-16","00:13","cristiano basciu","BasciuCristiano","Celebrity hairdresser,social butterfly and a Italian dramatic boy living in London!!!","Meeting old friends!!!! #Miami#miamibeach#Holliday @ Twist https://t.co/PIvui4OGbt",,,"25.781669","-80.1322673","US","Miami Beach, FL","http://pbs.twimg.com/profile_images/2684517370/bc1cc734694bf8e367eddf285e99620d_normal.png","252","259","7","en","http://www.twitter.com/BasciuCristiano/status/721129444501360640"
"721129443268366337 ","2016-04-16","00:13","Julie & Jeff Frisbee","juliekuzfrisbee","Jeff & I have been married for over 14 years. He is in sales & I am a SAHM of 3 amazing boys (a teenager and 2 toddlers). I am also an It Works Distributor.","🌹90 days on our ultimate pack! Contact me today to save up to 50%… https://t.co/ngrun4UwL0",,,"34.7711","-84.97150000000001","US","Dalton, GA","http://pbs.twimg.com/profile_images/707612538083647488/xU-JrlSq_normal.jpg","23","63","2","en","http://www.twitter.com/juliekuzfrisbee/status/721129443268366337"
"721129441062100992 ","2016-04-16","00:13","TTN El Paso","TotalTrafficELP",,"Accident cleared in #ElPaso on I 10 WB near Hawkins Blvd #traffic https://t.co/nZ2qPGUpz9",,,"31.77155","-106.3772","US","El Paso, TX","http://pbs.twimg.com/profile_images/439093302327906304/Dro5zYaU_normal.png","389","472","23","en","http://www.twitter.com/TotalTrafficELP/status/721129441062100992"
"721129438558187520 ","2016-04-16","00:13","i'm Paco Parker","Paco0rozco","hincha de River, hincha de Rayados","De la pandilla , toda la vida, Experiencia Rayada (@ Estadio BBVA Bancomer - @rayados in Guadalupe, NL) https://t.co/T8g79yx9Gp",,,"25.66928164","-100.24439675","MX","Guadalupe, Nuevo León","http://pbs.twimg.com/profile_images/718290622260604931/1HtYOpPb_normal.jpg","1560","1533","14","es","http://www.twitter.com/Paco0rozco/status/721129438558187520"
"721129438465818624 ","2016-04-16","00:13","TTN El Paso","TotalTrafficELP",,"Accident cleared in #ElPaso on I 10 EB at FM-2316 #traffic https://t.co/nZ2qPGUpz9",,,"31.759","-106.3555","US","El Paso, TX","http://pbs.twimg.com/profile_images/439093302327906304/Dro5zYaU_normal.png","389","472","23","en","http://www.twitter.com/TotalTrafficELP/status/721129438465818624"
"721129437358596096 ","2016-04-16","00:13","CinciBeerGuy","CinciBeerGuy","Self proclaimed beer connoisseur, home brewer, and jet settin' fool","The ginger and fruity flavors make me think this is supposed to be a holid... (Romantic Chemistry) https://t.co/O6m8pPdQVi",,,"39.3532","-84.3634","US","West Chester, OH","http://pbs.twimg.com/profile_images/2617102996/HG68ird1_normal","225","243","12","en","http://www.twitter.com/CinciBeerGuy/status/721129437358596096"
"721129437178236928 ","2016-04-16","00:13","♦️TLOInc.Forever®♦️","tloinc_forever","TLOInc.~forever~® LLT.,N.Y.C. PromotionalConcepts Music«»Fashion«»Living Philanthropist","I'm at @BedBathBeyond in Bronx, NY https://t.co/gUsCwnPVpf",,,"40.82306537","-73.93056393000001","US","Bronx, NY","http://pbs.twimg.com/profile_images/378800000550071960/1999bbd0bffc9f06711990d848423c4d_normal.jpeg","2407","919","28","en","http://www.twitter.com/tloinc_forever/status/721129437178236928"
"721129436200833024 ","2016-04-16","00:13","JP","JP__Perez_","Executive pastor Calvary Kendall, passionate about God and building up leaders. Liberty U alumni.","Date night with my ride or die @susanaperezmv we live in the best place on the planet. @ Lorelei… https://t.co/BDO0BNJk1l",,,"24.919631","-80.633689","US","Islamorada, FL","http://pbs.twimg.com/profile_images/535296937642442752/kfRbWttJ_normal.jpeg","739","456","17","en","http://www.twitter.com/JP__Perez_/status/721129436200833024"
"721129435810951168 ","2016-04-16","00:13","Boz","TheRealBoz","Postcards from hindsight.","Enjoying a Mocking Baered Episode 1: Lost On Lacto Island — https://t.co/wxzWvupJCX",,,"39.7693","-105.007","US","Denver, CO","http://pbs.twimg.com/profile_images/1119212863/Banana_Grabber_by_frostedflames_normal.jpg","97","815","6","en","http://www.twitter.com/TheRealBoz/status/721129435810951168"
"721129433977868289 ","2016-04-16","00:13","TTN Phoenix","TotalTrafficPHX","Call in your Traffic Problems - 602-374-6300","Accident --- off to the side in #Phoenix on I - 10 EB east of 51st Ave --- Exit 139, stop and go traffic back to 59th Ave --- Exit 138",,,"33.46264","-112.1691","US","Phoenix, AZ","http://pbs.twimg.com/profile_images/439098732013838337/8q9ZLgpa_normal.png","1096","192","78","en","http://www.twitter.com/TotalTrafficPHX/status/721129433977868289"
"721129433713799168 ","2016-04-16","00:13","Emily","andemily","pastry cook.","💙 @ Lake Peachtree https://t.co/xSTszoxcSE",,,"33.4016242","-84.5801689","US","Peachtree City, GA","http://pbs.twimg.com/profile_images/674786794077057024/ItK0DGN5_normal.jpg","274","448","4","en","http://www.twitter.com/andemily/status/721129433713799168"
"721129433109819392 ","2016-04-16","00:13","Seth Thornberry","stm555","Chach. Also, Husband, Father and Systems Architect @ SoftLayer, an IBM company.","Celebrating my promotion with my favorite ladies. (&amp; some Rip Van Winkle) (@ Smoke Plano) https://t.co/bLXqLOwWWx https://t.co/8ZGX9A8h95",,,"33.030024","-96.79399100000001","US","Plano, TX","http://pbs.twimg.com/profile_images/529290843954241536/zjsiDBbr_normal.jpeg","280","439","25","en","http://www.twitter.com/stm555/status/721129433109819392"
"721129432606502912 ","2016-04-16","00:13","tommy lipnick","tommylipnick","Musician, Producer, Entrepreneur, Philanthropist","Amazing event launching the Parker Foundation for Cancer Research @ Holmby Park https://t.co/ANaaqbgsvm",,,"34.0731868","-118.4302788","US","Los Angeles, CA","http://pbs.twimg.com/profile_images/2189184495/G4_normal.jpg","1818","364","29","en","http://www.twitter.com/tommylipnick/status/721129432606502912"
"721129432593772544 ","2016-04-16","00:13","Dallas Johnson","DallasJ1977","Too much to type. Just ask me.","So me..😑😑😑 @ Lakewood, Ohio https://t.co/lX3cqwx46q",,,"41.48083333","-81.80027778","US","Lakewood, OH","http://pbs.twimg.com/profile_images/716222944956039168/05su4el4_normal.jpg","297","1045","22","en","http://www.twitter.com/DallasJ1977/status/721129432593772544"
"721129432241610752 ","2016-04-16","00:13","Buda Da Future","BudaDaFuture","(Production Duo w/ @Grandzmuzik) @JazzyAmra @Estelledarlings @TheLOX @50Cent @KushedGod @WycleJean @nipseyhussle @Dave_east @kattrockell mgmt: @wayno119","@DaveEast on the #HateMeNowTour doing a promo run  Money Prod.by 🇺🇸's Fav Duo @buda_and_grandz… https://t.co/sPgeRCxTIQ",,"1","40.7142","-74.0064","US","Manhattan, NY","http://pbs.twimg.com/profile_images/572631850440634368/27GzKDJR_normal.jpeg","6288","2779","106","en","http://www.twitter.com/BudaDaFuture/status/721129432241610752"
"721129431218196486 ","2016-04-16","00:13","Akaela Ramon","akaelaraee8","UTRGV. Esteban❤️.","It's official! So excited for our summer job! Can't wait to start… https://t.co/J6Y5pLtEPk",,,"26.07938152","-97.16179568","US","South Padre Island, TX","http://pbs.twimg.com/profile_images/711283356869087233/-pVETF0g_normal.jpg","89","127",,"en","http://www.twitter.com/akaelaraee8/status/721129431218196486"
"721129431138508804 ","2016-04-16","00:13","Zel Cabrera","Mademoi_Zel","| Bonita, como aquellos juguetes | ★ | Soy la Clark Kent del copywriter, pero sin capa | Mi vida gira en torno a 900 palabras |","Acompañando al novio barbón (@ El Catrín Barbershop - @elcatrinmexico in Benito Juárez, DF w/ @joelossorio) https://t.co/JZlJNkkudz",,,"19.39261095","-99.15136907999999","MX","Benito Juárez, Distrito Federal","http://pbs.twimg.com/profile_images/713673438293008384/6KVRrgVc_normal.jpg","1309","834","15","es","http://www.twitter.com/Mademoi_Zel/status/721129431138508804"
"721129430089916417 ","2016-04-16","00:13","Scott T.","staylorme",,"Drinking a Dwarf Invasion by @bnektar at @sublimealehouse — https://t.co/vurnIaI0vT",,,"33.1352","-117.19","US","San Marcos, CA","http://pbs.twimg.com/profile_images/573203167527088130/3e4y7kCB_normal.jpeg","41","69","2","en","http://www.twitter.com/staylorme/status/721129430089916417"
"721129427774517248 ","2016-04-16","00:13","Winn-Dixie Careers","WDCareers","Join our WINN-ing team and help make the lives of our customers and fellow associates FUN! Winn-Dixie is one of the nation's largest food retailers.","Can you recommend anyone for this #Retail #job? https://t.co/FJbieExuf7 #DIBERVILLE, MS #Hiring",,,"30.4391071","-88.8982462","US","D'Iberville, MS","http://pbs.twimg.com/profile_images/636616310403653633/sIs1Iqbk_normal.png","527","252","334","en","http://www.twitter.com/WDCareers/status/721129427774517248"
"721129427715940352 ","2016-04-16","00:13","Brittany Richards","brichhhhh","i just eat a lot of chicken","Hello friends, meet Willow, the newest addition to the fam 😍 @… https://t.co/t89p7c7I6e",,,"30.5469","-88.6726","US","Mississippi, USA","http://pbs.twimg.com/profile_images/715183944380063744/Z4HAxjHv_normal.jpg","158","190",,"en","http://www.twitter.com/brichhhhh/status/721129427715940352"
"721129426428235777 ","2016-04-16","00:13","barbrix","barbrix","We're a wine bar in the Silver Lake neighborhood of LA, good food, good wine, good prices. White Zinfandel...NOT!","Señor Pepe Aguilar himself is in town tomorrow! And he will be kicking off the new season of the… https://t.co/1jUH3yBw1C",,,"34.10407","-118.27294","US","Los Angeles, CA","http://pbs.twimg.com/profile_images/78134463/barbrixlogoalt_normal.png","2178","521","196","en","http://www.twitter.com/barbrix/status/721129426428235777"
"721129424712765440 ","2016-04-16","00:13","Robert F","fayta9","I drink beer and watch the NY Rangers, on occasion at the same time","Hanging by the fire pit with a few of these - Drinking a Nirvana IPA @ Lyndhurst, NJ - https://t.co/O2Vwi1dkPS #photo",,,"40.808","-74.12179999999999","US","Lyndhurst, NJ","http://pbs.twimg.com/profile_images/1646130608/197383_1010888045358_1619707993_34471_1483_n_normal.jpg","96","230","16","en","http://www.twitter.com/fayta9/status/721129424712765440"
"721129424024788993 ","2016-04-16","00:13","Giovanna Armas","FamousGio","Master in Innovation, I´m a fun loving  Tech girl & Giants Fan...","Deliiiii #foodie #deli #pornfood #instafood #instalike #colorful #french #food #lunch #friday… https://t.co/tNu3NzuYE0",,,"21.16307211","-86.82111025","MX","Benito Juárez, Quintana Roo","http://pbs.twimg.com/profile_images/2977060520/48099d3b71941e31bd6bb641c02a32e6_normal.jpeg","794","568","20","es","http://www.twitter.com/FamousGio/status/721129424024788993"
"721129424012316673 ","2016-04-16","00:13","Ana Gonzalez","willisana","SOÑADORA CONSTANTE ..LOS CAMBIOS  M MOTIVAN...LA MUSICA LO MEJOR D LA VIDA ...ESPOSA ORGULLOSA DE UN SOBRECARGO  !! PROXIMO A  VOLVER A VOLAR !!","Cafe con mi gran amiga @Sonia (@ Trebol Dos 81 in Ciudad de México, Distrito Federal) https://t.co/CqtCk6zBd6",,,"19.38854673","-99.13633272","MX","Benito Juárez, Distrito Federal","http://pbs.twimg.com/profile_images/719679543510827008/pUbUXkKY_normal.jpg","427","424","3","es","http://www.twitter.com/willisana/status/721129424012316673"
"721129423731171328 ","2016-04-16","00:13","maurices careers","mauricescareers","Love Fashion? Join our team! @maurices is a world-class specialty retailer that caters to young-at-heart fashionistas. Check here for #job opportunities.","This #Retail #job might be a great fit for you: Sales Associate - https://t.co/gNl5p45LCM #TraverseCity, MI #Hiring https://t.co/68yJob4pfU",,,"44.7630567","-85.6206317","US","Traverse City, MI","http://pbs.twimg.com/profile_images/415180880005455872/g0aid-0R_normal.png","386","26","283","en","http://www.twitter.com/mauricescareers/status/721129423731171328"
