"721118800599523328 ","2016-04-15","23:31","George Benson","bensoron",,"https://t.co/4ldwMxTJLN",,,"37.69916326","-123.01190847","US","California, USA","http://pbs.twimg.com/profile_images/619670042582495232/Re9tAotO_normal.png","3",,,"es","http://www.twitter.com/bensoron/status/721118800599523328"
"721118800360308738 ","2016-04-15","23:31","Phil Daru","PhilBamBamDaru","Phil Daru owner of Daru Fitness Performance, strength conditioning specialist, nutrition consultant, pro MMA fighter, competitive bodybuilder, Powerlifter","It's time to eat!!! 🌪🌪 @teciatorres  teciatorresufc with repostapp. ・・・ Weight-in #ufcTampa… https://t.co/OMqvXp48ws",,,"26.30203313","-80.20131111000001","US","Coconut Creek, FL","http://pbs.twimg.com/profile_images/654476878636453892/Q0gGz0GH_normal.jpg","23","11",,"en","http://www.twitter.com/PhilBamBamDaru/status/721118800360308738"
"721118800079298560 ","2016-04-15","23:31","Annie Parker IFBBPro","SassyFitChick","✨IFBB Bikini Pro ✨3x Bikini Champ ✨Online Nutritionist & Trainer ✨Bikini Posing Coach ✨EAS Athlete ✨SassyFitChick@iCloud.Com✨","A little #bts shot by @FouFou_MaKeUp during our @ironmanmagazine at @metroflexlbc 😍 That's a… https://t.co/vA1jtm4GMU","1","1","33.862725","-118.155247","US","Long Beach, CA","http://pbs.twimg.com/profile_images/677741222694428672/2Q5QRsAk_normal.jpg","3616","1066","46","en","http://www.twitter.com/SassyFitChick/status/721118800079298560"
"721118800020680706 ","2016-04-15","23:31","Matt Daugherty","DaughertyMatt","searching the world for good beer, great music and awesome food.","Diggin' the wine barrel. Tons of dry red n... (The Quadfather (Cabernet Sauvignon Barrels)) https://t.co/voe0PkO7lP #photo",,,"40.5227","-80.24809999999999","US","Moon, PA","http://pbs.twimg.com/profile_images/2165675976/image_normal.jpg","468","1348","3","en","http://www.twitter.com/DaughertyMatt/status/721118800020680706"
"721118791711600640 ","2016-04-15","23:31","Meaghan B Murphy","meaghanbmurphy","Executive Editor of @goodhousemag, @acefitness fit pro, gel nail addict, Mom x3, #JerseyStrong, #GlutenFree, Instagram = @meaghanbmurphy","Strong, confident Mom = Strong, confident daughter. I'm empowered by the need to be an example… https://t.co/fJYOXpmCCw",,,"40.766538","-73.983452","US","Manhattan, NY","http://pbs.twimg.com/profile_images/2725964967/4d5fcbee540ae61c649151483a2aaaa6_normal.jpeg","6921","187","269","en","http://www.twitter.com/meaghanbmurphy/status/721118791711600640"
"721118791535435776 ","2016-04-15","23:31","Chris Kelly","cgkelly","Senior Producer of CBC's This Is That. Musician. Offline specialist.","#makedonalddrumpfagain or turn him into a Piñata @ New York, New York https://t.co/TDHWRSeQ41",,,"40.7142","-74.0064","US","Manhattan, NY","http://pbs.twimg.com/profile_images/3088835767/3ffb32984dfea5ca55ca7ecb727be55f_normal.jpeg","3018","891","110","en","http://www.twitter.com/cgkelly/status/721118791535435776"
"721118791002886144 ","2016-04-15","23:31","Beer Wench Georgia","BeerWenchGA","The Beer Wench Georgia is a BJCP certified beer judge who posts on craft breweries, beer travel, and beer & food pairings.","Drinking a Double Cannon by @HeavySeasBeer at @ianinathens — https://t.co/eSknQHO8xB",,,"33.9119","-83.3137","US","Athens, GA","http://pbs.twimg.com/profile_images/505025186899308545/q82PihFa_normal.jpeg","205","104","18","en","http://www.twitter.com/BeerWenchGA/status/721118791002886144"
"721118788381491200 ","2016-04-15","23:31","AJ Clayborne","dunadanjets","Law Student and Jow Ga Practitioner","My bday and Jackie Robinson day. I have my fiancee w me and the first at bat I see is Big Pappi… https://t.co/5xNYDgQqnf",,,"42.34644218","-71.0971914","US","Boston, MA","http://pbs.twimg.com/profile_images/422071769454116864/rrf-Yo6d_normal.jpeg","208","487","2","en","http://www.twitter.com/dunadanjets/status/721118788381491200"
"721118787827855360 ","2016-04-15","23:31","Gretch","gspeicher22","Happiness is a choice! Forever Blessed and Thankful :)","Passionate Embrace....(Uncomfortable Silence) @gristhouse… https://t.co/Cre1cxOzjv",,,"40.478634","-79.97221399999999","US","Millvale, PA","http://pbs.twimg.com/profile_images/474376787053805568/mSjxd_SR_normal.jpeg","275","646","8","en","http://www.twitter.com/gspeicher22/status/721118787827855360"
"721118787391500288 ","2016-04-15","23:31","Yoda","yodauncut","The Force is strong with you, my Padawan. Here you have come, for wisdom you seek. (Parody account)","From his students-then truly, he shall be a teacher will appear. When you are not. To the center of the men of old; seek what they sought.",,,"35.0110319","-118.0102653","US","California, USA","http://pbs.twimg.com/profile_images/650379772854300672/Ps1bgmSS_normal.png","45","135","10","en","http://www.twitter.com/yodauncut/status/721118787391500288"
"721118786250764289 ","2016-04-15","23:31","Jess O'Reilly","SexWithDrJess","TV Host - @PlayboyTV's SWING ~ #Sex & #Relationship Expert (PhD) ~ Best-Selling Author ~ Counsellor ~ Keynote Speaker/Facilitator","Visiting the spot where he proposed about 13 years ago. ❤️😍 @ Edwards Gardens https://t.co/we0dRnoBez","1",,"43.73388889","-79.35944444","CA","Toronto, Ontario","http://pbs.twimg.com/profile_images/2788900460/6b4de13aef822cba710e8df4dea58ff5_normal.png","18756","15480","365","en","http://www.twitter.com/SexWithDrJess/status/721118786250764289"
"721118784564695040 ","2016-04-15","23:31","Varsenik Wilson","mansonrepublica","#isupportmarkdiba","Transportation Gallery - 999 Steam Locomotive @ Museum of Science and Industry, Chicago https://t.co/11QTDcESKS",,,"41.79101199","-87.58293241","US","Chicago, IL","http://pbs.twimg.com/profile_images/618192805379313664/eKA0jFyN_normal.jpg","1104","860","31","en","http://www.twitter.com/mansonrepublica/status/721118784564695040"
"721118783876820992 ","2016-04-15","23:31","Kaitlyn Jeffries ♡","kaitlynjeffries","be kind to one another ; IG: kaitlynmariejeffries","Well that concludes #dentalhygieneweek !!! #niagaracollege senior #dentalhygiene students lit up… https://t.co/kVO3zhJrxy",,,"43.01510485","-79.26292345","CA","Welland, Ontario","http://pbs.twimg.com/profile_images/708195519886000128/2hG6urqN_normal.jpg","676","1622","5","en","http://www.twitter.com/kaitlynjeffries/status/721118783876820992"
"721118783247675392 ","2016-04-15","23:31","Niki Blaker","NikiBlaker","Design strategist. AIGA Incoming Presidents Council Chair. Quipsologies contributor. Conveniently married to a developer. Known to be bubbly.","It's Friday! We've got the seat by the open window at our favorite neighborhood restaurant. @… https://t.co/6XhIj6bief",,,"42.3608665","-71.0566788","US","Boston, MA","http://pbs.twimg.com/profile_images/644224724474707968/wSY1UAn3_normal.jpg","1858","1056","124","en","http://www.twitter.com/NikiBlaker/status/721118783247675392"
"721118782043910144 ","2016-04-15","23:31","Karissa Paxton","SCConcierge","Co-Owner of Coastside Couture Wedding/ Event Design, Planner & Concierge. Loves dogs, outdoors, food & running. Lucky to be living in the beautiful Monterey Bay","It's a spectacular day on the #coastside for a #coastsidecouture… https://t.co/mpm44L9cBs",,,"37.50399428","-122.48395535","US","El Granada, CA","http://pbs.twimg.com/profile_images/1304118449/Karissa_profilepix_normal.jpg","900","294","57","en","http://www.twitter.com/SCConcierge/status/721118782043910144"
"721118781733359617 ","2016-04-15","23:31","Argosy Casino KC","ArgosyKC_Jobs","A Penn National Gaming property, Argosy Casino Hotel & Spa offers gaming excitement, luxury hotel rooms, fine dining and a rejuvenating spa.","Argosy Casino Hotel &amp; Spa: Director Lounge Bartender (#Riverside, MO) https://t.co/epQIk7L8Bz #Hospitality #Casino https://t.co/4iUWCPxGvt",,,"39.1605504","-94.6219162","US","Riverside, MO","http://pbs.twimg.com/profile_images/378800000468699401/d7064f571ef68bb6f10256aba2be8e38_normal.jpeg","206","137","81","it","http://www.twitter.com/ArgosyKC_Jobs/status/721118781733359617"
"721118780743643140 ","2016-04-15","23:31","OverAttired Vintage","OverAttired","OverAttired Vintage Fashion                337 14th St in beautiful Oakland, California! Open Daily 11am-8pm https://t.co/h8hUnvkJge","I’m cosplaying a shopkeeper today at #OverAttired #vintagefashion. #1930s or #1940s green &amp;… https://t.co/U7QN36TTjA",,,"37.8030548","-122.2683792","US","Oakland, CA","http://pbs.twimg.com/profile_images/119788596/Twitter_normal.jpg","345","363","14","en","http://www.twitter.com/OverAttired/status/721118780743643140"
"721118779850104832 ","2016-04-15","23:31","JenCrawford","jcrawford720","Michigan girl at heart, with a brief stay in Bama. Tweet's running fun, camping adventures, my awesome husband, our spoiledBoston Terriers & college football!","1st camping outing of the season. Last time we were here #crawbaby… https://t.co/oP0y4u848v",,,"42.34394","-84.9980999","US","Michigan, USA","http://pbs.twimg.com/profile_images/3392150694/e284335443f374bea8ea321c437617bb_normal.jpeg","348","593","10","en","http://www.twitter.com/jcrawford720/status/721118779850104832"
"721118779665567744 ","2016-04-15","23:31","Brian Adler","badlerJCC","Jewish Communal Professional/Development Director. Just a guy who's passionate about life...","#shabbatdinner Plans Tonite...BBQ Chicken with Chipotle BBQ sauce,… https://t.co/iDjg7lz7X2",,,"39.91875133","-74.92830536","US","Ramblewood, NJ","http://pbs.twimg.com/profile_images/661045176304082944/5djo05fg_normal.jpg","395","567","10","en","http://www.twitter.com/badlerJCC/status/721118779665567744"
"721118779485212672 ","2016-04-15","23:31","Jess","lifeandkeopi","I sing, dance instead of walk, and my drawings are mediocre.","Just posted a photo @ Main Street Arts Festival Sundance Square Stage https://t.co/lLsOv0iOdn",,,"32.75482692","-97.33178150000001","US","Fort Worth, TX","http://pbs.twimg.com/profile_images/697379161992630272/ybXr-86o_normal.jpg","383","1198","5","en","http://www.twitter.com/lifeandkeopi/status/721118779485212672"
"721118778369687552 ","2016-04-15","23:31","Héctor Zerpa","Hectorlzerpa","ACNÉ","Thank you for everything  my friend @realdonaldtrump @ Trump International Beach Resort https://t.co/gWmTjTCgQs",,,"25.94339011","-80.12026505","US","Sunny Isles Beach, FL","http://pbs.twimg.com/profile_images/715973971980763136/Sges9PyY_normal.jpg","4428","459","135","en","http://www.twitter.com/Hectorlzerpa/status/721118778369687552"
"721118777673277441 ","2016-04-15","23:31","Sab","sscardamaglia","Just livin' on the Edge ⚾️ WVHS '17","Beat Neuqua 👊🏼💚 @ Neuqua Valley High School https://t.co/Jb9nUmkIhH","2","2","41.70762","-88.196011","US","Naperville, IL","http://pbs.twimg.com/profile_images/713954903392133120/H8_aKXHE_normal.jpg","540","467","5","es","http://www.twitter.com/sscardamaglia/status/721118777673277441"
"721118776733929472 ","2016-04-15","23:31","Illuminate","IlluminateITW","Illuminate The World Ministries | Hog Mob Ministries  Booking: DaPark38@yahoo.com • 702.300.6781 Son of God, Minister, Artist, Freedom Fighter","S/O to @truvineapparel for the fresh tee &amp; @gkapparel for the dope headwear! These are 2 other… https://t.co/ya0vLy7Juh",,,"37.91","-122.047","US","Walnut Creek, CA","http://pbs.twimg.com/profile_images/707682978390872066/Yz8OMdtr_normal.jpg","1225","1109","29","en","http://www.twitter.com/IlluminateITW/status/721118776733929472"
"721118773629968384 ","2016-04-15","23:31","Spike B","Dr_Mean","hard to explain","my first and only #coachella2016 selfie #feelthebern #unicorn #beard #nice #berniesanders @… https://t.co/kOvhxTWgT3",,,"33.67997","-116.23722","US","California, USA","http://pbs.twimg.com/profile_images/709990678521122816/U_pFQeIf_normal.jpg","209","316","7","en","http://www.twitter.com/Dr_Mean/status/721118773629968384"
"721118773525291009 ","2016-04-15","23:31","Brandon Hochman","split_lanes","Snowboarding, Motorcycles and anything in between","gopro @foxracingshox heartlandbiker @bartelslabrammo vanceandhines thespeedmerchant @alpinestars… https://t.co/r1YN4Q5ARC",,,"34.8599","-111.789","US","Sedona, AZ","http://pbs.twimg.com/profile_images/541486293298208768/r5bgLZQq_normal.jpeg","77","23","9","en","http://www.twitter.com/split_lanes/status/721118773525291009"
"721118771314708480 ","2016-04-15","23:31","maurices careers","mauricescareers","Love Fashion? Join our team! @maurices is a world-class specialty retailer that caters to young-at-heart fashionistas. Check here for #job opportunities.","Want to work in #ColoradoSprings, CO? View our latest opening: https://t.co/qQkjAMxOVP #Retail #LoveFashionLetsTalk https://t.co/JFicOIb2h1",,,"38.9583005","-104.7812654","US","Colorado Springs, CO","http://pbs.twimg.com/profile_images/415180880005455872/g0aid-0R_normal.png","386","26","283","en","http://www.twitter.com/mauricescareers/status/721118771314708480"
"721118771167895552 ","2016-04-15","23:31","UAMS Nursing Jobs","uamsnurses","@uamshealth is looking for #healthcare professionals who believe in excellence as a way of life. #nursing #jobs","We're #hiring! Read about our latest #job opening here: SURGICAL ONCOLOGY RN III... - https://t.co/gnICbRRga3 https://t.co/xVb1lnEuH9",,,"34.7464809","-92.2895948","US","Little Rock, AR","http://pbs.twimg.com/profile_images/685220069215834113/nkI9Q6KP_normal.jpg","51","43","24","en","http://www.twitter.com/uamsnurses/status/721118771167895552"
"721118770593288193 ","2016-04-15","23:31","Premise Health","PremiseJobs","Premise Health onsite health programs help people – and the organizations they work for – keep their edge, day after day.","Can you recommend anyone for this #job? Nurse Practitioner (NP) - https://t.co/eUV3tY9R3H #Charlotte, NC #Nursing https://t.co/PYxIV0Iv9c",,,"35.2270869","-80.8431267","US","Charlotte, NC","http://pbs.twimg.com/profile_images/702600519643103232/Rb7n5Con_normal.jpg","507","388","196","en","http://www.twitter.com/PremiseJobs/status/721118770593288193"
"721118770266136576 ","2016-04-15","23:31","TMJ-LAX Legal Jobs","tmj_lax_legal","Follow this account for geo-targeted Legal/Paralegal job tweets in Los Angeles, CA. Need help? Tweet us at @CareerArc!","In-House Counsel Jobs | JDHUNTR: Law Jobs-Jdhuntr-15517 IP Attorney (email... (#VariousUSCities, US) https://t.co/TRwAQDZRsb #Legal #Job",,,"34.062028","-118.314876","US","Los Angeles, CA","http://pbs.twimg.com/profile_images/666996460664193024/73dN8rKR_normal.jpg","577","293","100","en","http://www.twitter.com/tmj_lax_legal/status/721118770266136576"
"721118770236944385 ","2016-04-15","23:31","straight edge betty","_talkingbird_","Man up, Meg.","I hate the idea of having children even more after giving a haircut to a screaming 1 year old.",,,"46.9052278","-96.79649745","US","Fargo, ND","http://pbs.twimg.com/profile_images/714617009410023424/JDvJYrMf_normal.jpg","97","120","2","en","http://www.twitter.com/_talkingbird_/status/721118770236944385"
"721118769230266369 ","2016-04-15","23:31","Brian A. Bernhard","BrianABernhard","Weird Artist, Illustrator, Painter, Photographer, EMMY-winning Creative Content Ninja & Chief Weirdo at @BlightProd. Subscribe on #Patreon!","The Missing Adventures of Blight the Clown Ep.08 Panel 02 of 03. An original comicstrip by… https://t.co/FUPz9kppbe","2",,"33.7588615","-118.1323013","US","Long Beach, CA","http://pbs.twimg.com/profile_images/681131111540391936/1o61cyHd_normal.jpg","33813","30650","235","en","http://www.twitter.com/BrianABernhard/status/721118769230266369"
"721118768655499265 ","2016-04-15","23:31","TMJ-LAX HRTA Jobs","tmj_lax_hrta","Follow this account for geo-targeted Hospitality/Restaurant/Tourism job tweets in Los Angeles, CA. Need help? Tweet us at @CareerArc!","Can you recommend anyone for this #Hospitality #job? https://t.co/THpI9X7Weq #restaurantjobs #ThousandOaks, CA #Hiring #CareerArc",,,"34.1971476","-118.824722","US","Thousand Oaks, CA","http://pbs.twimg.com/profile_images/666930533297864704/xfFx5CSs_normal.jpg","485","295","85","en","http://www.twitter.com/tmj_lax_hrta/status/721118768655499265"
"721118768538198016 ","2016-04-15","23:31","Max L. Sotomayor E.","TavoMaxStomayor","La verdad me hace libre. Creando eternidad. Mexicano, azul, ideales en cada paso. Abogado en el mundo empresarial. Presidente Evolución Ideológica.","Mi pastel de cumpleaños 32. #JaliscoNoTeRajes @ Centro Historico de Guadalajara https://t.co/K03uLBUUVe",,,"20.6754338","-103.34668722","MX","Guadalajara, Jalisco","http://pbs.twimg.com/profile_images/710908350926458880/vfvTXEqI_normal.jpg","991","1098","34","es","http://www.twitter.com/TavoMaxStomayor/status/721118768538198016"
"721118768512901120 ","2016-04-15","23:31","Chad","_CeeGall_",,"420 blaze it. 420lbs for 2 sets of 3 (1st set shown). Weight is… https://t.co/03PWF371pn",,,"43.63270493","-79.52531700999999","CA","Toronto, Ontario","http://pbs.twimg.com/profile_images/584766609375506432/NntDlFES_normal.jpg","219","215",,"en","http://www.twitter.com/_CeeGall_/status/721118768512901120"
"721118768496316416 ","2016-04-15","23:31","Giv Me Luv or Nuthin","Toni_O_Toni","I'm on a mission with a few incompletes, but by the grace and power of God my mission will be accomplished. Thanking him for everything he has done and will do!","Feeling that Good Weather feelin that sunshine #vegas @ Las Vegas Strip https://t.co/5kS0JkzGam",,,"36.12083333","-115.17222222","US","Paradise, NV","http://pbs.twimg.com/profile_images/702521265534300161/OwBgwl3R_normal.jpg","921","883","14","en","http://www.twitter.com/Toni_O_Toni/status/721118768496316416"
"721118768324157440 ","2016-04-15","23:31","NAPA AUTO PARTS Jobs","NAPAAUTOJobs","Over the last 80 years our customers have made us a leader in the auto parts industry, and now we need you to take NAPA into the future.","Genuine Parts NAPA: Bilingual Counter Sales (Kansas City) (#KansasCity, KS) https://t.co/WcdBFiVFtS #Sales #Job #Jobs #Hiring",,,"39.1173883","-94.62695720000001","US","Kansas, USA","http://pbs.twimg.com/profile_images/429033123213373440/S5HFEfrk_normal.jpeg","419","2","369","es","http://www.twitter.com/NAPAAUTOJobs/status/721118768324157440"
"721118766990385152 ","2016-04-15","23:31","Becca Polaha","rebeccapolaha","CdM '16. Libra. PSU '20","It's windy @ Coachella Music and Arts Festival https://t.co/xAfXwkZHxt",,,"33.667661","-116.253392","US","La Quinta, CA","http://pbs.twimg.com/profile_images/651599844641865730/mCzX8hPK_normal.jpg","583","376","1","en","http://www.twitter.com/rebeccapolaha/status/721118766990385152"
"721118766726164480 ","2016-04-15","23:31","SanFran Facility Mgt","tmj_SFO_facmgmt","Follow this account for geo-targeted Facilities Management job tweets in San Francisco, CA. Need help? Tweet us at @CareerArc!","This #FacilitiesMgmt #job might be a great fit for you: Maintenance Technician - https://t.co/MoXwr9A54c #nowhiring #SanFrancisco, CA",,,"37.7749295","-122.4194155","US","San Francisco, CA","http://pbs.twimg.com/profile_images/714719335328194560/QE-V596L_normal.jpg","195","161","37","en","http://www.twitter.com/tmj_SFO_facmgmt/status/721118766726164480"
"721118766285864960 ","2016-04-15","23:31","Janet Cooley","0JANETCOOLEY0",,"@greta B SANDERS JUST A LOFTY STUFF BAG COMMUNIST❗THREAT 2 FREEDOM❗❗BRAINWASHES THE UNAWARE WTH PROPAGANDA❗ FIRED HER❗ CAREER UPGRADE 4 HER❗",,,"42.541191","-70.9444168","US","Peabody, MA","http://abs.twimg.com/sticky/default_profile_images/default_profile_0_normal.png","93","77","33","en","http://www.twitter.com/0JANETCOOLEY0/status/721118766285864960"
"721118765388296196 ","2016-04-15","23:31","닉네임을어쩌다들켜서급하게바꾼닉네임","AlluRtoru","희망직무: 아이돌","아 폐장 30분밖에 안남음 ㅜㅜ",,,"40.76358861","-73.98029765","US","Manhattan, NY","http://pbs.twimg.com/profile_images/710771801811329024/-0-V1xHo_normal.jpg","293","281","4","es","http://www.twitter.com/AlluRtoru/status/721118765388296196"
"721118764998111233 ","2016-04-15","23:31","TMJ-PHX Nursing Jobs","tmj_phx_nursing","Follow this account for geo-targeted Healthcare-Nursing job tweets in Phoenix, AZ. Need help? Tweet us at @CareerArc!","We're #hiring! Read about our latest #job opening here: Med Surg - https://t.co/AxgeqdLaWP #Phoenix, AZ #Nursing #CareerArc",,,"33.6364503","-112.0118669","US","Phoenix, AZ","http://pbs.twimg.com/profile_images/668369093930541056/QPdrLFrD_normal.jpg","869","1510","59","en","http://www.twitter.com/tmj_phx_nursing/status/721118764998111233"
"721118764603940865 ","2016-04-15","23:31","Lee","_leejd","don't be an asshole, mind your own business & just enjoy your life.","Just posted a photo @ Fresno City College https://t.co/UUhjg9nnOD",,,"36.76692459","-119.79626577","US","Fresno, CA","http://pbs.twimg.com/profile_images/705649987539984384/bmVz04i5_normal.jpg","480","268","5","en","http://www.twitter.com/_leejd/status/721118764603940865"
"721118764503203840 ","2016-04-15","23:31","Mark Allen","markjohnallen73",,"#yankeesconnect @ Yankee Stadium https://t.co/W9Jxq0Id3f",,,"40.82926679","-73.92657946999999","US","Bronx, NY","http://pbs.twimg.com/profile_images/1433013874/image_normal.jpg","58","80","1","en","http://www.twitter.com/markjohnallen73/status/721118764503203840"
"721118763697836032 ","2016-04-15","23:31","Colorado Acct Jobs","tmj_CO_ACCT","Follow this account for geo-targeted Accounting job tweets in Colorado Non-Metro. Need help? Tweet us at @CareerArc!","US/Canada Payroll Manager - Aerotek: (#Loveland, CO) https://t.co/OLKOGv2fqB #Accounting #Job #Jobs #Hiring",,,"40.3977612","-105.0749801","US","Loveland, CO","http://pbs.twimg.com/profile_images/717089959690113024/b9qXofFU_normal.jpg","333","287","30","es","http://www.twitter.com/tmj_CO_ACCT/status/721118763697836032"
"721118763521695744 ","2016-04-15","23:31","LanguageLine Jobs","LanguageRecruit","Follow us here for LanguageLine Solutions career opportunities. LanguageLine Solutions is the global leader in telephone interpreting and language solutions.","See our latest #Nashville, TN #job and click to apply: Turkmen Interpreters - https://t.co/0JSeehVUEd #interpreter #bilingual #Hiring",,,"36.1626638","-86.7816016","US","Nashville, TN","http://pbs.twimg.com/profile_images/503920852807585792/mx9Ze3oc_normal.jpeg","274","54","274","en","http://www.twitter.com/LanguageRecruit/status/721118763521695744"
"721118761705697280 ","2016-04-15","23:31","Ryan LaPierre","RL007titans",,"Drinking a Four Star Pils by @GooseIsland @ Tiffanys Homestyle Cookin — https://t.co/iXCS5iqCuX",,,"41.5759","-72.13120000000001","US","Connecticut, USA","http://pbs.twimg.com/profile_images/656563574278631424/Q2ibDCka_normal.jpg","277","297","5","en","http://www.twitter.com/RL007titans/status/721118761705697280"
"721118759084285952 ","2016-04-15","23:31","kayl","kaylinncecch","-tragic            -loves pink","@chancetherapper and will b at Gino's within an hour and I will send my precise location again come see me❤️❤️❤️❤️",,,"41.93957546","-87.65305411999999","US","ComedySportz Theatre","http://pbs.twimg.com/profile_images/711918793858150400/xmhJFEfF_normal.jpg","1248","1001",,"en","http://www.twitter.com/kaylinncecch/status/721118759084285952"
"721118758195052544 ","2016-04-15","23:31","kevinlbeck","kevinlbeck","Loving it at Dell!","Just got done cleaning the fish.  Beer 30. (@ Green's Sausage House in Temple, TX) https://t.co/s7vYdoSjiG",,,"31.0452011","-97.16681258","US","Texas, USA","http://pbs.twimg.com/profile_images/616725879/Me_Singing_normal.JPG","152","450","3","en","http://www.twitter.com/kevinlbeck/status/721118758195052544"
"721118758010515456 ","2016-04-15","23:31","xtina","uhitschristina","nurse/zayn malik enthusiast","I'm at St. Mary's University - @stmarysu in San Antonio, TX https://t.co/bcROInw1dd",,,"29.45191484","-98.56240437","US","San Antonio, TX","http://pbs.twimg.com/profile_images/704606957265620992/6_VITR9l_normal.jpg","197","140","4","en","http://www.twitter.com/uhitschristina/status/721118758010515456"
"721118757339471874 ","2016-04-15","23:31","HeatherStout","HeabMarie","#BLESSED♥️ SC: heathermaria9 IG: heatherrmaria","Bummin' on a Fri-Yay ♥️ #cheers2thewknd @ Manhattan Upper Eastside https://t.co/KvVSD1YqF3",,,"40.77744452","-73.95435114999999","US","Manhattan, NY","http://pbs.twimg.com/profile_images/719914089695338496/SEeCyNHQ_normal.jpg","653","413","5","en","http://www.twitter.com/HeabMarie/status/721118757339471874"
"721118754193698816 ","2016-04-15","23:31","Anne Marie Price","annemariemavie","Mosaic Artist/Teacher/Student on my journey in CA. Anne Marie Price-AMP Art Studio https://t.co/6IfeOlg5Zb","😁 (@ Huntington Beach Art Center in Huntington Beach, CA) https://t.co/hlQxaYw3Rk",,,"33.662321","-117.998766","US","Huntington Beach, CA","http://pbs.twimg.com/profile_images/713248324795564033/N84we5II_normal.jpg","286","274","23","en","http://www.twitter.com/annemariemavie/status/721118754193698816"
"721118753551998976 ","2016-04-15","23:31","Kris A Olsen","KrisAOlsen","Founder @FLineEngravers Ambassador @FitFluential @cbusmarathon @dresdenmarathon #cbus #runner #6run4 #runwiththeMarines 2016","Someday I'm going to get on that horse 😁 early birthday celebration with my favorite guy!… https://t.co/JKAyj26ROS",,,"26.3687","-80.1001","US","Boca Raton, FL","http://pbs.twimg.com/profile_images/676816602424307712/oEfen4Ph_normal.jpg","4353","4125","120","en","http://www.twitter.com/KrisAOlsen/status/721118753551998976"
"721118752717148160 ","2016-04-15","23:31","Kayla Pashovich","k_matejka","I found my life when I laid it down.  †","Primary colors and summertime favorites got me on cloud nine. ☀️ @ East Coast Custard https://t.co/9R6YKHAC9i",,,"41.39161","-81.761","US","Parma Heights, OH","http://pbs.twimg.com/profile_images/664282215195549696/CXWCA3O7_normal.jpg","264","509","7","en","http://www.twitter.com/k_matejka/status/721118752717148160"
