"721130281843884032 ","2016-04-16","00:17","Jobs at WM","AllWMJobs","All #jobs currently available at @WasteManagement. For more info on #careers, company news, life at #WM, or assistance with an application, follow @WMCareers.","We're #hiring! Read about our latest #job opening here: Construction... - https://t.co/vnio22MK81 #Sewickley, PA https://t.co/2ZXFToYRwe",,,"40.5364846","-80.1844243","US","Sewickley, PA","http://pbs.twimg.com/profile_images/705505273553637376/aYCfUBSN_normal.jpg","407","23","380","en","http://www.twitter.com/AllWMJobs/status/721130281843884032"
"721130281495826432 ","2016-04-16","00:17","Gabriel Shaffer","gabrielshaffer","Artist, Illustrator,Debaser","#fbf to the waynewhiteart Ass Kicking Contest install heronarts with bryan_cunningham_ bringing… https://t.co/U7jsm2Qe2W",,,"37.774749","-122.408506","US","San Francisco, CA","http://pbs.twimg.com/profile_images/575164872754905088/GiMZo8Ic_normal.jpeg","983","1923","77","en","http://www.twitter.com/gabrielshaffer/status/721130281495826432"
"721130278282928132 ","2016-04-16","00:17","RealBoi Wilson  ⛽️","Playas_Punchh","Revenge is the sweetest joy. #RIPGramz #FreeMir #R E A L all i gt is ma Balls n ma words","Pizza hot pockets gone forever go",,,"38.4419991","-121.444815","US","Sacramento, CA","http://pbs.twimg.com/profile_images/717940872738779140/mqkxn1qt_normal.jpg","1239","1442","34","en","http://www.twitter.com/Playas_Punchh/status/721130278282928132"
"721130277242843136 ","2016-04-16","00:17","LAKE","laurenxkenealy","fluent in sarcasm and constantly embarrassing myself","back where it all started @ Watterson Dining Center https://t.co/jIMgmZf6hD",,,"40.50896877","-88.98781201","US","Normal, IL","http://pbs.twimg.com/profile_images/720503707260084224/kf_VHzoG_normal.jpg","224","333","3","en","http://www.twitter.com/laurenxkenealy/status/721130277242843136"
"721130276940812288 ","2016-04-16","00:17","Nico Merritt","scissorguysays",,"Hanging with my boys! #revelry #rochesterny #deaffriendly #signlife #asl @ The Revelry https://t.co/EocsjhtpPq",,,"43.15088","-77.56835","US","New York, USA","http://pbs.twimg.com/profile_images/575692410409345024/sZYrfhUd_normal.jpeg","63","101","6","en","http://www.twitter.com/scissorguysays/status/721130276940812288"
"721130276605313025 ","2016-04-16","00:17","Tim Evans","timmy8271","#PorraKonanBig","@BohsJohnny he looks like a Chippendale now. Like Latin lover",,,"28.5111723","-81.363635","US","Orlando, FL","http://pbs.twimg.com/profile_images/617567908793683968/QTLyw884_normal.jpg","525","602","16","en","http://www.twitter.com/timmy8271/status/721130276605313025"
"721130275871330304 ","2016-04-16","00:17","Maty Lehman","matylehman","idk why I spell my name with a t","My bestie is in Athens!! @ Red Brick Tavern https://t.co/HqiggTkyja",,,"39.32988828","-82.10102381999999","US","Athens, OH","http://pbs.twimg.com/profile_images/718895505204514816/pJf99LJy_normal.jpg","505","324","1","en","http://www.twitter.com/matylehman/status/721130275871330304"
"721130275284074496 ","2016-04-16","00:17","Veroga","veroga02","Si no sabes a dónde vas, cualquier camino te llevará","Un rato familiar 😊😊😊 (@ El Bajío - @rest_elbajio in Cuauhtémoc, DF) https://t.co/lqJQiTQDbB",,,"19.42848034","-99.16186703","MX","Cuauhtémoc, Distrito Federal","http://pbs.twimg.com/profile_images/719275863032725504/S168Oubq_normal.jpg","40","87","2","es","http://www.twitter.com/veroga02/status/721130275284074496"
"721130274789007360 ","2016-04-16","00:17","Octane Boyz CEO/Prez","Mr_Whasup","#nothirst #teamNoShame #SixFigureShawty #Teampureoctane #octaneboyz #teamitttech #nomeeeee","Coolin' wit the promods @ Maryland International Raceway https://t.co/pbUS9bjss5",,,"38.395256","-76.844291","US","Maryland, USA","http://pbs.twimg.com/profile_images/717751495190515712/hDlfPXEc_normal.jpg","280","418","6","en","http://www.twitter.com/Mr_Whasup/status/721130274789007360"
"721130273883209728 ","2016-04-16","00:17","Alexis Groce","grocealexis09","~live everyday like it's your last~","Swinging and watching the sunset go down together is like a dream… https://t.co/L77hplFcLw",,,"40.07523913","-86.04463409","US","Noblesville, IN","http://pbs.twimg.com/profile_images/719506067340804100/NDBFlmhx_normal.jpg","244","122",,"en","http://www.twitter.com/grocealexis09/status/721130273883209728"
"721130273690165249 ","2016-04-16","00:17","Paige Lowe","Paigelowee","Love God, love others, share Christ ↠ Pray for Haiti","I like my girls foreign #Brazil @ Calabash Creamery https://t.co/DIYx7LjzSU",,,"33.891908","-78.56584100000001","US","Calabash, NC","http://pbs.twimg.com/profile_images/719954899694456832/1qX1EDKV_normal.jpg","808","545","4","en","http://www.twitter.com/Paigelowee/status/721130273690165249"
"721130273379778562 ","2016-04-16","00:17","CVS Health Jobs","CVSHealthJobs","We're #hiring! Explore a variety of open positions that offer a challenging & rewarding #career. Follow us to uncover #job opportunities at @CVSHealth.","See our latest #Greenwich, CT #job and click to apply: Pharmacy Technician - https://t.co/OfGeg9fatR #Healthcare #Hiring",,,"41.0262417","-73.62819639999999","US","Greenwich, CT","http://pbs.twimg.com/profile_images/511525698507268097/ptBo_zo__normal.jpeg","626","3","782","en","http://www.twitter.com/CVSHealthJobs/status/721130273379778562"
"721130273279238144 ","2016-04-16","00:17","Brooks Health","brooks_health","We provide a plethora of services for Mental & Physical Health and Intensive Outpatient Programming Services! Call us at (702) 720-3735.","Learn #parenting skills. Call us (702) 720-3735 . https://t.co/XmhUG6E12F . #mentalhealth #science… https://t.co/0QF1BGPgVv",,,"36.2176399","-115.1871185","US","North Las Vegas, NV","http://pbs.twimg.com/profile_images/674010154895990784/YOUBRThD_normal.jpg","155","471","15","en","http://www.twitter.com/brooks_health/status/721130273279238144"
"721130270456348672 ","2016-04-16","00:17","Sutter Health Jobs","SutterJobs","Looking for a job in #healthcare? Join our team! Follow tweets for the latest job openings across Sutter Health. Get Sutter Health news at @SutterHealth.","Want to work at Sutter Delta Medical Center? We're #hiring in #Antioch, CA! Click for details: https://t.co/nQ18kTNLuY #Pharmaceutical #Job",,,"38.0049214","-121.805789","US","Antioch, CA","http://pbs.twimg.com/profile_images/718231764817350659/Z4iX3VdA_normal.jpg","361","22","284","en","http://www.twitter.com/SutterJobs/status/721130270456348672"
"721130269890256900 ","2016-04-16","00:17","guro","okuudere","I love woman's BALLBUSTING!!!!!!!","@moonblastcorps &gt;:T",,,"26.1172548","-80.2232867","US","Plantation, FL","http://pbs.twimg.com/profile_images/718650505510187008/Urpq_o9t_normal.jpg","2304","693","76","es","http://www.twitter.com/okuudere/status/721130269890256900"
"721130269328089089 ","2016-04-16","00:17","Destination Jobs","DestinationJobs","The Destination Hotels collection includes award-winning hotels & resorts in premier vacation destinations around the U.S. Check here for open jobs. #hiring","Want to work at Quirk Hotel? We're #hiring in #Richmond, VA! Click for details: https://t.co/hLeYxra8T1 #Hospitality #Job #Jobs",,,"37.542979","-77.469092","US","Richmond, VA","http://pbs.twimg.com/profile_images/609368691415711744/AAI1ubpI_normal.jpg","304","2","454","en","http://www.twitter.com/DestinationJobs/status/721130269328089089"
"721130269231620096 ","2016-04-16","00:17","IASIS Careers","IASISCareers","When you join IASIS, you become part of a team that is committed to caring. Our goal is to approach every situation and every patient with a caring heart.","If you're a #Nursing professional in #Layton, UT, check out this #job: https://t.co/JLRaAKcKwm #MedField #Hiring https://t.co/o9EEXgmgie",,,"41.0909507","-111.9957262","US","Layton, UT","http://pbs.twimg.com/profile_images/677541200551784448/wTBBM-Cg_normal.png","74","213","50","en","http://www.twitter.com/IASISCareers/status/721130269231620096"
"721130267675525122 ","2016-04-16","00:17","anahii","anah_ii","Music is my hometown !","My lovers , my friends ! @ Pa'l Norte https://t.co/2uOix82cDU",,,"25.67993837","-100.28496265","MX","Monterrey, Nuevo León","http://pbs.twimg.com/profile_images/657283776402223104/1ifaJn0i_normal.jpg","864","596","23","en","http://www.twitter.com/anah_ii/status/721130267675525122"
"721130267465789440 ","2016-04-16","00:17","TMJ-CA HRTA Jobs","tmj_ca_hrta","Follow this account for geo-targeted Hospitality/Restaurant/Tourism job tweets in California Non-Metro. Need help? Tweet us at @CareerArc!","Want to work at Starbucks? We're #hiring in ! Click for details: https://t.co/7UmdvmFwGE #Hospitality #Veterans #Job #Jobs #CareerArc",,,"34.4418727","-119.8322572","US","Goleta, CA","http://pbs.twimg.com/profile_images/666794831088234496/d0myNv4o_normal.jpg","451","297","112","en","http://www.twitter.com/tmj_ca_hrta/status/721130267465789440"
"721130267453366272 ","2016-04-16","00:17","Tom Hreha","TomHreha","Life is better than I deserve.","I'm at LongHorn Steakhouse in Rock Hill, SC w/ @peanutmobile https://t.co/DLNgsScK7F",,,"34.9395542","-80.96666336","US","Rock Hill, SC","http://pbs.twimg.com/profile_images/1642422202/Tom_Hreha_normal.jpg","36","33","4","en","http://www.twitter.com/TomHreha/status/721130267453366272"
"721130267419680768 ","2016-04-16","00:17","Miss Marquez","themissmarquez","Burlesque Performer . Bettie Page impersonator . Bloc Talent Agency . LA based. Available for bookings. Tumbler: MissAlyssaMarquez","This Sunday!! Burlesque, Brunch &amp; Weekend Cocktails await you at #BurlesqueBrunchLA 🍾 Come see… https://t.co/atYwD6MTqe",,,"34.0760361","-118.3770865","US","Los Angeles, CA","http://pbs.twimg.com/profile_images/584501959400366080/MlH3pYHP_normal.jpg","320","398","13","en","http://www.twitter.com/themissmarquez/status/721130267419680768"
"721130266874347521 ","2016-04-16","00:17","♕katieco","_katieco","Ocean addict, BackBay, expert in the field of nachos + margaritas, photography on the side, Project Manager for Mullen Lowe, in love with love.","💙 Never Forget 💛 #BostonStrong #OneDayBoston @ Boston, Massachusetts https://t.co/1PCZftvU8F",,,"42.3578","-71.0617","US","Boston, MA","http://pbs.twimg.com/profile_images/678039168707072000/ytWUO_k9_normal.jpg","498","665","6","en","http://www.twitter.com/_katieco/status/721130266874347521"
"721130265821577218 ","2016-04-16","00:17","TMJ- PHX Health Jobs","tmj_phx_health","Follow this account for geo-targeted Healthcare job tweets in Phoenix, AZ. Need help? Tweet us at @CareerArc!","Project Manager Practice Growth &amp; Operations - HonorHealth: (#Phoenix, AZ) https://t.co/0ZblALtvp4 #Healthcare #Job #Jobs #Hiring",,,"33.5699124","-112.0670612","US","Phoenix, AZ","http://pbs.twimg.com/profile_images/667348413910913025/WZYlVAa7_normal.jpg","1177","1436","108","en","http://www.twitter.com/tmj_phx_health/status/721130265821577218"
"721130265536544773 ","2016-04-16","00:17","Karel Becerra","KarelBecerra","Future | Rights | Freedom - karelbecerra@gmail.com US/CU/AR","#Cuba Universidad Las Villas (donde yo estudié) Inaugurada en ... adivinen ... si 1952 !! Increíble ! @CubaArchivo https://t.co/vBCK6g2F2k","4","5","22.400788","-79.96262900000001","CU","Cuba","http://pbs.twimg.com/profile_images/681265818487918592/B0IDJKwA_normal.jpg","80934","56297","433","es","http://www.twitter.com/KarelBecerra/status/721130265536544773"
"721130265473630210 ","2016-04-16","00:17","correynextdoor","ItsYaboyCK","Education is our passport to the future, for tomorrow belongs to the people who prepare for it today","We knew last year that we weren't gonna have dates so... Here we are . @ Saint Anselm College https://t.co/PjEcfKee4X",,,"42.98463989","-71.50563081999999","US","Goffstown, NH","http://pbs.twimg.com/profile_images/720611275580039169/wQfKEWWl_normal.jpg","507","729","2","en","http://www.twitter.com/ItsYaboyCK/status/721130265473630210"
"721130262357094400 ","2016-04-16","00:17","Cindy Ung","cunggie","a real estate agent with psoriasis who's in love with positivism, health, food and traveling https://t.co/aLyFHQ5WNS","Poke addiction !! Thank you for the quality customer service tonight @seamoresnyc @ Seamore's https://t.co/PcxsB1I0hz",,,"40.72065","-73.9969","US","Manhattan, NY","http://pbs.twimg.com/profile_images/570779940867719168/-hVHDfkd_normal.jpeg","225","103","14","en","http://www.twitter.com/cunggie/status/721130262357094400"
"721130262067822592 ","2016-04-16","00:17","Jennifer Betus","Jebet221","MOM...Hockey fan...School Counselor...Horror Movie/Paranormal Junkie   Just the kids & I making the most of this wonderful life!","Gonna miss my Rampage, see you next season! Let's go home with a… https://t.co/Cyum3Xh6om",,,"29.42692648","-98.43735141000001","US","San Antonio, TX","http://pbs.twimg.com/profile_images/709759724938338304/SFIN4Q47_normal.jpg","127","669","6","en","http://www.twitter.com/Jebet221/status/721130262067822592"
"721130257940680704 ","2016-04-16","00:17","Tim Davis","timdavis1979","I'm a Chicago Area Fitness Professional who's way too big of a sports fan. I'm Vegas to my friends and Tim, Timmy, and TJ by my family. Nice to meet you.","Drinking an 5 Vulture Oaxacan Style Dark Ale by @5RabbitBrewery at @pritalianbistro — https://t.co/gI5OYdfnZR",,,"41.9531","-87.6546","US","Chicago, IL","http://pbs.twimg.com/profile_images/717043450298781696/UC5RUMei_normal.jpg","91","145","2","en","http://www.twitter.com/timdavis1979/status/721130257940680704"
"721130257575768064 ","2016-04-16","00:17","Marcel Thomas","mthomas22",,"City girl doing city things (@ Redbird Arena in Normal, IL) https://t.co/FW9pifrNV3",,,"40.51004702","-88.9989996","US","Normal, IL","http://pbs.twimg.com/profile_images/429705315/n1011600004_30641999_7433_normal.jpg","60","85","2","en","http://www.twitter.com/mthomas22/status/721130257575768064"
"721130254664904704 ","2016-04-16","00:17","Gary's DBG","GarysDBG","Healthy Eats with the only Sushi in Dewey Beach. With 20 rotating beers on tap and over 90 more brews in bottle, there is something for everyone. Since 1991.","Ms. beachparty256 doing what she do best. #deweybeachbrewfest #chalkboard #map @ Gary's Dewey… https://t.co/KQaRBSr5V5",,,"38.6951899","-75.07498","US","Dewey Beach, DE","http://pbs.twimg.com/profile_images/2053301577/garys_logo_normal.png","237","149","11","en","http://www.twitter.com/GarysDBG/status/721130254664904704"
"721130253264011265 ","2016-04-16","00:17","Laura T. Fitzpatrick","DisLauraT","Travel Agent for The Magic For Less Travel, Disney Enthusiast, Teacher","Back for Star Wars Fireworks! (@ Disney's Hollywood Studios - @waltdisneyworld in Lake Buena Vista, FL) https://t.co/oiQ29xUd0g",,,"28.35806252","-81.55915851","US","Florida, USA","http://pbs.twimg.com/profile_images/2719637457/0348f3f12d0c69626ad5014c403b5058_normal.png","386","953","18","en","http://www.twitter.com/DisLauraT/status/721130253264011265"
"721130252173324288 ","2016-04-16","00:17","Josh Appel","JoshAppel","Play-by-play broadcaster at USF and for the Clearwater @Threshers. Sports Director at Bulls Radio. Former backup JV Spring QB freshman year.","#WeSeeRed #WeWantTheCup #historystartsnow @ BB&amp;T Center Home of the Florida Panthers https://t.co/6eu19ALnlT","1",,"26.1579","-80.32568000000001","US","Sunrise, FL","http://pbs.twimg.com/profile_images/720481893309935616/SxLl5GNH_normal.jpg","2710","993","61","en","http://www.twitter.com/JoshAppel/status/721130252173324288"
"721130250067791872 ","2016-04-16","00:17","umm. reneja™","iSewTracX","I am your personal hairstylist! I go above and beyond for my customers.. I am saved by the blood of Jesus Christ. #Blessed and #HighlyFavored","because the ad libs are so funny! 😂😂😂😂😂 (Hair provided by: @pinkandpretty01)… https://t.co/rGreKOHt1T",,,"41.3245853","-72.9337325","US","New Haven, CT","http://pbs.twimg.com/profile_images/524321878874525697/E2Hawg3m_normal.jpeg","339","357","3","en","http://www.twitter.com/iSewTracX/status/721130250067791872"
"721130247358439425 ","2016-04-16","00:17","Brad Sax","McSteezy","Spreadsheet Ninja","Drinking an Arbor Oak Amber Ale by @LakeEffect_LLC at @thebutcherstap — https://t.co/W1YwOWWfLd",,,"41.9468","-87.6639","US","Chicago, IL","http://pbs.twimg.com/profile_images/458713094991003648/52KlUtMW_normal.jpeg","105","396","7","en","http://www.twitter.com/McSteezy/status/721130247358439425"
"721130247001911297 ","2016-04-16","00:17","Matthew Horn","MatthewHornNH","sports reporter, news herald. two dogs i love pitching, transition offense, nhl game 7s and calvin johnson. mhorn@gannett.com","@shadrewbie complete game victory on mound. Mitchell mueller three hits. Port Clinton 6 Perkins 3 #nhhss","1","1","41.50059432","-83.14575382","US","Ohio, USA","http://pbs.twimg.com/profile_images/378800000517127313/9a26acc08f36e1fafcfd08a70eb339e1_normal.jpeg","895","616","19","en","http://www.twitter.com/MatthewHornNH/status/721130247001911297"
"721130243931529216 ","2016-04-16","00:17","Donna Riopel","DonnaRiopel","I play roller derby @CJRollerVixens and do mom stuff. I work in Outdoor Adventures at @MonCountyParks.","Looks like a Vixens pre-bout meeting... @ Keansburg, New Jersey https://t.co/KPLjC09Jku",,,"40.4473","-74.13120000000001","US","Keansburg, NJ","http://pbs.twimg.com/profile_images/693382241293070336/idVDTbdn_normal.jpg","688","649","18","en","http://www.twitter.com/DonnaRiopel/status/721130243931529216"
"721130242895646720 ","2016-04-16","00:17","Dave","DavidLindgren","I'm an entrepreneur at heart, with a passion for what I do. My career is in home care, and my hobby is enjoying life.","I'm at Etropal in La Porte, IN https://t.co/FVMiqaqekQ",,,"41.61154938","-86.72048187","US","La Porte, IN","http://pbs.twimg.com/profile_images/2229114647/me_normal.jpg","713","1982","25","es","http://www.twitter.com/DavidLindgren/status/721130242895646720"
"721130241784025088 ","2016-04-16","00:17","Juan Carlos Sanchez","juankha1973","100% Apartidista me gusta el debate con respeto de ideas no insultos si me sigues te sigo","@paliplax @ClubAmerica es un equipo popular con muy buena mercadotecnia no se puede ser grande solo con 12 títulos en 100 años",,,"20.62810862","-100.41575374","MX","Querétaro, Querétaro Arteaga","http://pbs.twimg.com/profile_images/531242229411872768/Usv-dJle_normal.jpeg","675","616","5","es","http://www.twitter.com/juankha1973/status/721130241784025088"
"721130241322651648 ","2016-04-16","00:17","Ross Lucas","roslucas","Christian, father, grandfather, great-grandfather, learner, student, loved by God.","Fountain @ Hermann Park https://t.co/dpFVPRj8v1",,,"29.72111111","-95.39138889","US","Houston, TX","http://pbs.twimg.com/profile_images/3676554172/66696e3204eca948ba0aa7c61e454017_normal.jpeg","171","554","4","en","http://www.twitter.com/roslucas/status/721130241322651648"
"721130240815181825 ","2016-04-16","00:17","Emilio♎️⚓️✝","emilio_9610","La vida es como conducir bicicleta; para mantener el equilibrio, hay que mantenerse en movimiento y no mirar atrás. snap: emilio_gt","Mi crush de la secu😏😂👀 @ Esfera City Center La Rioja https://t.co/q2tIz7EuRH",,,"25.57654833","-100.24452737","MX","Monterrey, Nuevo León","http://pbs.twimg.com/profile_images/697321748333604864/qwdFY6Vt_normal.jpg","242","256","1","es","http://www.twitter.com/emilio_9610/status/721130240815181825"
"721130239733207040 ","2016-04-16","00:17","STL |-/ Clique","AurynJounin",,"#winning - Drinking a Double Bean Blonde by @schlafly at @schlafly  — https://t.co/CzN8lHAz1D",,,"38.633","-90.2098","US","St Louis, MO","http://pbs.twimg.com/profile_images/600706048584863745/WekM10Mz_normal.jpg","23","72","1","en","http://www.twitter.com/AurynJounin/status/721130239733207040"
"721130239485542400 ","2016-04-16","00:17","MadHouse Comedy Club","MadHouseComedy","Mad House Comedy Club Open 7 Days A Week! Call Our Box Office at (619) 702-6666.","Craig Conant smashin it on the mic!! (Photo credit: @jmatthewbyrd) @ Mad House Comedy Club https://t.co/lcSXImQNsc",,,"32.71332291","-117.16357878","US","San Diego, CA","http://pbs.twimg.com/profile_images/356756936/Mad_House_Stacked_01_normal.jpg","2427","1029","68","en","http://www.twitter.com/MadHouseComedy/status/721130239485542400"
"721130236885209089 ","2016-04-16","00:17","Gabs","_gbertrand","be free as fast as you can | georgian","Greasiest auto squad 💩 @ Barrie's Water Front https://t.co/1Bwy8HSqyH",,,"44.38019839","-79.68985625000001","CA","Barrie, Ontario","http://pbs.twimg.com/profile_images/720784749116063744/2rz09xyn_normal.jpg","520","449","1","en","http://www.twitter.com/_gbertrand/status/721130236885209089"
"721130236625215488 ","2016-04-16","00:17","Abby Warmington","HolyCraft","I'm just a mom...doin' my thing, crafting my way through life! https://t.co/saQXgKmvbM","Peace Love &amp; Macarons! #friendssincekindergarten… https://t.co/YbfqWiapkx",,,"42.7311516","-84.46824650000001","US","East Lansing, MI","http://pbs.twimg.com/profile_images/344513261566689534/843819c1edb9fd6acc06173159bf82f8_normal.jpeg","609","142","13","en","http://www.twitter.com/HolyCraft/status/721130236625215488"
"721130236524564480 ","2016-04-16","00:17","⚒ MrRojo ⚒","MrRojoERHS","I always wanted to be Mr. Dyson, so I traveled the world w/@Navy, & now I teach APHuG @ElRanchoHS in H3. Social Media Manager for @ElRanchoHS.","Date night😍 (@ California Fish Grill - @cafishgrill in Long Beach, CA) https://t.co/0yYz9Pp5hz","1",,"33.8282845","-118.14304885","US","Long Beach, CA","http://pbs.twimg.com/profile_images/685242121675128832/8KuM97dO_normal.jpg","791","202","50","en","http://www.twitter.com/MrRojoERHS/status/721130236524564480"
"721130235920519168 ","2016-04-16","00:17","Eleanor Biddulph","elbiddulph","Passionate about the development of emerging leaders. Coach. Consultant. Facilitator. Living in gratitude, joy & peace. https://t.co/JwVxDCpig5","Sunset at Alum Creek 04/15/16. @ Alum Creek Lake https://t.co/uu4jcKd6AM",,,"40.185718","-82.96663599999999","US","Ohio, USA","http://pbs.twimg.com/profile_images/657628328208257025/Us-uJKgS_normal.jpg","1367","1205","84","en","http://www.twitter.com/elbiddulph/status/721130235920519168"
"721130235383705600 ","2016-04-16","00:17","Francisco X","elfrankx","Eterno estudiante de Medicina Pseudo DJ aficionado Jugador de futbol amateur llanero Idealista-artistico como sueño -UN SER HUMANO SUPERIOR-","I'm at tienda nina https://t.co/cpkUniaN4e",,,"19.63865923","-98.91120348","MX","Acolman, México","http://pbs.twimg.com/profile_images/478318244118278144/R4wOrTNf_normal.jpeg","165","114","3","en","http://www.twitter.com/elfrankx/status/721130235383705600"
"721130235052339200 ","2016-04-16","00:17","TMJ-CAP HRTA Jobs","tmj_CAP_HRTA","Follow this account for geo-targeted Hospitality/Restaurant/Tourism job tweets in The Peninsula, CA. Need help? Tweet us at @CareerArc!","Specialty's Cafe &amp; Bakery #Hospitality #Job: Guest Services (#Pleasanton, CA) https://t.co/mP4Xfm7ImZ #Jobs #Hiring #CareerArc",,,"37.7000164","-121.9047822","US","Pleasanton, CA","http://pbs.twimg.com/profile_images/700732020704423937/fNDZ0Bvg_normal.jpg","288","268","29","en","http://www.twitter.com/tmj_CAP_HRTA/status/721130235052339200"
"721130234398056450 ","2016-04-16","00:17","Diego Hernandez","dhbaquedano","Cocinero mexicano entrenado en México por cocineros mexicanos. 646","Checking out spaces for my next project with @rokaimexico #dtla @ Art District, Downtown - Los… https://t.co/zljqLzvDln",,,"34.05219997","-118.2430001","US","Los Angeles, CA","http://pbs.twimg.com/profile_images/717822334225108992/7nMF_xoI_normal.jpg","11008","328","109","en","http://www.twitter.com/dhbaquedano/status/721130234398056450"
"721130234188144640 ","2016-04-16","00:17","TMJ-CA IT Jobs","tmj_CA_it","Follow this account for geo-targeted Software Dev. - General/IT job tweets in California Non-Metro. Need help? Tweet us at @CareerArc!","#RedwoodShores, CA #IT #Job: Senior Direct, Cloud Evangelism at Oracle https://t.co/3z7dq1pDlM #Jobs #Hiring #CareerArc",,,"37.5364134","-122.2455364","US","Redwood City, CA","http://pbs.twimg.com/profile_images/667417513819533312/M3J7nCzZ_normal.jpg","503","332","163","es","http://www.twitter.com/tmj_CA_it/status/721130234188144640"
"721130232980369413 ","2016-04-16","00:17","Denise Iz the Name","BringsTruth","Laughter Is Life Success In My Soul On The Road To Riches Im Chasing Gold I'm Ambitious humble and selfish Waiting on my husband so we can reach perfection","Look how far that's got me though🤔",,,"37.045254","-76.357268","US","Hampton, VA","http://pbs.twimg.com/profile_images/717922740863246336/h0hNEjvd_normal.jpg","1131","922","21","en","http://www.twitter.com/BringsTruth/status/721130232980369413"
"721130232850161666 ","2016-04-16","00:17","Beersalt Bob","BobRam70","It's not who you know, it's who knows you","Checked in @ Dodger Stadium for the #dodgers vs #sfgiants game w/ https://t.co/uVicnAZFj5 https://t.co/vwYKvgerMV",,,"34.07368","-118.24053","US","Los Angeles, CA","http://pbs.twimg.com/profile_images/584192616700383232/qgEDagaX_normal.jpg","84","293","8","en","http://www.twitter.com/BobRam70/status/721130232850161666"
"721130232456081408 ","2016-04-16","00:17","ƒede Moreno","Fed3Moreno","Estudiante de Facultad de Derecho de la UNAM y apasionado por el Futbol.","Coldplay (@ Foro Sol for Coldplay and Lianne La Havas in Iztacalco, DF) https://t.co/sXNgdW432H",,,"19.40517933","-99.0961647","MX","Iztacalco, Distrito Federal","http://pbs.twimg.com/profile_images/506280643886845952/Qj2CJlUV_normal.jpeg","322","270","2","en","http://www.twitter.com/Fed3Moreno/status/721130232456081408"
