"721145132410470400 ","2016-04-16","01:16","LegiScan NJ","LegiScanNJ","National public service for legislative tracking and data API; both free and subscription offerings with advanced monitoring, research, and reporting tools.","A3651 [NEW] Requires school district that includes grades kindergarten through six to offer Eddie Eagle Gunsafe P... https://t.co/wYSQW4DdgA",,,"40.22028","-74.77014","US","Trenton, NJ","http://pbs.twimg.com/profile_images/535687441718317056/eVth758T_normal.png","153","1","20","en","http://www.twitter.com/LegiScanNJ/status/721145132410470400"
"721145130326093824 ","2016-04-16","01:16","thestolenolive","thestolenolive","Baylor Alum '98, Chiari, Culinary, Yelp, Sleep, Blogger, Texas, Retired HS Teacher after 3 years,","I'm at Cathay House in Waco, TX https://t.co/9QrUMFnf7I",,,"31.52843874","-97.19093493","US","Waco, TX","http://pbs.twimg.com/profile_images/659155481622020096/mlMwgVZt_normal.jpg","811","2011","44","en","http://www.twitter.com/thestolenolive/status/721145130326093824"
"721145129730498560 ","2016-04-16","01:16","Angela","acomicbookgirl","Comic book reading, WWE Network and movie watching lady. Work in progress. Will not debate the things I like.","Part of In The Land of the Dead, Stepping on the Tail of a Rainbow @ The Broad https://t.co/SwgRwF4DrI","1",,"34.0543137","-118.2502899","US","Los Angeles, CA","http://pbs.twimg.com/profile_images/639278483210792961/LJfAI4iJ_normal.jpg","2323","559","170","en","http://www.twitter.com/acomicbookgirl/status/721145129730498560"
"721145128430211072 ","2016-04-16","01:16","Mapache Maravilla","reginosauriorex","(488)","I'm at Mango Deck Restaurant, Bar &amp; Beach Club - @mangodeckcabo in Cabo San Lucas, Baja California Sur https://t.co/SlZe9lFiaL",,,"22.88731","-109.90478","MX","Los Cabos, Baja California Sur","http://pbs.twimg.com/profile_images/717571655904534528/sO23npOC_normal.jpg","700","437","10","en","http://www.twitter.com/reginosauriorex/status/721145128430211072"
"721145127843061760 ","2016-04-16","01:16","Cj Bernauer","CjSaysThings","Mediocre Stand-Up Comic in Windsor Ontario. I also have a production company called Frozenbrick Productions.","She's amazing ❤️ kristylauriault @ Artisan Grill https://t.co/RGWoUP0PcH",,,"42.10176","-83.11263","CA","Amherstburg, Ontario","http://pbs.twimg.com/profile_images/714003672896811008/yoTlKgHs_normal.jpg","1001","552","8","en","http://www.twitter.com/CjSaysThings/status/721145127843061760"
"721145127255830528 ","2016-04-16","01:16","Jessi","_jesssssi","ig/sc- jessidemment","shoutout miss C for the water balloons🤘🏼 @ Bethel High School (Connecticut) https://t.co/RGuyMEtOHr",,,"41.3781","-73.3939","US","Bethel, CT","http://pbs.twimg.com/profile_images/718261221787627520/WqyMatXX_normal.jpg","347","261","1","en","http://www.twitter.com/_jesssssi/status/721145127255830528"
"721145125489893376 ","2016-04-16","01:16","Marissa Monaghan","risssy_ruexOxO","hi I'm marissa & i like adventures, join me? | 6.16.15 KL❤️ ΔΦΕ","➰ @ The Mansion At Voorhees https://t.co/HLCO7F8Ol0",,,"39.86621566","-74.94672903","US","Voorhees, NJ","http://pbs.twimg.com/profile_images/717211577716498432/GxUYJf3X_normal.jpg","1478","1174","2","en","http://www.twitter.com/risssy_ruexOxO/status/721145125489893376"
"721145125200461825 ","2016-04-16","01:16","Sam I Am","TheReal_Sam1Am","Writer. Smarty Pants. Professional Sasser. Views are my own.","#ATX @ Austin, Texas https://t.co/Q2B4MGmXsV","1",,"30.2672","-97.76390000000001","US","Austin, TX","http://pbs.twimg.com/profile_images/667073133254279168/UyNDSxWv_normal.jpg","111","256","3","en","http://www.twitter.com/TheReal_Sam1Am/status/721145125200461825"
"721145124269334533 ","2016-04-16","01:16","IASIS Careers","IASISCareers","When you join IASIS, you become part of a team that is committed to caring. Our goal is to approach every situation and every patient with a caring heart.","See our latest #Phoenix, AZ #job and click to apply: PACU RN - Full Time - St Luke's... - https://t.co/e00YB5GHeU https://t.co/TR1wk2CR5a",,,"33.4544851","-112.0423562","US","Phoenix, AZ","http://pbs.twimg.com/profile_images/677541200551784448/wTBBM-Cg_normal.png","75","213","50","en","http://www.twitter.com/IASISCareers/status/721145124269334533"
"721145121375281152 ","2016-04-16","01:16","LegiScan MS","LegiScanMS","National public service for legislative tracking and data API; both free and subscription offerings with advanced monitoring, research, and reporting tools.","SC679 [Engross] Commend Saltillo Girls' Cross-Country Team and Coach Charles Covington for winning 2015 Class 5A... https://t.co/6S1sWJQyni",,,"32.303799","-90.182005","US","Jackson, MS","http://pbs.twimg.com/profile_images/535684207918338050/uZbM67T3_normal.png","77","1","9","en","http://www.twitter.com/LegiScanMS/status/721145121375281152"
"721145120729407488 ","2016-04-16","01:16","Speedway Jobs","SpeedwayJobs","Rethink Speedway. It's more than a convenience store... It's your career opportunity!","Want to work at Speedway? We're #hiring in #Kankakee, IL! Click for details: https://t.co/1YW6fH67cr #CustomerService #Job #Jobs",,,"41.1200325","-87.8611531","US","Kankakee, IL","http://pbs.twimg.com/profile_images/588378982485110784/CoHZRLK7_normal.png","217","27","381","en","http://www.twitter.com/SpeedwayJobs/status/721145120729407488"
"721145119261372416 ","2016-04-16","01:16","Manulife Jobs","ManulifeJobs","Official jobs account of Manulife. Follow us to see open Manulife jobs across the globe.Terms of Use http://t.co/l3MI6lVKkH. Visit us @Manulife & @ManulifeNews.","We're #hiring! Read about our latest #job opening here: Counsel, Group Benefits - https://t.co/LM6qQWtfE1 #Toronto, ON #Legal",,,"43.653226","-79.3831843","CA","Toronto, Ontario","http://pbs.twimg.com/profile_images/545627182114959361/5QFcHxas_normal.jpeg","809","5","563","en","http://www.twitter.com/ManulifeJobs/status/721145119261372416"
"721145118988845058 ","2016-04-16","01:16","Rosangela Santos","rosangela100m","Atleta Olímpica de atletismo 100m/200m/4x100m, atleta do Exército Brasileiro, Adidas , Oakley, Max in Time , ECPinheiros, Time Nissan, bolsa pódio. #RumoRio2016","Que minha coragem seja maior ué meu medo é que minha força seja tão grande quanto minha fé.… https://t.co/cD78my0Rfw",,"1","25.71339","-80.28314","US","Coral Gables, FL","http://pbs.twimg.com/profile_images/696504790071820288/lStdBNCy_normal.jpg","948","434","28","pt","http://www.twitter.com/rosangela100m/status/721145118988845058"
"721145116409405441 ","2016-04-16","01:16","Dafne Castañón","daffcastt",,"#herewego ✈✈ @ Mexico City, Mexico https://t.co/9gx7QPWwn1",,,"19.4333","-99.13330000000001","MX","Cuauhtémoc, Distrito Federal","http://pbs.twimg.com/profile_images/611403210524246016/DQEY9VyD_normal.jpg","168","156","1","es","http://www.twitter.com/daffcastt/status/721145116409405441"
"721145115662626817 ","2016-04-16","01:16","#Talk2Me","LilBankhead945","‼️BOOKING ‼️EMAIL ONLY TALK2MEBANKHEAD@GMAIL.COM @LilBankheadFanPage Sat 6-9pm Sun6-10pm Streetz945 10pm-12am http://t.co/jACrDmfwQN","THIS SAT FREE❌ EVERYBODY FREE ❌ FREE ALL NIGHT @palaceatl hosted by @lilbankhead945 @defientent… https://t.co/SoRctUk46b",,,"33.62250816","-84.47624743","US","College Park, GA","http://pbs.twimg.com/profile_images/584883952994889728/clbKLqq1_normal.jpg","382464","140355","525","en","http://www.twitter.com/LilBankhead945/status/721145115662626817"
"721145115591450625 ","2016-04-16","01:16","Toronto Fire East","tofireE","Toronto Fire East Command Active Incidents","Alarm Commercial/industrial - Lebovic Avenue b/w Eglinton Avenue East / Comstock Road, Scarborough (2 Trucks)","1",,"43.726911","-79.2915031","CA","Toronto, Ontario","http://pbs.twimg.com/profile_images/3289433546/9c1c721e2eebde5fabe4e26704f8777b_normal.jpeg","3320","7","109","en","http://www.twitter.com/tofireE/status/721145115591450625"
"721145114698072065 ","2016-04-16","01:16","Toronto Fire","tofire","Toronto Fire Active Incidents.  NOT affiliated with Toronto Fire Dept. or City of Toronto.","Alarm Commercial/industrial - Lebovic Avenue b/w Eglinton Avenue East / Comstock Road, Scarborough (2 Trucks)",,,"43.726911","-79.2915031","CA","Toronto, Ontario","http://pbs.twimg.com/profile_images/3289441363/dccf4602666e4eacec1725d231e5d42a_normal.jpeg","6294","12","245","en","http://www.twitter.com/tofire/status/721145114698072065"
"721145113712463873 ","2016-04-16","01:16","LegendaryMsTee","LegendaryMsTee","legendary Bounce Artist from New Orleans, The First Lady sign to Cash Money Records in 1993. Entrepreneur, Artist, Writter, and motivational Speaker.","Blood Thicker Than Water available now.. If you want to buy the album come to Nuthin but fire… https://t.co/AVy5ws3nXf",,,"29.9728","-90.059","US","New Orleans, LA","http://pbs.twimg.com/profile_images/520757595527987200/k4AisN-z_normal.jpeg","1442","589","24","en","http://www.twitter.com/LegendaryMsTee/status/721145113712463873"
"721145109715226624 ","2016-04-16","01:16","Toronto Fire FIRE","tofiref","Toronto Fire FIRE active incidents (Minus ALARM Calls)  Not affiliated with Toronto Fire Dept. or City of Toronto.","Fire (Grass/rubbish) - Franson Crescent b/w St Lucie Dr / St Lucie Dr, North York (2 Trucks)",,,"43.739642","-79.5452099","CA","Toronto, Ontario","http://pbs.twimg.com/profile_images/3289419608/102b412f2c69ecf7780dfd3d8b9a70df_normal.jpeg","1606","4","49","en","http://www.twitter.com/tofiref/status/721145109715226624"
"721145108616376320 ","2016-04-16","01:16","Daniel Arzola","Arzola_d","Artivista. Creador de la campaña #NoSoyTuChiste - Artivist. I created the #ImNotaJoke campaign.  Liberté, Egalité, Sensualité.","May I call you #Jiggly? Thanks @jigglycaliente ¡Gracias, Bianca! @ Amherst College https://t.co/mEVOf14lxt",,,"42.36818684","-72.51869898","US","Amherst, MA","http://pbs.twimg.com/profile_images/720616724329009152/NZ0N9SIo_normal.jpg","9686","379","111","en","http://www.twitter.com/Arzola_d/status/721145108616376320"
"721145108603793408 ","2016-04-16","01:16","Toronto Fire West","tofireW","Toronto Fire West Command Active Incidents.  Not affiliated with Toronto Fire Dept. or The City of Toronto.","Fire (Grass/rubbish) - Franson Crescent b/w St Lucie Dr / St Lucie Dr, North York (2 Trucks)",,,"43.739642","-79.5452099","CA","Toronto, Ontario","http://pbs.twimg.com/profile_images/3289303680/992bb62b100f46f8426c4ebc9779e128_normal.jpeg","3040","8","106","en","http://www.twitter.com/tofireW/status/721145108603793408"
"721145108146561024 ","2016-04-16","01:16","aka Quessie Jankenz","tuffgyrl66","superstar","Just posted a photo @ Phillies Game @ Citizen's Bank Park https://t.co/hKpw9ZNs7f",,,"39.90586081","-75.16654487","US","Philadelphia, PA","http://pbs.twimg.com/profile_images/712281376700162048/FwexkquJ_normal.jpg","526","724","18","en","http://www.twitter.com/tuffgyrl66/status/721145108146561024"
"721145107802624001 ","2016-04-16","01:16","Zuly Sánchez Dulce","ZulyDulce","Tantos libros por leer, tantas canciones por escuchar, tantas películas por ver, tantos lugares por visitar. Hay tanta vida por vivir!!!","#HappyFriday @ Monterrey, Mexico https://t.co/dAUtPrnnc7",,,"25.6667","-100.3","MX","Monterrey, Nuevo León","http://pbs.twimg.com/profile_images/711209340976427009/zsDtcaCd_normal.jpg","186","332","3","es","http://www.twitter.com/ZulyDulce/status/721145107802624001"
"721145107769110529 ","2016-04-16","01:16","Toronto Fire","tofire","Toronto Fire Active Incidents.  NOT affiliated with Toronto Fire Dept. or City of Toronto.","Fire (Grass/rubbish) - Franson Crescent b/w St Lucie Dr / St Lucie Dr, North York (2 Trucks)",,,"43.739642","-79.5452099","CA","Toronto, Ontario","http://pbs.twimg.com/profile_images/3289441363/dccf4602666e4eacec1725d231e5d42a_normal.jpeg","6294","12","245","en","http://www.twitter.com/tofire/status/721145107769110529"
"721145105399291904 ","2016-04-16","01:16","Shelly","shellyBmedia","Columbia College Alum, voice of @MonDogBeach, contributor for @LakeViewILPatch, voice is my own","Spring open house (@ Glenwood Avenue Arts District in Chicago, IL) https://t.co/IXAQX9WfNp","1",,"42.00745265","-87.66619921","US","Chicago, IL","http://pbs.twimg.com/profile_images/1348914853/049049a8-f3ba-499e-80f5-ab8d65330586_normal.png","1619","1991","122","en","http://www.twitter.com/shellyBmedia/status/721145105399291904"
"721145105344786432 ","2016-04-16","01:16","Toronto Fire South","tofireS","Toronto Fire South Command Active Incidents.  Not affiliated with Toronto Fire Department or the City of Toronto.","Medical (Trouble Breathing) - Riverdale Avenue b/w Broadview Avenue / Logan Avenue, Toronto (2 Trucks)",,,"43.6688142","-79.3530177","CA","Toronto, Ontario","http://pbs.twimg.com/profile_images/3289345659/895d41a4a2c5dbda5bfbe97f73f96c2c_normal.jpeg","4003","8","137","en","http://www.twitter.com/tofireS/status/721145105344786432"
"721145104300433408 ","2016-04-16","01:16","IG: TWNTY8","TWNTY8","#TeamTWNTY8 #TeamYote TSGK","They Like Pablo, Why Are All The Windows Tinted On Your Tahoe? #TeamTWNTY8 #TeamYote #RWTW… https://t.co/zWENa0bv7Z",,,"41.8369","-87.6844","US","Chicago, IL","http://pbs.twimg.com/profile_images/701266461986332673/ZD-XjNfK_normal.jpg","888","315","16","en","http://www.twitter.com/TWNTY8/status/721145104300433408"
"721145103797133313 ","2016-04-16","01:16","Toronto Fire","tofire","Toronto Fire Active Incidents.  NOT affiliated with Toronto Fire Dept. or City of Toronto.","Medical (Trouble Breathing) - Riverdale Avenue b/w Broadview Avenue / Logan Avenue, Toronto (2 Trucks)",,,"43.6688142","-79.3530177","CA","Toronto, Ontario","http://pbs.twimg.com/profile_images/3289441363/dccf4602666e4eacec1725d231e5d42a_normal.jpeg","6294","12","245","en","http://www.twitter.com/tofire/status/721145103797133313"
"721145101284700161 ","2016-04-16","01:16","Mario","mareoflores","Prefiero hablar en la radio e ilustrar pa' no robar ✉: mareoflores@gmail.com","ApocalipCDMX #sunset #dusk #cdmx #mextagram #México @ Monumento a la Revolución https://t.co/aALizHalqT","1",,"19.43609925","-99.15430483","MX","Cuauhtémoc, Distrito Federal","http://pbs.twimg.com/profile_images/713918234672697344/IlDqICL1_normal.jpg","31985","571","617","es","http://www.twitter.com/mareoflores/status/721145101284700161"
"721145095861493761 ","2016-04-16","01:16","Equespecte","thedopefiends","On a mission to change the world through comics, puppets, and amigurumi magic. The Dope Fiends Comics, El Paso, TX","EPCON 2016 - #asquirrelandanut @ El Paso Convention Center https://t.co/4uZpkLtGD6","1",,"31.757769","-106.491178","US","El Paso, TX","http://pbs.twimg.com/profile_images/3503888651/6544cb811cff61b18c2908a19a6454fb_normal.jpeg","71","259","6","es","http://www.twitter.com/thedopefiends/status/721145095861493761"
"721145094481526784 ","2016-04-16","01:16","Miguel Angel ®","CeratiD","Soda Stereo||Cerati||The Smiths||Led Zeppelin||@Chivas||Ibero90.9||Ingenieria Petrolera||UNAM||Coachella||#CC16||Breaking Bad||Charles Bukowski||Jose Saramago||","I will fix you ❤... (@ Ciudad Deportiva Magdalena Mixhuca in Iztacalco, Distrito Federal) https://t.co/sNUV7m1cAu",,,"19.40841814","-99.08949599","MX","Venustiano Carranza, Distrito Federal","http://pbs.twimg.com/profile_images/697640911421853700/yg8Mw3Cu_normal.jpg","726","399","2","es","http://www.twitter.com/CeratiD/status/721145094481526784"
"721145093990658049 ","2016-04-16","01:16","Greg Williams","PQSports","Grassroots/Exposure Tournament & Camp Provider for Boys/Girls to showcase their talents. #HoopQuest #ReleasingGreatness | https://t.co/vKXUAZB4g5","D'Ville Dreams 28, Tru Elite 14, 6th Grade/12U Invitational - Pool (A) #HQAtlantaLive @exposurebball",,,"33.8956737","-84.6770432","US","Georgia, USA","http://pbs.twimg.com/profile_images/661876036922019840/azSNY_5B_normal.jpg","3491","4203","32","en","http://www.twitter.com/PQSports/status/721145093990658049"
"721145092388601856 ","2016-04-16","01:16","DeanneFerrerDrake","deannehferrer","Professional Runway Model","I'm at @StripViewCafe in Las Vegas, NV https://t.co/0nWHc85BDE","1",,"36.13048599","-115.24339431","US","Nevada, USA","http://pbs.twimg.com/profile_images/378800000411377075/d1afdbdc15fb06f6fda4e5d6c36add15_normal.jpeg","225","129","2","en","http://www.twitter.com/deannehferrer/status/721145092388601856"
"721145089641177094 ","2016-04-16","01:16","LegiScan CA","LegiScanCA","National public service for legislative tracking and data API; both free and subscription offerings with advanced monitoring, research, and reporting tools.","AB118 [Enroll] Hazardous substances: cleanup: Exide Technologies facility. https://t.co/TobDBXKeiX",,,"38.5767","-121.493766","US","Sacramento, CA","http://pbs.twimg.com/profile_images/535666313914363904/AqeCWugY_normal.png","375","1","18","es","http://www.twitter.com/LegiScanCA/status/721145089641177094"
"721145088399785984 ","2016-04-16","01:16","sage nell","123sage","sc:sageriley1 || tumblr:sage12","boats &amp;&amp; hoezzzz @ Kemah, Texas https://t.co/O15VxwybAH",,,"29.5425","-95.02030000000001","US","Kemah, TX","http://pbs.twimg.com/profile_images/712810704764424193/KDbGYgTp_normal.jpg","957","608","3","es","http://www.twitter.com/123sage/status/721145088399785984"
"721145085954371584 ","2016-04-16","01:16","Nicole Latorre","aurorainexile","creative mind, loving heart, gypsy spirit. I work with animals, and live in Los Angeles.","It's that part of the night... #sorrynotsorry @ Ceasar's Palace, Las Vegas, Nevada https://t.co/wedvvFjVYp","1",,"36.11874539","-115.17714063","US","Paradise, NV","http://pbs.twimg.com/profile_images/707991977388736513/_dfi1oQe_normal.jpg","271","169","15","en","http://www.twitter.com/aurorainexile/status/721145085954371584"
"721145082762670090 ","2016-04-16","01:16","93.3 The Beat","933thebeatjamz","#Jacksonville's #1 #Radio Station for #HipHop & #RnB | Listen to #933thebeatjamz #Live on the #iHeartRadio app| @breakfastclubam 6 -10am |IG: @933thebeatjamz","@metropcs IS THE PLUG TONIGHT. GIVING AWAY 2. PHONES ONE FOR THE......WHATEVER YOU WANT IT TO… https://t.co/Vc6teFdBbW",,,"30.32506018","-81.66021652000001","US","Downtown Jacksonville, FL","http://pbs.twimg.com/profile_images/697189852320657410/Wq3YFB9X_normal.jpg","6309","720","86","en","http://www.twitter.com/933thebeatjamz/status/721145082762670090"
"721145082636673025 ","2016-04-16","01:16","DialAmerica Jobs","DialAmericaJobs","Come for a job, stay for a career. Follow us for info on career opportunities at DialAmerica. Apply today and find out why we’re the best job in town!","Want to work in #Fairlawn, OH? View our latest opening: https://t.co/kTDfFnfQ1w #milspouse #parttime #nowhiring https://t.co/eo8j1XD7vS",,,"41.127833","-81.609844","US","Fairlawn, OH","http://pbs.twimg.com/profile_images/477080445910147073/zT7fWtoD_normal.jpeg","324","215","143","en","http://www.twitter.com/DialAmericaJobs/status/721145082636673025"
"721145082611675136 ","2016-04-16","01:16","PapasKitchen","Papas_Kitchen_","Follow me @ Papa'sKitchen as I represent my Philippines, its cuisine and warm hospitality - Featured in The NYTimes/Hungry City October 2013","Total eclipse #karaokeEVERYnight #papas_kitchen_#eeeeeats #foooodieee #feedmeny #pinoy… https://t.co/xTeQffxd7G",,,"40.743159","-73.898634","US","Queens, NY","http://pbs.twimg.com/profile_images/378800000595798776/c92c36412b9a380f640c30c913090c9e_normal.jpeg","338","843","13","en","http://www.twitter.com/Papas_Kitchen_/status/721145082611675136"
"721145081688752128 ","2016-04-16","01:16","Kelly (Fiore) Stultz","K_FioreStultz","Author of THICKER THAN WATER, JUST LIKE THE MOVIES, TASTE TEST & FLIRTING W/DISASTER romance series (2015-16) as Annie Kelly.","Finally got to meet @victoriaaveyard in person! Team @sztownsend81! ❤️❤️❤️ @newleafliterary @… https://t.co/HYoLPpV9L4","1",,"36.1208804","-115.1871198","US","Paradise, NV","http://pbs.twimg.com/profile_images/712077521378889728/hGgYOnuQ_normal.jpg","2239","1151","76","en","http://www.twitter.com/K_FioreStultz/status/721145081688752128"
"721145081584087040 ","2016-04-16","01:16","Braden Barty","bradenbarty","Video Production Expert Specializing in Effective, Creative, Quality, Hip, Cool HD / 4K Video for TV and the Web.","#teammeb @kttape #bostonmarathon @ The Boston Marathon https://t.co/iUR01pglTe","1",,"42.34872656","-71.08208571","US","Boston, MA","http://pbs.twimg.com/profile_images/550678064791703552/eBKkq8Il_normal.jpeg","309","306","12","en","http://www.twitter.com/bradenbarty/status/721145081584087040"
"721145081089167361 ","2016-04-16","01:16","Xhino","xhino","Codear es mi trabajo, el web development es mi hobbie y el fut mi pasion","I'm at Sam's Club México Sonora in Obregón, Sonora https://t.co/C1xoba7Ht0",,,"27.51552347","-109.93140084","MX","Cajeme, Sonora","http://pbs.twimg.com/profile_images/625475322046119936/Y_U6nHp2_normal.jpg","384","647","21","es","http://www.twitter.com/xhino/status/721145081089167361"
"721145834868318208 ","2016-04-16","01:18","LalalalalaToya","Lalalalatoya_10","what's in your grits?","Last night recap with my freshman roomie and good friend sw33t_t22!… https://t.co/JMNdGTQ05J",,,"36.124115","-86.7895432","US","Nashville, TN","http://pbs.twimg.com/profile_images/437732674564669442/Xo-uFscw_normal.jpeg","429","509","6","en","http://www.twitter.com/Lalalalatoya_10/status/721145834868318208"
"721145833786359808 ","2016-04-16","01:18","Mr. Bright Eyes","adrianvef","Aliis Vivere.","Qué pedo, putos. (@ Bar san francisco) https://t.co/vWVqLjDKAY",,,"19.34450071","-99.16759768999999","MX","Coyoacán, Distrito Federal","http://pbs.twimg.com/profile_images/672269121006923776/JTvT8oG-_normal.jpg","2280","1135","18","es","http://www.twitter.com/adrianvef/status/721145833786359808"
"721145833408872449 ","2016-04-16","01:18","spb","ggltlkprtty1day","This is crap transcribed from personal Google Voice messages and other such shenanigans.","Just posted a photo @ Beck's Motor Lodge https://t.co/O53a9qiHiE",,,"37.76559887","-122.43181463","US","San Francisco, CA","http://pbs.twimg.com/profile_images/1370649182/IMG00355_normal.jpg","24","37","10","en","http://www.twitter.com/ggltlkprtty1day/status/721145833408872449"
"721145831483707392 ","2016-04-16","01:18","blake cottle","bec102896",,"I'm at Sheraton Club Lounge in Maitland, FL https://t.co/mqk7ICMUc1",,,"28.63775717","-81.40477817","US","Maitland, FL","http://abs.twimg.com/sticky/default_profile_images/default_profile_4_normal.png","42","311",,"en","http://www.twitter.com/bec102896/status/721145831483707392"
"721145829646540800 ","2016-04-16","01:18","historymike","historymike","Iconoclast","Manx Pub. Ottawa. Friday. @ The Manx https://t.co/ZS8sciMtLg",,,"45.4150102","-75.6881192","CA","Ottawa, Ontario","http://pbs.twimg.com/profile_images/529667504679817217/ce5owfzo_normal.jpeg","57","97","7","en","http://www.twitter.com/historymike/status/721145829646540800"
"721145829428432896 ","2016-04-16","01:18","Matt Washington","matt_wash12","Hi I'm Matthew. I am Married, a Man of God, Brother, Uncle and Friend. Tweeting something Inspiring, Encouraging & Helpful.","The park was kind of empty today, but it made for a fantastic picture! #paris #park #landscape… https://t.co/u4ur4aa8si",,,"34.120158","-118.12175","US","San Marino, CA","http://pbs.twimg.com/profile_images/718936462192828417/1-ZgCyCH_normal.jpg","454","453","13","en","http://www.twitter.com/matt_wash12/status/721145829428432896"
"721145828958539776 ","2016-04-16","01:18","Jackie Barikhan","mylenderjackie","CA Home Loan Expert since 1997   Buying a Home? Get answers to your questions? Rates, Costs, Programs Quick & Easy 3 week closings! http://t.co/iFsPYkNnG1","Loving on Black Beauty!!💓💕💗 @ Serrano Creek Ranch Equestrian Center https://t.co/xAyrTZiNkZ",,,"33.64832549","-117.68965013","US","Lake Forest, CA","http://pbs.twimg.com/profile_images/585191869665026048/tbdTB79V_normal.jpg","169","193","4","en","http://www.twitter.com/mylenderjackie/status/721145828958539776"
"721145828891607040 ","2016-04-16","01:18","Mark Reed","reed_mars","#SHSUgrad Kansas✈️Huntsville✈️Houston✈️MARS #MakingARealitySurface Writer Educator & Owner of #FitFactoryHoustonATH #WhatUp6 bio in the link below","Currently here at #FitFactoryHouston ...#MARS🚀 🏃💨💪🏾 boys getting beefy lol @ Fit Factory Houston https://t.co/L2loHTveml",,,"29.93942","-95.3052699","US","Houston, TX","http://pbs.twimg.com/profile_images/710269316667604992/1tip98nq_normal.jpg","515","471","2","en","http://www.twitter.com/reed_mars/status/721145828891607040"
"721145827301986304 ","2016-04-16","01:18","Mark L. Feinsod","Feinsodville","International man of mystery. If the mystery is whether or not I remembered to turn off the coffee maker.","Red Hook. @ Jalopy Tavern https://t.co/8pnhqHPOx4",,,"40.68131","-74.00435","US","Brooklyn, NY","http://pbs.twimg.com/profile_images/646759038437433345/dvG0Iz03_normal.jpg","367","269","12","en","http://www.twitter.com/Feinsodville/status/721145827301986304"
"721145824445599744 ","2016-04-16","01:18","Haley Pearson","HaleyRhiannon23","Romans 8:28 ✝ Grand Valley State University","so much love for pronto pups, these girls &amp; sunsets..........but mostly for the pronto pups @… https://t.co/U9KMnnPGwr",,,"43.06305556","-86.22833333","US","Grand Haven, MI","http://pbs.twimg.com/profile_images/621703316863586304/zkDIic8S_normal.jpg","506","271","4","en","http://www.twitter.com/HaleyRhiannon23/status/721145824445599744"
"721145823900352512 ","2016-04-16","01:18","Akata Akua ✨","GLAMOROUS24_7","@Drake Future Wife .","All summer 16, playing dirty not clean 😎 @ Soho, New York Fashion… https://t.co/PIJySs4Mut",,,"40.72387","-74.00125","US","Manhattan, NY","http://pbs.twimg.com/profile_images/719968226940219392/1bG4612c_normal.jpg","1366","589","11","en","http://www.twitter.com/GLAMOROUS24_7/status/721145823900352512"
