"721135055326810113 ","2016-04-16","00:36","Bri","lightninggCOLT","i'll be in room 119 if ya want an autograph","oh my god yes... I love pizza! can't wait to take on prom with… https://t.co/8oFAwAIybY",,,"40.6649208","-73.4971085","US","Seaford, NY","http://pbs.twimg.com/profile_images/705731054104137728/875j5fZb_normal.jpg","184","266",,"en","http://www.twitter.com/lightninggCOLT/status/721135055326810113"
"721135053733015553 ","2016-04-16","00:36","Ivan Devore Holt","ivan_dateerible","Living, working out, art, fashion and a little bit of love. IG: ivandevoreholt Snapchat: ivandevoreholt Facebook: Ivan Devore Holt","Yeah I #messedup but I uploaded this #clip because it's not about the #wrong step  it's the step… https://t.co/EtpdPJQDXJ",,,"33.74112","-84.34961","US","Atlanta, GA","http://pbs.twimg.com/profile_images/698219869163122689/VhTWftNU_normal.jpg","1766","1569","50","en","http://www.twitter.com/ivan_dateerible/status/721135053733015553"
"721135049899380736 ","2016-04-16","00:36","LegiScan GA","LegiScanGA","National public service for legislative tracking and data API; both free and subscription offerings with advanced monitoring, research, and reporting tools.","HR1871 [Passed] Luton, Jimmie MeMa; commend https://t.co/mb0pBYGi7G",,,"33.749035","-84.388195","US","Atlanta, GA","http://pbs.twimg.com/profile_images/535676170071592960/9zVeWdzO_normal.png","136","1","16","en","http://www.twitter.com/LegiScanGA/status/721135049899380736"
"721135049794592768 ","2016-04-16","00:36","Steve Morrow","morrow_steve","On the board of The Well a nonprofit coffeehouse in Nashville that turns coffee into clean drinking water for people around the world because of Christ's love!","@mochaclub is rocking @wellcoffeehouse and saving lives in Africa! I love these guys &amp; gals!!! @… https://t.co/CqBAaaBnfJ",,,"36.0404249","-86.76814","US","Nashville, TN","http://pbs.twimg.com/profile_images/676024022572916737/VaH-jb9n_normal.jpg","130","253","1","en","http://www.twitter.com/morrow_steve/status/721135049794592768"
"721135049681346560 ","2016-04-16","00:36","Jess Bailey","JessicaMBailey_","Wagner College '17, AOΠ, Arts Admin Trash, Lover of Tea, Musical Theatre Enthusiast, Puppy and Child Caretaker, It's Lit","TKE formal❣💋 @ Ocean Place Resort &amp; Spa https://t.co/XCybq8OFPz",,,"40.30457","-73.97933","US","Long Branch, NJ","http://pbs.twimg.com/profile_images/714677871588024320/SOuVwjyw_normal.jpg","695","651","5","en","http://www.twitter.com/JessicaMBailey_/status/721135049681346560"
"721135049496727553 ","2016-04-16","00:36","Angela Nikole","NikoleAngela","Dog lover ❤ Backstreet Boys fan for life KTBSPA 4eva also a fan of NY Yankees⚾️","#lobstershack @ Lobster Shack https://t.co/oy8ieQsgw6",,,"40.666153","-73.48659000000001","US","Seaford, NY","http://pbs.twimg.com/profile_images/515102576170512384/MDxDuGnh_normal.jpeg","207","635","10","en","http://www.twitter.com/NikoleAngela/status/721135049496727553"
"721135049278525440 ","2016-04-16","00:36","Sylvia Solano","CleaningLady","Best Cleaning Service In Miami","Just posted a photo @ Asian Garden Chinese food and Sushi bar https://t.co/X2vkV7pscN",,,"25.88454851","-80.33242658","US","Hialeah, FL","http://pbs.twimg.com/profile_images/615202099777941504/nluRD6J4_normal.jpg","377","711","13","en","http://www.twitter.com/CleaningLady/status/721135049278525440"
"721135048502681600 ","2016-04-16","00:36","Brooke Lockett","BrookeNG12",,"I'm at @BlueRiverBowl in Shelbyville, IN https://t.co/ZMM9dvn6dE",,,"39.51026403","-85.785956","US","Shelbyville, IN","http://pbs.twimg.com/profile_images/589431979734499328/eqsKHNtF_normal.jpg","288","379","4","es","http://www.twitter.com/BrookeNG12/status/721135048502681600"
"721135048410468352 ","2016-04-16","00:36","April Chantia Roller","acrollermom","Jeremy's Legacy will live on through the love we shared and our sons Christian 8, Castiel 6, and Chance 4 ♡ RIP baby, we love and miss you! #SPNfamily","Just posted a photo @ University of Central Missouri https://t.co/qDKN10jPL1",,,"38.75782868","-93.74116932","US","Warrensburg, MO","http://pbs.twimg.com/profile_images/708388602128896000/LXZOqrjZ_normal.jpg","462","1620","14","en","http://www.twitter.com/acrollermom/status/721135048410468352"
"721135048213327872 ","2016-04-16","00:36","Bella ❣","bellgiunta","#liveforKait","All laughs all the time 🤑 @ PNC Park https://t.co/BcH5JvYax4",,,"40.44709673","-80.00615131000001","US","Pittsburgh, PA","http://pbs.twimg.com/profile_images/720244639190491137/cb4JxCYz_normal.jpg","512","561",,"en","http://www.twitter.com/bellgiunta/status/721135048213327872"
"721135047626092544 ","2016-04-16","00:36","Timothy Buck ⚡️","asktimothybuck","Reader, Software Lover, Product @Varigence, Formerly @HP. I blog at timothybuck.me. Tweets are my own.","Pretty cool that @saddlebackbags launched a new line of canvas bags–#Mountaback. https://t.co/3tNHfcOdF7","1",,"34.83301256","-82.40755046","US","Greenville, SC","http://pbs.twimg.com/profile_images/469348184766951424/AjGQJAxu_normal.jpeg","577","648","32","en","http://www.twitter.com/asktimothybuck/status/721135047626092544"
"721135046585892864 ","2016-04-16","00:36","GROB SAVAGE","SlickSavGROB","#GorillaBroke | REALEST 1 RAPPIN | JEALOUS Muisc Video In Link! | Contact  SlickSavMusic@Gmail.Com https://t.co/HLioHpSunK","Just Know We Ain't Even Finish Yet... 😏 I ain't about to pay for… https://t.co/thPNhqEGGe",,,"32.58670695","-83.610564","US","Warner Robins, GA","http://pbs.twimg.com/profile_images/720039959781064704/m3WsWHmq_normal.jpg","5508","4431","13","en","http://www.twitter.com/SlickSavGROB/status/721135046585892864"
"721135046552338433 ","2016-04-16","00:36","Janet Anderson","Jantucket15","Blessed beyond belief. I love the Packers, the Penguins, and the Pirates. I enjoy God's world by organic gardening, fly tying,and hiking.","@PirateNation22 All three runs have come from them.",,,"40.4472348","-80.00616840000001","US","Pittsburgh, PA","http://pbs.twimg.com/profile_images/1644080833/g01jU2Ef_normal","43","144","3","en","http://www.twitter.com/Jantucket15/status/721135046552338433"
"721135046246182912 ","2016-04-16","00:36","제나 (Jenna)","kamala_chan","Deeply in love with Asian culture from Korea, Japan, China and India.  YBF (Yoon Do-Hyun Band) Fan Girl! I proudly write for YAM! http://t.co/pfN76Guk","Good job #BarnesAndNoble! Look at this kick-ass display of comic ladies (and...er...… https://t.co/4ni9OPNuK4",,,"44.96898267","-93.44685462","US","Minnetonka, MN","http://pbs.twimg.com/profile_images/628014633484312576/NavM4t7a_normal.jpg","408","1401","37","en","http://www.twitter.com/kamala_chan/status/721135046246182912"
"721135045570789376 ","2016-04-16","00:36","guestofaguest LA","gofgLA","Los Angeles People, Places, Parties & Nightlife; from the strip on Sunset Boulevard to the bike path of Venice and all the hills and broken dreams in between.","@kyliejenner and her friends having fun at the DJ booth #YOUth @papermagazine @ Parker Palm Springs https://t.co/fT5AAAv2cG",,,"33.79568806","-116.5002714","US","Palm Springs, CA","http://pbs.twimg.com/profile_images/456530250457833473/VnB3z5Zd_normal.jpeg","3227","988","148","en","http://www.twitter.com/gofgLA/status/721135045570789376"
"721135045143044098 ","2016-04-16","00:36","emilee flurry","emilee_flurry","shoot for the moon even if you miss it you will land among the stars - les brown❤️❤️❤️❤️❤️❤️❤️","OMG one of my favorite teacher Just got engaged I am so proud of her she is one of the best… https://t.co/CWzTT8XxYA",,,"31.30513185","-89.40467709000001","US","Mississippi, USA","http://pbs.twimg.com/profile_images/676225887935709184/Ftuv9Uvj_normal.jpg","172","1054",,"en","http://www.twitter.com/emilee_flurry/status/721135045143044098"
"721135045004652544 ","2016-04-16","00:36","Mr. DeVoe","MrDeVoe","Environmental Science Teacher - NYS Master Teacher Program","Cutting posts for a trail project. @ New Vision Environmental Science Careers https://t.co/l7HcEgrj2R",,,"42.570876","-76.245552","US","New York, USA","http://pbs.twimg.com/profile_images/563526994831618048/MSsZ7OFt_normal.jpeg","298","295","23","en","http://www.twitter.com/MrDeVoe/status/721135045004652544"
"721135044216168448 ","2016-04-16","00:36","Jim Harris","jimh1014","Jets, Knicks, Yankees fan, Seton Hall alum, Unilever opex analyst, and horrible golfer","Drinking a Gold Bar Blonde by @manskirtbrew @ Manskirt Brewery — https://t.co/OPKMlnlnW6",,,"40.8539","-74.82980000000001","US","Hackettstown, NJ","http://pbs.twimg.com/profile_images/660951172669440002/_adZpodT_normal.jpg","313","757","18","en","http://www.twitter.com/jimh1014/status/721135044216168448"
"721135043364700161 ","2016-04-16","00:36","Underground Rich","URStudio336","With the total of 2 studios located in Greensboro, NC and a great staff, we are well known as one of the finest studios in the world. Call 336-505-8413","@rickyruckus x @jwhite4life #UndergroundRichStudios #Hittsboro #StudioB #StudioVibes #StudioLife… https://t.co/5aGAGy7MsS",,,"36.0649148","-79.86430405999999","US","Greensboro, NC","http://pbs.twimg.com/profile_images/643681006696951808/U9MXVXAw_normal.jpg","718","937","5","es","http://www.twitter.com/URStudio336/status/721135043364700161"
"721135042760716288 ","2016-04-16","00:36","Just _ Me","WestonDaphne",,"Checked in automatically with the Uber Checkin app! https://t.co/6uMOZVAbw5 (@ The Mixx Audience in TN) https://t.co/vruLXbW6YY",,,"36.17750059","-83.43487852","US","Morristown, TN","http://pbs.twimg.com/profile_images/703337684153065473/bMUM50Lv_normal.jpg","381","577","13","en","http://www.twitter.com/WestonDaphne/status/721135042760716288"
"721135041963757568 ","2016-04-16","00:36","Just _ Me","WestonDaphne",,"Checked in automatically with the Uber Checkin app! https://t.co/6uMOZVAbw5 (@ Hot Tub Central in TN) https://t.co/AMEAFmVX66",,,"36.17752126","-83.4347013","US","Morristown, TN","http://pbs.twimg.com/profile_images/703337684153065473/bMUM50Lv_normal.jpg","381","577","13","en","http://www.twitter.com/WestonDaphne/status/721135041963757568"
"721135040927830017 ","2016-04-16","00:36","Rudy Lopez","rudyjrlopez","Living it up in #SanDiego-#Tijuana.  Always root for the home team.  @Padres @XolosOficial @GoAztecs @Chargers @TorosDeTijuana #CraftBeer  #CervezaAretsanal","Canned water? Maybe...but look at the bulk of my beers - Drinking a Tecate Light at @xolosoficial - https://t.co/4miYsaCxO5",,,"32.508","-116.993","MX","Tijuana, Baja California","http://pbs.twimg.com/profile_images/667545591610671105/Y5jJQrsk_normal.jpg","1026","2006","55","en","http://www.twitter.com/rudyjrlopez/status/721135040927830017"
"721135040382558208 ","2016-04-16","00:36","April Chantia Roller","acrollermom","Jeremy's Legacy will live on through the love we shared and our sons Christian 8, Castiel 6, and Chance 4 ♡ RIP baby, we love and miss you! #SPNfamily","Memorial wall will go here @ University of Central Missouri https://t.co/luLYrYfGEP",,,"38.75782868","-93.74116932","US","Warrensburg, MO","http://pbs.twimg.com/profile_images/708388602128896000/LXZOqrjZ_normal.jpg","462","1620","14","en","http://www.twitter.com/acrollermom/status/721135040382558208"
"721135040206413826 ","2016-04-16","00:36","Ismael Vargas","ismaloo","Licenciado en comunicación. Relaciones públicas.Gusto por el arte, moda, cine, gay","Delush 👌🏻 (@ Sushi Hokō-Ki - @sushihokoki_fan in Mexico City, DF w/ @yorchmacias) https://t.co/e4Pue6uY5H",,,"19.43806264","-99.15120692000001","MX","Cuauhtémoc, Distrito Federal","http://pbs.twimg.com/profile_images/703230901501595648/0Yv2Mt02_normal.jpg","273","581","5","fi","http://www.twitter.com/ismaloo/status/721135040206413826"
"721135040168665088 ","2016-04-16","00:36","SankofaVideoBks&Cafe","SankofaVideoBks","2714 Georgia Ave NW Wash. DC since '97. Cultural center for books, DVD's about people of African descent cultural activities, & community space. Great food too!","#alleyesondc @ Sankofa Video Books &amp; Cafe https://t.co/gQkbEIwd5v",,,"38.92556","-77.02315","US","Washington, DC","http://pbs.twimg.com/profile_images/2106039270/sankofalogo_normal.jpg","1434","1954","39","en","http://www.twitter.com/SankofaVideoBks/status/721135040168665088"
"721135039879200768 ","2016-04-16","00:36","Arturo Osorio Barrig","arthurlinux","Web Developer and Free Software Advocate","Alitas mmmmm (at @VancouverWings in Guadalajara, Jalisco) https://t.co/84IWi4RyCc",,,"20.65593658","-103.3177033","MX","Guadalajara, Jalisco","http://pbs.twimg.com/profile_images/688984600899526657/RyHks32y_normal.jpg","697","800","45","es","http://www.twitter.com/arthurlinux/status/721135039879200768"
"721135038809542656 ","2016-04-16","00:36","KombustionMoto","KombustionMoto","801-674-2451 UtV & side x side performance parts. Home for all RZR Parts!! We build custom themed RzR's","Eliminate the front end noise from your RzR 1000 with this carrier bearing upgrade! Just click… https://t.co/ZkgBw9AsQ6",,,"40.628945","-111.8997849","US","Murray, UT","http://pbs.twimg.com/profile_images/561010130431389696/AqDc3_SH_normal.jpeg","290","477","3","en","http://www.twitter.com/KombustionMoto/status/721135038809542656"
"721135038386073600 ","2016-04-16","00:36","SAY IT LOUD!","LocoLoud","fearless","Finally @bjformento @ Snap! Orlando https://t.co/kpqARd1Be1",,,"28.55336671","-81.36584662999999","US","Orlando, FL","http://pbs.twimg.com/profile_images/179538671/SIL_FCbk_normal.jpg","1143","1933","31","en","http://www.twitter.com/LocoLoud/status/721135038386073600"
"721135038193123328 ","2016-04-16","00:36","Kadir","_KadirAli_","Be smart, always be #1","Just posted a photo @ City of East Orange https://t.co/4jNwFj0Q2t",,,"40.7653427","-74.21601870000001","US","East Orange, NJ","http://pbs.twimg.com/profile_images/654107204606234624/MZu6hyIL_normal.jpg","140","677","14","en","http://www.twitter.com/_KadirAli_/status/721135038193123328"
"721135033780736005 ","2016-04-16","00:36","Austin Barbian","holyfoleypro","Filmmaker/Sound Designer/Colorist","@beccamaeh About to get life casted for the first time!! #creativityforlife #entertainmentdesign… https://t.co/JXpgKyfMdQ",,,"40.43749453","-79.9995744","US","Pittsburgh, PA","http://pbs.twimg.com/profile_images/675895571647963136/tbyPdOk7_normal.png","144","418","4","en","http://www.twitter.com/holyfoleypro/status/721135033780736005"
"721135033440997376 ","2016-04-16","00:36","theCityMoms","theCityMoms","Not your average moms group. THE social events + support community for moms in the Indianapolis area. We want to meet you! Copyright 2014.","Loving-capital-L this pic of the beautiful expectant mommas from last night's #RockTheCradle by… https://t.co/7SUhAV9Uby",,,"39.96475564","-86.15885132","US","Carmel, IN","http://pbs.twimg.com/profile_images/504765048045068288/XBfAvBwn_normal.png","1838","1610","40","en","http://www.twitter.com/theCityMoms/status/721135033440997376"
"721135031133937664 ","2016-04-16","00:36","LJVM Coliseum","LJVMColiseum","Home to Wake Forest University Basketball. Follow the LJVM Coliseum on Facebook for upcoming event information & updates! https://t.co/Ay1wDUyRzk","We hope you're with us as the celticwomanofficial share their #Destiny World Tour with us… https://t.co/lJWhPWOrim",,,"36.12636","-80.25924999999999","US","Winston-Salem, NC","http://pbs.twimg.com/profile_images/667819738211426304/ZBs6h0XS_normal.jpg","434","447","11","en","http://www.twitter.com/LJVMColiseum/status/721135031133937664"
"721135030978879493 ","2016-04-16","00:36","LegiScan FL","LegiScanFL","National public service for legislative tracking and data API; both free and subscription offerings with advanced monitoring, research, and reporting tools.","H3515 [Passed] Providing for an appropriation and annuity to compensate Q.B. for injuries sustained as a result ... https://t.co/2q8baKQZA7",,,"30.438086","-84.282196","US","Tallahassee, FL","http://pbs.twimg.com/profile_images/535675584634830848/XYdWKq-s_normal.png","292","1","10","en","http://www.twitter.com/LegiScanFL/status/721135030978879493"
"721135028982431749 ","2016-04-16","00:36","Randy Twyford","Twyfordbbq","Award Winning BBQ, Sauces and catering company in Jacksonville, IL","Thank you Springfield for a great day at 2nd &amp; Carpenter and especially the crew from Memorial… https://t.co/plSXRL7BVW",,,"39.7715416","-90.12348179999999","US","Illinois, USA","http://pbs.twimg.com/profile_images/1333756708/_MG_8700__640x480__normal.JPG","3550","3098","111","en","http://www.twitter.com/Twyfordbbq/status/721135028982431749"
"721135027900186624 ","2016-04-16","00:36","Jacey Holst","Jacey_Mae","21 | College Volleyball #4 | Devoted Denver Nuggets & Blue Devil fan | Taken | #JesusSaves | #PCSaints |#RollPokes | #77 | Proverbs 31:25 | ig: jacey_rae | ❤️","Yay football. 🏈💛💚 #42 #gosaintsgo @ Presentation College https://t.co/d2UoypVcPI",,,"45.4812012","-98.487915","US","Aberdeen, SD","http://pbs.twimg.com/profile_images/720468120104787969/W7Ao5zO-_normal.jpg","570","365","4","en","http://www.twitter.com/Jacey_Mae/status/721135027900186624"
"721135025673093120 ","2016-04-16","00:36","Pəpinóskī","PepeTheDreamer","Tan inhumano, hedonista-cabrón de corazón. Jugoso de convicción, sibarita y ególatra por iniciación (todo de petatiux).","I'm at Muse Beauty-bar in Morelia, Michoacan https://t.co/ak3MMqgVuv",,,"19.68685062","-101.14962869","MX","Morelia, Michoacán de Ocampo","http://pbs.twimg.com/profile_images/616694672467951617/V0XcWNqJ_normal.jpg","122","133","6","en","http://www.twitter.com/PepeTheDreamer/status/721135025673093120"
"721135025521987584 ","2016-04-16","00:36","Samuel Rubenfeld","srubenfeld","WSJ reporter; opinions are my own. Also tweeting at @WSJRisk. Stories here http://t.co/qux1rnvWph. Shalom to all my fans; salute to all my haters.","I'm at @LICBar in Long Island City, NY https://t.co/vNeMC1T5wX",,,"40.747002","-73.952798","US","Queens, NY","http://pbs.twimg.com/profile_images/552175640946827265/6rMVzQn__normal.jpeg","5001","712","304","en","http://www.twitter.com/srubenfeld/status/721135025521987584"
"721135023282216960 ","2016-04-16","00:36","Methodist PO Jobs","HMPOJobs","Great Opportunities available at the TMH Physician Organization","Want to work at Houston Methodist Specialty Phys...? We're #hiring in #Houston, TX! Click for details: https://t.co/tDACAMwAls",,,"29.7106841","-95.40089519999999","US","Houston, TX","http://pbs.twimg.com/profile_images/475022818514440193/OFqeKQ_o_normal.jpeg","97","8","37","en","http://www.twitter.com/HMPOJobs/status/721135023282216960"
"721135023152177152 ","2016-04-16","00:36","GMS World","geolocationms","Discover interesting places nearby!","Discover hotels around Jacksonville, United States from 38 USD per night: https://t.co/JgCrUOiVT8 https://t.co/pQUpR1S1FU",,,"30.134025","-81.549977","US","Mandarin, FL","http://pbs.twimg.com/profile_images/551822819403644928/ObInx5M7_normal.png","120","1","175","en","http://www.twitter.com/geolocationms/status/721135023152177152"
"721135021772279808 ","2016-04-16","00:36","TMJ-SFO HRTA Jobs","tmj_sfo_hrta","Follow this account for geo-targeted Hospitality/Restaurant/Tourism job tweets in San Francisco, CA. Need help? Tweet us at @CareerArc!","We're #hiring! Read about our latest #job opening here: Baker - Night - https://t.co/NeYBp93gWD #parttime #Emeryville, CA #Hospitality",,,"37.8291601","-122.2878255","US","Oakland, CA","http://pbs.twimg.com/profile_images/667231528036909056/bLUbyNXE_normal.jpg","489","323","87","en","http://www.twitter.com/tmj_sfo_hrta/status/721135021772279808"
"721135021344559105 ","2016-04-16","00:36","LegiScan CA","LegiScanCA","National public service for legislative tracking and data API; both free and subscription offerings with advanced monitoring, research, and reporting tools.","ACR156 [Engross] Hemophilia: World Hemophilia Day. https://t.co/IKv1dtcTgs",,,"38.5767","-121.493766","US","Sacramento, CA","http://pbs.twimg.com/profile_images/535666313914363904/AqeCWugY_normal.png","375","1","18","en","http://www.twitter.com/LegiScanCA/status/721135021344559105"
"721135019796750337 ","2016-04-16","00:36","Kindred Jobs","Kindred_Jobs","Kindred Healthcare, named a Fortune Magazine Most Admired Company, is the largest provider of post-acute care services in the United States.","Can you recommend anyone for this #HealthWelfare #job? https://t.co/G83koRJPsE #Denver, Colorado #Hiring",,,"39.7392358","-104.990251","US","Denver, CO","http://pbs.twimg.com/profile_images/881390226/twitter_logo_bigger_normal.jpg","824",,"413","en","http://www.twitter.com/Kindred_Jobs/status/721135019796750337"
"721135019670970368 ","2016-04-16","00:36","Arthrex","Arthrex","Welcome to Arthrex…we are a global medical device company committed to making people better in our community and around the world. #DiscoverArthrex","Want to work at Arthrex? We're #hiring in #Naples, FL! Click for details: https://t.co/pvgeIUBk96 #Manufacturing #Job #Jobs",,,"26.1420358","-81.79481029999999","US","Naples, FL","http://pbs.twimg.com/profile_images/459798083866349568/_AR7vdl3_normal.jpeg","2478","93","194","en","http://www.twitter.com/Arthrex/status/721135019670970368"
"721135019645911040 ","2016-04-16","00:36","Julie Franczek","j_frannie","Nothing to see here folks. Just a Republican, Bears & Spartan fan with a giant dog.","Let's groove.🌎💨🔥 #earthwindandfire @ Van Andel Arena Grand Rapids, Michigan https://t.co/5vfocYik1K",,,"42.9627453","-85.67202305000001","US","Grand Rapids, MI","http://pbs.twimg.com/profile_images/1245145670/Picture_4_normal.png","140","318","3","en","http://www.twitter.com/j_frannie/status/721135019645911040"
"721135018479734784 ","2016-04-16","00:36","CVS Health Jobs","CVSHealthJobs","We're #hiring! Explore a variety of open positions that offer a challenging & rewarding #career. Follow us to uncover #job opportunities at @CVSHealth.","Pharmacy Technician – Target Store - CVS Health: (#HuntingtonBeach, CA) https://t.co/73aMO9NYS9 #Healthcare #Job #Jobs #Hiring",,,"33.660297","-117.9992265","US","Huntington Beach, CA","http://pbs.twimg.com/profile_images/511525698507268097/ptBo_zo__normal.jpeg","626","3","782","en","http://www.twitter.com/CVSHealthJobs/status/721135018479734784"
"721135017775079424 ","2016-04-16","00:36","TMJ-CAN Jobs","tmj_can_jobs1","Follow this account for geo-targeted Other job tweets in Canada. Need help? Tweet us at @CareerArc!","Want to work at Emerson Electric Co? We're #hiring in #Brantford, CA-ON! Click for details: https://t.co/JPpwREyBi7 #Finance #Job #Jobs","1",,"43.1393867","-80.26442539999999","CA","Brantford, Ontario","http://pbs.twimg.com/profile_images/668741123448246274/qbqqldf1_normal.jpg","730","507","263","en","http://www.twitter.com/tmj_can_jobs1/status/721135017775079424"
"721135017418702848 ","2016-04-16","00:36","Christian","chris_ab911","soy de los que les hablan bonito y se les rasga el calzón...","I'm at Paseo Acoxpa - @pacoxpa in Tlalpan, DF w/ @ponxho https://t.co/jmPx42z33D",,,"19.29913443","-99.13695574","MX","Tlalpan, Distrito Federal","http://pbs.twimg.com/profile_images/3605779390/0190af340a580fbfbbe9cd79b08a777d_normal.jpeg","3252","3281","6","en","http://www.twitter.com/chris_ab911/status/721135017418702848"
"721135017347260416 ","2016-04-16","00:36","Ranger Known as Dave","RGRDave","Bio you can't get my Bio..... But you should follow @zfgnation as well.","Drinking and grillen https://t.co/Z2Y62J686j",,,"30.65945455","-96.31176364","US","Bryan, TX","http://pbs.twimg.com/profile_images/2438988145/zlvr1csxqrh97n1do6dy_normal.jpeg","140","207","9","en","http://www.twitter.com/RGRDave/status/721135017347260416"
"721135016416317440 ","2016-04-16","00:36","Angélica Vieira","angelvieira",,"Eu não consigo fechar a boca. Um dos meus maiores prazeres na vida é… https://t.co/PkDc44RymI",,,"34.23546253","-118.66066194","US","Los Angeles, CA","http://pbs.twimg.com/profile_images/692878694537261057/8hY4EBb5_normal.jpg","469","424","11","pt","http://www.twitter.com/angelvieira/status/721135016416317440"
"721135016324034561 ","2016-04-16","00:36","Poettis","IamPoettis","I am a God-loving, professional encourager,  hope coach, free-styling poet, speaker, writer, educator and Queen Mom...doing all the jobs He gave me!","The Christian Mic is Open....C Style. @ Studio 5 ten https://t.co/SNgrARevXK",,,"26.18136591","-80.25120987","US","Lauderhill, FL","http://pbs.twimg.com/profile_images/601478678896312322/u6ZU3xNx_normal.jpg","964","930","17","en","http://www.twitter.com/IamPoettis/status/721135016324034561"
"721135016277708800 ","2016-04-16","00:36","TMJ-CA HRTA Jobs","tmj_ca_hrta","Follow this account for geo-targeted Hospitality/Restaurant/Tourism job tweets in California Non-Metro. Need help? Tweet us at @CareerArc!","See our latest #job and click to apply: Barista (US) - https://t.co/LTUBeB0Xrq #Hospitality #Veterans #Hiring #CareerArc",,,"33.7883451","-116.4815969","US","Cathedral City, CA","http://pbs.twimg.com/profile_images/666794831088234496/d0myNv4o_normal.jpg","451","297","112","en","http://www.twitter.com/tmj_ca_hrta/status/721135016277708800"
"721135015455809536 ","2016-04-16","00:36","GeneDotCom","GeneDotCom","Radio Personality V101.5 CEO Of https://t.co/6vbP0kQneZ LLC, ➕Marketing, Actor, Host, Public Figure, Rising Tycoon, No  to waste!","#Relationship101 @ Jacksonville, Florida https://t.co/wi0wJ4PFPa",,,"30.3194","-81.66","US","Southside, FL","http://pbs.twimg.com/profile_images/713762785096810496/HXl1MIfd_normal.jpg","1590","919","29","sv","http://www.twitter.com/GeneDotCom/status/721135015455809536"
