"721134668297433091 ","2016-04-16","00:34","Kristiana","_Kristiana_","Chicagoan. Idea generator. Jack-of-all-Trades. Quick with a quip. Audiophile. Bibliophile. Cinephile. Foodie. People Person. Wanderer.","First time (@ Red Robin's Burger Works - @redrobincareers in Chicago, IL) https://t.co/4l5TdH8hIH",,,"41.89676034","-87.62747122","US","Chicago, IL","http://pbs.twimg.com/profile_images/1226902631/image_normal.jpg","877","344","40","en","http://www.twitter.com/_Kristiana_/status/721134668297433091"
"721134667504623617 ","2016-04-16","00:34","TheDopestMatrix","TheDopestMatrix","Listen to Young Takeover 1.5 by TheDopestMatrix on @AppleMusic. https://t.co/vEbjNs46Dp","Smoked my first blunt in #sandiego with @jake6thestar @ San Diego, California https://t.co/WrzAFuv0xX",,,"32.7153","-117.156","US","San Diego, CA","http://pbs.twimg.com/profile_images/634960235967311876/pKqlsF8F_normal.jpg","3605","3231","31","en","http://www.twitter.com/TheDopestMatrix/status/721134667504623617"
"721134666594533376 ","2016-04-16","00:34","Karim","Bionik05","Un simple robot...","Cuando quieras Chris Martin!! @ Foro Sol, Mexico D.F. https://t.co/Hco1beFR8M",,,"19.40511435","-99.09569378","MX","Iztacalco, Distrito Federal","http://pbs.twimg.com/profile_images/665654800642535424/DHeM1Cr6_normal.jpg","414","262","17","es","http://www.twitter.com/Bionik05/status/721134666594533376"
"721134665969569794 ","2016-04-16","00:34","Eugenia Olivares","LovenFaithGenia","I am always smiling and I do love giving hugs. I enjoy life and live it to its fullest. I know that God will help me make a difference and take me far.","This was me after the Fiesta Parade. It was lots of fun.… https://t.co/Ug6LiVUl4L",,,"29.40789","-98.65679","US","San Antonio, TX","http://pbs.twimg.com/profile_images/618128346715586560/SzcTOYWk_normal.jpg","74","115","5","en","http://www.twitter.com/LovenFaithGenia/status/721134665969569794"
"721134664853897216 ","2016-04-16","00:34","Courtney Metcalf","cerwin711","I'm just a small woman with big dreams who serves an infinite God.","#hinckley #beauty #nature @ Hinckley Lake https://t.co/gDvSYPU6ri",,,"41.225957","-81.719742","US","Ohio, USA","http://pbs.twimg.com/profile_images/606420451330564096/8cJlz-J6_normal.jpg","160","599","7","en","http://www.twitter.com/cerwin711/status/721134664853897216"
"721134664778317824 ","2016-04-16","00:34","Virtual Jukebox","VirtualJukebox","Live stream of music playing at @VirtualJukebox locations. We make background music more engaging.","Sylvia by Miike Snow is #nowplaying in Thumb Coast Brewing Co., Port Huron.",,,"42.975489","-82.42236699999999","US","Port Huron, MI","http://pbs.twimg.com/profile_images/474304332217610241/_0avhFdd_normal.png","1496",,"334","en","http://www.twitter.com/VirtualJukebox/status/721134664778317824"
"721134662915985408 ","2016-04-16","00:34","*~Frannie Rhodes~*","PrudenceBlak","IN LOVE With Nicholas James Bates Of Duran Duran And I DO HOPE To Be His Wife Someday And Im NEVER TAKING THIS DOWN AGAIN!!!!! COME HELL OR HIGHWATER! NEVER!:)","Off Work And Off To The Gym!:) Did I Just Say That?:}",,,"37.2896968","-121.9442891","US","Campbell, CA","http://pbs.twimg.com/profile_images/655527012191240192/kUw1eLaR_normal.jpg","808","483","24","en","http://www.twitter.com/PrudenceBlak/status/721134662915985408"
"721134662005829632 ","2016-04-16","00:34","Ya Mama's FavToy","KissMyBlakGrits","SF Bay is home. I travel a lot. Bro's b 4 Hoe's always. Being a Chef is what I was born 2 do. My future u w c Podcast aka storytelling . A food truck & a Memoir","It's the end of the line for a few Bus Lines next thing I know a fine ass Chocolat Bus driver comes out of no where im like Chello",,,"37.8025894","-122.2725223","US","Oakland, CA","http://pbs.twimg.com/profile_images/716217812734246913/IqbKBe1I_normal.jpg","208","536","19","en","http://www.twitter.com/KissMyBlakGrits/status/721134662005829632"
"721134661397819393 ","2016-04-16","00:34","Ben Ball","nyangosling","Rarely awake | Garbage human | Listens to terrible local music | Writer, editor, serial list | @benballjr","QUILLA @ The Millennium Center https://t.co/4dzX7zsyTo",,,"36.10021103","-80.24568908000001","US","Winston-Salem, NC","http://pbs.twimg.com/profile_images/654744006975356930/abq61WCS_normal.jpg","144","425","8","en","http://www.twitter.com/nyangosling/status/721134661397819393"
"721134659711541249 ","2016-04-16","00:34","Angel Lira","Angel_Glz96",,"#ViernesBotanero viendo el partido de los gallos vs @ClubAmerica  venga Águilas por un triunfo más!!!",,,"26.0558185","-98.2975651","MX","Reynosa, Tamaulipas","http://pbs.twimg.com/profile_images/703054339883970560/CiQEx7Kd_normal.jpg","85","620","1","es","http://www.twitter.com/Angel_Glz96/status/721134659711541249"
"721134659048853504 ","2016-04-16","00:34","mia","miafrda","shoutout to the sun","at least at THIS boring school dance there's a beach! @ Disney Fantasia Gardens https://t.co/n83LWU1h4I",,,"28.36412545","-81.56107005","US","Florida, USA","http://pbs.twimg.com/profile_images/713872342498340864/Itafft-N_normal.jpg","1351","582","17","en","http://www.twitter.com/miafrda/status/721134659048853504"
"721134658910621697 ","2016-04-16","00:34","Lake Highlands News","LakeHighlandsBL","Lake Highlands BubbleLife features community news, photos and events. Share your business, organization or personal news and events at https://t.co/tVcFYvfSTT.","Exploring Teeth Whiteners - Dentist-Supervised vs. Over-the-Counter https://t.co/kN0xK723Yw",,,"32.87659836","-96.75099944999999","US","Dallas, TX","http://pbs.twimg.com/profile_images/481881168745222144/np7fvUsc_normal.jpeg","692","1518","10","en","http://www.twitter.com/LakeHighlandsBL/status/721134658910621697"
"721134658776223745 ","2016-04-16","00:34","Meredith Lynch","MissMurderith","Pool player with a penchant for PUNishing her opponents. *eh? eh? eh?*","If you're not following my insta (@MissMurderith), here's the men's 10 ball bracket so far. @… https://t.co/x6tZOlv8W4",,,"40.12447","-75.45842","US","Pennsylvania, USA","http://pbs.twimg.com/profile_images/2974455755/58441f11949556a982e72716794c5697_normal.jpeg","480","893","2","en","http://www.twitter.com/MissMurderith/status/721134658776223745"
"721134657362915329 ","2016-04-16","00:34","Lake Highlands News","LakeHighlandsBL","Lake Highlands BubbleLife features community news, photos and events. Share your business, organization or personal news and events at https://t.co/tVcFYvfSTT.","Dallas Garden Club Hosts 70th Annual Standard Flower Show https://t.co/EDT4lqJsoZ https://t.co/D80e94oa2Y",,,"32.87659836","-96.75099944999999","US","Dallas, TX","http://pbs.twimg.com/profile_images/481881168745222144/np7fvUsc_normal.jpeg","692","1518","10","en","http://www.twitter.com/LakeHighlandsBL/status/721134657362915329"
"721134656846860288 ","2016-04-16","00:34","Mercy Jobs","MercyJobs","When you join Mercy, you are part of a community that is embracing a new way to care for people while building your skills and growing in your career.","Registered Nurse - Mercy: (#Springfield, MO) https://t.co/E5kQi3HioU #Nursing #Job #Jobs #Hiring https://t.co/IJ9GxUSzmk",,,"37.2089572","-93.29229890000001","US","Missouri, USA","http://pbs.twimg.com/profile_images/472075334662119425/BVxsLuHr_normal.jpeg","348","4","249","en","http://www.twitter.com/MercyJobs/status/721134656846860288"
"721134654670127104 ","2016-04-16","00:34","Lauren Lacoste","LaurenLunacy","Imperfection is beauty, madness is genius and it's better to be absolutely ridiculous then absolutely boring.","See that bright light all the way at the end? Yeah that's the other end. Building is a quarter… https://t.co/W3epeAAspY",,,"38.09","-122.26333333","US","Vallejo, CA","http://pbs.twimg.com/profile_images/684587488216662016/pJKTfGXN_normal.jpg","114","298","9","en","http://www.twitter.com/LaurenLunacy/status/721134654670127104"
"721134654531567616 ","2016-04-16","00:34","John Kera","johnnykera","Filmmaker & Photographer Instagram @john.kera","Whether you had a great week or a bad one, sink your teeth into a nice juicy steak made for you.… https://t.co/Uz0tvR6naL",,,"34.0522","-118.243","US","Los Angeles, CA","http://pbs.twimg.com/profile_images/639237041276874752/Q7SDUwZ0_normal.jpg","409","986","75","en","http://www.twitter.com/johnnykera/status/721134654531567616"
"721134654351347712 ","2016-04-16","00:34","Aishley","MusiKCityK","I am just me you either love it or leave me the fuck alone!!!","Views... @ BNP Paribas Indian Wells CA https://t.co/MLP7M9SyM8",,,"33.72318878","-116.30425865","US","Indian Wells, CA","http://pbs.twimg.com/profile_images/661953038257676288/HBC9TsP2_normal.jpg","192","364","5","fr","http://www.twitter.com/MusiKCityK/status/721134654351347712"
"721134653768396800 ","2016-04-16","00:34","Lake Highlands News","LakeHighlandsBL","Lake Highlands BubbleLife features community news, photos and events. Share your business, organization or personal news and events at https://t.co/tVcFYvfSTT.","A Night of Honor: Students Inducted Into Six Honor Societies https://t.co/cVt3UD1EjV https://t.co/cMW5tXgXAl",,,"32.87659836","-96.75099944999999","US","Dallas, TX","http://pbs.twimg.com/profile_images/481881168745222144/np7fvUsc_normal.jpeg","692","1518","10","en","http://www.twitter.com/LakeHighlandsBL/status/721134653768396800"
"721134652858200064 ","2016-04-16","00:34","Abby Raeman","Raeman_Noodles","Basically every team at Platinum Athletics // US Navy GF // LU '20","the season aint even over yet @ Christy Banquet Center https://t.co/YlH2jwd0bM",,,"38.801049","-90.712428","US","O'Fallon, MO","http://pbs.twimg.com/profile_images/720300083250466817/8yJIkT8L_normal.jpg","1818","1096","5","en","http://www.twitter.com/Raeman_Noodles/status/721134652858200064"
"721134652056965121 ","2016-04-16","00:34","AHCStaff","AccountableHS","Accountable #Healthcare Staffing is a top rated national staffing corporation. We provide #PerDiem #Locums #PRMContract #travelnursing & #travelhealthcare","Want to work in #Brownsville, TX? View our latest opening: https://t.co/JgEZQC32YG #Healthcare #Job #Jobs #Hiring https://t.co/t3lXIYzH5w",,,"25.9017472","-97.4974838","US","Brownsville, TX","http://pbs.twimg.com/profile_images/690612439960842244/IssUyFCG_normal.jpg","778","167","481","en","http://www.twitter.com/AccountableHS/status/721134652056965121"
"721134650769481729 ","2016-04-16","00:34","Lakewood Dallas News","BLifeLakewood","Lakewood BubbleLife features community news, photos and events. Share your business, organization or personal news and events at https://t.co/om3Pl431w3.","Dallas Garden Club Hosts 70th Annual Standard Flower Show https://t.co/mBh3scvqmj https://t.co/mLg3AXBOWc",,,"32.82289886","-96.74839783","US","Dallas, TX","http://pbs.twimg.com/profile_images/481880605144018944/q_fs2oGm_normal.jpeg","876","2186","13","en","http://www.twitter.com/BLifeLakewood/status/721134650769481729"
"721134649838301184 ","2016-04-16","00:34","511 New York","511NY","Traffic & transit updates for all of New York State provided by New York State 511. Visit the website for more feeds.","Construction on #GardenStateParkway NB from North of Exit 142 - I-78 to South of Exit 143 https://t.co/vAwhY6mZh5",,,"40.71001","-74.24473399999999","US","Hillside, NJ","http://pbs.twimg.com/profile_images/307131779/511twitlogo_normal.png","1288","206","192","en","http://www.twitter.com/511NY/status/721134649838301184"
"721134648898777088 ","2016-04-16","00:34","Ray Eckenrode","15MinutesBlog","Altoona (PA) Mirror GM, tweeting about Steelers, Pirates, NFL, TV, fitness, fatness, music, pop culture, journalism, pro wrestling, food and life in the sticks.","The Mishler is packed to the rafters for The Clarks. @ Mishler Theatre https://t.co/eIzruVYqD5",,,"40.5163","-78.402","US","Pennsylvania, USA","http://pbs.twimg.com/profile_images/656508483215364096/LnzzvELD_normal.jpg","923","797","40","en","http://www.twitter.com/15MinutesBlog/status/721134648898777088"
"721134647812497409 ","2016-04-16","00:34","Lakewood Dallas News","BLifeLakewood","Lakewood BubbleLife features community news, photos and events. Share your business, organization or personal news and events at https://t.co/om3Pl431w3.","AquaFriars receive postseason awards from TAPPS https://t.co/Wg5bdDICAV https://t.co/tUNKTVD1xS",,,"32.82289886","-96.74839783","US","Dallas, TX","http://pbs.twimg.com/profile_images/481880605144018944/q_fs2oGm_normal.jpeg","876","2186","13","en","http://www.twitter.com/BLifeLakewood/status/721134647812497409"
"721134646482837504 ","2016-04-16","00:34","Wilberth Mis™","Will_Alfaro24_","Cancunense, Coordinador EA, Fan del Jägger \o/ #Traveler #PartyHolic #YOLO","I'm at Starbucks in Cancun, Quintana Roo https://t.co/mmvtbaaK6f",,,"21.15902493","-86.82080716","MX","Benito Juárez, Quintana Roo","http://pbs.twimg.com/profile_images/714635707592130561/Vld511ae_normal.jpg","575","577","13","en","http://www.twitter.com/Will_Alfaro24_/status/721134646482837504"
"721134645077794816 ","2016-04-16","00:34","Lakewood Dallas News","BLifeLakewood","Lakewood BubbleLife features community news, photos and events. Share your business, organization or personal news and events at https://t.co/om3Pl431w3.","A Night of Honor: Students Inducted Into Six Honor Societies https://t.co/E8MjXeyEWC https://t.co/sMrMjU3pCN",,,"32.82289886","-96.74839783","US","Dallas, TX","http://pbs.twimg.com/profile_images/481880605144018944/q_fs2oGm_normal.jpeg","876","2186","13","en","http://www.twitter.com/BLifeLakewood/status/721134645077794816"
"721134643915964421 ","2016-04-16","00:34","B. Weezy","BdashHEN","I make goals, take control & drink out of my own bottle","I'm at City Works in Minneapolis, MN https://t.co/spWBKF20hf",,,"44.9781417","-93.27484123000001","US","Minneapolis, MN","http://pbs.twimg.com/profile_images/441394158771519488/lBT0A-Im_normal.jpeg","83","115",,"en","http://www.twitter.com/BdashHEN/status/721134643915964421"
"721134643768995840 ","2016-04-16","00:34","Speedway Jobs","SpeedwayJobs","Rethink Speedway. It's more than a convenience store... It's your career opportunity!","We're #hiring! Read about our latest #job opening here: Food Service Specialist-Retail Sales - https://t.co/m9sW1xdCLe #CrescentSprings, KY",,,"39.0514492","-84.5816106","US","Crescent Springs, KY","http://pbs.twimg.com/profile_images/588378982485110784/CoHZRLK7_normal.png","217","27","381","en","http://www.twitter.com/SpeedwayJobs/status/721134643768995840"
"721134643190190080 ","2016-04-16","00:34","Kishau Rogers","kishau","CEO of @WebsmithGroup, computer scientist, serial entrepreneur, unapologetic southerner & (self-proclaimed) coolest mom. On a relentless pursuit of excellence.","Hello Boston. @ Boston Logan International Airport https://t.co/2xUBX7PM7M",,,"42.3651062","-71.01874857999999","US","Boston, MA","http://pbs.twimg.com/profile_images/546892704223735808/ewpwlnet_normal.jpeg","8906","4058","479","en","http://www.twitter.com/kishau/status/721134643190190080"
"721134642661761025 ","2016-04-16","00:34","ERICK ZC","erickzc","I'm a border boy crossing oceans in the name of love... Life is simple enjoy it #Travel #Friends #Experiences #CeroDrama #Love","I love this song #dontletmedown @thechainsmokers https://t.co/Vcg1z7ow07 @guizareddy @ The… https://t.co/IzZivzvvyr",,,"37.72019319","-122.39993919","US","San Francisco, CA","http://pbs.twimg.com/profile_images/466561383900139520/m2tWPmQb_normal.jpeg","710","1276","12","en","http://www.twitter.com/erickzc/status/721134642661761025"
"721134642137436160 ","2016-04-16","00:34","Jennifer Stewart","JenDoesAustin","Work smart, not hard. And, do it with integrity!","What you know bout some clogging @ Alamo Heights Night https://t.co/UR4SLVSgZg",,,"29.46849392","-98.46912521","US","San Antonio, TX","http://pbs.twimg.com/profile_images/530502722509078528/KVyFMrlZ_normal.jpeg","139","421","6","en","http://www.twitter.com/JenDoesAustin/status/721134642137436160"
"721134641906851840 ","2016-04-16","00:34","J@v13r","jparedesb","Nada salio como lo tenia planeado y esta bien ♐️","Algo leve 😁 (@ El Estadio- Cervecería &amp; Restaurant - @el_estadio_cyr in Cancún, QR, Quintana Roo) https://t.co/0GDyc4znqB",,,"21.15123276","-86.84000752","MX","Benito Juárez, Quintana Roo","http://pbs.twimg.com/profile_images/378800000453806528/fd4436b3bc6a1804711665a7e28b2bf6_normal.jpeg","104","130","4","es","http://www.twitter.com/jparedesb/status/721134641906851840"
"721134641680265216 ","2016-04-16","00:34","TMJ-LAX HRTA Jobs","tmj_lax_hrta","Follow this account for geo-targeted Hospitality/Restaurant/Tourism job tweets in Los Angeles, CA. Need help? Tweet us at @CareerArc!","Want to work at McDonald's Corporation? We're #hiring in #WestLosAngeles, CA! Click for details: https://t.co/iI6MWwF2wE #Hospitality #Job",,,"34.0412085","-118.442596","US","Los Angeles, CA","http://pbs.twimg.com/profile_images/666930533297864704/xfFx5CSs_normal.jpg","484","295","85","en","http://www.twitter.com/tmj_lax_hrta/status/721134641680265216"
"721134640782663680 ","2016-04-16","00:34","Allie Miller","a_pmiller",,"Check out these #kongos stencils around campus and look out for their first single off… https://t.co/V4JlzONd4x",,,"33.79303","-84.32347","US","Druid Hills, GA","http://pbs.twimg.com/profile_images/719217032022138881/b8qi7geE_normal.jpg","349","396","1","en","http://www.twitter.com/a_pmiller/status/721134640782663680"
"721134640459702276 ","2016-04-16","00:34","Jobs at VA","JobsatVA","This is our #jobs feed. Follow @VACareers to connect.","Can you recommend anyone for this #FacilitiesMgmt #job? https://t.co/1TZCs1zJHe #Omaha, NE #Veterans #Hiring",,,"41.2523634","-95.9979883","US","Omaha, NE","http://pbs.twimg.com/profile_images/527141119344123904/_GQQe9Or_normal.png","661","1","633","en","http://www.twitter.com/JobsatVA/status/721134640459702276"
"721134640409370625 ","2016-04-16","00:34","WHBM Careers","WHBMCareers","WH|BM offers fashionable and sophisticated clothing and accessory items. Our passion has always been to make women feel beautiful. That’s what we’re about.","WHBM: Support Associate (#OrchardPark, NY) https://t.co/b1D9WSg1pf #Retail #Job #Jobs #Hiring",,,"42.7675593","-78.7439189","US","Orchard Park, NY","http://pbs.twimg.com/profile_images/510069752887119874/AG-7s4eI_normal.jpeg","141",,"301","en","http://www.twitter.com/WHBMCareers/status/721134640409370625"
"721134639381786625 ","2016-04-16","00:34","MiddleRob","MiddleRob",,"Director and star Katie Holmes. All We Had. #tribecafilmfestival #tribecafilm2016 #katieholmes… https://t.co/1ES0cz68c7",,,"40.71747816","-74.01210988","US","Manhattan, NY","http://pbs.twimg.com/profile_images/695655018859520000/sUHQKUPq_normal.jpg","63","257","12","en","http://www.twitter.com/MiddleRob/status/721134639381786625"
"721134638664581120 ","2016-04-16","00:34","Kindred Jobs","Kindred_Jobs","Kindred Healthcare, named a Fortune Magazine Most Admired Company, is the largest provider of post-acute care services in the United States.","Can you recommend anyone for this #job? Caregiver - Home Health Aide - https://t.co/4k8nctSTJq #Littleton, Colorado #HealthWelfare #Hiring",,,"39.613321","-105.0166498","US","Littleton, CO","http://pbs.twimg.com/profile_images/881390226/twitter_logo_bigger_normal.jpg","824",,"413","en","http://www.twitter.com/Kindred_Jobs/status/721134638664581120"
"721134638660509696 ","2016-04-16","00:34","Lisa.Malanij","lisamalanij","FASHION DESIGNER. ILLUSTRATOR. MAKEUP ARTIST. STYLIST. INSOMNIAC. POP CULTURE SNOB.","Made it to the fashion district in L.A.  SO MUCH FABRIC EVERYWHERE!!! 💖✨😎 #PamandLisaLAVacay #LA… https://t.co/vGvg9PakYb",,"1","34.0405807","-118.2553787","US","Los Angeles, CA","http://pbs.twimg.com/profile_images/431284481870143488/OFXjwGnG_normal.jpeg","190","252","36","en","http://www.twitter.com/lisamalanij/status/721134638660509696"
"721134638400282624 ","2016-04-16","00:34","Join Roadrunner","JoinRoadrunner",,"Want to work at Roadrunner Transportation? We're #hiring in #Matthews, NC! Click for details: https://t.co/Vu0xmZoqRY #Transportation #Job",,,"35.1168131","-80.72368040000001","US","Matthews, NC","http://pbs.twimg.com/profile_images/684093351394717697/5d79riPb_normal.jpg","76","183","118","en","http://www.twitter.com/JoinRoadrunner/status/721134638400282624"
"721134636915503105 ","2016-04-16","00:34","Alie","AlieAlejandro",,"Tequila-induced selfies 😄🍹 @ Pappasito's Cantina https://t.co/ZEsEnbPDLM",,,"29.7524924","-95.36074069999999","US","Houston, TX","http://pbs.twimg.com/profile_images/700121102920495104/b8eF_qJI_normal.jpg","694","718","2","en","http://www.twitter.com/AlieAlejandro/status/721134636915503105"
"721134636513026048 ","2016-04-16","00:34","jordankeith✂️","theoriginaljlyn","life is a great big canvas, you should throw all the paint on it you can!","My handsome date this evening and....forever....😊❤️ #myhusband #mybestfriend @ Paseo Grill https://t.co/OAzlFjTvtG",,,"35.4987959","-97.52227148","US","Oklahoma City, OK","http://pbs.twimg.com/profile_images/699444798923485185/7r__E_bg_normal.jpg","111","362","1","en","http://www.twitter.com/theoriginaljlyn/status/721134636513026048"
"721134636273807360 ","2016-04-16","00:34","TMJ-SFO Mgmt. Jobs","tmj_sfo_mgmt","Follow this account for geo-targeted Business/Mgmt. job tweets in San Francisco, CA. Need help? Tweet us at @CareerArc!","Join the KellyMitchell Group team! See our latest #BusinessMgmt #job opening here: https://t.co/tymjEeTDBx #SanFrancisco, CA #Hiring",,,"37.7749295","-122.4194155","US","San Francisco, CA","http://pbs.twimg.com/profile_images/668268201814261760/Ji37y2WS_normal.jpg","463","284","105","en","http://www.twitter.com/tmj_sfo_mgmt/status/721134636273807360"
"721134636068417536 ","2016-04-16","00:34","AU Gnomeboy","AUGnomeboy","Former underground gnome pornstar predigital age. In quest of MY perfect beer(s), All things AUburn, good humor and other natural things","Dangerously smooth - Drinking an Imperial Russian Stout (2015) by @StoneBrewingCo @ The Wooden Nickel  — https://t.co/db9WdEdVyP",,,"36.0756","-79.0994","US","Hillsborough, NC","http://pbs.twimg.com/profile_images/3491896795/7ccbfd4802bbf91cd6c8c407c938e498_normal.jpeg","173","448","7","en","http://www.twitter.com/AUGnomeboy/status/721134636068417536"
"721134635204218881 ","2016-04-16","00:34","BH Media Jobs","BHMediaJobs",,"Join the BH Media Group team! See our latest #IT #job opening here: https://t.co/Ahh0Hb69Io #nowhiring #Richmond, VA #Hiring",,,"37.5407246","-77.43604809999999","US","Richmond, VA","http://pbs.twimg.com/profile_images/494153984064503809/yQV1nCWb_normal.jpeg","282",,"393","en","http://www.twitter.com/BHMediaJobs/status/721134635204218881"
"721134633686036480 ","2016-04-16","00:34","Robert B","SgtRock2u2000","Sports fan, enjoys the out doors, :D Semper Fidelis","Great Scott!!! #BacktotheFutureison 😄",,,"33.71667049","-78.86178631","US","Myrtle Beach, SC","http://pbs.twimg.com/profile_images/718780403650273280/Rw4BtOgr_normal.jpg","279","165","20","en","http://www.twitter.com/SgtRock2u2000/status/721134633686036480"
"721134633597833216 ","2016-04-16","00:34","Vitamin Shoppe Jobs","VSIcareers","At #VitaminShoppe we are lovers of fitness, health, vitamins, helping you on your wellness journey and motivating others. Apply to our #jobs below.","The Vitamin Shoppe: Key Holder (part-time) (#Irvine, CA) https://t.co/b8mpLVOvU8 #Job #Jobs #Hiring",,,"33.6490314","-117.7449241","US","Irvine, CA","http://pbs.twimg.com/profile_images/497122335518769153/S7vPUx1I_normal.png","602","96","608","en","http://www.twitter.com/VSIcareers/status/721134633597833216"
"721134633497145344 ","2016-04-16","00:34","Shelly Shaw","shellyshaw09","CCTX/25/happily taken, so please random creepy twitter guys, don't waste your messages on me, I will not respond","These refs freaking suck. #redwings #datsyuk #whopaidtherefs",,,"29.5162152","-98.4957374","US","San Antonio, TX","http://pbs.twimg.com/profile_images/718406648545415169/LRoQPcwZ_normal.jpg","43","51","1","en","http://www.twitter.com/shellyshaw09/status/721134633497145344"
"721134631144153089 ","2016-04-16","00:34","Chamber of Commerce","GreaterFlushing","The Greater Flushing Chamber of Commerce is building a strong, diverse, and sustainable community through advocacy, education, and networking.","Winners of the Greater Flushing SOUP @FlushingMeeting #FlushingSOUP #Flushing #Queens… https://t.co/2r2NLLFmio",,,"40.7630392","-73.8305464","US","Queens, NY","http://pbs.twimg.com/profile_images/540915933699522562/8d8_7qsc_normal.png","771","457","29","en","http://www.twitter.com/GreaterFlushing/status/721134631144153089"
"721134630062063616 ","2016-04-16","00:34","emswaggy","emilyimiller","IUP '20 - sc: emiiiiiiily13","we out here @ PNC Park https://t.co/Y83wE0XPmA",,,"40.44709673","-80.00615131000001","US","Pittsburgh, PA","http://pbs.twimg.com/profile_images/720702650686251010/QkUbIcpX_normal.jpg","545","312","2","en","http://www.twitter.com/emilyimiller/status/721134630062063616"
"721134628434812928 ","2016-04-16","00:34","Nola J","Nolajokes","Nola J is originally from Milwaukee, WI and is now commuting between Milwaukee, Las Vegas and Los Angeles. Her career began as a comic when she left the corpora","#comedy (@ Jokerz Comedy Club in Milwaukee, WI) https://t.co/mw4nuXR81g",,,"43.11984281","-88.05461479","US","Milwaukee, WI","http://pbs.twimg.com/profile_images/544462378054582272/wW-4wU9-_normal.jpeg","1191","2149","24","en","http://www.twitter.com/Nolajokes/status/721134628434812928"
"721134627960664064 ","2016-04-16","00:34","panasphotography","panasphoto","Lifestyle and architecture photography based in Los Angeles, CA.","#flowergirls, #wedding, #kids, #weddingphotography, #gettingready ready @ Sheraton Fairplex… https://t.co/x7sUseiV52",,,"34.07956184","-117.7624295","US","Pomona, CA","http://pbs.twimg.com/profile_images/665627157079547904/aPqy0Tdq_normal.jpg","45","85","27","en","http://www.twitter.com/panasphoto/status/721134627960664064"
