"721163190067994624 ","2016-04-16","02:27","Nukeproof","Nuke_Proof",,"@bretttippie and pinkbike grab a selfie with our man samhill13  @seaotterclassic #MylifeMyway… https://t.co/09n0i0QkIy",,,"36.584921","-121.898736","US","Monterey, CA","http://pbs.twimg.com/profile_images/1120453960/NP_FACEBOOK_GRAPHIC_normal.jpg","8606","163","112","en","http://www.twitter.com/Nuke_Proof/status/721163190067994624"
"721163189405224960 ","2016-04-16","02:27","Shelly Spurgeon","maybe_itsshelly","lol my life is a mess","y'all my heart is so full. this sweet boy came up to me at dinner and asked me to dance with… https://t.co/yG5HaJhDfN",,,"33.73769","-82.74042","US","Washington, GA","http://pbs.twimg.com/profile_images/710331763772493824/D26gceoE_normal.jpg","302","268","2","en","http://www.twitter.com/maybe_itsshelly/status/721163189405224960"
"721163189052956672 ","2016-04-16","02:27","AL","alileigh_earle","sometimes memories sneak out of my eyes and roll down my cheeks","No words can explain how much I love you girls💜 @ Lake Dallas, Texas https://t.co/vGWnFmoks9",,,"33.1283","-97.02760000000001","US","Lake Dallas, TX","http://pbs.twimg.com/profile_images/715234312342409217/XtFH3D9e_normal.jpg","502","496","2","en","http://www.twitter.com/alileigh_earle/status/721163189052956672"
"721163188826456065 ","2016-04-16","02:27","VSU Student Life","VSUStudentLife","Keeping all VSU students up to date on Student Organizations, Greek Organizations, events hosted by Student Life and the happenings in the Student Union!","#2chainz has this crowd lit🔥🔥 if you aren't here #BlazerNation you are missing out on the party… https://t.co/gMEIgUkQR7",,,"30.84610708","-83.29382883","US","Valdosta, GA","http://pbs.twimg.com/profile_images/1508673698/200_normal.jpg","2076","163","7","en","http://www.twitter.com/VSUStudentLife/status/721163188826456065"
"721163188243406848 ","2016-04-16","02:27","Pete F","petefitz41",,"#instagood #nyc #series #reflections #sunset #blue #construction #crane #new #instacool… https://t.co/wmk8euw1MH",,,"40.7142","-74.0064","US","Manhattan, NY","http://pbs.twimg.com/profile_images/1326504088/PF_normal.png","54","315","3","es","http://www.twitter.com/petefitz41/status/721163188243406848"
"721163187995811840 ","2016-04-16","02:27","FIDEL","FGarcia0",,"Just posted a photo @ B52's Lounge &amp; Restaurant Ceviche Bar https://t.co/umZbBl9vsd",,,"40.7475348","-74.1607128","US","Harrison, NJ","http://pbs.twimg.com/profile_images/540646689594679296/pU_XlsUa_normal.jpeg","93","467",,"en","http://www.twitter.com/FGarcia0/status/721163187995811840"
"721163186536325120 ","2016-04-16","02:27","RONALD S. SAJA","RONALDSSAJA","PROFESSIONAL REALTOR at FLORIDA LUXURY (LUXURY & WATERFRONT SPECIALIST) OFFERING THE FLORIDA LUXURY LIFESTYLE, EVERY DAY!!! http://t.co/dBb1vAjt2I (CLICK NOW)","The Ocean Resort Residences  #theoceanresortresidences #condos #luxuryrealestate #Oceanfront… https://t.co/xUpcnaHqwy",,,"26.1308193","-80.1041031","US","Fort Lauderdale, FL","http://pbs.twimg.com/profile_images/378800000443851023/e073389b138321ad7ddb618a901d8eac_normal.jpeg","822","2045","43","en","http://www.twitter.com/RONALDSSAJA/status/721163186536325120"
"721163185974296577 ","2016-04-16","02:27","G. Douglas Pemberton","DougPemberton","Trials and hardships I've had many. My eyes allow others to view my truest spirit.  knock, knock, knock and please come in sit right down, tell me you woes","It is I awesome to be able to enjoy our city my city, our people and other people. The #sunset… https://t.co/TaDxbHf2Os",,,"33.43111606","-117.63154309","US","San Clemente, CA","http://pbs.twimg.com/profile_images/678068593301393408/YI5MviAc_normal.jpg","870","1323","9","en","http://www.twitter.com/DougPemberton/status/721163185974296577"
"721163184208486400 ","2016-04-16","02:27","Dano","DannyAisse",,"I'm at Culture Club https://t.co/S4b3voHjd8",,,"25.57843681","-103.40586139","MX","Torreón, Coahuila de Zaragoza","http://pbs.twimg.com/profile_images/719968158883254272/R4Ge9BfK_normal.jpg","424","205","3","en","http://www.twitter.com/DannyAisse/status/721163184208486400"
"721163183642316800 ","2016-04-16","02:27","Alan Rodrigo Garcia","Axcetub","Ser libre, vivir sin preocupaciones.","Primera foto para Instagram, la cachorra en viernes de hueva. @ El Cuernito https://t.co/eIYfhahVDu",,,"19.38766","-99.22011000000001","MX","Álvaro Obregón, Distrito Federal","http://pbs.twimg.com/profile_images/2288042752/buj0o0sf5vodgvj4foq8_normal.jpeg","46","148",,"es","http://www.twitter.com/Axcetub/status/721163183642316800"
"721163182828494848 ","2016-04-16","02:27","Jojo tron","WallyMcwaller61",,"Flatbush zombies concert is about to be badass",,,"39.7579039","-104.9808188","US","Denver, CO","http://pbs.twimg.com/profile_images/710232883537907712/GilUtQ3e_normal.jpg","241","1159",,"en","http://www.twitter.com/WallyMcwaller61/status/721163182828494848"
"721163182287355904 ","2016-04-16","02:27","Jay Torres","jaytorres","Engineer Former line cook & Apple Retail. I write at https://t.co/Nc6oOzTWwY and imbibe at https://t.co/XljGbj0GqE. My better half: @makeupregistry","@NICKPR0 Aww I prefer the grapefruit over pineapple. I can barely taste the pineapple.",,,"37.49360598","-122.27602582","US","San Carlos, CA","http://pbs.twimg.com/profile_images/560307263957520385/I_xvJw3Z_normal.jpeg","453","449","23","en","http://www.twitter.com/jaytorres/status/721163182287355904"
"721163182048481284 ","2016-04-16","02:27","Marple Syrup","zefer777",,"Beeeeeee gooooooood - Drinking a Coors Original by Coors Brewing Company @ Kavorka  — https://t.co/98E6x4JT4I #photo",,,"39.7459","-105.073","US","Lakewood, CO","http://pbs.twimg.com/profile_images/545279329232367617/egy9-cP2_normal.jpeg","24","118","8","en","http://www.twitter.com/zefer777/status/721163182048481284"
"721163181549350912 ","2016-04-16","02:27","blake wilson","pastorblakew","Blake Wilson is the Pastor of Crossover Bible Fellowship. He is married to Dr. Ronique Wilson, they are parents of Reagan & Robert Chance.","You definitely want to dine at Tony Mandola's Gulf Coast Kitchen!!!… https://t.co/x6251oOpyx",,,"29.75576005","-95.39835429999999","US","Houston, TX","http://pbs.twimg.com/profile_images/3421709057/13a13fb29f1d58de83c4bdb185e0c563_normal.jpeg","1436","417","34","en","http://www.twitter.com/pastorblakew/status/721163181549350912"
"721163180785971201 ","2016-04-16","02:27","Tom Harness","iTomHarness","#Army #Veteran, Techie, ☕️#Coffee Addict, #CraftBeer Drinker, & Chicago #Cubs fan! Currently owner of @HarnessDM, @craftbeericans cohost","Drinking an Ivanhoe Pale Lager by @OldBakeryBeer at @brewsbrostap — https://t.co/q0x1l6mryM",,,"37.7637","-89.33540000000001","US","Murphysboro, IL","http://pbs.twimg.com/profile_images/719147268276895744/99Yk9XiG_normal.jpg","2173","1888","241","en","http://www.twitter.com/iTomHarness/status/721163180785971201"
"721163180383318016 ","2016-04-16","02:27","$2Tues Uptown Bar","Domanyce_Da_1","All around Business Man & Entertainer Actor Artist Promotor Plus I have street smarts follow me on Instagram and Fb @Domanyce...","Check that dread head out too turnt 😎 @ Uptown Sports Bar - Flint https://t.co/9oWEmQiegU",,,"43.02498328","-83.68267227","US","Flint, MI","http://pbs.twimg.com/profile_images/620833876152291328/3BU5Wi5__normal.jpg","1423","1075","5","en","http://www.twitter.com/Domanyce_Da_1/status/721163180383318016"
"721163178827194369 ","2016-04-16","02:27","yaj","thotpagnemami","@richiehawtin","@BootyShamen @Sazon_Mia @Bedouin_Music",,,"26.00825098","-80.15369478","US","Hollywood, FL","http://pbs.twimg.com/profile_images/715540632257695746/JC43nlUH_normal.jpg","1182","315","18","es","http://www.twitter.com/thotpagnemami/status/721163178827194369"
"721163177149480961 ","2016-04-16","02:27","Stacy Oglesby","stace0531",,"#pelipeligalleria #datenight #hendricksgin #southafricanfood @ Peli Peli - Galleria https://t.co/zuqLsa3cm7",,,"29.740104","-95.46336700000001","US","Houston, TX","http://pbs.twimg.com/profile_images/580297612944764928/Hlm8x1By_normal.jpg","19","44","2","fi","http://www.twitter.com/stace0531/status/721163177149480961"
"721163177027874817 ","2016-04-16","02:27","Kyle D. Studtmann","KyleDStudtmann","Singer, Songwriter, Dreamer https://t.co/X2sEy6wS8C instagram - @studtmann_music snapchat - kstudman Sweet Home VA Single to be released May 31","Blue 5 is happnin tonight @ Blue 5 Restaurant https://t.co/lxZOARgJ2A",,,"37.271111","-79.943916","US","Roanoke, VA","http://pbs.twimg.com/profile_images/685097087432790017/cYfaNoIB_normal.jpg","191","192","6","en","http://www.twitter.com/KyleDStudtmann/status/721163177027874817"
"721163176683900928 ","2016-04-16","02:27","Interactive Hail Map","ihailmaps","Interactive Hail Maps is a leading provider of real-time live-updating hail intel with unsurpassed accuracy for the storm damage restoration industry","golf ball sized hail @ Texline TX - 97.5mi NW of Amarillo TX https://t.co/txY6NwPGOs",,,"36.31","-102.92","US","Texas, USA","http://pbs.twimg.com/profile_images/547430842083983360/-IEdrMiy_normal.png","1844","1971","38","en","http://www.twitter.com/ihailmaps/status/721163176683900928"
"721163176499408900 ","2016-04-16","02:27","R.","rpriffic","Kiss me hard before you go.","I'm at Board &amp; Brew Scripps Ranch - @boardnbrewsr in San Diego, CA https://t.co/RVUGnFhIqn",,,"32.91553516","-117.11438656","US","San Diego, CA","http://pbs.twimg.com/profile_images/520095384417218560/lsLrlwKZ_normal.jpeg","551","127","4","en","http://www.twitter.com/rpriffic/status/721163176499408900"
"721163175178022912 ","2016-04-16","02:27","Tommy Trinh","TomTTrinh","Cinematographer https://t.co/x5rDxyuUz0 Formula Arts Media","Oh yes. @ Little Dipper Shabu Shabu https://t.co/K8c0ewu71u","1",,"37.4912943","-121.9280364","US","Fremont, CA","http://pbs.twimg.com/profile_images/454257916837523456/pNncq0p3_normal.jpeg","25817","156","43","en","http://www.twitter.com/TomTTrinh/status/721163175178022912"
"721163175006203904 ","2016-04-16","02:27","Nancita Kapi","NancitaKapi","Singer•Writer•Muse•Fitness {Music on I-TUNES, Amazon, Google play & more} IG : @misskapiofficial Fb / Youtube and Snapchat:NancitaKapi","#latenightsearlymornings #latenights #studiosessions #studiosesh got… https://t.co/PeLxYQNulq",,,"45.47536","-75.52374","CA","Ottawa, Ontario","http://pbs.twimg.com/profile_images/696886050027868161/ez6NmAHk_normal.jpg","1009","502","29","es","http://www.twitter.com/NancitaKapi/status/721163175006203904"
"721163172938440704 ","2016-04-16","02:27","Amy Lopez","amylopez80","Love God w/ all my heart!! Worshiper, Preacher, Singer...President/Founder of ABS Ministries....","When you are shorter than your fiancé. #teamnosleep #TeamSanchez… https://t.co/lmgJckJ1O5",,,"40.6607018","-74.1723404","US","Elizabeth, NJ","http://pbs.twimg.com/profile_images/576566134918381569/UYXR0BJH_normal.jpeg","264","411","8","en","http://www.twitter.com/amylopez80/status/721163172938440704"
"721163172351250432 ","2016-04-16","02:27","gilbert shepherd","lostboy2","#SingleGayGuyInTheCity","Goodnight. (@ Gil's New Bedroom in Chicago, IL) https://t.co/6o6YiWHDIL",,,"41.9651865","-87.66359163","US","Chicago, IL","http://pbs.twimg.com/profile_images/706493996072374272/bepiRTHa_normal.jpg","241","310","17","en","http://www.twitter.com/lostboy2/status/721163172351250432"
"721163170371526656 ","2016-04-16","02:27","Claudio Gonzalez","clau_scl",,"SFO😍👌🏼🇺🇸 #cablecar #sanfrancisco #california #usa @ Union Square,… https://t.co/Jx2UXUFleP",,,"37.78730192","-122.40788953","US","San Francisco, CA","http://pbs.twimg.com/profile_images/496868026269319171/DKNkTzeG_normal.jpeg","223","310","6","it","http://www.twitter.com/clau_scl/status/721163170371526656"
"721163169830477824 ","2016-04-16","02:27","Kayy Ann Dmac","kanny367","Living life. So many new things to try out.","Our weekly sushi! (@ Suki Sushi in Simi Valley, CA) https://t.co/nAfNdjmHvw",,,"34.27127595","-118.67999732","US","Simi Valley, CA","http://pbs.twimg.com/profile_images/683904435353862144/gVpWYm6v_normal.jpg","43","116","2","es","http://www.twitter.com/kanny367/status/721163169830477824"
"721163169440268289 ","2016-04-16","02:27","Noe Ramirez 1⃣9⃣⚽","Noe_Ramirez10","McAllen Tx,Monterrey NL •Regio• ⚽️","Espero América haya jugado así solo por que en el volcán darán un partido perfecto...eso espero",,,"25.7545736","-100.3530147","MX","Monterrey, Nuevo León","http://pbs.twimg.com/profile_images/718192606799204352/TjYAe8a5_normal.jpg","499","670","2","es","http://www.twitter.com/Noe_Ramirez10/status/721163169440268289"
"721163167817183233 ","2016-04-16","02:27","Sarah Bakshis ♈️","justabuzzkill","18 year old college kid that just wants to sleep and eat all the pizza rolls in the freezer . | Columbia College '19 |","I'm naming him Gary. Idk why he just feels like a Gary to me @ Brookfield Zoo https://t.co/69115tBKhX",,,"41.83361633","-87.83411477","US","Brookfield, IL","http://pbs.twimg.com/profile_images/718287619340247040/8CCdMaqJ_normal.jpg","140","392","9","en","http://www.twitter.com/justabuzzkill/status/721163167817183233"
"721163167397769216 ","2016-04-16","02:27","Jake Tremblay","jaketremblay89","Jake Tremblay is a #Film #Actor and #ProductionDesigner. Facebook/Instagram: jaketremblay89 Food, Adventures, and Art","Thanks #mirror #ewetoo #mirrorselfie #🐏 @ Boyle Heights, Los Angeles https://t.co/lEdQluvzjN",,,"34.03389","-118.20444","US","Los Angeles, CA","http://pbs.twimg.com/profile_images/635939174181285889/55UQ-EwB_normal.jpg","274","730","12","en","http://www.twitter.com/jaketremblay89/status/721163167397769216"
"721163166349025280 ","2016-04-16","02:27","Nijel Taylor","nijeltaylor","Visual Designer. Follow me on instagram @nijeltaylor","Opportunity to get lit #summersixteen #bigrings #nicethings #aigagala #aigadesign… https://t.co/0anCAYMuID",,,"40.7142","-74.0064","US","Manhattan, NY","http://pbs.twimg.com/profile_images/713721318622015488/P-Eq6czl_normal.jpg","269","735","83","en","http://www.twitter.com/nijeltaylor/status/721163166349025280"
"721163165766184966 ","2016-04-16","02:27","kate lynagh","katemonster20","diary of kate - spinster & lunatic. 29. affinity for bartenders. obsessed with #flyers hockey, #eagles football, #dmb, and #bruuuuuce. #WeAre","Drinking a Miller Lite by @MillerCoors at @misconductphi — https://t.co/8nB6vGbkGl",,,"39.9486","-75.1665","US","Philadelphia, PA","http://pbs.twimg.com/profile_images/513689409137696768/vhOM0s3g_normal.jpeg","1473","1219","22","en","http://www.twitter.com/katemonster20/status/721163165766184966"
"721163164851822594 ","2016-04-16","02:27","Brittany Flocken, MJ","Brittybam","Aviation geek ✈ cyclist, photographer, traveler, wakesurfer, HootSuite & Yammer certified. In the sky, mountains or lake & I'm right at home.","Thrilled fine headed home tomorrow, but first a breezy evening run. @ Sheraton Vistana Resort https://t.co/rLwqdEOWql",,,"28.36660155","-81.50576261","US","Florida, USA","http://pbs.twimg.com/profile_images/2681761452/58241b228cb3f15aefc69019eca7ee71_normal.jpeg","352","647","22","en","http://www.twitter.com/Brittybam/status/721163164851822594"
"721163164243496960 ","2016-04-16","02:27","Riley Kliethermes","rileyklietherme","| Riley's the name ~ Art History's the game |Competitive Ballroom Dance team at UTK","Back at it again with the mocha iced coffee ☕️ { #ootd #liveauthentic } @ Queen City, Charlotte https://t.co/zsbeiKv7uK",,,"35.27628","-80.77769000000001","US","Charlotte, NC","http://pbs.twimg.com/profile_images/709376853656670209/vDoUR-6d_normal.jpg","115","210",,"en","http://www.twitter.com/rileyklietherme/status/721163164243496960"
"721163163153088513 ","2016-04-16","02:27","Kent Palmer","kepamer",,"Photo: School of spadefish https://t.co/oOJIdouIlg",,,"37.69932402","-123.01239861","US","California, USA","http://pbs.twimg.com/profile_images/594241302591508480/SBx9aRGf_normal.jpg","174",,"23","en","http://www.twitter.com/kepamer/status/721163163153088513"
"721163163102810113 ","2016-04-16","02:27","iamrainee","iamrainee",,"Just posted a photo @ International Hot Air Balloon Festival https://t.co/Krxa7CbH24",,,"35.80441049","-105.92196238","US","New Mexico, USA","http://pbs.twimg.com/profile_images/3395114985/ab045a54ed4455a1a25c013ca6b3c185_normal.jpeg","157","96","2","en","http://www.twitter.com/iamrainee/status/721163163102810113"
"721163159852171264 ","2016-04-16","02:27","F3rrara","F3rrara","Instagram: @anthonyf3rrara Vine/Snapchat/Musical.ly: @F3rrara Contact: Anthonyf3rrara@gmail.com","Fighting Cancer at Relay For Life @stjohnsuLYMcrew helping out and making big steps… https://t.co/4VpLafJSqd","2","1","40.72270603","-73.79457005","US","Queens, NY","http://pbs.twimg.com/profile_images/647083045934235648/YHCCqHtR_normal.jpg","2517","1760","7","en","http://www.twitter.com/F3rrara/status/721163159852171264"
"721163158652653568 ","2016-04-16","02:27","Emmilio Rius","eRiooS","Sarcastico,voluble, honesto,leal,perseverante,tolerante, amigos, rock , fanatico enfermo de PUMAS de la UNAM,Real Madrid, la cerveza , PEARL JAM y el SKA!!!","Segunda parada ! La 39... (@ Cantina La 39 in Chihuahua) https://t.co/nLmHyz2o2o",,,"28.64700567","-106.06513442","MX","Chihuahua, México","http://pbs.twimg.com/profile_images/3320380967/2c014f9a1e51e85e01f681c66eb9202c_normal.png","292","1579","1","es","http://www.twitter.com/eRiooS/status/721163158652653568"
"721163157964726272 ","2016-04-16","02:27","Cedric","CedricClaytonSt","Transfer Coordinator & Admissions Recruiter in the Office of Undergraduate Recruitment & Admissions at Clayton State University. Achievement. Son of Diggs.","Congratulations 4ever15ez #4ever15ez @ Hyatt Regency Atlanta Perimeter at Villa Christina https://t.co/GY9wnOSjzh",,,"33.91337","-84.34195","US","Brookhaven, GA","http://pbs.twimg.com/profile_images/662739546493161472/LqBGZ1OS_normal.jpg","151","300","7","es","http://www.twitter.com/CedricClaytonSt/status/721163157964726272"
"721163156828106752 ","2016-04-16","02:27","Brian Correia","bcorr92","Expect great things from God; attempt great things for God -William Carey","Because I said we were with the cool kids! #itinerationnation #missioncolombia #welovecolombia @… https://t.co/ZR9UGpyOxX",,,"40.77878","-74.15635","US","Newark, NJ","http://pbs.twimg.com/profile_images/716095397807005696/xMNmixSd_normal.jpg","113","75","1","en","http://www.twitter.com/bcorr92/status/721163156828106752"
"721163155376738305 ","2016-04-16","02:27","CVS Health Jobs","CVSHealthJobs","We're #hiring! Explore a variety of open positions that offer a challenging & rewarding #career. Follow us to uncover #job opportunities at @CVSHealth.","#Healthcare #Job in #Morrisville, NC: Pharmacy Technician – Target Store at CVS Health https://t.co/EQZKEVt1YL #Jobs #Hiring",,,"35.823483","-78.8255621","US","Morrisville, NC","http://pbs.twimg.com/profile_images/511525698507268097/ptBo_zo__normal.jpeg","629","3","783","en","http://www.twitter.com/CVSHealthJobs/status/721163155376738305"
"721163151291625472 ","2016-04-16","02:27","tony1020s","tony1020s","Follow me SnapChat tony1020s and Instagram tony1020s","😂😂😂😂😂 @ Biloxi, Mississippi https://t.co/6I1jyHp6AL",,,"30.412","-88.9278","US","Biloxi, MS","http://pbs.twimg.com/profile_images/720933511222423557/aorPYY_g_normal.jpg","285","382","1","es","http://www.twitter.com/tony1020s/status/721163151291625472"
"721163150280757249 ","2016-04-16","02:27","Metztlixochitl","metztlixochitl",,"#viernestradicional Milpa alta y Xochimilco @ Milpa Alta Barrio Santa Martha https://t.co/fiKBV5JFsT",,,"19.17737545","-99.03509617","MX","Milpa Alta, Distrito Federal","http://pbs.twimg.com/profile_images/643593396280541184/ED2EvTLo_normal.jpg","172","329",,"es","http://www.twitter.com/metztlixochitl/status/721163150280757249"
"721163148493922305 ","2016-04-16","02:27","Shannon Breen","SHANBREEN",,"Just posted a photo @ Wine &amp; Design https://t.co/dt3yp6SUpp",,,"41.48260771","-81.83719222000001","US","Rocky River, OH","http://pbs.twimg.com/profile_images/707037387990441985/N2Hr_qeS_normal.jpg","650","403","3","en","http://www.twitter.com/SHANBREEN/status/721163148493922305"
"721163147428532224 ","2016-04-16","02:27","robert mascarenas 3","BurritoBob87",,"# teamburrito @ Very Top of Mt Rubidoux https://t.co/RwqFCtJXkp",,,"33.98425726","-117.39257713","US","Riverside, CA","http://pbs.twimg.com/profile_images/718426103715500033/VZnuHESL_normal.jpg","118","478","1","en","http://www.twitter.com/BurritoBob87/status/721163147428532224"
"721163144299724800 ","2016-04-16","02:27","Nicole Keeler","Whitefish007","Just a girl living the life that i love and loving the life that i live. No regrets. Thats life.","Drinking a Brainless® Belgian-Style Golden Ale by @EpicBrewing @ Lethbridge, Alberta — https://t.co/DRD7dCIU5w",,,"49.6988","-112.815","CA","Lethbridge, Alberta","http://pbs.twimg.com/profile_images/2509593498/image_normal.jpg","80","344","3","en","http://www.twitter.com/Whitefish007/status/721163144299724800"
"721163141141368832 ","2016-04-16","02:27","aslammemon","aslammemon","| Web & Graphic Designer | Freelancer | Available for Hire | Blogger | Font lover | http://t.co/RMfIxzI6Dl |","Friday prayers! @ Islamic Circle of Mercer County https://t.co/OmumjjneO9",,,"40.27248","-74.68387","US","Lawrence, NJ","http://pbs.twimg.com/profile_images/459998533211271168/pSa_tLYF_normal.jpeg","600","571","42","en","http://www.twitter.com/aslammemon/status/721163141141368832"
"721163140486987776 ","2016-04-16","02:27","Gilberto Covelli G.","GilbertoCovelli","Ciudadano y Empresario, Soy parte de la generación que quiere contribuir a la grandeza de Ensenada. Mi orgullo y mi amor son mi esposa e hijos.","Hoy tarde de #trabajo probando #vino para #FincaCovelli #valledeguadalupe #Covelli #Ensenada… https://t.co/ZKi2Cl1c83",,,"31.3236159","-116.25374066","MX","Ensenada, Baja California","http://pbs.twimg.com/profile_images/674285726507229184/zGWXGjo5_normal.jpg","2003","609","4","es","http://www.twitter.com/GilbertoCovelli/status/721163140486987776"
"721163138343768066 ","2016-04-16","02:27","Miguel Macias","miguelmmacias12","He volado de acá para allá ... fui de todo y sin medida","#sirloin #carrabbas #miami #florida @ Carrabba's Italian Grill https://t.co/H1w68aX69K",,,"25.8118899","-80.12291","US","Miami Beach, FL","http://pbs.twimg.com/profile_images/692031799967424513/DFAMt4gz_normal.jpg","13","58",,"en","http://www.twitter.com/miguelmmacias12/status/721163138343768066"
"721163137022631936 ","2016-04-16","02:27","andrea chvz","ChvzAndrea","Just a small town girl living in a lonely world 28-05-15","I'm at OXXO in Aguascalientes, AGS https://t.co/GSbtV0MuWA",,,"21.92420592","-102.31859475","MX","Aguascalientes, México","http://pbs.twimg.com/profile_images/709257440731082752/0vyP6Mni_normal.jpg","115","185","1","en","http://www.twitter.com/ChvzAndrea/status/721163137022631936"
"721163136598806530 ","2016-04-16","02:27","Pedro Lucio","pedrolmc","I.ɹ.","Ustedes no están para saberlo pero yo sí para contarlo, ¡gracias! (with Miriam at @pedrolmc) [pic] — https://t.co/l72Ssg3HO3",,,"21.8931","-102.47106","MX","Jesús María, Aguascalientes","http://pbs.twimg.com/profile_images/673297540603707392/AUqbM5A0_normal.jpg","552","1024","12","es","http://www.twitter.com/pedrolmc/status/721163136598806530"
"721163135059496961 ","2016-04-16","02:27","Sara C Velasquez","SaraCVelasquez","Believer,  #AuntieSara, @RelayForLife volunteer, sports better, #BravesFan, #CoedSoftball, #KidatHeart, searching for balance in this game we call life!","This fool is sober! #relayforlife of Mesquite. Working on mile 3! @ Virgin Valley High School https://t.co/OexCGYiaS4",,,"36.81321","-114.051941","US","Mesquite, NV","http://pbs.twimg.com/profile_images/619698431058034688/HTCiiCc-_normal.jpg","112","311","2","en","http://www.twitter.com/SaraCVelasquez/status/721163135059496961"
"721163134975787011 ","2016-04-16","02:27","Adam McGrath","adamrmcgrath","Champion of the English language. Communications professional at Germantown Academy (@GA1759). Writer for @THATMUSICMAG. #LaSalleProud","Good crew, good tunes in the city tonight! (@ MilkBoy Philadelphia - @milkboyphilly for Har Mar Superstar + more) https://t.co/B66JdyiLVw",,,"39.9501153","-75.15880108","US","Philadelphia, PA","http://pbs.twimg.com/profile_images/378800000701167760/4bf7a40eebb6fe99728b7f548839a796_normal.jpeg","275","273","18","en","http://www.twitter.com/adamrmcgrath/status/721163134975787011"
"721163134757691392 ","2016-04-16","02:27","P.O.P","Southerndevil12","Video Games, Texas Rangers & MLB","Who gave up all the runs?",,,"32.42362498","-96.83708627","US","Waxahachie, TX","http://pbs.twimg.com/profile_images/692420003392524289/w9hXCHCn_normal.jpg","235","298","9","en","http://www.twitter.com/Southerndevil12/status/721163134757691392"
"721163134686236672 ","2016-04-16","02:27","Raven","RavenChasity","Assistant Director of @NCStateFSL :: @IllinoisStateU & @Illinois_Alma Alumna :: ΔΣΘ @DSTinc1913 :: #SApro #BLKSAP","You guessed it 😍😘🙌🏾 #VindicaTEDinTheCITY #VindicaTEDturns5 @ Buddakan NYC https://t.co/1vgD7jDm2u",,,"40.7421586","-74.00470989999999","US","Manhattan, NY","http://pbs.twimg.com/profile_images/570022516183470082/DFA0Lkua_normal.jpeg","1517","519","104","en","http://www.twitter.com/RavenChasity/status/721163134686236672"
"721163134392598528 ","2016-04-16","02:27","Man Of Many Talents","MogulMalik","R.I.P. Medasi Gore #DoingIt4Dasi #TeamSwagg #CLMG PHOTO x VIDEO. Mr. Cool, Calm, Collected...On A Quest To Be Internationally Known.","No Face, No Case In Any State :: #RestStopSelfie #TrustTheShooter @ Williamston, South Carolina https://t.co/VLL7ASxVch",,,"34.61777778","-82.47916667","US","Williamston, SC","http://pbs.twimg.com/profile_images/416586587934576640/R3op8n8n_normal.jpeg","396","668","11","en","http://www.twitter.com/MogulMalik/status/721163134392598528"
