"721119313445330944 ","2016-04-15","23:33","Trump Hotels Jobs","weareteamtrump","Bring your passion, drive and enthusiasm to our A+ team. We are looking for you! #hoteljobs #weareteamtrump","This #FacilitiesMgmt #job might be a great fit for you: Engineer II (FT) - https://t.co/5zp7MnGl0d #LasVegas, NV #Hiring",,,"36.129558","-115.172623","US","Paradise, NV","http://pbs.twimg.com/profile_images/691659244932718592/snRNgx4H_normal.jpg","393","37","112","en","http://www.twitter.com/weareteamtrump/status/721119313445330944"
"721119312157741057 ","2016-04-15","23:33","Adam","Adam_Johnson07","fourth grade teacher. Youtuber. Christian. Jeremiah 29:11","Almost game time! Let's go sox! @ Old White Plains Gym https://t.co/qOMX8epeml",,,"36.44492575","-80.63468638000001","US","North Carolina, USA","http://pbs.twimg.com/profile_images/572220634299809793/6usY7-2x_normal.jpeg","474","827","13","en","http://www.twitter.com/Adam_Johnson07/status/721119312157741057"
"721119310198910976 ","2016-04-15","23:33","TMJ-LAX HRTA Jobs","tmj_lax_hrta","Follow this account for geo-targeted Hospitality/Restaurant/Tourism job tweets in Los Angeles, CA. Need help? Tweet us at @CareerArc!","#Hospitality #Job in #Torrance, CA: Restaurant Cook at King's Hawaiian https://t.co/g7eSMK1L8n #Jobs #Hiring #CareerArc",,,"33.8358492","-118.3406288","US","Torrance, CA","http://pbs.twimg.com/profile_images/666930533297864704/xfFx5CSs_normal.jpg","485","295","85","en","http://www.twitter.com/tmj_lax_hrta/status/721119310198910976"
"721119308919742467 ","2016-04-15","23:33","mollywhomp","mollymcpheron","Scarlet and Grace Notes A Cappella•ΑΦΩ","Kindergarten ➡️ College 💕 #apoformal2k16 @ THE Ohio State University! https://t.co/gYNJRKEAk1",,,"39.99522467","-83.00697998","US","Columbus, OH","http://pbs.twimg.com/profile_images/598488571314573312/WXJmkl9d_normal.jpg","333","363","1","en","http://www.twitter.com/mollymcpheron/status/721119308919742467"
"721119306348687364 ","2016-04-15","23:33","Justin Cox","justinthered",,"@UncleChaps best case scenario is a New Orleans procession followed by a Viking funeral",,,"30.19332735","-81.75957581","US","Orange Park, FL","http://pbs.twimg.com/profile_images/688053273283145729/QKfg2Gr-_normal.jpg","148","603","2","en","http://www.twitter.com/justinthered/status/721119306348687364"
"721119303563476992 ","2016-04-15","23:33","Jordan Buettner","jmbuettner","this shits a journey.","#peacetreebrewing #biggrovebrewery #westobeer @augustaoxford #local @ Augusta Restaurant and… https://t.co/WfXUqwF6KP",,,"41.66145","-91.52605","US","Iowa City, IA","http://pbs.twimg.com/profile_images/717545464774561792/_tXLvhNH_normal.jpg","286","301","10","es","http://www.twitter.com/jmbuettner/status/721119303563476992"
"721119303286657025 ","2016-04-15","23:33","Mena Gutierrez","soymenagtz","LIGA IBEROAMERICANA DE BIKINI FOOTBALL VEGAN & BUSY MOM / Insta: MENADEAD","🏈👙🏈👙🏈👙🏈👙🏈👙🏈 24 de abril a las 2 pm en el deportivo plan sexenal, no… https://t.co/Yb4vmZJMKW",,,"19.42930868","-99.16201194999999","MX","Cuauhtémoc, Distrito Federal","http://pbs.twimg.com/profile_images/714866826421919747/Zr3qTKHN_normal.jpg","11","9","1","es","http://www.twitter.com/soymenagtz/status/721119303286657025"
"721119303148417025 ","2016-04-15","23:33","Matt Fisher","fisherdidwhat",,"The Chrysler Building is classic #newyork #architecture. #photooftheday #city #nyc #newyork_ig… https://t.co/7Kpe3Nw6V7",,,"40.74967835","-73.97702852","US","Manhattan, NY","http://pbs.twimg.com/profile_images/202055476/fatt_misher_logo_transparent__normal.png","133","98","7","en","http://www.twitter.com/fisherdidwhat/status/721119303148417025"
"721119301483290624 ","2016-04-15","23:33","Claire Elizabeth","ClaireLombrozo","Actress/college grad/singer/writer/adventurer","Dis onez mine. You cannot haz. 🌟😎☝️💯💭 #hollywood #walkoffame #motivated #actor #actress… https://t.co/fVFy8KLkMX",,,"34.10138889","-118.32666667","US","Los Angeles, CA","http://pbs.twimg.com/profile_images/704139813612425216/HdtLC5rK_normal.jpg","166","316","10","en","http://www.twitter.com/ClaireLombrozo/status/721119301483290624"
"721119301139173376 ","2016-04-15","23:33","Avery Lee Womble","He_Wumbo","Insert creative bio here.","My mind is telling me no, but my body, my body is telling me yes -Marvin Gaye","1",,"29.67571587","-98.11649448","US","New Braunfels, TX","http://pbs.twimg.com/profile_images/714177134189809665/tTyFLcgl_normal.jpg","334","260",,"en","http://www.twitter.com/He_Wumbo/status/721119301139173376"
"721119301088997376 ","2016-04-15","23:33","Ashley O'Connor","xxashleyocxx","ECSU '19 ☯","Shitty quality picture but saw Fetty Wap yesterday 👌🏻 @ UConn https://t.co/eEaLBb7ffJ",,,"41.80707068","-72.25394046","US","Storrs, CT","http://pbs.twimg.com/profile_images/714290681662062593/BGiC2CBt_normal.jpg","241","280","2","en","http://www.twitter.com/xxashleyocxx/status/721119301088997376"
"721119299419516928 ","2016-04-15","23:33","revchrisbyars","revchrisbyars","Follower of Jesus Christ, Husband, Father, Pastor, Son, Uncle, Great-Uncle, Great-Great-Uncle and Friend","#harlemwizards @ Washington High School (Washington, Indiana) https://t.co/fIRX3TxvLb",,,"38.65916667","-87.16805556","US","Washington, IN","http://pbs.twimg.com/profile_images/101400028/Father_and_Son_smaller_normal.jpg","214","434","7","en","http://www.twitter.com/revchrisbyars/status/721119299419516928"
"721119298819723264 ","2016-04-15","23:33","Kristina Centnere","kcentnere","Founding partner @ekatdevelopment Founder @twellnessc Speaker Upcoming author of #COAYE Hobbies: #LegDay & #Travel","Orchids are my absolute favorite flowers - unique, intricate and stare right into your #soul.… https://t.co/7Et9fwe6Mt",,,"40.863656","-73.88086368","US","Bronx, NY","http://pbs.twimg.com/profile_images/629070602905718784/nkKh4_CA_normal.png","1609","284","23","en","http://www.twitter.com/kcentnere/status/721119298819723264"
"721119298496897024 ","2016-04-15","23:33","Kevin Martin","bilco1331",,"Drinking a Christmas Morning (2015) by @hardywood @ E. K. Powe Elementary — https://t.co/EZVxEDTZ2y #photo",,,"36.0126","-78.92310000000001","US","Durham, NC","http://pbs.twimg.com/profile_images/494956932591923200/Gri7LYnV_normal.jpeg","55","133","10","en","http://www.twitter.com/bilco1331/status/721119298496897024"
"721119298358370304 ","2016-04-15","23:33","Mya VIPhost","MissMyaVIPHOST","Guest List/Bottle Service for Chateau, Omnia, Ghostbar, Rehab Pool, Hakkassan, Saphhire Pool & most major strip clubs in Las Vegas! Text 702-883-4204","SURRENDER YOUR SATURDAY!!! Ladies free plus 2 drinks before 1230 am! Guys reduced until 1230 am!… https://t.co/eDtMJFBh7W",,,"36.12928098","-115.16610697","US","Paradise, NV","http://pbs.twimg.com/profile_images/706898831934361601/wN-tQ6Hy_normal.jpg","1151","1982","18","en","http://www.twitter.com/MissMyaVIPHOST/status/721119298358370304"
"721119297314099201 ","2016-04-15","23:33","Maeghan Smulders","maeghansmulders","Acquired by @Intel || Marketing Director @PasswordBox || Co-Organizer @MtlGirlHackers || Founded ProjectONE12 || Awarded Women Leader || https://t.co/xkLKTR9GC2","I'm a let you finish, but.... 🌇 @ Passwordbox -HQ https://t.co/aSBhCOGQBE",,,"45.5182875","-73.58225815","CA","Montréal, Québec","http://pbs.twimg.com/profile_images/666440232498102272/cnNg3LDc_normal.jpg","1028","586","62","en","http://www.twitter.com/maeghansmulders/status/721119297314099201"
"721119294470250496 ","2016-04-15","23:33","Sara","saradougz","//25. //Graphic Design. //Coffee. //Karaoke. //GIFs. //Magic.","JENGA BITCH gabrielncoffey @ Independence Hall Pop Up Beer Garden https://t.co/FQkM1LNJ80",,,"39.95005472","-75.15078219999999","US","Philadelphia, PA","http://pbs.twimg.com/profile_images/638913410395172864/NPqGhB_m_normal.jpg","358","756","13","en","http://www.twitter.com/saradougz/status/721119294470250496"
"721119293556006912 ","2016-04-15","23:33","Pam Pippin","pam_pippin",,"Watching the crazy jumping beans at #airu   Love these people. @ Air U Trampoline Park &amp; Party… https://t.co/hI7U9XAJQQ",,,"35.5423012","-77.3639069","US","North Carolina, USA","http://pbs.twimg.com/profile_images/3246443684/661d9307c7fec9fd7c64828302b602eb_normal.jpeg","355","426","9","en","http://www.twitter.com/pam_pippin/status/721119293556006912"
"721119293191122944 ","2016-04-15","23:33","Valeria Luna","velv14","Old soul","I'm at Aeropuerto Internacional de Monterrey (MTY) - @aeropuertodemty in Apodaca, NL https://t.co/QrnZLiy8BG",,,"25.77781744","-100.11489987","MX","Apodaca, Nuevo León","http://pbs.twimg.com/profile_images/2367680891/image_normal.jpg","210","557","7","es","http://www.twitter.com/velv14/status/721119293191122944"
"721119292121423872 ","2016-04-15","23:33","CREME BRULEE","CREMEBRULEEPR","Te invitamos a seguirnos y así enterarte sobre lo más novedoso en nuestras pastelerías. ¡Comparte con nosotros!","¡ESTAMOS EN PLENA INAUGURACIÓN DE SUCURSAL ARAGON! -50% TODA LA TIENDA. Te esperamos en: https://t.co/7fT38klRAo https://t.co/blXYe5akvv",,"1","19.4520671","-99.06348490000001","MX","San Juan de Aragón IV Sección, Gustavo A. Madero","http://pbs.twimg.com/profile_images/603329850938511362/DtJHFR4g_normal.jpg","160","18",,"es","http://www.twitter.com/CREMEBRULEEPR/status/721119292121423872"
"721119291840598016 ","2016-04-15","23:33","Héctor","Hiper__Activo","Guapo por placer, cabrón por necesidad, viajero por diversión y caballero ante la sociedad","I'm at OXXO in San Simón Ticumac, DF https://t.co/P9ZHBGbAwW",,,"19.3784224","-99.14741785","MX","Benito Juárez, Distrito Federal","http://pbs.twimg.com/profile_images/523605382728404992/iLtZ_cv2_normal.jpeg","513","247","14","es","http://www.twitter.com/Hiper__Activo/status/721119291840598016"
"721119291446308864 ","2016-04-15","23:33","Tony Wood","Tonystopskony","Proud Father, husband, coach, brother, son, friend to few.","Nice view today!?!  WTF?!? @ Kaiser Roseville https://t.co/VbByR9ljuk",,,"38.7459036","-121.2497651","US","Roseville, CA","http://pbs.twimg.com/profile_images/546975741468897280/Lyb948G9_normal.jpeg","262","496","7","en","http://www.twitter.com/Tonystopskony/status/721119291446308864"
"721119290628419584 ","2016-04-15","23:33","Dennis Brekke","dbrekke",,"The usuals. #recordstoreday electricfetusmpls #vinyljunkie @ Electric Fetus Records https://t.co/PqrTa9qc14",,,"44.96226","-93.27025999999999","US","Minneapolis, MN","http://pbs.twimg.com/profile_images/477105252831723522/zKbAarGM_normal.jpeg","283","628","18","en","http://www.twitter.com/dbrekke/status/721119290628419584"
"721119288237535232 ","2016-04-15","23:33","Jennifer Cook","jennifersandra",,"springtime sunsets. #rooftopviews #sunset #almostsummer #brooklyn @ 44 Berry https://t.co/KwSWYycbyN",,,"40.72103287","-73.95665538","US","Brooklyn, NY","http://pbs.twimg.com/profile_images/557238753421705216/xvodGNYk_normal.jpeg","192","326","24","en","http://www.twitter.com/jennifersandra/status/721119288237535232"
"721119287998615552 ","2016-04-15","23:33","T-rav","Murderbot",,"Good with or without the Orange. - Drinking a White Zombie Ale @ The Spring Creek Tavern - https://t.co/Wix6v1Df2X #photo",,,"35.8931","-82.8272","US","North Carolina, USA","http://pbs.twimg.com/profile_images/1417794252/glassoctopus_normal.jpg","15","36","2","en","http://www.twitter.com/Murderbot/status/721119287998615552"
"721119285754482688 ","2016-04-15","23:33","SPINN","spinnmusic","Stiletto Runners. Dirty Tequila Connoisseurs. Eyelash Wishers. Insomniacs. Alternative Country Band. NEW EP *City Country* now available on itunes!!","Can you paint with all the colors of theeeee wiiiiiiiind! #showtime #makeup #allofthecolors… https://t.co/LzwssCDrZy",,,"41.06902","-74.13514000000001","US","Ramsey, NJ","http://pbs.twimg.com/profile_images/616626317656653824/hWP05fkS_normal.jpg","4024","3493","40","en","http://www.twitter.com/spinnmusic/status/721119285754482688"
"721119284139831297 ","2016-04-15","23:33","DoIt4Oshea❤","Dha_Spiffiest","Your Favorite Cook  *Half B.tch/Sweetheart i dance. ♥️ Mind Ya Business Lurk On:)Fly High My Love A.O.R.","I'm in the house 24/7 bruh .",,,"32.3598437","-86.3237185","US","Montgomery, AL","http://pbs.twimg.com/profile_images/717136989867352064/A6wNhaUG_normal.jpg","1750","1499","8","en","http://www.twitter.com/Dha_Spiffiest/status/721119284139831297"
"721119283145797632 ","2016-04-15","23:33","Dustin Fletcher","radiofletcher","food. music. travel. dogs. dork. also program director / midday presenter. XL102, Richmond's Alternative, RVA / iHeartRadio Global","🍷 @ VMFA Virginia Museum of Fine Arts https://t.co/NQYXz9gONs",,,"37.55667429","-77.47481946000001","US","Richmond, VA","http://pbs.twimg.com/profile_images/477238708270157824/7ATw_XaC_normal.jpeg","3181","2513","122","fi","http://www.twitter.com/radiofletcher/status/721119283145797632"
"721119281338060800 ","2016-04-15","23:33","RobIvHdzhdz","knight13",,"I'm at Starbucks in Monterrey, NL https://t.co/8N8tBfvu7Q",,,"25.71199691","-100.37776709","MX","Monterrey, Nuevo León","http://pbs.twimg.com/profile_images/662140011710537728/abqy4nqU_normal.jpg","99","162","7","en","http://www.twitter.com/knight13/status/721119281338060800"
"721119279412740096 ","2016-04-15","23:33","TCC Careers","TCCcareers","We hire finest talent in the industry and offer exceptional training to those who want to work toward a career. If this sounds like you, we’d love to talk!","This #Sales #job might be a great fit for you: Verizon Retail Sales Consultant - https://t.co/ehJ0SgmQDo #Hiring https://t.co/Oh6YXBljwO",,,"40.830603","-84.9291329","US","Decatur, IN","http://pbs.twimg.com/profile_images/492755882829029376/p6GcBpW8_normal.jpeg","78","10","167","en","http://www.twitter.com/TCCcareers/status/721119279412740096"
"721119279131668480 ","2016-04-15","23:33","Alex","Alex___the_Gr8","What we do in life, echoes in eternity","#FIT @ Griswoldville, Connecticut https://t.co/GzjPPPtFGr",,,"41.6936","-72.6711","US","Wethersfield, CT","http://pbs.twimg.com/profile_images/714289149222764546/bX9Hmwgx_normal.jpg","372","332","12","en","http://www.twitter.com/Alex___the_Gr8/status/721119279131668480"
"721119277441490944 ","2016-04-15","23:33","Amanda S.","RI_Amanda_",,"I'm at Uno Pizzeria &amp; Grill - Attleboro in Attleboro, MA https://t.co/kSj3lGVlX5",,,"41.92519146","-71.35668779","US","Attleboro, MA","http://pbs.twimg.com/profile_images/450022918526083073/_hbDtg3G_normal.jpeg","971","562","39","en","http://www.twitter.com/RI_Amanda_/status/721119277441490944"
"721119277215047680 ","2016-04-15","23:33","jesse james","FreeJesseJames","glorified welder","Another angle of #TexasHotRods  Fab Master heman_fab New coupe. @ TX Hill Country https://t.co/WzZAUKA9yY","3",,"30.2335248","-97.99280856999999","US","Texas, USA","http://pbs.twimg.com/profile_images/378800000726052434/1aa5add386abbf292aa5e3e44a640abd_normal.jpeg","149539","278","811","en","http://www.twitter.com/FreeJesseJames/status/721119277215047680"
"721119276866908160 ","2016-04-15","23:33","César.","iCesarRT","19. Living ⏳ || snap:cesarrt96","I'm at Foro Sol for Coldplay and Lianne La Havas in Iztacalco, DF https://t.co/NOGmTQsdyX",,,"19.40517933","-99.0961647","MX","Iztacalco, Distrito Federal","http://pbs.twimg.com/profile_images/678038302599987201/RFNHPzoO_normal.jpg","1541","800","6","en","http://www.twitter.com/iCesarRT/status/721119276866908160"
"721119276619280384 ","2016-04-15","23:33","Jeff Johnson","milwaukeejeff","You never had a friend like me","Going to get my rakim concert on#oldschool @ Six Flags Over Georgia &amp; Hurricane Harbor https://t.co/P4UahjMLMJ",,,"33.76769","-84.557","US","Georgia, USA","http://pbs.twimg.com/profile_images/3413312540/252e4171d5e7281b1c3b96e6a57cd5e9_normal.jpeg","441","1668","6","en","http://www.twitter.com/milwaukeejeff/status/721119276619280384"
"721119276405366785 ","2016-04-15","23:33","Phil Genskow","pgenskow",,"First game of season",,,"44.981318","-93.277669","US","Minneapolis, MN","http://pbs.twimg.com/profile_images/638205919663419392/EqtEFCzm_normal.jpg","48","524","11","en","http://www.twitter.com/pgenskow/status/721119276405366785"
"721119276107628544 ","2016-04-15","23:33","Sacramento Gen. Sci.","tmj_SAC_gensci","Follow this account for geo-targeted General Scientific job tweets in Sacramento, CA. Need help? Tweet us at @CareerArc!","Join the KellyMitchell Group team! See our latest #GeneralScience #job opening here: https://t.co/4lOni6oHKH #Woodland, CA #Hiring",,,"38.6785157","-121.7732971","US","Woodland, CA","http://pbs.twimg.com/profile_images/709036837759614981/nEJLfjWl_normal.jpg","302","267","12","en","http://www.twitter.com/tmj_SAC_gensci/status/721119276107628544"
"721119275520520193 ","2016-04-15","23:33","Tarma Z","Tarma0","I don't believe in karma, I believe in Tarma","No quería venir (@ Universidad De Londres in Mexico, DF) https://t.co/C9aK2o5MHd",,,"19.41952076","-99.14814213","MX","Cuauhtémoc, Distrito Federal","http://pbs.twimg.com/profile_images/700845884041396225/ncNPrbA__normal.jpg","270","1223","1","es","http://www.twitter.com/Tarma0/status/721119275520520193"
"721119274279038977 ","2016-04-15","23:33","ally bruce","lly_bee","Media Planner @ Racepoint Global. Boston with a hint of Rhode Island","#OneBostonDay 💙💛 @ Marathon Finish Line https://t.co/DOtU8Bo3N0","1","1","42.34977372","-71.07864066","US","Boston, MA","http://pbs.twimg.com/profile_images/719330787762561024/SfG9ErEa_normal.jpg","361","265","1","en","http://www.twitter.com/lly_bee/status/721119274279038977"
"721119273725202433 ","2016-04-15","23:33","TMJ-SLC HRTA Jobs","tmj_slc_hrta","Follow this account for geo-targeted Hospitality/Restaurant/Tourism job tweets in Salt Lake City, UT. Need help? Tweet us at @CareerArc!","Restaurant Co-worker (Franchise) - Golden Corral: (#OGDEN, UT) https://t.co/Ta91ArMthG #Hospitality #Job #Jobs #Hiring #CareerArc",,,"41.2473361","-111.9690424","US","Ogden, UT","http://pbs.twimg.com/profile_images/668373794654818304/1Ez1rLG-_normal.jpg","334","291","45","en","http://www.twitter.com/tmj_slc_hrta/status/721119273725202433"
"721119272760684544 ","2016-04-15","23:33","Jim Harris","jimh1014","Jets, Knicks, Yankees fan, Seton Hall alum, Unilever opex analyst, and horrible golfer","Drinking an ESB by Jersey Girl Brewing  @ Jersey Girl Brewery — https://t.co/tzrSPB6Vd6",,,"40.8572","-74.77719999999999","US","New Jersey, USA","http://pbs.twimg.com/profile_images/660951172669440002/_adZpodT_normal.jpg","312","757","18","en","http://www.twitter.com/jimh1014/status/721119272760684544"
"721119272487903232 ","2016-04-15","23:33","Clare Brady","fittingitallin","Hello friends! I'm the blogger behind http://t.co/qVSpCDObO4. Future M.D. Passionate about #health & #yoga. #ED advocate. #fitfluential #stl #goirish","My bro and me. #LGB!!💙🏒 @ Shelly's in Soulard https://t.co/HzCrrv2yIp",,,"38.60802","-90.20740000000001","US","St Louis, MO","http://pbs.twimg.com/profile_images/378800000248171521/2c404e64de1f0057cfbbf78de077010a_normal.jpeg","4526","1214","193","en","http://www.twitter.com/fittingitallin/status/721119272487903232"
"721119271498047488 ","2016-04-15","23:33","TMJ-SAN Nursing Jobs","tmj_san_nursing","Follow this account for geo-targeted Healthcare-Nursing job tweets in San Diego, CA. Need help? Tweet us at @CareerArc!","Per Diem RN II - Hospital - Sharp Healthcare: (#SanDiego, CA) https://t.co/qrY0Ll6rgN #Nursing #Job #Jobs #Hiring #CareerArc",,,"32.715738","-117.1610838","US","San Diego, CA","http://pbs.twimg.com/profile_images/671403885072744448/S7IFkxkW_normal.jpg","1084","1120","60","da","http://www.twitter.com/tmj_san_nursing/status/721119271498047488"
"721119271384981504 ","2016-04-15","23:33","Andre","Dre_Sully","25, making moves, anything else jus ask #TeamTeal #TeamFollowBack #TeamDuval #TeamCancer #TeamGodFirst","The smile was real #GammaPhiBeta  #Formal @ Deercreek Country Club https://t.co/ek1EDRROwF",,,"30.18603199","-81.53816587999999","US","Mandarin, FL","http://pbs.twimg.com/profile_images/430853153966145536/y92QvCYr_normal.jpeg","660","1700","2","en","http://www.twitter.com/Dre_Sully/status/721119271384981504"
"721119271074463744 ","2016-04-15","23:33","Speedway Jobs","SpeedwayJobs","Rethink Speedway. It's more than a convenience store... It's your career opportunity!","Want to work at Speedway? We're #hiring in #Lebanon, PA! Click for details: https://t.co/8E28glX0CG #Retail #Job #Jobs",,,"40.2927633","-76.38687969999999","US","Pennsylvania, USA","http://pbs.twimg.com/profile_images/588378982485110784/CoHZRLK7_normal.png","218","27","381","en","http://www.twitter.com/SpeedwayJobs/status/721119271074463744"
"721119271074435072 ","2016-04-15","23:33","TMJ-CAA IT Jobs","tmj_CAA_it","Follow this account for geo-targeted Software Dev. - General/IT job tweets in Santa Barbara, CA. Need help? Tweet us at @CareerArc!","Can you recommend anyone for this #job? Software Development Engineer I - https://t.co/lRubLYIjc9 #SantaBarbara, CA #IT #Veterans #Hiring",,,"34.4335198","-119.8284491","US","Goleta, CA","http://pbs.twimg.com/profile_images/704139733635432448/4oquKlUO_normal.jpg","339","303","24","en","http://www.twitter.com/tmj_CAA_it/status/721119271074435072"
"721119270961188864 ","2016-04-15","23:33","Chelsey Lee Gaddy","chelseyleegaddy","Singing Dancing and Acting a Fool","The Man Who Came To Dinner with mama! Break a leg, ya'll! @ Asheville Community Theatre https://t.co/k8R2tIxP6s",,,"35.59718908","-82.5507841","US","Asheville, NC","http://pbs.twimg.com/profile_images/504727359468367872/gTGJN0Mq_normal.jpeg","412","999","6","en","http://www.twitter.com/chelseyleegaddy/status/721119270961188864"
"721119270378147840 ","2016-04-15","23:33","Jobs at VA","JobsatVA","This is our #jobs feed. Follow @VACareers to connect.","Department of Veterans Affairs #Purchasing #Job: Acquisition &amp; Utilization Specialist (#Salisbury, NC) https://t.co/OV9KyNKs3x #Veterans",,,"35.6709727","-80.4742261","US","Salisbury, NC","http://pbs.twimg.com/profile_images/527141119344123904/_GQQe9Or_normal.png","661","1","633","en","http://www.twitter.com/JobsatVA/status/721119270378147840"
"721119270281854977 ","2016-04-15","23:33","Share Designs","sharedesigns","Share Designs Upscale Vintage Boutique in Phila, Pa if u want to purchase on-line u can leave ur email address next to each item for an invoice thru PayPal.","Alexander McQueen inspired Faux leather orange clutch with scull print all over it Brand new… https://t.co/fwaKuN5J9r",,,"39.99918","-75.1696599","US","Philadelphia, PA","http://pbs.twimg.com/profile_images/720062442273927169/4WUD3Jce_normal.jpg","150","246","36","en","http://www.twitter.com/sharedesigns/status/721119270281854977"
"721119269660938240 ","2016-04-15","23:33","California Auto.","tmj_CA_auto","Follow this account for geo-targeted Automotive job tweets in California Non-Metro. Need help? Tweet us at @CareerArc!","Aerotek: Diesel Mechanic (#Bakersfield, CA) https://t.co/CD1KZGS6d4 #Automotive #Job #Jobs #Hiring",,,"35.3732921","-119.0187125","US","Bakersfield, CA","http://pbs.twimg.com/profile_images/671766179229204480/QSnVQ2ME_normal.jpg","206","134","58","es","http://www.twitter.com/tmj_CA_auto/status/721119269660938240"
"721119268880912385 ","2016-04-15","23:33","✨MAGADAN✨","magadanp","No me importa de que tan bajo ⬇ uno pueda venir . . . . Sino lo alto ⬆ que uno pueda llegar. Zazzzzzz culero eh dicho.","I'm at Toreo Parque Central - @toreopc in Naucalpan de Juárez, MEX, MEX https://t.co/so7XkvU5fK",,,"19.45409503","-99.21886204","MX","Naucalpan de Juárez, México","http://pbs.twimg.com/profile_images/713012233970655232/0-Hn44da_normal.jpg","89","46","5","es","http://www.twitter.com/magadanp/status/721119268880912385"
"721119268176338944 ","2016-04-15","23:33","Alena","alenahakansson","Tackling life like a viking on a seahorse","#Macallan I melt! So good! Thank you @vinconservatory #perfectdrop @ The Vintage Conservatory -… https://t.co/IGhPgMW7HY",,,"43.6522161","-79.37345154","CA","Toronto, Ontario","http://pbs.twimg.com/profile_images/1545715909/Headshot_normal.jpg","235","276","7","en","http://www.twitter.com/alenahakansson/status/721119268176338944"
"721119267131764736 ","2016-04-15","23:33","Sentir Venezuela","SVenezuela1","Sentir Venezuela es una proyecto de promoción de eventos  y a la vez de ser una exitosa plataforma de mercadeo con sede en Miami que se especializa en eventos.","Expo Sentir Venezuela 2016. Durante el fin de semana de Abril 29,30 y 1 de Mayo en el Miami… https://t.co/PtcZ8HRwJ6",,,"25.7764314","-80.3126449","US","Miami, FL","http://pbs.twimg.com/profile_images/598936662593314816/7ou7E0LZ_normal.png","633","1534","11","es","http://www.twitter.com/SVenezuela1/status/721119267131764736"
"721119266016256000 ","2016-04-15","23:33","Nathaly Velazquez","allynath8","sc: nath_ally","4/15/16 @ Crown Point Courthouse Square Historic District https://t.co/okWz1TwMlA",,,"41.41694444","-87.36555556","US","Crown Point, IN","http://pbs.twimg.com/profile_images/712834132687106048/TJdPGpij_normal.jpg","385","241","3","en","http://www.twitter.com/allynath8/status/721119266016256000"
"721119262308462592 ","2016-04-15","23:33","Jorge Ledezma","JorgeLeru","Egresado de Comunicación, eso significa que también le hago de músico, artista, cineasta, escritor, productor y nada más, eso creo.","I'm at Milán 44 in Juárez, Mexico City https://t.co/zkC2xFg4kJ",,,"19.42929613","-99.15702331","MX","Cuauhtémoc, Distrito Federal","http://pbs.twimg.com/profile_images/556304743703015424/ESVL5GCW_normal.jpeg","559","705","15","es","http://www.twitter.com/JorgeLeru/status/721119262308462592"
