"721139128750968832 ","2016-04-16","00:52","Tommy LeBlanc, Ph.D.","AstroCaribe","Software Developer. From-the-hip, double-barrel code slinger. Family man, daydreamer, always looking for answers and learning new things. Vanderbilt Alum.","Drinking a Samuel Adams Noble Pils by @SamuelAdamsBeer @ City Of Belle Meade — https://t.co/4JeytpuVbt",,,"36.1072","-86.8574","US","Belle Meade, TN","http://pbs.twimg.com/profile_images/2857730515/835f2eae43c586d72d78d696c1ca314f_normal.png","199","287","27","en","http://www.twitter.com/AstroCaribe/status/721139128750968832"
"721139127471710208 ","2016-04-16","00:52","Melinda","MelindaMichale","Blonde and Blessed!!","🍔🍟🌭 @ The Cosmopolitan of Las Vegas https://t.co/qIvYzZBqRo","1",,"36.1096802","-115.174166","US","Paradise, NV","http://pbs.twimg.com/profile_images/2961414228/87ac67eb80f788711ca5a5eb83b71cec_normal.jpeg","29054","24287","80","en","http://www.twitter.com/MelindaMichale/status/721139127471710208"
"721139122501332993 ","2016-04-16","00:52","LA Education Jobs","tmj_lax_edu","Follow this account for geo-targeted Education/Teaching job tweets in Los Angeles, CA. Need help? Tweet us at @CareerArc!","We're #hiring! Read about our latest #job opening here: SAT/ACT Instructor and Tutor - West LA (Los... - https://t.co/PgsxfSxUpE #Education",,,"34.0194543","-118.4911912","US","Santa Monica, CA","http://pbs.twimg.com/profile_images/673799358215675904/S8uLbZrm_normal.jpg","499","238","73","en","http://www.twitter.com/tmj_lax_edu/status/721139122501332993"
"721139122048356353 ","2016-04-16","00:52","Helzberg Diamonds","HelzbergJobs",,"Interested in a #Sales #job near #Atlanta, GA? This could be a great fit: https://t.co/f8dXGn69dn #Hiring",,,"33.7489954","-84.3879824","US","Atlanta, GA","http://pbs.twimg.com/profile_images/3273300269/9b3e73115238cd362bfa11ed4d7b7ae6_normal.jpeg","106",,"228","en","http://www.twitter.com/HelzbergJobs/status/721139122048356353"
"721139122044166144 ","2016-04-16","00:52","CA Veteran Jobs","tmj_CA_vets","Follow this account for geo-targeted Veteran job tweets in California Non-Metro. Need help? Tweet us at @CareerArc!","This #Healthcare #job might be a great fit for you: Pharmacist - https://t.co/CCyWq0hhIm #Benicia, CA #Veterans #Hiring #CareerArc",,,"38.049365","-122.1585777","US","Benicia, CA","http://pbs.twimg.com/profile_images/667891026904748032/zv0uO3_w_normal.jpg","207","127","144","en","http://www.twitter.com/tmj_CA_vets/status/721139122044166144"
"721139117724155904 ","2016-04-16","00:52","G.U.Y. Incognito","MegaTogekiss","Previous Earth Ambassador to Coruscant. Self deprecates, parodies self. Opinions are mine and such.","@duhlaymos as of what information we know, no",,,"38.86502443","-76.99745126000001","US","Washington, DC","http://pbs.twimg.com/profile_images/684198929563529216/HddOtl49_normal.jpg","946","624","14","en","http://www.twitter.com/MegaTogekiss/status/721139117724155904"
"721139117472358400 ","2016-04-16","00:52","Dana Wittie","danawittie","Hairstylist, love my baby girl, love to rope, barrel race. Instagram: danawittie Facebook: https://t.co/BRnv4rDla6","Gosh I love this horse! #SusieTheCowPony #April2016 #RanchHorses… https://t.co/VjsVEeRJkP",,,"31.42208618","-97.76777346999999","US","Texas, USA","http://pbs.twimg.com/profile_images/658676621566603264/A_OG5-jT_normal.jpg","87","394","3","en","http://www.twitter.com/danawittie/status/721139117472358400"
"721139117216677888 ","2016-04-16","00:52","nikki","bbyniks","We're speaking in bodies.","Cutest ice cream shop with the cutest company 🍦 @crazyweird99 @ McConnell's Fine Ice Creams https://t.co/pftIAaswdO",,,"34.144547","-118.39463","US","Los Angeles, CA","http://pbs.twimg.com/profile_images/715007229116694528/IfNbIWI__normal.jpg","632","496","13","en","http://www.twitter.com/bbyniks/status/721139117216677888"
"721139115530526720 ","2016-04-16","00:52","Jen B","WIGeekMom","I'm a mom and wife, public employee, beer drinker, foodie, Whovian, and have MS. Welcome to my eclectic life.","Drinking a Warped Speed Scotch Ale by @LakeLouieBrewer @ Looking Glass — https://t.co/RAaZX7Q5X6",,,"42.6834","-89.0227","US","Janesville, WI","http://pbs.twimg.com/profile_images/695808352807309313/veub9tdE_normal.jpg","394","334","32","en","http://www.twitter.com/WIGeekMom/status/721139115530526720"
"721139113781428225 ","2016-04-16","00:52","Steven Evans","StvnMchl","Living and loving Orange County CA. I can't get enough of your love. Member Long Beach Grand Prix volunteer association. #countrymusic","@HonestlySherry probably. Didn't look good when we opened the gates to come through. O yeah, it was on a flat bed. #tgplb #bubbaburgers","1",,"33.76576577","-118.18871358","US","Terminal Island, Los Angeles","http://pbs.twimg.com/profile_images/545372915944812545/RdW4Aid2_normal.jpeg","138","679","2","en","http://www.twitter.com/StvnMchl/status/721139113781428225"
"721139113727037440 ","2016-04-16","00:52","DJ Michael Lopez","DJBignutLopez",,"First i have to analyze a some new music, grab a little bite to eat,… https://t.co/65Yd53xjiA",,,"32.2294","-110.96558","US","Tucson, AZ","http://pbs.twimg.com/profile_images/417125305464016896/EXjymVnr_normal.jpeg","217","119","1","en","http://www.twitter.com/DJBignutLopez/status/721139113727037440"
"721139112829292545 ","2016-04-16","00:52","verox","VRvrrc","amor y pasión por la musica","Y que se arma la fiesta🎉🎊🎊🎉🎇con uno de nuestros galanes consentidos @davidpalacio91 eres un amor… https://t.co/nHsYf3Vle3",,,"19.36519842","-99.14022430999999","MX","Benito Juárez, Distrito Federal","http://pbs.twimg.com/profile_images/715254675335831552/zpB3k6eG_normal.jpg","123","319","1","es","http://www.twitter.com/VRvrrc/status/721139112829292545"
"721139110467928064 ","2016-04-16","00:52","DineHere.us","dine_here","The simple dining guide","Try https://t.co/z4rrf5q2hQ Crust availability, prices, participation, delivery areas and charges, and minimum purchase #Crust #menu",,,"28.1065","-81.62439999999999","US","Haines City, FL","http://pbs.twimg.com/profile_images/1657084315/simps_normal.jpg","4386","876","708","en","http://www.twitter.com/dine_here/status/721139110467928064"
"721139110409207809 ","2016-04-16","00:52","Philip McLaughlin","philip07304",,"At Bayonne Crossing — https://t.co/ZF13Y9aOiV",,,"40.66321","-74.10693000000001","US","Bayonne, NJ","http://pbs.twimg.com/profile_images/712154452816433154/oot_6V3g_normal.jpg","554","2019","20","fr","http://www.twitter.com/philip07304/status/721139110409207809"
"721139110262534144 ","2016-04-16","00:52","MARCUS P HATCH","MARCUSPH333","https://t.co/uCWi3SO5bH","gOT tO D.C 7am tHIS mORNING fOR a sHAPE uP,.. bACK iN LA rOTATION bY 3pm ,... FRESHERISTIC… https://t.co/5yL0oZ736f",,,"33.9442368","-118.3975983","US","Los Angeles, CA","http://pbs.twimg.com/profile_images/344513261571925412/173abbc7c03c5ab45b67ee7fae70f7e5_normal.jpeg","819","1017","19","en","http://www.twitter.com/MARCUSPH333/status/721139110262534144"
"721139110006534145 ","2016-04-16","00:52","An⚡","Annel14_",,"Fool for you💕",,,"23.2674613","-106.3895604","MX","Mazatlán, Sinaloa","http://pbs.twimg.com/profile_images/718317121789431809/INeUNjMm_normal.jpg","356","196","5","en","http://www.twitter.com/Annel14_/status/721139110006534145"
"721139109796847616 ","2016-04-16","00:52","Matthew Bender","5280code","I'm a Ruby on Rails developer, ipso facto, I'm a big fan of robots and cats. I also am a huge hockey fan! Go Avs, Ducks, Jets, Kings!","Relationship Foals @ Coachella https://t.co/t4Ld5k9Ohl",,,"33.679974","-116.237221","US","California, USA","http://pbs.twimg.com/profile_images/513895723805339648/YPbYE7GV_normal.png","281","225","36","en","http://www.twitter.com/5280code/status/721139109796847616"
"721139109675274240 ","2016-04-16","00:52","Adam Edgmond","aeligature","INTP. Polymath. Visual Storyteller, Fluffmoo Studioo. Embers of Sozon premieres late 2016. Views are personal.","Let's disrupt some fundraisers, shall we? #feelthebern @ Huntington Park https://t.co/XgTRWBnd15",,,"37.791956","-122.41205","US","San Francisco, CA","http://pbs.twimg.com/profile_images/693275355763732481/gZssp6xI_normal.png","261","213","66","en","http://www.twitter.com/aeligature/status/721139109675274240"
"721139109188636672 ","2016-04-16","00:52","Brenda Swann","BSwanntastic","Advocate of Merriment & Good Health! Wedding Planner+Holistic Health Coach. On a mission to Encourage, Inspire, & find Adventure! #keepitreal #liverichly","This place is such a dream!! Talk about a hidden treasure amongst the concrete! Thank you… https://t.co/rQWLCElyHh",,,"32.898139","-117.1786","US","San Diego, CA","http://pbs.twimg.com/profile_images/515868428729843713/-cAVQQFc_normal.jpeg","2003","827","105","en","http://www.twitter.com/BSwanntastic/status/721139109188636672"
"721139108559519744 ","2016-04-16","00:52","Sam I Am","TheReal_Sam1Am","Writer. Smarty Pants. Professional Sasser. Views are my own.","The Railroad Bridge and all its graffiti glory 😍 @ Austin, Texas https://t.co/oFJ3ZqyZpq",,,"30.2672","-97.76390000000001","US","Austin, TX","http://pbs.twimg.com/profile_images/667073133254279168/UyNDSxWv_normal.jpg","111","256","3","en","http://www.twitter.com/TheReal_Sam1Am/status/721139108559519744"
"721139106777055232 ","2016-04-16","00:52","Scott Shaykett","scottshaykett","Saddle Maker - Leatherworker - Outdoorsman - Homebrewer I follow positive people.","Metal. - Drinking a Todd - The Axe Man (Surly Release) by @surlybrewing @ Valley Springs, SD  — https://t.co/S3666hMkjb #photo",,,"43.5817","-96.465","US","South Dakota, USA","http://pbs.twimg.com/profile_images/714605087532969984/qlxgCZF0_normal.jpg","597","896","8","en","http://www.twitter.com/scottshaykett/status/721139106777055232"
"721139106315689984 ","2016-04-16","00:52","Darrin Everitt","DRE_Go_Fish","Wishing I was fishing...love my family, beer and cigars. Untappd: DRE_Go_Fish","Loving that malty backbone - Drinking a Hop Rising by @squattersbeers at @lewisvilletexas  — https://t.co/HuXWYhNOKA #photo",,,"33.0463","-96.9941","US","Lewisville, TX","http://pbs.twimg.com/profile_images/692462987072913408/oBoGMuZl_normal.jpg","321","600","29","en","http://www.twitter.com/DRE_Go_Fish/status/721139106315689984"
"721139105707462657 ","2016-04-16","00:52","Elisa Becker","elisabecker","Traveling alone since June 11. Follow the trip on Snapchat: elisabecker24 #eurotrip2015 #USAtrip2016","Muir Woods Redwood National Park, California USA April 2016 | by @elisabecker @ Muir Woods… https://t.co/UGVz8DnznX",,,"37.89396954","-122.57425706","US","California, USA","http://pbs.twimg.com/profile_images/720884358865768448/FZVajhAe_normal.jpg","766","520","303","en","http://www.twitter.com/elisabecker/status/721139105707462657"
"721139105099300864 ","2016-04-16","00:52","Christina Torres","chrissytorres","I'm a busy mother of two boys and craft beer aficionado.","FAR TOO SWEET! - Drinking a Blueberry Cream Ale by Dad &amp; Dude's Breweria at @mccabesirishpub  — https://t.co/xom5gmJjrS",,,"39.6057","-104.708","US","Colorado, USA","http://pbs.twimg.com/profile_images/684421421779431424/8UmX81Li_normal.jpg","65","138","2","en","http://www.twitter.com/chrissytorres/status/721139105099300864"
"721139104214163456 ","2016-04-16","00:52","SF311 Reports","SF311Reports","This is account is not monitored and is used to post service request update information. To communicate with SF311, please use our main account 'SF311'","Opened Flooding and Sewer Issues request via android at Intersection of 8th Ave &amp; Clement St https://t.co/WLLGCgn2hh. Water leak in street.",,,"37.782833","-122.466297","US","San Francisco, CA","http://pbs.twimg.com/profile_images/378800000255346636/324671de53605fa795ab03eb73a7b0b5_normal.png","126",,"30","en","http://www.twitter.com/SF311Reports/status/721139104214163456"
"721139103916552192 ","2016-04-16","00:52","Hilda Castillo","hidacalo",,"https://t.co/rI8licqoKX",,,"37.69932436","-123.01194271","US","California, USA","http://pbs.twimg.com/profile_images/594287611042107392/xH4hhKrS_normal.jpg","5",,"3","es","http://www.twitter.com/hidacalo/status/721139103916552192"
"721139102867931136 ","2016-04-16","00:52","her royal buffness","hrylbuffness","all is vanity #peace","#Friday #evening #losangeles @ Pershing Square https://t.co/sKSk8fqNBA",,,"34.04825","-118.25301","US","Los Angeles, CA","http://pbs.twimg.com/profile_images/720150217794826240/fZqIFY8x_normal.jpg","854","906","43","en","http://www.twitter.com/hrylbuffness/status/721139102867931136"
"721139102477860864 ","2016-04-16","00:52","~","10Garza","Él en el cielo y yo en la tierra, hacemos equipo para uno mismo ♥➕","😍 (@ Yukis Cuernavaca) https://t.co/KHMzgaBDDX",,,"26.92878511","-101.42749665","MX","Monclova, Coahuila de Zaragoza","http://pbs.twimg.com/profile_images/720093200598216704/4004C1FH_normal.jpg","381","337","3","es","http://www.twitter.com/10Garza/status/721139102477860864"
"721139100724633600 ","2016-04-16","00:52","BatMcfunky","JoshInBlack","Jalisquillo, Futbolero, comicquero, Lic. en Informática UDG, EDI Analyst (HPE), Food lover","I'm at Paseo Chapultepec in Guadalajara, JAL https://t.co/8NrE83rqJW",,,"20.67103438","-103.36859107","MX","Guadalajara, Jalisco","http://pbs.twimg.com/profile_images/676262984776212480/S_FZM9Ha_normal.jpg","180","149","18","es","http://www.twitter.com/JoshInBlack/status/721139100724633600"
"721139098950496256 ","2016-04-16","00:52","Justin Guin (Mush)","justin_guin","just a southern artist looking to be happy and create beauty in the world..","Smoking some Kush all naked in the bed like a G! LOL#420life ~🍄 🌿🌿🌿🌿🌿🌿🌿🌿🌿🌿🌿🌿🌿🌿🌿🌿🌿 #MUSHYLOV… https://t.co/NJ4spPbIo3","2",,"30.2958","-91.11669999999999","US","Louisiana, USA","http://pbs.twimg.com/profile_images/708269729073352704/SKZxT72U_normal.jpg","161","299","7","en","http://www.twitter.com/justin_guin/status/721139098950496256"
"721139098564608001 ","2016-04-16","00:52","kenna b †","dirt_princess36","21. Spalding University 2017 W.R.R. 10/7/15❤️","😁😁🍻🍻 @ Fourth Street Live! Entertainment District https://t.co/uotsGlQMJF","1",,"38.25253","-85.757411","US","Louisville, KY","http://pbs.twimg.com/profile_images/630159641016725504/wU8bzVJR_normal.jpg","371","605","1","en","http://www.twitter.com/dirt_princess36/status/721139098564608001"
"721139098216476672 ","2016-04-16","00:52","Edgardo Marrero","edgardus3000","Runner, musician, bimmer fan, football fan and F1 enthusiast.","I'm at @Walmart Supercenter in Port Charlotte, FL https://t.co/uITE1otImi",,,"27.01283457","-82.13962555000001","US","Port Charlotte, FL","http://pbs.twimg.com/profile_images/516236957891178496/6TLkfV5W_normal.jpeg","161","1597","37","en","http://www.twitter.com/edgardus3000/status/721139098216476672"
"721139097927094272 ","2016-04-16","00:52","Baytown, TX News","BLifeBaytown","Baytown BubbleLife features community news, photos and events. Share your business, organization or personal news and events at https://t.co/Fmh4fe1Z0T.","A$AP Bari &amp; A$AP Rocky Launch VLONE x Off-White Collaboration https://t.co/4sZPo1UbIJ",,,"29.77070045","-94.87539673000001","US","Baytown, TX","http://pbs.twimg.com/profile_images/527566908980092930/N2JI7vyA_normal.jpeg","161","122","2","en","http://www.twitter.com/BLifeBaytown/status/721139097927094272"
"721139097478238208 ","2016-04-16","00:52","David Holm","Daves_cool","Motion Designer / Artist","Night out in the city @ DIA Kresge Court https://t.co/fFsyBsypEp",,,"42.3591152","-83.06460027","US","Detroit, MI","http://pbs.twimg.com/profile_images/626760656625123329/U5Vd3Qxr_normal.jpg","156","310","11","en","http://www.twitter.com/Daves_cool/status/721139097478238208"
"721139096475865088 ","2016-04-16","00:52","Baytown, TX News","BLifeBaytown","Baytown BubbleLife features community news, photos and events. Share your business, organization or personal news and events at https://t.co/Fmh4fe1Z0T.","4216 Thyme Cir, Baytown, TX 77521, $199,900 4 beds, 3.5 baths https://t.co/icBMKNpIEZ",,,"29.77070045","-94.87539673000001","US","Baytown, TX","http://pbs.twimg.com/profile_images/527566908980092930/N2JI7vyA_normal.jpeg","161","122","2","en","http://www.twitter.com/BLifeBaytown/status/721139096475865088"
"721139095314018304 ","2016-04-16","00:52","Baytown, TX News","BLifeBaytown","Baytown BubbleLife features community news, photos and events. Share your business, organization or personal news and events at https://t.co/Fmh4fe1Z0T.","10626 Ravens Way, Baytown, TX 77523, $0 https://t.co/RqJEygzDTh",,,"29.77070045","-94.87539673000001","US","Baytown, TX","http://pbs.twimg.com/profile_images/527566908980092930/N2JI7vyA_normal.jpeg","161","122","2","en","http://www.twitter.com/BLifeBaytown/status/721139095314018304"
"721139093665517568 ","2016-04-16","00:52","Héctor Islas","Sir_Phileas_Fog","Nací en el lugar mas hermoso del planeta tierra a la edad de cero años.","El inicio... @ Deportivo Mixhuca https://t.co/uIaa0o1vxK",,,"19.40864026","-99.11062975999999","MX","Venustiano Carranza, Distrito Federal","http://pbs.twimg.com/profile_images/703790595139985409/waNm4HYH_normal.jpg","133","558",,"es","http://www.twitter.com/Sir_Phileas_Fog/status/721139093665517568"
"721139093531287552 ","2016-04-16","00:52","Argosy Casino KC","ArgosyKC_Jobs","A Penn National Gaming property, Argosy Casino Hotel & Spa offers gaming excitement, luxury hotel rooms, fine dining and a rejuvenating spa.","#BusinessMgmt #Job alert: Poker Supervisor | Argosy Casino Hotel &amp; Spa | #Riverside, MO https://t.co/qxtfXiWMhN https://t.co/hYEWSUwabi",,,"39.1605504","-94.6219162","US","Riverside, MO","http://pbs.twimg.com/profile_images/378800000468699401/d7064f571ef68bb6f10256aba2be8e38_normal.jpeg","206","137","81","es","http://www.twitter.com/ArgosyKC_Jobs/status/721139093531287552"
"721139093065883656 ","2016-04-16","00:52","Nathaniel Johnson","OnjMonster","I am the Loup Garou","Oooohhhhhhhhh yeaaaa - Drinking a Kentucky Breakfast Stout (KBS) by @foundersbrewing @ The Moan and Dove  — https://t.co/xxAyCK0XR2",,,"42.3406","-72.5198","US","South Amherst, MA","http://pbs.twimg.com/profile_images/836291039/IMG_0140_normal.JPG","257","2030","10","en","http://www.twitter.com/OnjMonster/status/721139093065883656"
"721139091996282880 ","2016-04-16","00:52","Victor Julian","Juliantejeda","Productor Audiovisual Valora A.C; Lic. En Medios Audiovisuales; Geek. Porque Para DIOS Todo Es Posible, Yo Si Creo.","I'm at Pit´s Burger in Guadalajara, jalisco https://t.co/bRpmaOloee",,,"20.70235312","-103.33274829","MX","Guadalajara, Jalisco","http://pbs.twimg.com/profile_images/665801994355916800/SDTG0Ea1_normal.jpg","171","84","9","es","http://www.twitter.com/Juliantejeda/status/721139091996282880"
"721139091773853696 ","2016-04-16","00:52","Julian Lee","Dodgers2915","Photography, Dodgers, Taco Tuesdays #Litmas","Had to hit that shake shack tho @ Shake Shack West Hollywood, CA https://t.co/tYMfvG1S8Z",,,"34.08899535","-118.37696903","US","West Hollywood, CA","http://pbs.twimg.com/profile_images/686016673510330368/l9oqMwvV_normal.jpg","105","647","4","en","http://www.twitter.com/Dodgers2915/status/721139091773853696"
"721139090347966468 ","2016-04-16","00:52","marlene correa","marlenebonita",,"Jahaha me pareció chistoso @ Naugatuck State Forest https://t.co/G5GeADmx6V",,,"41.45805556","-73.01472222","US","Connecticut, USA","http://pbs.twimg.com/profile_images/513827203742576640/PB5P_SGd_normal.jpeg","119","654","2","it","http://www.twitter.com/marlenebonita/status/721139090347966468"
"721139089156739072 ","2016-04-16","00:52","Gary Miller","gmmac74",,"The pear trees are almost ready to bloom. Soon our streets will be… https://t.co/3BA0SVprQl",,,"41.5821","-85.83669999999999","US","Goshen, IN","http://pbs.twimg.com/profile_images/1160382136/Gary_in_Batcave2_normal.JPG","25","177","3","en","http://www.twitter.com/gmmac74/status/721139089156739072"
"721139088582123520 ","2016-04-16","00:52","Cynthia Gómez.","CynnGmz","21. Wannabe Architect. RM4. Snap: cynngu","I'm at Estadio Kukulcán in Mérida, YUC w/ @arrmxndo https://t.co/sj5tutAgXX",,,"20.94045911","-89.59608007","MX","Mérida, Yucatán","http://pbs.twimg.com/profile_images/714673244670976000/zViBiEE1_normal.jpg","299","478",,"es","http://www.twitter.com/CynnGmz/status/721139088582123520"
"721139087986573312 ","2016-04-16","00:52","david","djfeimster",,"Just posted a photo @ Fahrenheit https://t.co/2tQOnChiOC",,,"35.222586","-80.841021","US","Charlotte, NC","http://pbs.twimg.com/profile_images/479986994345308162/zg8dBCKC_normal.jpeg","200","388","2","en","http://www.twitter.com/djfeimster/status/721139087986573312"
"721139087554539520 ","2016-04-16","00:52","WilJames","WilJames","Tech enthusiast, hell raiser, all around fun guy. No subject is too controversial. Follow at your own risk!","I'm at Queen City Q (The Q) - @theqclt in Charlotte, NC w/ @msippi https://t.co/pHl62rJotQ",,,"35.22723415","-80.83871126","US","Charlotte, NC","http://pbs.twimg.com/profile_images/64506712/070410_Wil___Denise_normal.jpg","730","1507","34","en","http://www.twitter.com/WilJames/status/721139087554539520"
"721139086547886080 ","2016-04-16","00:52","PABLO PORTILLO","pabloportillo","Cantante, compositor y actor. Integrante de #MDO. https://t.co/IhN7XGAmr1 #MdoIsBack #PabloPortillo","#Yes #esviernesyelcuerpolosabe 😜 #esviernes de ¿#salironosalir? 🙈 ¿qué opinan? @ Mexico City,… https://t.co/ZCKmB2wB4E","32","5","19.4333","-99.13330000000001","MX","Cuauhtémoc, Distrito Federal","http://pbs.twimg.com/profile_images/697178938938757120/KoPyX4Rr_normal.jpg","36613","11968","148","es","http://www.twitter.com/pabloportillo/status/721139086547886080"
"721139085243523072 ","2016-04-16","00:52","Aarón Ramírez","Aaron_C7","¡Vida mía, nunca te acabes! ✌️♻️","Viernes sin alcohol. 😌 (@ Liverpool in Benito Juárez, DF) https://t.co/26cyyW4iZW",,,"19.37234882","-99.17906642","MX","Benito Juárez, Distrito Federal","http://pbs.twimg.com/profile_images/524794982440648704/u0LNJYxo_normal.jpeg","125","112",,"es","http://www.twitter.com/Aaron_C7/status/721139085243523072"
"721139083829972992 ","2016-04-16","00:52","She's a Harriette","wHoleBlowOut","Run, drink, sing, blog, repeat.","Drinking a Jai Alai IPA by @CigarCityBeer at @waltdisneyworld — https://t.co/6sVx91AUKj #photo",,,"28.3576","-81.56019999999999","US","Florida, USA","http://pbs.twimg.com/profile_images/463699959938686977/Mt6W_krs_normal.png","326","581","20","es","http://www.twitter.com/wHoleBlowOut/status/721139083829972992"
"721139082668052481 ","2016-04-16","00:52","Jobs at VA","JobsatVA","This is our #jobs feed. Follow @VACareers to connect.","We're #hiring! Click to apply: Licensed Vocational Nurse - https://t.co/9cH26gZBUq #Nursing #Fresno, CA #Veterans https://t.co/7aY9Cd7p5k",,,"36.7468422","-119.7725868","US","Fresno, CA","http://pbs.twimg.com/profile_images/527141119344123904/_GQQe9Or_normal.png","661","1","633","en","http://www.twitter.com/JobsatVA/status/721139082668052481"
"721139081753845760 ","2016-04-16","00:52","Oxford Canteen","OxfordCanteen","Eat like you mean it. Follow us for Daily Specials. Open Tue thru Sat 11am-3pm and NOW until 7 on Wed, Thur and Fri","Ole Miss Women's Council for Philanthropy @thelyricoxford was good fun w/riversrutherford and… https://t.co/k9wBaDICn1",,,"34.3658981","-89.5200882","US","Oxford, MS","http://pbs.twimg.com/profile_images/441397392311463936/MBm9qQqP_normal.jpeg","1244","901","18","en","http://www.twitter.com/OxfordCanteen/status/721139081753845760"
"721139080885612544 ","2016-04-16","00:52","Tori A","coconutsunset","life is like one big wave, sometimes you're riding high and then before you know it, you're slammed to the ground","I'm at I-we-juns Only in West Palm Beach, FL https://t.co/VXHk9uZhld https://t.co/3U1rGrIyX5",,,"26.681863","-80.1261093","US","West Palm Beach, FL","http://pbs.twimg.com/profile_images/677345905364697089/WkhlLFWn_normal.jpg","287","322","12","en","http://www.twitter.com/coconutsunset/status/721139080885612544"
"721139080856088576 ","2016-04-16","00:52","TCG Jobs","TCGJobs","TCG is a staffing firm that places design, interactive and marketing professionals in freelance and full-time jobs. See all our Jobs here!","Want to work at The Creative Group? We're #hiring in #Plainsboro, NJ! Click for details: https://t.co/DbcciBXh8X #Art #TheCreativeGroup #Job",,,"40.3379035","-74.58733479999999","US","Plainsboro, NJ","http://pbs.twimg.com/profile_images/430398231730589697/ncWn7U77_normal.png","367","7","938","en","http://www.twitter.com/TCGJobs/status/721139080856088576"
"721139080398909441 ","2016-04-16","00:52","TMJ-CA HRTA Jobs","tmj_ca_hrta","Follow this account for geo-targeted Hospitality/Restaurant/Tourism job tweets in California Non-Metro. Need help? Tweet us at @CareerArc!","#CareerArc #Hospitality #Job alert: Blazing Noodles Chef | Pechanga Resort &amp; Casino | #Temecula, CA https://t.co/E1fwp2JtiV #Jobs #Hiring",,,"33.4555619","-117.1061456","US","California, USA","http://pbs.twimg.com/profile_images/666794831088234496/d0myNv4o_normal.jpg","451","297","112","es","http://www.twitter.com/tmj_ca_hrta/status/721139080398909441"
"721139079694401537 ","2016-04-16","00:52","Mel Jenner","Melanie_Sniper","Myself & -6:00 GMT since 1995. Marketing student & ultimate frisbee player at Carthage College.","Just posted a photo @ Kenosha https://t.co/aJ7j32y2NT",,,"42.5822","-87.8456","US","Kenosha, WI","http://pbs.twimg.com/profile_images/579059054439366656/tsZ0r6sH_normal.jpg","94","226","2","en","http://www.twitter.com/Melanie_Sniper/status/721139079694401537"
