"721138578697244672 ","2016-04-16","00:50","Ruan Resbo","Ruanbananana","Troublemaker.  Snapchat: ruanawayy","Trouble @ Urbandale, Iowa https://t.co/9L4dRCzNe5",,,"41.6364","-93.73609999999999","US","Urbandale, IA","http://pbs.twimg.com/profile_images/703733831321292800/AwHlemxO_normal.jpg","369","87","3","es","http://www.twitter.com/Ruanbananana/status/721138578697244672"
"721138578625933312 ","2016-04-16","00:50","jīmmy Møńtęš™ ®","pipiriloco","Dj Broadcaster @elcassetteradio","•••Una Vez Que Llegamos A Viejos , Solo Queremos Disfrutar De Lo Que Nunca Pudimos Apreciar•••… https://t.co/RiJSbXCVny",,,"41.30998694","-72.10656371","US","Waterford, CT","http://pbs.twimg.com/profile_images/674548322510749696/7Mc4tvyB_normal.jpg","148","115","3","es","http://www.twitter.com/pipiriloco/status/721138578625933312"
"721138578051481600 ","2016-04-16","00:50","Victoria Fernandez","yogabyvictoria","yoga teacher • mermaid • aerialist // the bay, ca","Beautiful day for donation yoga millscollege! Join us next Friday, April 22 @ 12pm President's… https://t.co/mUMJvqlrzd",,,"37.78117445","-122.18281624","US","Oakland, CA","http://pbs.twimg.com/profile_images/542216014612553728/UdtawQuW_normal.jpeg","242","339","17","en","http://www.twitter.com/yogabyvictoria/status/721138578051481600"
"721138578038853638 ","2016-04-16","00:50","Afton Oaks, TX News","BLifeAftonOaks","Afton Oaks BubbleLife features community news, photos and events. Share your business, organization or personal news and events at https://t.co/Y1CY57ZECo.","Another Colorway Of The Nike Air More Uptempo Is Hitting Shelves https://t.co/KZw3cWv6Si",,,"29.74629974","-95.44750214","US","Houston, TX","http://pbs.twimg.com/profile_images/527544023385255936/BoP0u5Ri_normal.jpeg","150","158","2","en","http://www.twitter.com/BLifeAftonOaks/status/721138578038853638"
"721138577854373888 ","2016-04-16","00:50","Bishop St.Clair","Politco1906","ΑΦΑ MADE. JCSU/Howard University Alum. Advocate For Black Youth. Educator Community Activist.  ✊","Artwork created by Ms. Lauryn Hill before her show! Blessed to be… https://t.co/95smssXhue",,,"40.65","-73.95","US","Brooklyn, NY","http://pbs.twimg.com/profile_images/683870121249603585/4lGtpHJy_normal.jpg","1460","1284","14","en","http://www.twitter.com/Politco1906/status/721138577854373888"
"721138577665445888 ","2016-04-16","00:50","Point5 music","Point5music","Minister of the Gospel! Christian Recording Artist. Public Speaker. Communications Expert.","Cardiooooooooo! #goinghigher higherfitness #goals #fitlife #bestat30… https://t.co/FsUcZAvb4z",,,"38.53349","-89.86425","US","Scott Air Force Base, IL","http://pbs.twimg.com/profile_images/667675649717334017/ofoY2jr1_normal.jpg","1411","712","29","en","http://www.twitter.com/Point5music/status/721138577665445888"
"721138576965165057 ","2016-04-16","00:50","Afton Oaks, TX News","BLifeAftonOaks","Afton Oaks BubbleLife features community news, photos and events. Share your business, organization or personal news and events at https://t.co/Y1CY57ZECo.","A$AP Bari &amp; A$AP Rocky Launch VLONE x Off-White Collaboration https://t.co/RmeoHy1331",,,"29.74629974","-95.44750214","US","Houston, TX","http://pbs.twimg.com/profile_images/527544023385255936/BoP0u5Ri_normal.jpeg","150","158","2","en","http://www.twitter.com/BLifeAftonOaks/status/721138576965165057"
"721138576935616512 ","2016-04-16","00:50","Diana Lee","dianaelee","Disabled lawyer, wife & mom living w/ Chronic Migraine. Believe in critical thought, equality, kindness. Love books, sports, knitting.","My sweet girl is still struggling with teething, so I put her right up in our new lennylamb… https://t.co/keYbl8l0nK",,,"38.9599","-95.25320000000001","US","Kansas, USA","http://pbs.twimg.com/profile_images/644935332048203776/3gnpGSbq_normal.jpg","3168","3003","228","en","http://www.twitter.com/dianaelee/status/721138576935616512"
"721138575954341888 ","2016-04-16","00:50","Acres Homes, TX News","BLifeAcresHomes","Acres Homes BubbleLife features community news, photos and events. Share your business, organization or personal news and events at https://t.co/KK0MGMb3mA.","Another Colorway Of The Nike Air More Uptempo Is Hitting Shelves https://t.co/lCnCcqabBt",,,"29.88139915","-95.45439911","US","Houston, TX","http://pbs.twimg.com/profile_images/527480917527236608/csR1ymhV_normal.jpeg","149","149","1","en","http://www.twitter.com/BLifeAcresHomes/status/721138575954341888"
"721138574729486336 ","2016-04-16","00:50","Efrain Conde","EfrainPanda","me dedico al cine, el mejor de mis adjetivos sin duda alguna es ser, Yucateco! jajaj BOMBA!!","Con él Mucuyito a ver a los venados de Yucatán. @ Estadio Carlos Iturralde https://t.co/gwjbmKYqz8",,,"20.94583333","-89.59361111","MX","Mérida, Yucatán","http://pbs.twimg.com/profile_images/638754175141044224/9oBO1aOh_normal.jpg","742","2217","12","es","http://www.twitter.com/EfrainPanda/status/721138574729486336"
"721138574570188800 ","2016-04-16","00:50","Acres Homes, TX News","BLifeAcresHomes","Acres Homes BubbleLife features community news, photos and events. Share your business, organization or personal news and events at https://t.co/KK0MGMb3mA.","A$AP Bari &amp; A$AP Rocky Launch VLONE x Off-White Collaboration https://t.co/JbzX2I5BfY",,,"29.88139915","-95.45439911","US","Houston, TX","http://pbs.twimg.com/profile_images/527480917527236608/csR1ymhV_normal.jpeg","149","149","1","en","http://www.twitter.com/BLifeAcresHomes/status/721138574570188800"
"721138574188535808 ","2016-04-16","00:50","Mike Koff","Mike_Photograph","Photographer for the altamont enterpise but also do other photographs as well. instagram: mikey518, snapchat: mike51833","I'm at Bethlehem, NY in Bethlehem, NY https://t.co/Ia0K8QXP4m",,,"42.61925382","-73.8405825","US","Delmar, NY","http://pbs.twimg.com/profile_images/378800000609356840/7dd12b72d28111a14f5569f2648a4495_normal.jpeg","152","245","3","en","http://www.twitter.com/Mike_Photograph/status/721138574188535808"
"721138573747965952 ","2016-04-16","00:50","Meara","Born_Thirsty","drinks well with others                                     PVD/BOS wine-o","🌅 @ Lake George, New York https://t.co/N8rIxwWpIf",,,"43.42511757","-73.7126567","US","Lake George, NY","http://pbs.twimg.com/profile_images/672253898858590209/PQ_XJN0K_normal.jpg","60","98","6","en","http://www.twitter.com/Born_Thirsty/status/721138573747965952"
"721138573186043904 ","2016-04-16","00:50","Gabriel Hayes","glmh101","#WhySoCurious #WolvesNotFar","#Tribeca Film Festival #tff #tff2016 (@ Regal Cinemas Battery Park 11 - @regalmovies for The Devil and the Deep...) https://t.co/q7fG9yxet6",,,"40.71461229","-74.01515282","US","Manhattan, NY","http://pbs.twimg.com/profile_images/2857903235/5239eb3bfae482c84481b58af3d2af5a_normal.jpeg","264","1542","14","en","http://www.twitter.com/glmh101/status/721138573186043904"
"721138573047504897 ","2016-04-16","00:50","Nevada City Weather","NevadaCountyWX","Nevada County Weather. Home of the only 24/7 Live weather station with twitter updates. Plan your day. Follow my weather discussion: http://t.co/mdsOJfCe3d","Wind 3.0 mph N. Barometer 30.112 in, Steady. Temperature 63.0 °F. Rain today 0.01 in. Humidity 23%",,,"39.24222222","-121.05444444","US","Grass Valley, CA","http://pbs.twimg.com/profile_images/1765139375/nevadacityfull_normal.jpg","204","59","9","en","http://www.twitter.com/NevadaCountyWX/status/721138573047504897"
"721138572716294144 ","2016-04-16","00:50","Joshua Gibson","919jsgibson","It is what it is and will be what it will be...yep yep","Drinking a Citradelic IPA by @newbelgium @ The Badge Barn — https://t.co/kAmjVS7ah5 #photo",,,"35.9239","-78.5728","US","Raleigh, NC","http://pbs.twimg.com/profile_images/643937402269122560/Iu8Ip4FQ_normal.jpg","58","459","2","en","http://www.twitter.com/919jsgibson/status/721138572716294144"
"721138572493852673 ","2016-04-16","00:50","TMJ-LAS HRTA Jobs","tmj_las_hrta","Follow this account for geo-targeted Hospitality/Restaurant/Tourism job tweets in Las Vegas, NV. Need help? Tweet us at @CareerArc!","Starbucks #Hospitality #Job: Barista (US) (2120 N. RAMPART, #LASVEGAS, NV) https://t.co/NHavVfiWO9 #Veterans #Jobs #Hiring #CareerArc",,,"36.198736","-115.2828319","US","Las Vegas, NV","http://pbs.twimg.com/profile_images/667624789436006401/BgXrgWvV_normal.jpg","444","291","50","es","http://www.twitter.com/tmj_las_hrta/status/721138572493852673"
"721138571617431553 ","2016-04-16","00:50","United Rentals Jobs","URcareers","The official Twitter account for jobs at United Rentals, Inc. Come Build Your Career With Us!","We're #hiring! Read about our latest #job opening here: Credit Service Rep - https://t.co/dlgy35dwUJ #Charlotte, NC #Accounting #Veterans",,,"35.339215","-80.83690199999999","US","Charlotte, NC","http://pbs.twimg.com/profile_images/476046602071588864/OMoFrl1W_normal.jpeg","424","214","341","en","http://www.twitter.com/URcareers/status/721138571617431553"
"721138571273326592 ","2016-04-16","00:50","Cameron Craig Group","cameroncraig","#Hiring for thousands of #jobs across the #USA in #Engineering #Manufacturing #IT #HealthCare #Science #Sales and everything in between. Find a #newjob today!","See our latest #Cambridge, MA #job and click to apply: Full Stack Java Engineer - https://t.co/1tF1thyI7s #Engineering #Hiring",,,"42.3736158","-71.1097335","US","Cambridge, MA","http://pbs.twimg.com/profile_images/624744525060112384/ev75cgyk_normal.png","27328","27550","772","en","http://www.twitter.com/cameroncraig/status/721138571273326592"
"721138570853875712 ","2016-04-16","00:50","CVS Health Jobs","CVSHealthJobs","We're #hiring! Explore a variety of open positions that offer a challenging & rewarding #career. Follow us to uncover #job opportunities at @CVSHealth.","Pharmacy Technician - CVS Health: (#Jamestown, NY) https://t.co/SYccFh6S6H #Healthcare #Job #Jobs #Hiring",,,"42.0970023","-79.23532590000001","US","Jamestown, NY","http://pbs.twimg.com/profile_images/511525698507268097/ptBo_zo__normal.jpeg","626","3","782","en","http://www.twitter.com/CVSHealthJobs/status/721138570853875712"
"721138570535116800 ","2016-04-16","00:50","TMJ-LAX Nursing Jobs","tmj_lax_nursing","Follow this account for geo-targeted Healthcare-Nursing job tweets in Los Angeles, CA. Need help? Tweet us at @CareerArc!","Want to work in #LosAngeles, CA? View our latest opening: https://t.co/IMJI2D4Kdf #Nursing #Job #Jobs #Hiring #CareerArc",,,"34.049321","-118.217463","US","Los Angeles, CA","http://pbs.twimg.com/profile_images/667045290910728196/MLReqBE0_normal.jpg","499","306","75","en","http://www.twitter.com/tmj_lax_nursing/status/721138570535116800"
"721138570396700672 ","2016-04-16","00:50","PFG Careers","PFGCareers","Set your career in motion with a team that delivers. We are driving the industry forward by bringing great food—and great careers—to the table. Apply today!","Want to work at Performance Food Group? We're #hiring in #Cairo, Georgia! Click for details: https://t.co/EjjKCtt9IK #Transportation #Job",,,"30.8774132","-84.2012897","US","Cairo, GA","http://pbs.twimg.com/profile_images/624601721768054784/_SZeKGD0_normal.png","535","365","274","en","http://www.twitter.com/PFGCareers/status/721138570396700672"
"721138570182946816 ","2016-04-16","00:50","iMatt","Matty_See","Baltimore Born & Raised // Optimistic Opportunist // GlowWashingtonDC. https://t.co/S7MjwiEwKZ","Get Lit w/ Boss Mode ÷÷÷÷÷÷÷÷÷÷÷÷÷÷÷÷÷÷÷÷÷÷÷÷÷÷÷÷ #KnifeParty #UltraMusicFestival #Day3… https://t.co/vp6ZNbaJkR",,,"25.77488547","-80.18636769","US","Miami, FL","http://pbs.twimg.com/profile_images/707810433286205440/4Wqf4WxI_normal.jpg","656","1205","17","en","http://www.twitter.com/Matty_See/status/721138570182946816"
"721138568891121664 ","2016-04-16","00:50","Brittany Hiciano","lovebrittanyoox","God is within her, she will not fall. - Psalms 46:5 #GodsNotDead #RIPRosanneGear https://t.co/Qeik8cflP5","7 months 😊🐥 @ Primark Boston https://t.co/fuGu7C0ioS",,,"42.3553044","-71.0600135","US","Boston, MA","http://pbs.twimg.com/profile_images/713925614311440384/ydq8UtGb_normal.jpg","593","550","6","fr","http://www.twitter.com/lovebrittanyoox/status/721138568891121664"
"721138566110191616 ","2016-04-16","00:50","Kiley Soulier","xkileyxsoulierx","On the road to success; there's a curve called failure, a loop called confusion, speed bumps called friends & red lights called enemies. Suffolk university","I 💜 Boston @ Boston Harbor walk https://t.co/bIv2LpAIRC",,,"42.36030576","-71.05045789","US","Boston, MA","http://pbs.twimg.com/profile_images/661284427620876289/CYIBSuYK_normal.jpg","824","1998","12","en","http://www.twitter.com/xkileyxsoulierx/status/721138566110191616"
"721138564386435073 ","2016-04-16","00:50","Michael Bentivegna","mtbenti","❤ my beautiful girlfriend @iamstephs, #Batman & @DCComics, @Mets @NYRangers @Giants","Dinner time w @iamstephs (at @HootersNj in Wayne, NJ) https://t.co/o9d3XmNYtn",,,"40.88882791","-74.24792290000001","US","Wayne, NJ","http://pbs.twimg.com/profile_images/711417146824327168/GiZDBxqB_normal.jpg","250","1093","14","en","http://www.twitter.com/mtbenti/status/721138564386435073"
"721138564298371072 ","2016-04-16","00:50","Alexus Sa'da♐️™","_LexxKnows","Philippians 4:13✨ Instagram&Musical.ly:alexus_sada✨ Snapchat:xojustsada✨","Gates tonight💋 @ Maverick's https://t.co/SYIn5FvUhv",,,"30.32506018","-81.66021652000001","US","Downtown Jacksonville, FL","http://pbs.twimg.com/profile_images/713138610111782913/0Dp7QfYi_normal.jpg","1574","2045","1","en","http://www.twitter.com/_LexxKnows/status/721138564298371072"
"721138564101181440 ","2016-04-16","00:50","mike","m1k3hf","Yo! Don't take what I say here too seriously, how serious can I be in 140 Characters or less? #Dodgers #LAKings #Packers #Playstation #YourWelcome","I'm at 22nd Street Park in Los Angeles, CA https://t.co/6kc5Yh503P",,,"33.7256049","-118.28307572","US","Los Angeles, CA","http://pbs.twimg.com/profile_images/646171595195617281/1fwHuX3D_normal.jpg","46","172","7","en","http://www.twitter.com/m1k3hf/status/721138564101181440"
"721138563782459392 ","2016-04-16","00:50","Jake Fox","JakeFoxx","Fluffy fox fursuiter, board gamer, B.S. Chemistry - Clemson (2015), listen to EDM. Boyfriend @TannerFawkes","Dinner. So good :3 (at @ssamburger in Atlanta, GA w/ @tannerfawkes) https://t.co/00limXT8tX",,,"33.81201585","-84.42595224999999","US","Atlanta, GA","http://pbs.twimg.com/profile_images/717906963967950848/oyPcj62N_normal.jpg","1777","1749","50","en","http://www.twitter.com/JakeFoxx/status/721138563782459392"
"721138563551727616 ","2016-04-16","00:50","AAron Stowell","AAronStowell","Professional dancer with Fred Astaire Dance Studios","The guys are all ready to dance. #proshow #dwts #letsdothis @ Fred… https://t.co/kkzxnDAOkC",,,"30.4226303","-86.6129074","US","Cinco Bayou, FL","http://pbs.twimg.com/profile_images/711737051775827968/WLRVZ0nq_normal.jpg","241","532","3","en","http://www.twitter.com/AAronStowell/status/721138563551727616"
"721138561316188161 ","2016-04-16","00:50","Bill Swersey","swersey","Digital. Media. Tech, Content, design, innovation, ui/ux, photography, baseball (Mets), skiing, drums, local beer, Russia. NYU ITP. Work: @HIASrefugees Comms","Delish! - Drinking an Amber Ale by @fullsailbrewing at @melsburgerbarny  — https://t.co/mw6Dkv4dTt",,,"40.8045","-73.9663","US","Manhattan, NY","http://pbs.twimg.com/profile_images/1384197839/bswersey_normal.jpg","754","1513","74","en","http://www.twitter.com/swersey/status/721138561316188161"
"721138561303592960 ","2016-04-16","00:50","Mikaela","MikaelaNadeau","WB '16 | MSU '20","Washburn Jews take Madison ✡ @ Temple Beth El https://t.co/d4VFjbKQoq",,,"43.05643","-89.4287499","US","Wisconsin, USA","http://pbs.twimg.com/profile_images/717876996924157952/kiv7ixda_normal.jpg","387","251","5","en","http://www.twitter.com/MikaelaNadeau/status/721138561303592960"
"721138559596376064 ","2016-04-16","00:50","Lauren Schell","thepalestblue",,"First #sunset of the season. #openingday #boatlife @ GRAND BANKS https://t.co/lMuMPb24w1",,,"40.72023","-74.00424","US","Manhattan, NY","http://pbs.twimg.com/profile_images/1891001065/image_normal.jpg","98","44","2","en","http://www.twitter.com/thepalestblue/status/721138559596376064"
"721138559189524480 ","2016-04-16","00:50","Carlos Loría","Stylelab11","Graphic designer, fashion lover, creative director, mad hattered, yogui, runner, crossfiter and animal lover, I live in my own wonderland and i love it! :p","#crispybeefdumpling #let'sbeginthe#night 😚 #jfwculinary #rivieramaya #playadelcarmen… https://t.co/tX9y7NseB5",,,"20.78651825","-86.93758261000001","MX","Solidaridad, Quintana Roo","http://pbs.twimg.com/profile_images/710714505647497216/8e7aWvl8_normal.jpg","231","809","63","en","http://www.twitter.com/Stylelab11/status/721138559189524480"
"721138559101624320 ","2016-04-16","00:50","Callie Householder","calliewyne","Photo & Video Producer, Casting & Art Producer. Atlanta APA Director. Starring role as a wife & Carina's mom. Located in Atlanta but have passport will travel!","Last Super before this Atlanta gem is gone forever. Love brother Ted… https://t.co/aGa9tMshcQ",,,"33.8102112","-84.35772710000001","US","Atlanta, GA","http://pbs.twimg.com/profile_images/435783168554061824/7EfPOcnQ_normal.jpeg","408","267","12","en","http://www.twitter.com/calliewyne/status/721138559101624320"
"721138558346649604 ","2016-04-16","00:50","Big Brandon","thephatboi74","Just a big family man who does bjj. #veganlifestyle","Mind....blown!!! @ Dallas, Texas https://t.co/wyPKVtKYvQ",,,"32.7833","-96.8","US","Dallas, TX","http://pbs.twimg.com/profile_images/696834609514844160/BFFMoRWw_normal.jpg","532","1692","16","en","http://www.twitter.com/thephatboi74/status/721138558346649604"
"721138557721657344 ","2016-04-16","00:50","Kyle Vincent Thomas","kylevthomas","Contemporary realist painter. Husband, Father. All purchases and commissions are directly with me. Contact me through my website.","Mists of Elysium and Toward the Island of the Blessed. Both are 30x24, oil on canvas. These… https://t.co/0rPnDUCAkI",,,"33.3033","-111.841","US","Chandler, AZ","http://pbs.twimg.com/profile_images/667866138475278336/uPgXtlvn_normal.jpg","917","1132","72","en","http://www.twitter.com/kylevthomas/status/721138557721657344"
"721138557121789952 ","2016-04-16","00:50","Alvin Stafford","Alvinstafford","One of God's favorites! No for real!","Enough Said! #wearehere #LocaL #liveonce #hoodrules #watts @ Local, Watts CA https://t.co/VrlQH6yrjY",,,"33.94288","-118.23778","US","Los Angeles, CA","http://pbs.twimg.com/profile_images/482893133999390721/aK6TUHVg_normal.jpeg","475","1013","5","en","http://www.twitter.com/Alvinstafford/status/721138557121789952"
"721138555628699648 ","2016-04-16","00:50","alice jurist","alicejurist",,"#fridaynight @ The Bernards Inn https://t.co/RqJpC7RX3X",,,"40.71774888","-74.57057888999999","US","Bernardsville, NJ","http://pbs.twimg.com/profile_images/1717665553/image_normal.jpg","66","217",,"en","http://www.twitter.com/alicejurist/status/721138555628699648"
"721138554995257345 ","2016-04-16","00:50","Dj Fever","DJFEVERNYC","INSTAGRAM @DJFEVERNYC For Bookings CONTACT BookDjFever@Gmail.com","#jordanbrandclassic 😎 @ Jordan Brand Classic https://t.co/60t4YaJEKI",,,"40.68304725","-73.97584841","US","Brooklyn, NY","http://pbs.twimg.com/profile_images/642871841632223232/ud6BHtMi_normal.jpg","1214","1603","36","en","http://www.twitter.com/DJFEVERNYC/status/721138554995257345"
"721138554622119936 ","2016-04-16","00:50","TheOathNY","theoathny","Craft beer sanctuary on Main Street in Tarrytown. 20 draft lines and 100 bottles. All craft all the time.","Knee Deep Lupulin River now available on tap. https://t.co/DnRW5at7TS @KneeDeepBrewing #craftbeersanctuary #BeerMenus",,,"41.0765438","-73.8585824","US","Tarrytown, NY","http://pbs.twimg.com/profile_images/551172912225337344/JTtTE5ZQ_normal.jpeg","448","955","10","en","http://www.twitter.com/theoathny/status/721138554622119936"
"721138554534031361 ","2016-04-16","00:50","Kenny","KennyWitTheKoke","Excuse the Rant | #EnginEars | #KennythingCanHappen | Mix x Master $25 Per Song | excusetherant@gmail.com","After this tape drop Imma act like I don’t know nobody",,,"30.4186967","-91.18232713","US","Baton Rouge, LA","http://pbs.twimg.com/profile_images/720774346910920705/HLRm7uxJ_normal.jpg","796","394","14","en","http://www.twitter.com/KennyWitTheKoke/status/721138554534031361"
"721138553854562304 ","2016-04-16","00:50","Toni","disneytoni","RHS Class of '84, RCC Class of '86, UCR Class of '88, CSUSB Class of '95, English Teacher for JUSD since 1990. Proud owner of Taffy the Rockstar Dog.","I'm at @PhillysBest in Mira Loma, CA https://t.co/dikPIy3b9G",,,"33.97453646","-117.54419304","US","Jurupa Valley, CA","http://pbs.twimg.com/profile_images/472533784143749120/8klzPbp0_normal.jpeg","138","338","7","en","http://www.twitter.com/disneytoni/status/721138553854562304"
"721138552038248448 ","2016-04-16","00:50","D-Eazy","damnitdez","I'm tryna be cool but I might just go ape shit TrackNation || ig/snap: dezzzzi || RIP CB || TØP","yo it's outdoor season so here's a mediocre boomerang vid of the… https://t.co/iy0JRCUbrU",,,"42.62259","-87.82155","US","Kenosha, WI","http://pbs.twimg.com/profile_images/712363824473464833/u64k4kd1_normal.jpg","381","266","8","en","http://www.twitter.com/damnitdez/status/721138552038248448"
"721138551711248384 ","2016-04-16","00:50","JameSasHass","jnslovebeer","Exploring craft beer daily","The abv's and ibu's are as follows. 6.6ABV &amp; 60 IBU Just to clarify. De... (Jasmine Green Tea IPA) https://t.co/czi5wj049a",,,"46.8398","-114.033","US","Missoula, MT","http://pbs.twimg.com/profile_images/1105521365/IMG00017-20100430-1500_normal.jpg","69","391","4","en","http://www.twitter.com/jnslovebeer/status/721138551711248384"
"721138551346327553 ","2016-04-16","00:50","Paige Worthy","paigeworthy","Cheeky as hell. Lover + fighter. Full-time freelance writing. Cooking and looking for my calling.","Happy weekend, Lincoln Square! @ Lincoln Square Neighborhood https://t.co/AVo3Qpcu1y",,,"41.96467","-87.68595000000001","US","Chicago, IL","http://pbs.twimg.com/profile_images/707302330014695424/yxbvAakk_normal.jpg","5872","972","481","en","http://www.twitter.com/paigeworthy/status/721138551346327553"
"721138550889193472 ","2016-04-16","00:50","Chris Slaughter","ChrisMSlaughter",,"Walked all around Savannah, GA and all I got was this photo @ Historic Downtown - Savannah,GA https://t.co/Q9K9my1JbN",,,"32.07998125","-81.09510924999999","US","Savannah, GA","http://pbs.twimg.com/profile_images/1932130743/DJSlawSlaw_normal.jpg","115","97","1","en","http://www.twitter.com/ChrisMSlaughter/status/721138550889193472"
"721138550482206720 ","2016-04-16","00:50","Edgar Quintanilla M.","edgquin","CUENTA PERSONAL: Las opiniones aquí expresadas son de exclusiva responsabilidad del autor y no reflejan ni representan postura de nadie más. ¡Contenido variado!","#CDMX #Xochimilco #Trajineras #Conociendo @ Delegacion Xochimilco https://t.co/3Qjisx0EKl",,,"19.25727818","-99.10906692","MX","Xochimilco, Distrito Federal","http://pbs.twimg.com/profile_images/709259149452836865/SVnY8KsR_normal.jpg","838","2217","67","es","http://www.twitter.com/edgquin/status/721138550482206720"
"721138549475528706 ","2016-04-16","00:50","Jeff","oilologist",,"Martini @ Jesse's Steaks &amp; Seafood Hoover, AL https://t.co/GYT6MbHRPs",,,"33.374138","-86.814026","US","Hoover, AL","http://pbs.twimg.com/profile_images/3392407860/a2376acec42448139d1f3ad62faf468a_normal.jpeg","209","241","12","en","http://www.twitter.com/oilologist/status/721138549475528706"
"721138548439707648 ","2016-04-16","00:50","Michael-Ángel León","Perico429","Just Me!!! If your curiosity gets the best of you, just ask.","#Recolor #Colorfly #Coloring #PrismaJoy #ColorMe #Colorfy #Colorgram  #ColourTherapy… https://t.co/noqR5I5Gvk",,,"32.8348","-83.65170000000001","US","Macon, GA","http://pbs.twimg.com/profile_images/3143242944/0ef9682cd3cce5e53fa17e44421a247b_normal.jpeg","1556","2150","74","es","http://www.twitter.com/Perico429/status/721138548439707648"
"721138547542134786 ","2016-04-16","00:50","kennedy","Kennedy_Alyse","write me with Your Glory Jesus","sent my beautiful bff off to prom tonight 💋 @ Greenville, South Carolina https://t.co/BAhUsqTt7M",,,"34.8443","-82.3854","US","Greenville, SC","http://pbs.twimg.com/profile_images/719346235396763648/UcnLiGw4_normal.jpg","673","847","1","en","http://www.twitter.com/Kennedy_Alyse/status/721138547542134786"
"721138547282034688 ","2016-04-16","00:50","goeyyy!","goeyyyy","MarketingDigital+EnjoyTheSilence+Beetlejuice+AlternativoYMás","Precopeo (@ Downtown México - @downtownmexico in Cuauhtemoc, DF) https://t.co/00i041yZq4",,,"19.43289721","-99.13621381999999","MX","Cuauhtémoc, Distrito Federal","http://pbs.twimg.com/profile_images/717239121110892544/qUQX9i-u_normal.jpg","1723","2052","11","es","http://www.twitter.com/goeyyyy/status/721138547282034688"
"721138546443206656 ","2016-04-16","00:50","nyc real estate bot","realNYCbot","People spending money on real estate in the greatest city on earth / bot by @fitnr","February 16, 2016: 4066 Lowerre Place, Williamsbridge, the Bronx – $410,000 – 2 units – 1,596 sf – two family home – two family brick",,,"40.89048","-73.86015999999999","US","Bronx, NY","http://pbs.twimg.com/profile_images/673272521228083201/IGvlDbxE_normal.jpg","51","2","13","en","http://www.twitter.com/realNYCbot/status/721138546443206656"
