"721152915675693056 ","2016-04-16","01:47","Mariana la niña.","Mariana96p","Bla bla bla.","😍😍😍🤘🏻 (@ Puerto de Veracruz in Veracruz, VER, Veracruz) https://t.co/9L9yUfOj14",,,"19.19625789","-96.13573488999999","MX","Veracruz, Veracruz de Ignacio de la Llave","http://pbs.twimg.com/profile_images/679011336517357568/Ika6IdR5_normal.jpg","16502","732","115","es","http://www.twitter.com/Mariana96p/status/721152915675693056"
"721152914278854656 ","2016-04-16","01:47","Mabel Medina","mayeyelove",,"Just posted a photo @ International Vision Expo (Official Page) https://t.co/8vUm6sfpiT",,,"40.75759123","-74.00116131","US","Manhattan, NY","http://pbs.twimg.com/profile_images/496396763683897345/mK9PkU1R_normal.jpeg","66","282","2","en","http://www.twitter.com/mayeyelove/status/721152914278854656"
"721152913960210433 ","2016-04-16","01:47","Destiny Corkle","LoveD2b",,"Just a few from today #smashcake #photo #photoshoot #minniemouse @ Starship Corkle https://t.co/GLEGroo2gQ",,,"37.00816846","-94.61739579","US","Missouri, USA","http://pbs.twimg.com/profile_images/716436882775629824/kkPpMycU_normal.jpg","31","60","4","en","http://www.twitter.com/LoveD2b/status/721152913960210433"
"721152913486307331 ","2016-04-16","01:47","Dawn Sullivan","dsully0829","Love sports (as a couch cheerleader), cooking, camping, shopping. Pats, Red Sox, Celtics, Bruins fan!! Made my goal, lost 62 lbs on Weight Watchers!","I'm at Normandy Farms Campground in Foxboro, MA https://t.co/9SQAdotlN4",,,"42.03918353","-71.28395535","US","Foxborough, MA","http://pbs.twimg.com/profile_images/564143848352673793/P-nYnVhW_normal.jpeg","113","389","7","en","http://www.twitter.com/dsully0829/status/721152913486307331"
"721152913167544320 ","2016-04-16","01:47","PeaTimexo™","peatimexo","Bahamian. 22. Ask what you wanna know..","Seeing as how I didn't take any pichas today... #fbf (p.s. I wear slippers everywhere) 😊😀 @… https://t.co/iqpSw5jJwK",,,"33.52238","-86.81010000000001","US","Birmingham, AL","http://pbs.twimg.com/profile_images/696812870143705088/5LlVcmeo_normal.jpg","438","264","7","en","http://www.twitter.com/peatimexo/status/721152913167544320"
"721152913167540224 ","2016-04-16","01:47","Amanda E. McCarty","amandasnoop",,"Girls night!!!! #winslows #girlsnightout #myladies @ Winslow's Tavern https://t.co/RVfqnkJepV",,,"35.61140148","-77.3737916","US","North Carolina, USA","http://pbs.twimg.com/profile_images/1786430832/image_normal.jpg","78","313","5","en","http://www.twitter.com/amandasnoop/status/721152913167540224"
"721152909908414464 ","2016-04-16","01:47","DJ","VHokieJD",,"Tonight's moon is 68% Waxing Gibbous. Next full moon will be in 5 days. STAY TUNED :) 👍🏼🌑🌔 #moon… https://t.co/3AhUy6WA5V",,,"37.38192529","-77.46265952","US","Virginia, USA","http://pbs.twimg.com/profile_images/612416550822379520/tbzwVSVo_normal.jpg","224","633","26","en","http://www.twitter.com/VHokieJD/status/721152909908414464"
"721152909782724608 ","2016-04-16","01:47","Mariella","MariellaPaulino","NYU + GTown alumn. Techie. Adrenaline junkie. NYer. Lover of woc in tech + good design + open source. Opinions are my own.","Me: Let's pretend it's my birthday so we get free cake?!? @brandontluong: No babe, I'm… https://t.co/biDI4qR1UB",,,"38.89517922","-77.02713625","US","Washington, DC","http://pbs.twimg.com/profile_images/718481211904167936/PjNlZBWG_normal.jpg","384","463","33","en","http://www.twitter.com/MariellaPaulino/status/721152909782724608"
"721152908025335809 ","2016-04-16","01:47","meg❁","meagan_smithie","CLE | dancer | BHS 17' | snapchat: meagan_smithie","Can you tell we're cousins?💛 @ Newburgh, Indiana https://t.co/eBA1WZ5clk",,,"37.9444","-87.4053","US","Newburgh, IN","http://pbs.twimg.com/profile_images/716132814798917632/lqbhvYlB_normal.jpg","175","164","1","en","http://www.twitter.com/meagan_smithie/status/721152908025335809"
"721152907647787008 ","2016-04-16","01:47","El Taller Latino","ElTallerLatino","El Taller Latino Americano is a non-profit arts and education institution founded in NYC in 1979 to bridge the gap between Latin and North Americans.","Antenna performing at El Taller #SpringSounds #GrowingUnderGround #BeautyEverywhere… https://t.co/KX2Rei9XdO",,,"40.7870445","-73.9473953","US","Manhattan, NY","http://pbs.twimg.com/profile_images/462639359716384768/aym87-FV_normal.jpeg","524","515","18","es","http://www.twitter.com/ElTallerLatino/status/721152907647787008"
"721152907211620352 ","2016-04-16","01:47","Val Romero","TaigaVal","Nadie en esta vida es indispensable , solo el amor a los demas y a uno mismo .~= Las coincidencias no existen,solo lo inevitable ♥ ♥ ♥","I'm at @Quetacoatl_Bar Coyoacán in México, DF https://t.co/HOc6qFvEdx",,,"19.34747358","-99.1629678","MX","Coyoacán, Distrito Federal","http://pbs.twimg.com/profile_images/628335316030525440/VXnv2Hld_normal.jpg","271","643","7","es","http://www.twitter.com/TaigaVal/status/721152907211620352"
"721152906670383104 ","2016-04-16","01:47","Tai Bixby Associates","soldonsantafe","Tai Bixby & Associates works with buyers & sellers of homes in Santa Fe, NM providing great service and valuable insight into the Santa Fe real estate market.","See a video tour of my #listing 201 Los Pinos #SantaFe #NM https://t.co/MsZfqqOEtS #realestate https://t.co/UHH9h9Hnun",,,"35.58956528","-106.0969162","US","La Cienega, NM","http://pbs.twimg.com/profile_images/2347422226/9zkhy8smnyc93hj7q5jp_normal.jpeg","86","71","33","en","http://www.twitter.com/soldonsantafe/status/721152906670383104"
"721152906498473985 ","2016-04-16","01:47","Winn-Dixie Careers","WDCareers","Join our WINN-ing team and help make the lives of our customers and fellow associates FUN! Winn-Dixie is one of the nation's largest food retailers.","This #Retail #job might be a great fit for you: Center Store Lead - https://t.co/mpZNFlBCrW #GULFPORT, MS #Hiring",,,"30.450777","-89.098046","US","Gulfport, MS","http://pbs.twimg.com/profile_images/636616310403653633/sIs1Iqbk_normal.png","527","252","334","en","http://www.twitter.com/WDCareers/status/721152906498473985"
"721152906435633152 ","2016-04-16","01:47","Kelli Ann","Kelli_Ann8","Born and raised 5280!","CJ Anderson! @mammothlax broncos cjandersonrb9 #coloradolove… https://t.co/oDDpsHr57u",,,"39.74872484","-105.00750177","US","Denver, CO","http://pbs.twimg.com/profile_images/713922479908118529/tnsn3D7d_normal.jpg","43","97",,"es","http://www.twitter.com/Kelli_Ann8/status/721152906435633152"
"721152905915600900 ","2016-04-16","01:47","jonrivera420","jonrivera420","I never liked any of my old bosses, so I became my own","🌅🌊 @ Dockwiler Beach https://t.co/BBLEUECzQs",,,"33.93284133","-118.437344","US","Los Angeles, CA","http://pbs.twimg.com/profile_images/598274311091200002/uvBpOtBM_normal.jpg","442","874","16","en","http://www.twitter.com/jonrivera420/status/721152905915600900"
"721152905701515264 ","2016-04-16","01:47","Chico's Careers","ChicosCareers","Chico’s: Fabulous looks. Conversation-starting jewelry. The most amazing service. For 30 years, we’ve helped millions of women look as great as they feel.","If you're a #Retail professional in #Tampa, FL, check out this #job: https://t.co/eJpjWOTVeP #Hiring",,,"28.0660231","-82.5714961","US","Citrus Park, FL","http://pbs.twimg.com/profile_images/509366095065522176/efVHHzwq_normal.jpeg","168",,"330","en","http://www.twitter.com/ChicosCareers/status/721152905701515264"
"721152905563254784 ","2016-04-16","01:47","Manny Prieto, RDN","bigredmannyp","Registered Dietitian/Exercise Specialist in NY. Cornell alum. Exercise and nutrition consultant to athletes, Fortune 500 company employees, & CV patients.","Had a lot of fun at @southbrooklynwc stop of the @denovonutrition #liftandchill tour - and of… https://t.co/PusWWGtGPZ",,,"40.67986","-73.9834","US","Brooklyn, NY","http://pbs.twimg.com/profile_images/600306605645770752/TwP-fHXN_normal.jpg","761","778","40","en","http://www.twitter.com/bigredmannyp/status/721152905563254784"
"721152904661377024 ","2016-04-16","01:47","Yosemite NP News","yosemitenews","Yosemite, the Sierra, National Parks, hiking, sightseeing, talk","Tioga Road plowing https://t.co/Iu41EFgyFR",,,"37.74459265","-119.59470825","US","California, USA","http://pbs.twimg.com/profile_images/191547072/vernel_normal.jpg","6006","5860","269","en","http://www.twitter.com/yosemitenews/status/721152904661377024"
"721152904464191488 ","2016-04-16","01:47","BH Media Jobs","BHMediaJobs",,"Want to work in #Roanoke, VA? View our latest opening: https://t.co/AdPdyP8RHy #Accounting #nowhiring #Job #Jobs #Hiring",,,"37.2709704","-79.9414266","US","Roanoke, VA","http://pbs.twimg.com/profile_images/494153984064503809/yQV1nCWb_normal.jpeg","282",,"393","en","http://www.twitter.com/BHMediaJobs/status/721152904464191488"
"721152904145596420 ","2016-04-16","01:47","Jared Scott Gregory","JaredSGregory","Christ Follower||Lee University Flames||Levite Custom Cymbals/@ajpdrums Artist||TKΩ Tap 31||EΛΦ Tap 55||","Playing at Extreme Beach with my boys @colearlen vickwill93 @captain_b_o_p @trev_twentysev… https://t.co/WSzQwUkSDn",,,"35.1657374","-84.86986098","US","Cleveland, TN","http://pbs.twimg.com/profile_images/640759955390361600/Ij0GGqGO_normal.jpg","271","62",,"en","http://www.twitter.com/JaredSGregory/status/721152904145596420"
"721152902811660290 ","2016-04-16","01:47","Vitamin Shoppe Jobs","VSIcareers","At #VitaminShoppe we are lovers of fitness, health, vitamins, helping you on your wellness journey and motivating others. Apply to our #jobs below.","Store Manager - The Vitamin Shoppe: (#TomsRiver, NJ) https://t.co/ocjlVaA3Pf #Retail #Job #Jobs #Hiring",,,"39.9817037","-74.1831528","US","Toms River, NJ","http://pbs.twimg.com/profile_images/497122335518769153/S7vPUx1I_normal.png","602","96","610","en","http://www.twitter.com/VSIcareers/status/721152902811660290"
"721152902799220736 ","2016-04-16","01:47","Alberto Zamora Luna","BetoZamoraLuna","Informático, Juan de Dios Batiz, UPIICSA, INFOTEC, Secretaría de Economía","Evento de Calidad de Praxis (@ Sheraton Mexico City Maria Isabel in Mexico City, DF) https://t.co/EraXcy5BvQ",,,"19.42778441","-99.16708231","MX","Cuauhtémoc, Distrito Federal","http://pbs.twimg.com/profile_images/1133213846/Beto_normal.jpg","31","60","1","es","http://www.twitter.com/BetoZamoraLuna/status/721152902799220736"
"721152902685974528 ","2016-04-16","01:47","✨Regina George✨","th3_st0rm","I have 2 Fendi purses and a silver Lexus. My hair is insured for $10K. I do car commercials - in Japan. I met John Stamos on a plane - he told me I was pretty.","I'm at @EmpirePolo Club for Do LaB Stage at Coachella 2016 in Indio, CA https://t.co/vcV0WKN0WB",,,"33.67924696","-116.23732567","US","California, USA","http://pbs.twimg.com/profile_images/707244357741518848/CH3QbO6o_normal.jpg","1014","782","39","en","http://www.twitter.com/th3_st0rm/status/721152902685974528"
"721152902237155329 ","2016-04-16","01:47","Al Reed","tikial1","Beach Lover, Runner, Workout Nut, SF 49ers/SF Giants Fan and love my sons!","I'm at @PizzaMyHeart in Saratoga, CA https://t.co/QD22IrKtAd",,,"37.28883395","-121.98982716","US","San Jose, CA","http://pbs.twimg.com/profile_images/3075787846/5d9014a17b5a15689b3a86b51a7aeaf1_normal.jpeg","36","182","8","en","http://www.twitter.com/tikial1/status/721152902237155329"
"721152901981163520 ","2016-04-16","01:47","WHBM Careers","WHBMCareers","WH|BM offers fashionable and sophisticated clothing and accessory items. Our passion has always been to make women feel beautiful. That’s what we’re about.","#Retail #Job in #Bakersfield, CA: Support Associate at WHBM https://t.co/kDs7Nla8Dy #Jobs #Hiring",,,"35.3413681","-119.103607","US","Bakersfield, CA","http://pbs.twimg.com/profile_images/510069752887119874/AG-7s4eI_normal.jpeg","141",,"301","it","http://www.twitter.com/WHBMCareers/status/721152901981163520"
"721152901234704385 ","2016-04-16","01:47","Cindy Callahan","beadlady3","Beading, Reading, Craft Beer, CBJ hockey, No1Momma, Fun Gal!","Bar fly (@ Sharito in Springboro, OH w/ @charles_murguia) https://t.co/g96Gt7rNWR",,,"39.56385877","-84.23052181","US","Springboro, OH","http://pbs.twimg.com/profile_images/551549082742059008/wjvB_aD-_normal.jpeg","143","190","14","en","http://www.twitter.com/beadlady3/status/721152901234704385"
"721152900936773632 ","2016-04-16","01:47","Ms. BOOTZ","_knockndaBOOTZ_","darĸ нorѕe ❤️ #HOTTYTODDY © #daSip","Omega Psi Phi Chapter Party💜🐶💛 #Bootzxie #hsv @ Huntsville, Alabama https://t.co/TaJgdQb7bU",,,"34.7123","-86.5963","US","Huntsville, AL","http://pbs.twimg.com/profile_images/717622704992550913/7aCXnoGC_normal.jpg","631","373","2","es","http://www.twitter.com/_knockndaBOOTZ_/status/721152900936773632"
"721152896641998850 ","2016-04-16","01:47","David Benedy ★彡","davidbenedy","Futuro arquiteto, botafoguense, amante da música e outras artes. Barba porque sim!","Apenas o lugar mais incrível que já vi. #cancún #islamujeres #mexico @ Islas Mujeres Cancun https://t.co/pYSHUCXdo0",,,"21.14734455","-86.7907076","MX","Benito Juárez, Quintana Roo","http://pbs.twimg.com/profile_images/701913713650098177/SK8a3pUm_normal.jpg","210","201","2","pt","http://www.twitter.com/davidbenedy/status/721152896641998850"
"721152896243343360 ","2016-04-16","01:47","Alfredo Cortez","ChefACortez",,"Pan seared #alaskanhalibut pea #puree #pickled #ramps #wildmushrooms and #tuckerranch #turnips… https://t.co/w0i19TWQT0",,,"38.3048","-122.299","US","Napa, CA","http://pbs.twimg.com/profile_images/492814250734133249/Ii2A-sEo_normal.jpeg","27","66",,"en","http://www.twitter.com/ChefACortez/status/721152896243343360"
"721152895891202049 ","2016-04-16","01:47","Ms.PrettyBlack","Nadiyah_35","some times u have to fool the fool who thinks they are fooling u...to blessed to be stressed.... #UNBOTHERED","Bout to get it in @ Quarter View Restaurant https://t.co/CRBV9UrtXZ",,,"29.980179","-90.179175","US","Metairie, LA","http://pbs.twimg.com/profile_images/719142899850571776/0xkv5H_l_normal.jpg","57","100",,"en","http://www.twitter.com/Nadiyah_35/status/721152895891202049"
"721152893743718400 ","2016-04-16","01:47","Don Estrechito","GreenPistachio","Profesor / El chaparrito de tus sueños / diplomaticamente incorrecto / Eclectic music / Comida chatarra & soda / Estrella de David / No cuentas privadas ✡","I'm at @McDonaldsMexico in Benito Juárez, Distrito Federal https://t.co/hoIFs5QpLI https://t.co/WddTQEi79I",,,"19.36022293","-99.17032242000001","MX","Benito Juárez, Distrito Federal","http://pbs.twimg.com/profile_images/718856954823618562/Jju-JdJb_normal.jpg","2699","2453","28","es","http://www.twitter.com/GreenPistachio/status/721152893743718400"
"721152893479292928 ","2016-04-16","01:47","Jeff Schmidt","JeffreyASchmidt","Think BIG, Make BIG Things Happen. Radio gets results. Helping successful people become more successful sooner. #TBMBTH #getbetter #training #radio","Exploring Red Rock Canyon  -#exploringwithcarolyn @ Red Rock Canyons Las Vegas https://t.co/mfD4LQVVpk",,,"36.15215109","-115.43783162","US","Nevada, USA","http://pbs.twimg.com/profile_images/378800000837203102/eb4d60d714dd986db717f2ac2e3ff8ee_normal.jpeg","1052","968","46","en","http://www.twitter.com/JeffreyASchmidt/status/721152893479292928"
"721152893135515650 ","2016-04-16","01:47","OSIRIS_838","OSIRIS_838","Brookyln Ny Creator Innovator                https://t.co/ZIdTAiaS0p","SF - #sanfrancisco #Clouds #VirginAmerica #Art #OldbutNew #photography @ Hilton San Francisco… https://t.co/slsPKHAPXu",,,"37.78590621","-122.41069011","US","San Francisco, CA","http://pbs.twimg.com/profile_images/628076704016269312/KFT0kt0e_normal.jpg","55","66","22","en","http://www.twitter.com/OSIRIS_838/status/721152893135515650"
"721152892460261376 ","2016-04-16","01:47","Mike","mikepophis","Med student. TV producer. World traveler based in NYC.","My tooth at da club #faketooth #blacklight @ G Lounge https://t.co/GGQDGh0k5x",,,"40.7421785","-73.9983658","US","Manhattan, NY","http://pbs.twimg.com/profile_images/378800000849349521/1f7c9c1ff8296a50f3fb08690fb9423f_normal.jpeg","45","32","7","en","http://www.twitter.com/mikepophis/status/721152892460261376"
"721152890274906112 ","2016-04-16","01:47","Cameron Smith","cdsmith13","Just an average New Yorker observing life! instagram: cdsmith13","This guy. #datenight #lincolncenter #nyc #fiance @ Lincoln Center https://t.co/21yTD49eNM",,,"40.77246141","-73.98312556","US","Manhattan, NY","http://pbs.twimg.com/profile_images/2662372151/4290cd1c3cfcf39a0b4cd0defb2f12e7_normal.jpeg","195","134","5","en","http://www.twitter.com/cdsmith13/status/721152890274906112"
"721152889704595456 ","2016-04-16","01:47","J. Raven","JesseRaven","#flashfiction writer, cigar smoker, SoCo drinker, #dissertation procrastinator, #INTJ",".@pennbrewery bar crawl continues - come find me &amp; I'll buy you one! (@ The Abbey on Butler St in Pittsburgh, PA) https://t.co/MwwS6zw7zE",,,"40.473875","-79.95820399999999","US","Pittsburgh, PA","http://pbs.twimg.com/profile_images/640515298899050496/fMCKmtDP_normal.jpg","7687","7767","225","en","http://www.twitter.com/JesseRaven/status/721152889704595456"
"721152887192039424 ","2016-04-16","01:47","Shir.","_ShirleyKrisN_","18 Puerto Morelos cancun books & movies","vamo a comprar boleto para maluma *.*/",,,"20.8550486","-86.89866689999999","MX","Benito Juárez, Quintana Roo","http://pbs.twimg.com/profile_images/717019889018363904/Gn6Dfy2A_normal.jpg","842","110","1","pt","http://www.twitter.com/_ShirleyKrisN_/status/721152887192039424"
"721152883975188480 ","2016-04-16","01:47","Cuse Beer Chick","Cusebeerchick","Upstate NY native. Craft beer. Beach. Road trips. TB Lightning STM. All things Tampa Bay.","Rich coffee with hint of bittersweet chocolate. Very good... (Early Riser Coffee Porter) https://t.co/A41dJzTSZs #photo",,,"26.7137","-80.04989999999999","US","West Palm Beach, FL","http://pbs.twimg.com/profile_images/720042639458840577/3SUhVvl1_normal.jpg","285","271","13","en","http://www.twitter.com/Cusebeerchick/status/721152883975188480"
"721152883278901248 ","2016-04-16","01:47","Amie Gallette","amiegallette","Tweets of a lifelong lover of books! #Foodie #Politics #Liberal #Philosophy #Physics #ScifiFantasy #WineAndCoffee https://t.co/rhp0PF9Bvg","The sounds of ice cream cone induced happiness. @raineymarie @mzmeB #sigh #icecream @ Kilwin's… https://t.co/l6uc7qzrd0","1",,"42.2796898","-83.7483368","US","Ann Arbor, MI","http://pbs.twimg.com/profile_images/676908202710212609/Z2GCsZoR_normal.jpg","1698","1633","49","en","http://www.twitter.com/amiegallette/status/721152883278901248"
"721152882683351040 ","2016-04-16","01:47","Deann McG","SassynSweetDee","Passionate Hamiltonian Living Downtown. Love my City! Ti-Cat Fan. Coffee Obsessed. Loud Laugh. Big Hugger. HPS Victim Services Volunteer.","Dinner &amp; Drinks with Dee &amp; Dee! #frienship #ladiesnight… https://t.co/HtJuNteMfJ",,,"43.25206874","-79.87004512","CA","Hamilton, Ontario","http://pbs.twimg.com/profile_images/671535361206689792/Ql3mq7Tl_normal.jpg","1204","1110","32","en","http://www.twitter.com/SassynSweetDee/status/721152882683351040"
"721152882633019392 ","2016-04-16","01:47","Mr. Meech","iamsnakeeyez","I got my name from gambling with a well known #Philly rapper who shall remain anonymous 'cuz he might take it as a kinda diss...","#FlashbackFriday Gettin' flusty on my birthday circa. Winter '15... @ THE  ROXXY https://t.co/sExbHcXxiD",,,"39.963433","-75.13534199999999","US","Philadelphia, PA","http://pbs.twimg.com/profile_images/344513261580145996/5329718e9d867f83e58ffd0690a7f07b_normal.jpeg","1000","154","28","en","http://www.twitter.com/iamsnakeeyez/status/721152882633019392"
"721152881731182592 ","2016-04-16","01:47","Becca","BeccaTaka","Where's Larry?","Disarm by Smashing Pumpkins",,,"39.8419988","-82.6033867","US","Baltimore, OH","http://pbs.twimg.com/profile_images/713378085236776960/8DHWtep6_normal.jpg","240","264",,"en","http://www.twitter.com/BeccaTaka/status/721152881731182592"
"721153135134138368 ","2016-04-16","01:48","Metro Volleyball","Metrovbtweet","Premeire Junior Volleyball Club - USAV, AAU, JVA","Playing &amp; loving every minute of it!!! ❤️🏐🏆 #2016metrospringcollegecoachesclinic @ Memphis Metro… https://t.co/wZTjejwQy9",,,"35.2057051","-89.8144088","US","Bartlett, TN","http://pbs.twimg.com/profile_images/2483259211/06mmlogo_copy_copy_normal.gif","446","298","1","en","http://www.twitter.com/Metrovbtweet/status/721153135134138368"
"721153888213053440 ","2016-04-16","01:50","Dayana Espinosa","Dayanaespinosa","Venezolana. Basta decir que una sonrisa me cambia el día y las miradas me lo dicen todo","I loved to hear your music. Your show today was amazing @liannelahavas",,,"19.4056203","-99.09519476","MX","Mexico","http://pbs.twimg.com/profile_images/571449088392232960/-dw3IF5n_normal.jpeg","674","526","4","en","http://www.twitter.com/Dayanaespinosa/status/721153888213053440"
"721153885583355904 ","2016-04-16","01:50","Better Beer Bureau","ErieBetterBeer","News, Reviews, and Local Support for the Erie area related to the world of Craft Beer.  Content is for those over 21 years old.","Coconut, marshmallows and roast.  Thanks Mark.  Dave is - Drinking a Dark Age @ Dave's Beer and Bourbon Cellar - https://t.co/B2guwLWArf",,,"42.0678","-80.08839999999999","US","Erie, PA","http://pbs.twimg.com/profile_images/2160248855/BBBnewlogo1transcen_normal.PNG","1337","1894","39","en","http://www.twitter.com/ErieBetterBeer/status/721153885583355904"
"721153885507817472 ","2016-04-16","01:50","TheHeartTheHome","TheHeartTheHome","https://t.co/ENhsvN8OWz is your ONE stop for high quality Mid Century Modern furniture, home decor, & the most extensive collection of FULLY TESTED Polaroids!","This woman right here. 🙌💕can't get enough of her silly sassy ways even if I don't always admit… https://t.co/jOIwA4RkJl",,,"36.07947184","-79.7819088","US","Greensboro, NC","http://pbs.twimg.com/profile_images/378800000143814576/fc53b905de764183b9b2677e2950b914_normal.jpeg","575","626","25","en","http://www.twitter.com/TheHeartTheHome/status/721153885507817472"
"721153884073230336 ","2016-04-16","01:50","Gerardo Villarreal","gvillarreals631",,"@DominioRadio si ojetes si tu debes 2 meses luego luego. Te cortan el servicio",,,"25.7335144","-100.2625298","MX","San Nicolás de los Garza, Nuevo León","http://pbs.twimg.com/profile_images/666654001690050560/yqEE6Gf__normal.jpg","7","15",,"es","http://www.twitter.com/gvillarreals631/status/721153884073230336"
"721153882634760192 ","2016-04-16","01:50","Greg Smith","drsmitty","Husband, father, runner, dentist","My daughter was cold tonight, so this is how she dressed. @ Chesapeake, Virginia https://t.co/WVJWRSMh3w",,,"36.7674","-76.28740000000001","US","Chesapeake, VA","http://pbs.twimg.com/profile_images/618970376832462848/89cH8Lat_normal.jpg","506","320","42","en","http://www.twitter.com/drsmitty/status/721153882634760192"
"721153880076234752 ","2016-04-16","01:50","⚡Sadie Harper™","SayDay_12","fake it till ya make it | snapchat - say_day12 | #CM13","I wish I wasn't allergic to you @ ACARF https://t.co/IHAunRtykZ",,,"37.914998","-95.311042","US","Kansas, USA","http://pbs.twimg.com/profile_images/720790969398878208/XUotIY_o_normal.jpg","1403","999",,"en","http://www.twitter.com/SayDay_12/status/721153880076234752"
"721153879879114753 ","2016-04-16","01:50","Rodrigo Chiman","HeyRoodd","Decirte quien soy es adelantarme a los hechos... pero no temo desilusionarte. Ojos limpios y corazones llenos #FFF","I'm at San Angel in Alvaro Obregon, DF, Distrito Federal w/ @krislecval https://t.co/LxGbI6xP8a",,,"19.34468716","-99.19047576","MX","Álvaro Obregón, Distrito Federal","http://pbs.twimg.com/profile_images/551977097091366912/_I2e4d8E_normal.jpeg","177","198","2","es","http://www.twitter.com/HeyRoodd/status/721153879879114753"
"721153878943604736 ","2016-04-16","01:50","Eva Louis","chronicbehavior","#Fashion #Film #Promoter #Actress #Model  #IT #Consulting #Marketing #Fashionista #Networker #Portal  #Writer #Reporter #PR #IndustryExpert #Queen #Charity","Will you be there Scottsdale Culinary Festival for food, fashion, shop, sip &amp; socialize at one… https://t.co/xkwKikcEDo",,,"33.49228763","-111.92237492","US","Scottsdale, AZ","http://pbs.twimg.com/profile_images/378800000849397362/a578e5297c9ec0914e2c7c534415fdde_normal.jpeg","8738","9476","444","en","http://www.twitter.com/chronicbehavior/status/721153878943604736"
"721153878843133952 ","2016-04-16","01:50","Samantha Higbie","SamHigbie","Exploring a new life in #KCMO. Atlanta is home- #fila. I want to go everywhere.","I'm at Pizza Bella in Kansas City, MO https://t.co/S6VI9dPC4y",,,"39.09144564","-94.58490372","US","Kansas City, MO","http://pbs.twimg.com/profile_images/505199054952087553/5Xnu_AWx_normal.jpeg","866","632","9","es","http://www.twitter.com/SamHigbie/status/721153878843133952"
"721153877828046848 ","2016-04-16","01:50","Thomas","Tommyash27",,"Hey are you guys going to the frat gathering? @ Renaissance Minneapolis Hotel, The Depot https://t.co/ryo55ld4TV",,,"44.9803836","-93.2635528","US","Minneapolis, MN","http://pbs.twimg.com/profile_images/630270256515297280/SACxOQc4_normal.jpg","412","316","2","en","http://www.twitter.com/Tommyash27/status/721153877828046848"
"721153876968284160 ","2016-04-16","01:50","Greg Desrosiers","GDesrosiers93","Reporter/Broadcaster for @WBSM1420. Covering a little bit of everything on the Southcoast. Political junkie/Craft beer enthusiast/Red Sox Nation cardholder.","Best beer in the Lovecraft series yet... (Lovecraft I Am Providence Imperial Red Ale) https://t.co/WlvQTpfhMW #photo",,,"41.6349","-70.9259","US","New Bedford, MA","http://pbs.twimg.com/profile_images/622363167692230657/csQvLIMK_normal.jpg","315","700","7","en","http://www.twitter.com/GDesrosiers93/status/721153876968284160"
