"721129511744643072 ","2016-04-16","00:14","Brittany","BrittanyR_88","Craft beer, Music, Concerts, Photography, Travel, Comedy, Packers & Giants, Bruins, Hiking, Camping, Family & Friends. Untappd & Instagram- bkay1019","Dinner time with the girls! (@ Higashi Japanese Restaurant in South Windsor, CT) https://t.co/m6lqKisPT5",,,"41.82581397","-72.55614102","US","South Windsor, CT","http://pbs.twimg.com/profile_images/601213689597992961/4MegPqd2_normal.jpg","240","397","7","en","http://www.twitter.com/BrittanyR_88/status/721129511744643072"
"721129511694299136 ","2016-04-16","00:14","Emily Coffman","Emi10961949","If you want to know ask:-)","I would love to race with the camels @AmazingRace_CBS #gobrodieandkurt #socool",,,"37.5713395","-87.4806878","US","Kentucky, USA","http://pbs.twimg.com/profile_images/378800000603203250/4849bf1dd56cd3ec1147b8613d552ab7_normal.jpeg","518","1606","3","en","http://www.twitter.com/Emi10961949/status/721129511694299136"
"721129511308435456 ","2016-04-16","00:14","Michael Noble Jr.","MichaelNobleJr","I'm a Junior at Western Kentucky University studying photojournalism.","Relaxing and watching the shadows get longer at Hospital Hill. #sunsetandchill #sunset… https://t.co/4HubeVW81w",,,"36.98952606","-86.43800589","US","Bowling Green, KY","http://pbs.twimg.com/profile_images/613802266009706497/_i08tub2_normal.jpg","217","281","11","en","http://www.twitter.com/MichaelNobleJr/status/721129511308435456"
"721129509416759296 ","2016-04-16","00:14","David Teefy","david_teefy","President of Online Real Estate Technology Systems","I'm at 3T Consulting in GA https://t.co/2bYUup2RpJ",,,"33.92359","-84.787058","US","Georgia, USA","http://pbs.twimg.com/profile_images/565560019844734977/bNu9eqoe_normal.jpeg","68","177","1","en","http://www.twitter.com/david_teefy/status/721129509416759296"
"721129509387247616 ","2016-04-16","00:14","T.E.A.M. MANAGEMENT","TEAMHOLDINGCORP","T.E.A.M. MANAGEMENT CORP. PO BOX 8582 New York NY 10116 teamholdingcorp@gmail.com NYC 646-240-8133","#ArturoAponte #april152016 #cigars #Cigar #april152016 #Wine #vodka #shoot #america #Amen #NYC… https://t.co/aHZEOJWixD",,,"39.998","-75.1448","US","Philadelphia, PA","http://pbs.twimg.com/profile_images/702880900162277376/OgtLZJtU_normal.jpg","331","216","26","es","http://www.twitter.com/TEAMHOLDINGCORP/status/721129509387247616"
"721129509106425856 ","2016-04-16","00:14","Britany Therese","britanytherese","Firefighter in training. EMT ☤. German/Polish. Hawkey Fan. Top-notch driver. The Hulk. Beyoncè Enthusiast. Chicago native. Snapchat: britanytherese","🙏🏽 (@ Countryside Saloon in Des Plaines, IL) https://t.co/VOHskcI4wX",,,"42.04292909","-87.86245599999999","US","Des Plaines, IL","http://pbs.twimg.com/profile_images/699346145479294977/OKCIwsCm_normal.jpg","238","333","14","en","http://www.twitter.com/britanytherese/status/721129509106425856"
"721129508720521216 ","2016-04-16","00:14","Jime Lopez","mimen","Production Manager | Industrial Designer | Live Event Producer| Do what makes your heart sing, and those that matter will be there to join you!","Monterrey.... (@ Aeropuerto Internacional de la Ciudad de México (MEX) - @aicm3 in Venustiano Carranza, DF) https://t.co/Y5zk3FydSV",,,"19.43001034","-99.08041477","MX","Venustiano Carranza, Distrito Federal","http://pbs.twimg.com/profile_images/544277088921194496/E9F1qAQq_normal.jpeg","236","402","10","es","http://www.twitter.com/mimen/status/721129508720521216"
"721129508070248448 ","2016-04-16","00:14","DollarGeneralCareers","DGCareers","Let’s Grow Together! At 12,000 stores and counting, we're growing fast and so can you! Joining Dollar General is just the beginning of your best career yet.","Can you recommend anyone for this #job? Market Store Manager - https://t.co/aG7F9S2lnR #Diversity IN #Retail #Hiring https://t.co/CJdDigKaAt",,,"33.7126158","-117.8721676","US","Santa Ana, CA","http://pbs.twimg.com/profile_images/495247449812774914/BNUgRB9F_normal.jpeg","1082","725","339","en","http://www.twitter.com/DGCareers/status/721129508070248448"
"721129507759886339 ","2016-04-16","00:14","Nordstrom Jobs","JobsAtNordstrom",,"This #Labor #job might be a great fit for you: Stock Team - https://t.co/3ccxRNI6JJ #Birmingham, Alabama #Hiring https://t.co/5XLbFQUfdw",,,"33.5206608","-86.80249000000001","US","Birmingham, AL","http://pbs.twimg.com/profile_images/2391152025/j2te4k78l4mfarsx6lhm_normal.png","253",,"458","en","http://www.twitter.com/JobsAtNordstrom/status/721129507759886339"
"721129504370991104 ","2016-04-16","00:14","Alison","tikidaisy","DC native, NFL fan, geek girl.  Into social media, architecture, pop culture and tiki bars. Work @SavingPlaces, board of @NAPC.","@SlackHQ Yes to the top hat and rabbit but a magic wand is needed for all Harry Potter references. cc @smheffern",,,"38.9009009","-77.02824835","US","Washington, DC","http://pbs.twimg.com/profile_images/614168526392180736/fqA1YmpX_normal.jpg","639","190","81","en","http://www.twitter.com/tikidaisy/status/721129504370991104"
"721129503351816192 ","2016-04-16","00:14","Joan Allen","JoanAllenPhoto","Visual diary of photography, wanderlust, life. https://t.co/Y0CYPWAZYj","Friday!  This photogenic beauty is called Spring Fling.  Salers Aperitit Strawberry, HUSK… https://t.co/ihQAESGq0e",,,"36.15545","-86.76964","US","Nashville, TN","http://pbs.twimg.com/profile_images/698677252184092677/7qH-UP5-_normal.jpg","19020","115","281","en","http://www.twitter.com/JoanAllenPhoto/status/721129503351816192"
"721129503037263872 ","2016-04-16","00:14","Brenda Erazo","BrenBrenERAZO","PRODUCER and DIRECTOR. Reality, Docu-Drama, Entertainment News, Award Show, Red Carpet, Music Video, Junket and Premier. Travel Nationally and Internationally.","Carnival time! (@ New Overpeck Park in Ridgefield Park, NJ) https://t.co/F5FcFKGj7M",,,"40.85871379","-74.00925994000001","US","Ridgefield Park, NJ","http://pbs.twimg.com/profile_images/639646793765097473/UvGoWgjL_normal.jpg","456","293","26","en","http://www.twitter.com/BrenBrenERAZO/status/721129503037263872"
"721129502441648128 ","2016-04-16","00:14","BOS:311 Reports","BOS311x","BOS:311 enables real-time collaboration with citizens, 'deputizing' mobile users to become the city's eyes and ears. Call, tweet, or download the BOS:311 app.","Opened Illegal Parking report via iphone at 72 I St, South Boston https://t.co/Zo72jAqTp7. No residency sticker. https://t.co/GPGKe9rKR8",,,"42.33583144","-71.03983906000001","US","Boston, MA","http://pbs.twimg.com/profile_images/635435641870774272/21XwG7qN_normal.png","163","16","16","en","http://www.twitter.com/BOS311x/status/721129502441648128"
"721129502424883200 ","2016-04-16","00:14","ericamaspero","ericamaspero","I have been working as a color specialist and master stylist for 15 years now. I love my work and always keep up with the latest styles.","#balayagehighlights #caramelcolor #paulmitchellxgcolor #mondoverdebleach #hairdivasa… https://t.co/S3Ou5DQCTk",,,"29.51789306","-98.50475692000001","US","San Antonio, TX","http://pbs.twimg.com/profile_images/633991329563848704/nboOJdh__normal.jpg","270","492","22","es","http://www.twitter.com/ericamaspero/status/721129502424883200"
"721129502282096641 ","2016-04-16","00:14","Andrew Barnets","OperativeD",,"It's that time again... @ Strangefellows Bar and Grille https://t.co/3rK18watwd",,,"41.04332032","-85.14757323000001","US","Fort Wayne, IN","http://pbs.twimg.com/profile_images/426420891740688384/_utLWn0S_normal.jpeg","147","260","1","en","http://www.twitter.com/OperativeD/status/721129502282096641"
"721129502101737472 ","2016-04-16","00:14","LA Accounting Jobs","tmj_lax_acct","Follow this account for geo-targeted Accounting job tweets in Los Angeles, CA. Need help? Tweet us at @CareerArc!","Want to work in #Torrance, CA? View our latest opening: https://t.co/MxOpLhzj2I #Accounting #KellyJobs #KellyServices #Job #Jobs #Hiring",,,"33.8291867","-118.3169714","US","Torrance, CA","http://pbs.twimg.com/profile_images/668766582177271809/6HB5gl2g_normal.jpg","613","297","63","en","http://www.twitter.com/tmj_lax_acct/status/721129502101737472"
"721129501342740480 ","2016-04-16","00:14","Fetty♡","caitlinhandshoe","EN '16 || BSU '20 || Kenny Ray ♡","🐠 @ South Sarasota, Florida https://t.co/S0Q4kurv0O",,,"27.287","-82.52970000000001","US","South Sarasota, FL","http://pbs.twimg.com/profile_images/693948572698570752/36k29H0h_normal.jpg","898","188","19","pt","http://www.twitter.com/caitlinhandshoe/status/721129501342740480"
"721129501262876672 ","2016-04-16","00:14","Jessica Schaefer","december_joy86","I enjoy being the opposite of what people might expect. Some of the lesser known aspects of my personality may surprise people.....","You can never have too many working #sharpies 👍 #meetandgreet #spillcanvas #SiouxFalls… https://t.co/6tVod1QOHA",,,"43.55176134","-96.72784984","US","Sioux Falls, SD","http://pbs.twimg.com/profile_images/567906455294967808/869-XTS0_normal.jpeg","43","91","9","en","http://www.twitter.com/december_joy86/status/721129501262876672"
"721129501040721922 ","2016-04-16","00:14","Helle Bachofen","HelleBvE","Danish • BeSport Sponsored Elite Cyclist • Team leader @besport_women • FlyWheel Instructor • Writer • Personal Trainer • Living in Dubai","THE best tasting pea protein recovery drink I have ever had. @fluidnutrition  Cinnamon / Vanilla… https://t.co/vomEMy58af",,,"36.583859","-121.754753","US","California, USA","http://pbs.twimg.com/profile_images/696732775215292416/8YyZnaDp_normal.jpg","311","375","5","en","http://www.twitter.com/HelleBvE/status/721129501040721922"
"721129499740340225 ","2016-04-16","00:14","Rory Simms","simmsrory","Irish Designer @Pentagram","Just posted a photo @ Sagmeister &amp; Walsh https://t.co/Uo8xc0ct5n",,,"40.7389607","-73.989632","US","Manhattan, NY","http://pbs.twimg.com/profile_images/541328263092510720/goiMsDLO_normal.jpeg","485","532","9","en","http://www.twitter.com/simmsrory/status/721129499740340225"
"721129499451138052 ","2016-04-16","00:14","Gordon Valentine","Sluggoaafa","Traveler from Minneapolis. Love talking about aviation, Marching Bands, and Drum & Bugle Corps.","Great to be hone (@ One Ten Grant in Minneapolis, MN) https://t.co/TDvkYruFjr",,,"44.97051682","-93.28048516","US","Minneapolis, MN","http://pbs.twimg.com/profile_images/536309444070494208/QRSD3HEb_normal.jpeg","540","415","36","en","http://www.twitter.com/Sluggoaafa/status/721129499451138052"
"721129497962000385 ","2016-04-16","00:14","Destination Jobs","DestinationJobs","The Destination Hotels collection includes award-winning hotels & resorts in premier vacation destinations around the U.S. Check here for open jobs. #hiring","Interested in a #Hospitality #job near #ChapelHill, NC? This could be a great fit: https://t.co/kaORj7Hzpx #Hiring",,,"35.9131996","-79.05584450000001","US","Chapel Hill, NC","http://pbs.twimg.com/profile_images/609368691415711744/AAI1ubpI_normal.jpg","304","2","454","en","http://www.twitter.com/DestinationJobs/status/721129497962000385"
"721129497945251841 ","2016-04-16","00:14","Shawna Mendelson","shawnamendelson","World Champion Powerlifter;  Competitive Highland Games Athlete; MS Kinesiology/ Sports Sciences. Certified CSCS; Strength Coach; Owner of Blue Collar Barbell","And...then there were these!!! Killer death!! Redemption 2016!! #Louie #Genius… https://t.co/T216CUm3W6",,,"40.7765884","-73.09947200000001","US","Bohemia, NY","http://pbs.twimg.com/profile_images/1769888695/image_normal.jpg","733","627","7","en","http://www.twitter.com/shawnamendelson/status/721129497945251841"
"721129497911799808 ","2016-04-16","00:14","william pressley","da215","still short","Service not so great 2nite. (at @Outback Steakhouse in Turnersville, NJ) https://t.co/btGWl3pV6h",,,"39.744228","-75.04401300000001","US","Turnersville, NJ","http://pbs.twimg.com/profile_images/2739535068/b59b819d28190fa0875d6331bc0cc586_normal.jpeg","51","266","4","en","http://www.twitter.com/da215/status/721129497911799808"
"721129496137633792 ","2016-04-16","00:14","Princess","_robinnnnnnn","I see you looking at my booty.","I don't usually do double doubles. But we going all out today #yolo (at @InNOutBurger in Hollywood, CA) https://t.co/WNbioc65yK",,,"34.09820155","-118.34170103","US","Los Angeles, CA","http://pbs.twimg.com/profile_images/711668936618586112/0eFmBqQu_normal.jpg","271","249","8","en","http://www.twitter.com/_robinnnnnnn/status/721129496137633792"
"721129496137469957 ","2016-04-16","00:14","Lesli torres","_matthewftbiebs","Don't let your dreams be just dreams","We made it..",,,"36.7667554","-119.9175155","US","California, USA","http://pbs.twimg.com/profile_images/688073210244382720/cvQ-Sz05_normal.jpg","331","327","1","en","http://www.twitter.com/_matthewftbiebs/status/721129496137469957"
"721129494023651328 ","2016-04-16","00:14","James St. Clair","jstclair13","Freelance #gamedev. Working on #BiggerInTexas. Working on a beer trading app #MyTapRoom. Serial #entrepreneur. Co-Founder @Lon_Mon_Games https://t.co/QJkmqA3Hgs","3.5/5 untapped bug. - Drinking a Leggy Blonde by Rising Silo Farm Brewery @ Rising Silo Brewery  — https://t.co/3UvXytUhCK",,,"37.2317","-80.40560000000001","US","Blacksburg, VA","http://pbs.twimg.com/profile_images/691850596505231360/lRwVNXED_normal.jpg","1079","803","222","en","http://www.twitter.com/jstclair13/status/721129494023651328"
"721129493927174146 ","2016-04-16","00:14","Kenny","KennyWitTheKoke","Excuse the Rant | #EnginEars | #KennythingCanHappen | Mix x Master $25 Per Song | excusetherant@gmail.com","She gon let me fuck her friends? #INeedAllat @jzzleonline","2",,"30.41872879","-91.18233389","US","Baton Rouge, LA","http://pbs.twimg.com/profile_images/720774346910920705/HLRm7uxJ_normal.jpg","796","394","14","en","http://www.twitter.com/KennyWitTheKoke/status/721129493927174146"
"721129492413079552 ","2016-04-16","00:14","Who AM I.....","MsVaughn2_You","JSU Media Relations, Proud JSU Alumnus THEE I LOVE","Beautifully and wonderfully made!! #BlessedNotStressed 😍😘💁🏽🙏🏽🙌🏽 @ Brandon, Mississippi https://t.co/upNZgQP0LF",,,"32.2803","-89.99850000000001","US","Mississippi, USA","http://pbs.twimg.com/profile_images/482035253314191360/-oQz4ARg_normal.jpeg","125","205","1","en","http://www.twitter.com/MsVaughn2_You/status/721129492413079552"
"721129490311589888 ","2016-04-16","00:14","Jennifer Wakefield","jennwake9","2014 Olympic Gold Medalist. Canadian National W. Hockey Team. BostonU Alum. IIHF World Champion 2012. jennwake9@gmail.com","Texas Rangers game! #mlb #beingtouristy @ Texas Rangers Ballpark In Arlington https://t.co/Ie1hkBFfYP",,,"32.75136143","-97.08281134000001","US","Arlington, TX","http://pbs.twimg.com/profile_images/566682906161332225/WpZM8Tgx_normal.jpeg","5998","435","115","en","http://www.twitter.com/jennwake9/status/721129490311589888"
"721129490110394372 ","2016-04-16","00:14","Sandra Rodriguez","yayanava","Living my life on purpose","Old high school festival #NIOT @ Fox Tech High School, SAISD https://t.co/PWqqn8fCu6",,,"29.432939","-98.494198","US","San Antonio, TX","http://pbs.twimg.com/profile_images/694725402548277248/oZ9cPAld_normal.jpg","242","449","3","en","http://www.twitter.com/yayanava/status/721129490110394372"
"721129489346994176 ","2016-04-16","00:14","Randy","RandPitt","Tweets about Pop Culture, Music, Movies, TV, and whatever else comes to mind @rblaze4life is my other half. #teamfollowback #NOH8 #LoveWins","#ImWithHer #Gay #LGBT @ Vladimir's Haus of Pain https://t.co/cYZIA57uKC",,,"40.46281316","-80.00572719","US","Pittsburgh, PA","http://pbs.twimg.com/profile_images/671694530517721090/mrVhdQIw_normal.png","16416","15761","165","fr","http://www.twitter.com/RandPitt/status/721129489346994176"
"721129488747114498 ","2016-04-16","00:14","DJ B NICE","DJBNICE804","CapCity VA. 804, #SeratoScratchHead, #VinylCollector, #Club DJ BOOKDJBNICE@GMAIL.COM","#rp aceofbladez @djbnice804… https://t.co/ec7DoXv94r",,,"37.54474","-77.44249000000001","US","Richmond, VA","http://pbs.twimg.com/profile_images/648657266556731392/1ny7CqOF_normal.jpg","881","1037","22","de","http://www.twitter.com/DJBNICE804/status/721129488747114498"
"721129488155848704 ","2016-04-16","00:14","Alexander Cupo","ATCupo","ResilienceCorps Fellow for the City of Pittsburgh. Graduate of the University of Pittsburgh. B.A. in Environmental Studies, Poli Sci minor. Class of 2015.","@sofarpittsburgh secret show at the Bayardstown Social Club in the Strip! sofarsounds… https://t.co/elSxLTFWTF",,,"40.45887","-79.97226999999999","US","Pittsburgh, PA","http://pbs.twimg.com/profile_images/688187187448303616/lI0Go1dO_normal.jpg","143","247","8","en","http://www.twitter.com/ATCupo/status/721129488155848704"
"721129487941967873 ","2016-04-16","00:14","Almita hein","almitahein","wife , mama of 2 , Jesus follower, vegetarian , birth junkie , coffee lover , Starting a church plant @waterloochurch with my husband in austin, tx","We had way to much fun on our date day with nehemiah 💙 and The Jungle book was amazing!!!!!… https://t.co/XGJQqVr4s7",,,"30.4700093","-97.5982813","US","Texas, USA","http://pbs.twimg.com/profile_images/416071871512064001/UkYgPwGJ_normal.jpeg","220","264","9","en","http://www.twitter.com/almitahein/status/721129487941967873"
"721129487476400128 ","2016-04-16","00:14","Samantha Drake","samadron",,"Фото(22) https://t.co/vy3ZBx1Xb5",,,"37.69889969","-123.01196064","US","California, USA","http://pbs.twimg.com/profile_images/591695217272590336/EKbyPvQr_normal.jpg","12",,"4","ru","http://www.twitter.com/samadron/status/721129487476400128"
"721129486452809728 ","2016-04-16","00:14","Miguel Sánchez Rubio","MiguelSRubio","Estudiante de Actuaría, UAQ.                                                                                    Student of Actuarial Science, UAQ.","I'm at Che-Chelas https://t.co/7C6viR0XZw",,,"20.58850993","-100.41283317","MX","Querétaro, Querétaro Arteaga","http://pbs.twimg.com/profile_images/549842406708101120/J3uNkkwg_normal.jpeg","1038","1781","7","en","http://www.twitter.com/MiguelSRubio/status/721129486452809728"
"721129486247268352 ","2016-04-16","00:14","Tomato Wellness","TomatoWellness","We promote all tomatoes products! Cans, jars, sauces, etc, picked in season, at the PEAK OF FRESHNESS, and locking in the flavor and nutrients of summer!","You want a pizza me??? #pizzafriday #extrasauce @ Giordano's Pizza https://t.co/WbaFtELPyG",,,"41.8851395","-87.6231308","US","Chicago, IL","http://pbs.twimg.com/profile_images/433066956619390976/W48Am8xk_normal.jpeg","4889","2251","94","en","http://www.twitter.com/TomatoWellness/status/721129486247268352"
"721129480417247234 ","2016-04-16","00:14","A Beautiful Mess","KymberleyFraser","Interior Designer & Owner of A Beautiful Mess Home located at 28875 W. Agoura Road Agoura Hills, California 818-874-9092","Swooped this BIG beauty up for my #upperlakeproject #homeoffice. I can't get it here fast… https://t.co/TJQBoGBcJx",,,"34.1427612","-118.7540817","US","Agoura Hills, CA","http://pbs.twimg.com/profile_images/2513201556/v75bpcrttwzmhcgtmvsj_normal.jpeg","667","484","36","en","http://www.twitter.com/KymberleyFraser/status/721129480417247234"
"721129479809019905 ","2016-04-16","00:14","Alaska Solo","alaskasolo","Wizard at Fairy Tail | Star Wars | Comics | Anime | Video Games | Goofball | Gifted Assassin | Harry Potter | Always Reading | Sailor Moon | Music is life | ✌️","woo_t4ng and I have the best conversations. You'd never guess we are adults. 😋😋😋 @ Highlands… https://t.co/ALqGXm3d8n",,,"39.5445","-104.968","US","Highlands Ranch, CO","http://pbs.twimg.com/profile_images/712295814232576000/sRXSXEXt_normal.jpg","369","677","10","en","http://www.twitter.com/alaskasolo/status/721129479809019905"
"721129479783841792 ","2016-04-16","00:14","Ms Scarlet","_AlexisAllen","I don't share Netflix passwords, Hulu logins,or dick. #Aries","Nadea went to prom todayyyyyy!!!! #prettyful #prom #prom2k16 #RepresentationMatters #princess… https://t.co/neMBJ38pC1",,,"34.24083333","-80.61583333","US","Camden, SC","http://pbs.twimg.com/profile_images/687127350077730822/fx2dbVZk_normal.jpg","408","370","13","en","http://www.twitter.com/_AlexisAllen/status/721129479783841792"
"721129478349578240 ","2016-04-16","00:14","Jeremy Bates","DetroitPride90","Auto Mechanic/Heavy Vehicle Mechanic, Referee, Farmer.. That's about it y'all","Drinking a Kokanee Gold by Labatt Brewing Company at @tavernunited — https://t.co/shiMwO8FHf",,,"49.8323","-99.96120000000001","CA","Brandon, Manitoba","http://pbs.twimg.com/profile_images/621026659269873665/K_U3m-9-_normal.jpg","49","127","2","en","http://www.twitter.com/DetroitPride90/status/721129478349578240"
"721129477946871808 ","2016-04-16","00:14","Gustaph VaquerÖck","vaquerockr",,"No hay lugar como el hogar (@ Cuarto de VaquerÖck) https://t.co/WgdxEJfzue",,,"19.64050059","-99.11794647000001","MX","Coacalco de Berriozábal, México","http://pbs.twimg.com/profile_images/710852252332720128/fnQwFfkZ_normal.jpg","106","135","4","es","http://www.twitter.com/vaquerockr/status/721129477946871808"
"721129758382120960 ","2016-04-16","00:15","Jacksonville Now","JacksonvilleCP","Breaking news and weather updates from Jacksonville.","Viewing held for St. Augustine shooting victim (Francesca Amiker) - https://t.co/NlDhtGVHMK",,,"30.32633066","-81.65339546","US","Downtown Jacksonville, FL","http://pbs.twimg.com/profile_images/667517998559809537/Ffn0jfYD_normal.png","2283","10","81","en","http://www.twitter.com/JacksonvilleCP/status/721129758382120960"
"721129758134644746 ","2016-04-16","00:15","Baltimore Now","BaltimoreCP","Breaking news and weather updates from Baltimore.","Baltimore police investigating shooting by an officer that occurred this evening in West Baltimore. breaking https://t.co/tOWrof01M3",,,"39.30190319","-76.6155346","US","Baltimore, MD","http://pbs.twimg.com/profile_images/706524395104133120/8o-AggCr_normal.jpg","2993","38","166","en","http://www.twitter.com/BaltimoreCP/status/721129758134644746"
"721129758084440065 ","2016-04-16","00:15","þªµ| Ðªv¡|ª","pau7davi7a","Though I walk through the valley of the shadow of death, I will fear no evil: for thou art with me; thy rod and thy staff they comfort me. (Psalms 23:4 KJV)","Drinking a Hefeweizen by @theRAM at @theram — https://t.co/22nf7oDcGi",,,"41.993","-87.86360000000001","US","Rosemont, IL","http://pbs.twimg.com/profile_images/717026246534758400/dCBWoHGo_normal.jpg","293","542","9","en","http://www.twitter.com/pau7davi7a/status/721129758084440065"
"721129757820260352 ","2016-04-16","00:15","PawSox","PawSox","Official Twitter account of the Pawtucket Red Sox, Triple-A affiliate of the Boston Red Sox since 1973.  I.L. Governors' Cup Champions: 1973, 1984, 2012 & 2014.","LF Rusney Castillo lines a single to left and is 2-for-3 with 2 RBI thus far. #PawSox lead Lehigh Valley 4-1 halfway thru this one",,"1","40.6235427","-75.4638458","US","Fullerton, PA","http://pbs.twimg.com/profile_images/661206595423100928/6z4GPPks_normal.jpg","31061","570","824","en","http://www.twitter.com/PawSox/status/721129757820260352"
"721129756574396416 ","2016-04-16","00:15","Austin Now","Austin_CP","Breaking news and weather updates from Austin.","Get ready for a 3-day soaking, with heavy rainstorms Sunday https://t.co/Mm6cfmU6Xb",,,"30.26960519","-97.74361687","US","Austin, TX","http://pbs.twimg.com/profile_images/706522868809510913/vwGvnVip_normal.jpg","2202","12","148","en","http://www.twitter.com/Austin_CP/status/721129756574396416"
"721129755991543808 ","2016-04-16","00:15","every lot sf","everylotsf","Every parcel in San Francisco, in tax ID order. by @fitnr","865 Vallejo Street https://t.co/mRC48nlpt8",,,"37.79797","-122.4114","US","San Francisco, CA","http://pbs.twimg.com/profile_images/678985247506190337/U-GG0Q_f_normal.jpg","53","4","7","es","http://www.twitter.com/everylotsf/status/721129755991543808"
"721129755916021760 ","2016-04-16","00:15","Donovan Walker","soul_searcher02","#CCOT#PJNET#TCOT#TeaParty Truck driver. Continually shining LIGHT on truth. Pro-#2ndAmendment #ProLife #IStandWithIsrael","Obama Administration Doubles Down on Forcing Religious Groups to Accept Abortion Drug ‘Accommodation’ https://t.co/SyizEV5rWe",,,"32.4663795","-82.4740759","US","Georgia, USA","http://pbs.twimg.com/profile_images/635224861003022336/M2KOkq2z_normal.jpg","6879","7541","169","en","http://www.twitter.com/soul_searcher02/status/721129755916021760"
"721129753013395457 ","2016-04-16","00:15","Ricardo murillo","guapito1992",,"Diet: facts ✔️ •spinach ✅ •green apple✅ •kale✅ •arugula✅ •kiwi✅ Drinking An afternoon… https://t.co/iqmgwxOObQ",,,"39.12380719","-77.23864940999999","US","Gaithersburg, MD","http://pbs.twimg.com/profile_images/719272779854585856/RTsLM-jz_normal.jpg","14","5",,"en","http://www.twitter.com/guapito1992/status/721129753013395457"
"721129751537192960 ","2016-04-16","00:15","Nicole wickenheisser","Wickrealestate",,"https://t.co/uonGdV4beE",,,"40.8930347","-74.58822670000001","US","Wharton, NJ","http://pbs.twimg.com/profile_images/378800000084746644/3b32729d9368e71e4eab3f2b4acb52fe_normal.jpeg","139","275","2","es","http://www.twitter.com/Wickrealestate/status/721129751537192960"
"721129751335854080 ","2016-04-16","00:15","TTN Las Vegas","TotalTrafficLV","Covering all your traffic needs throughout Greater Las Vegas.  Please call 702-238-7333 if you have any traffic tips.","Accident in #LasVegas on Eastern Ave south of Washington Ave #VegasTraffic https://t.co/5rmaMyUrq6",,,"36.18108","-115.1159","US","Las Vegas, NV","http://pbs.twimg.com/profile_images/439096018932469760/e-YFscMC_normal.png","2234","137","82","en","http://www.twitter.com/TotalTrafficLV/status/721129751335854080"
