"721154776319266816 ","2016-04-16","01:54","Cali O.","GirlMeetGrowler","Girl Meets Growler is a #craftbeer lifestyle #blog for those of us who drink from a lipstick-stained pint. Mostly #mnbeer!","Great Brett IPA with a lot of sweetness and nice sharp finish - Drinking a Tanager at @fultonbeer - https://t.co/ZNjmaNeDYo #photo",,,"44.9849","-93.2787","US","Minneapolis, MN","http://pbs.twimg.com/profile_images/612813668225454084/8uu6xd_o_normal.jpg","120","264","10","en","http://www.twitter.com/GirlMeetGrowler/status/721154776319266816"
"721154774851198976 ","2016-04-16","01:54","Don DeMarko ♍","YungBroGaud","IG: Yung.Bro.Gaud2","😍😍😍 RT @yay_its_kiyah: https://t.co/BdXRSKrrT0",,,"41.8025852","-87.6117821","US","Chicago, IL","http://pbs.twimg.com/profile_images/701476844760006656/ReC4gEPJ_normal.jpg","1836","1828","31","es","http://www.twitter.com/YungBroGaud/status/721154774851198976"
"721154773559439361 ","2016-04-16","01:54","Anthony Birchak","abirchakMMA","135lb #Fighter in the #UFC Div2 #Wrestler #GrecoRoman #USAWrestling #AAU AllAmerican #Tucson #Arizona @TOROTechMMA Team #AZMMA Proud @lutaelitemma managed","We are set dtclash comes in at 185lbs and is ready to get the W tomorrow! The hard works done… https://t.co/wG8Rbsgjdg",,,"32.13003137","-111.08421603","US","Drexel Heights, AZ","http://pbs.twimg.com/profile_images/667578408323297280/gd52_brd_normal.jpg","4622","785","113","en","http://www.twitter.com/abirchakMMA/status/721154773559439361"
"721154771843874816 ","2016-04-16","01:54","Vanilla Coke","ColeBeatty","I'm in the zone, I feel like a robot. Kulawargo","I have some pretty cool friends 😛 @ Drake's Landing Banquet Center https://t.co/YfvqF7ekyk",,,"40.98743","-80.69208","US","Ohio, USA","http://pbs.twimg.com/profile_images/714567312788090880/2fQLR3N-_normal.jpg","590","335","1","en","http://www.twitter.com/ColeBeatty/status/721154771843874816"
"721154771080622080 ","2016-04-16","01:54","Elia Clemente","Eclemente79",,"Home sweet home (@ My Castle in New Rochelle, NY) https://t.co/WOwvdbtnnK",,,"40.96889721","-73.78896895","US","New Rochelle, NY","http://pbs.twimg.com/profile_images/2525695963/N96Nj3qA_normal","46","118","1","en","http://www.twitter.com/Eclemente79/status/721154771080622080"
"721154770115776512 ","2016-04-16","01:54","Kendall Conley","KendallConley",,"Lolaaaa @ St. John's University https://t.co/RzmR0tsse4",,,"40.72270603","-73.79457005","US","Queens, NY","http://pbs.twimg.com/profile_images/711419237932388353/r6GxGiO9_normal.jpg","366","246",,"en","http://www.twitter.com/KendallConley/status/721154770115776512"
"721154770099159040 ","2016-04-16","01:54","maylin ✨","missmaaaylin","awkward and oblivious.","This one is for you, Mom and Dad! 💕✨ #ucsc #classof2016 #PGOD @ UC Santa Cruz https://t.co/nRqvDENzbo",,,"36.97746","-122.05226","US","Santa Cruz, CA","http://pbs.twimg.com/profile_images/720715979991285760/Uf7woNQ5_normal.jpg","357","327","1","en","http://www.twitter.com/missmaaaylin/status/721154770099159040"
"721154769839124482 ","2016-04-16","01:54","Genuine Draft","GenuineDraft_SF","From baseball to making an old fashioned like Don Draper, the only voice poured straight from the tap. #JokerJokerRexRyanRexRyan","Despite the difference between the 3 time #WorldChamp #sfgiants and the #dodgers, this man… https://t.co/hUVnEGeKQa",,,"37.794225","-122.421323","US","San Francisco, CA","http://pbs.twimg.com/profile_images/719670199662747650/l-9QGpDA_normal.jpg","60","374","20","en","http://www.twitter.com/GenuineDraft_SF/status/721154769839124482"
"721154769461583873 ","2016-04-16","01:54","Alejandro Valdovinos","IBIZALE",,"I'm at Ezequiel Montes in Ezequiel Montes, QRO https://t.co/aR5IadACAE",,,"20.66621956","-99.89867953","MX","Ezequiel Montes, Querétaro Arteaga","http://pbs.twimg.com/profile_images/489281831347302402/dKOepj0f_normal.jpeg","142","394","3","es","http://www.twitter.com/IBIZALE/status/721154769461583873"
"721154768979300352 ","2016-04-16","01:54","Lisa Ann","HKLisaAnn","Sex, Love, Zeppelin, and of course Hello Kitty!! @HKLisaAnn #HKForever #HKLisaAnn","I'm at Piscataway, NJ in Piscataway, NJ https://t.co/EYXmN4YANr",,,"40.55239977","-74.46888541","US","Piscataway, NJ","http://pbs.twimg.com/profile_images/696177882905866241/EqhhrGKd_normal.jpg","557","2168","38","en","http://www.twitter.com/HKLisaAnn/status/721154768979300352"
"721154768534528000 ","2016-04-16","01:54","felicia","feliciajimenez","no mas con esta mierda https://t.co/lnztKtrNzW","classic bathroom pic 15.4.16 @ Humber College Lakeshore Campus https://t.co/CPJ4DstBYG",,,"43.597229","-79.5203094","CA","Toronto, Ontario","http://pbs.twimg.com/profile_images/639280316314689536/N4ijz_hK_normal.jpg","1033","353","13","en","http://www.twitter.com/feliciajimenez/status/721154768534528000"
"721154767532212224 ","2016-04-16","01:54","Rodrigo Ruiz","Ro1629","Diseñador gráfico y apasionado a la fotografia! Ver una buena foto siempre repara el alma.","I'm at @LaButaca_ in Ciudad Satélite, MEX, Estado de México w/ @anagarciarodri3 https://t.co/OHw4gyDfaj",,,"19.5136441","-99.23385974999999","MX","Naucalpan de Juárez, México","http://pbs.twimg.com/profile_images/664185737898622976/K5TcCYui_normal.jpg","167","851","7","es","http://www.twitter.com/Ro1629/status/721154767532212224"
"721154767175553025 ","2016-04-16","01:54","Jesse Quonce","JesseQuonce",,"Insert whimsical quote here @ Barnum Pond https://t.co/E93GIF8qTT",,,"44.4592215","-74.2604358","US","New York, USA","http://pbs.twimg.com/profile_images/628748109380763648/FRy3uBsJ_normal.jpg","72","173","7","en","http://www.twitter.com/JesseQuonce/status/721154767175553025"
"721154766282199040 ","2016-04-16","01:54","EJ Kenneth Gamboa","ejkenneth","Art Student","Lombard St. #sanfrancisco @ Lombard Street https://t.co/SYv86HjJHI",,,"37.79818735","-122.42472179","US","San Francisco, CA","http://pbs.twimg.com/profile_images/707941457034813444/4mH00SRu_normal.jpg","399","343","3","en","http://www.twitter.com/ejkenneth/status/721154766282199040"
"721154765871325184 ","2016-04-16","01:54","EHC!","EndHungerCT","End Hunger Connecticut! is a statewide anti-hunger and food security organization focusing on advocacy, outreach, education and research.","She's just clowning around!  EHC!Director of Child Nutrition Shannon juggled some serious fun… https://t.co/jc2IbWPewl",,,"41.55157","-72.7794399","US","Meriden, CT","http://pbs.twimg.com/profile_images/1149562129/EHC_Logo_normal.jpg","1194","686","52","en","http://www.twitter.com/EndHungerCT/status/721154765871325184"
"721154765212819456 ","2016-04-16","01:54","Lisa Jamison","LisaLIFT","LIFT PE uses a multi-disciplinary approach to helping you be the strongest, the most efficient, and the best you can be.  Realign. Reeducate. Rebuild.","After the fight. #thunderwin https://t.co/hWg9FzcPAO",,,"27.94305679","-82.45167966","US","Tampa, FL","http://pbs.twimg.com/profile_images/473136859652960256/aRDRn-bV_normal.jpeg","91","98","4","en","http://www.twitter.com/LisaLIFT/status/721154765212819456"
"721154764633804802 ","2016-04-16","01:54","Manuel Herrera M.","globoballoon","Manuel Herrera Maldonado Productor Musical Instagram: mherreramaldonado","Celebrando mezclas finales de la talentosa cantautora @cruisecruise_ @prestudios #Ing.Dávalos… https://t.co/k7WKhXyqa5",,,"25.666866","-100.3073231","MX","Monterrey, Nuevo León","http://pbs.twimg.com/profile_images/667359763059990528/DnZ_BV4T_normal.jpg","2085","426","16","es","http://www.twitter.com/globoballoon/status/721154764633804802"
"721154764466208768 ","2016-04-16","01:54","Emily Harrison","emily_charrison","22 year old Mezzo Soprano living in Perthshire. I favour gin...","Day two of the Roadtrip- we have reached Virginia! Lodging in Stafford, Quantico tonight 🇺🇸 I… https://t.co/zZPR2HiHiL",,,"38.42194444","-77.40833333","US","Stafford, VA","http://pbs.twimg.com/profile_images/701001946598129665/9grC1Y8Z_normal.jpg","180","282","7","en","http://www.twitter.com/emily_charrison/status/721154764466208768"
"721154764369698816 ","2016-04-16","01:54","OhVickiMarie","OhVickiMarie","Mom of 2, 1 adorable puppy, OC/LA Court Reporter, March baby & kid of the '80s, KROQ, taking pix, romance, travel & life for all that it is...A GREAT BLESSING!","@sspu Silversun Pickups rockin' the @KROQ coachella16 #partyhouse @ Bermuda Dunes, California https://t.co/VuMJA33hPk",,,"33.7445","-116.285","US","Bermuda Dunes, CA","http://pbs.twimg.com/profile_images/720019359129710592/MbcEaQ5o_normal.jpg","38","87","2","en","http://www.twitter.com/OhVickiMarie/status/721154764369698816"
"721154764264878080 ","2016-04-16","01:54","David","finsfan13ot","Occupational Therapist, Proud Father of two beautiful little girls... Love good beer","But too much ginger for me - Drinking a Wicked JuJu by @LeftHandBrewing @ Barrel Chest Wine and Beer  — https://t.co/N8UHbHgzvJ #photo",,,"37.2236","-79.983","US","Cave Spring, VA","http://pbs.twimg.com/profile_images/473259568802586624/eku9r8yy_normal.jpeg","50","408","4","en","http://www.twitter.com/finsfan13ot/status/721154764264878080"
"721154764004855809 ","2016-04-16","01:54","Jonás Flores","JonasFlorest","Máster en Dirección de Relaciones Públicas y Gabinetes de Comunicación. Me gusta ayudar y reír.","🦁 (at @PalNorteOficial in Monterrey, NLE, Nuevo León) https://t.co/2yElsSV8sL",,,"25.68078792","-100.2855901","MX","Monterrey, Nuevo León","http://pbs.twimg.com/profile_images/674796163300614144/5rGnhPhF_normal.jpg","9567","5527","37","es","http://www.twitter.com/JonasFlorest/status/721154764004855809"
"721154762528464897 ","2016-04-16","01:54","pat butter","patobutter","Wine lover/Foodie/Artist/Welder....Life is uncertain - eat desert first!!!","Always so good! #texas #deviledeggs #tamales @ Stampede 66 by… https://t.co/CDUFz5e3mS",,,"32.78882975","-96.80435063","US","Dallas, TX","http://pbs.twimg.com/profile_images/515029864974659587/x7gPltPL_normal.jpeg","409","1629","9","en","http://www.twitter.com/patobutter/status/721154762528464897"
"721154762398273540 ","2016-04-16","01:54","OttiS ЯoJiBlAиKo","ozzie_ulises","#Ingobernable y volatil fluoresente para muchos,d #CHIVAS y d la #JUVE toda la vida #Gym el escape perfecto para cualquier situación #JuntosVsTodo #ForzaJuve","Gracias a dios acabo esta primer lucha de las peores q e visto aquí! ASCO!!!",,,"19.42482029","-99.15196057999999","MX","Doctores, Cuauhtémoc","http://pbs.twimg.com/profile_images/719157598184873986/-UZVxO3i_normal.jpg","166","471","14","es","http://www.twitter.com/ozzie_ulises/status/721154762398273540"
"721154762192723969 ","2016-04-16","01:54","Varian Careers","Work4Varian","Varian employees focus energy on saving lives. We develop leading solutions for advancing cancer treatment, radiosurgery, X-ray imaging, & security.","Want to work at Varian Medical Systems? We're #hiring in #Atlanta, GA! Click for details: https://t.co/Rx0hTayJEY #Clerical #Veterans #Job",,,"33.7489954","-84.3879824","US","Atlanta, GA","http://pbs.twimg.com/profile_images/459064303056723968/nIrbM8pt_normal.jpeg","269","48","295","en","http://www.twitter.com/Work4Varian/status/721154762192723969"
"721154761332948993 ","2016-04-16","01:54","Winn-Dixie Careers","WDCareers","Join our WINN-ing team and help make the lives of our customers and fellow associates FUN! Winn-Dixie is one of the nation's largest food retailers.","Can you recommend anyone for this #job? Produce Associate - https://t.co/nCoB5GM9CZ #DOTHAN, AL #Retail #Hiring",,,"31.2127829","-85.36017150000001","US","Dothan, AL","http://pbs.twimg.com/profile_images/636616310403653633/sIs1Iqbk_normal.png","527","252","334","en","http://www.twitter.com/WDCareers/status/721154761332948993"
"721154760888311809 ","2016-04-16","01:54","HMSHost Jobs","HMSHostCareers","HMSHost is part of the world’s largest provider of food & beverage services for travelers. Explore our various hourly and management positions in US & Canada!","Can you recommend anyone for this #Hospitality #job? https://t.co/5NRMOwmcFZ #restaurantlife #Vandalia, OH #Hiring",,,"39.8906122","-84.1988308","US","Vandalia, OH","http://pbs.twimg.com/profile_images/701776933395243008/YHEZAae-_normal.jpg","280","221","133","en","http://www.twitter.com/HMSHostCareers/status/721154760888311809"
"721154760808787968 ","2016-04-16","01:54","CheckOutStore","checkoutstoretm","Offers CDR, DVDR, Paper Sleeves, DVD Cases, Jewel Cases, Media Supplies and Accessories.","10 Clear 6 Disc DVD Cases $9.60 https://t.co/steBAG6DeX #DVD #Cases #Generic https://t.co/VHH9hxAqPH",,,"40.6548713","-74.0064354","US","Brooklyn, NY","http://pbs.twimg.com/profile_images/563786504321769472/g5fgmHqN_normal.jpeg","49","7","41","en","http://www.twitter.com/checkoutstoretm/status/721154760808787968"
"721154760695414784 ","2016-04-16","01:54","Josef Aguilar","psychojoe","Art maker, Photo taker, SQL writer, Javascript doer, boots, cats, boots, cats, boots, cats.","Friday Night Code #programming #glichur #android #androidstudio #java #cplusplus #jni #xml… https://t.co/idMHHJXChd","1",,"41.8369","-87.6844","US","Chicago, IL","http://pbs.twimg.com/profile_images/709446024188665857/OXxyG4UR_normal.jpg","143","591","8","en","http://www.twitter.com/psychojoe/status/721154760695414784"
"721154760200609794 ","2016-04-16","01:54","tara","sd2lvtwin","❤Love and live for my family, great music and dancing!! :0) Living life to the fullest with no regrets!! Navy Veteran.","Kickboxing 😰 #doingwork #vegas (@ 103 Hot Pilates &amp; Yoga in Spring Valley, NV) https://t.co/7zASALy532",,,"36.11204252","-115.30688297","US","Nevada, USA","http://pbs.twimg.com/profile_images/549092247480700928/bkzNE-Mb_normal.jpeg","356","1128","10","en","http://www.twitter.com/sd2lvtwin/status/721154760200609794"
"721154760129277953 ","2016-04-16","01:54","Melissa Jean","TheMelissaJean","Girl. Copywriter. Hobbyist Photographer. Dancer. Crocheter. Pescatarian. Dog mother of 2 German Shepherds. Mover. Shaker. Do it all-er.","#robintrower #bluesface (at @WellmontTheatre for Robin Trower in Montclair, NJ) https://t.co/r5voVTtcnS",,,"40.81256692","-74.21651962","US","Montclair, NJ","http://pbs.twimg.com/profile_images/418441020930793473/T-3SUI4Q_normal.jpeg","215","328","6","en","http://www.twitter.com/TheMelissaJean/status/721154760129277953"
"721154757952479232 ","2016-04-16","01:54","Melly Corzo","mellyosaurus","sassy mujer. making messes. writing always.","LOL my unintentional photo bomb #raisethemacallan @ Morgan Manufacturing https://t.co/ThzZpD47hO",,,"41.889208","-87.651836","US","Chicago, IL","http://pbs.twimg.com/profile_images/662464496619778048/IHtqqvXK_normal.jpg","79","186","8","en","http://www.twitter.com/mellyosaurus/status/721154757952479232"
"721154757738389504 ","2016-04-16","01:54","Kaplan Test Prep","KTPJobs","Kaplan is hiring! Jobs in #Tech #Teaching #Sales #Marketing #Data. These tweets are ONLY job postings. Follow @KTP_Careers & @TeachForKaplan to get to know us!","If you're a #Education professional in #Sacramento, CA, check out this #job: https://t.co/IpwMs4nwPD #Hiring",,,"38.5815719","-121.4943996","US","Sacramento, CA","http://pbs.twimg.com/profile_images/445625327876726784/79uZeWkS_normal.jpeg","403",,"712","en","http://www.twitter.com/KTPJobs/status/721154757738389504"
"721154757562380288 ","2016-04-16","01:54","Sonoma Wine Bar","sonomahouston","Neighborhood Wine Shop, Wine Bar & Restaurant with two locations: #UpperKirby 713-526-9463 & #HoustonHeights 713-864-9463 #sonomahouston","What a great picture, thank you for sharing! #Repost kk23 with repostapp. ・・・ Happy Friyay… https://t.co/zsRb1xhdRw",,,"29.73435","-95.42081","US","Houston, TX","http://pbs.twimg.com/profile_images/716172224428843008/0YIx5Xp5_normal.jpg","813","460","44","en","http://www.twitter.com/sonomahouston/status/721154757562380288"
"721154756912267264 ","2016-04-16","01:54","Roberto BG","robertsilver84","Odontólogo en consultorio dental Bolaños","Frijoles charros y tostadas de pata que mal me la paso 😊😊 @ Cantina Daniels https://t.co/OBZYuOumGD",,,"19.4405171","-99.153226","MX","Cuauhtémoc, Distrito Federal","http://pbs.twimg.com/profile_images/673352288740597761/M0mWdBvf_normal.jpg","367","1325","2","es","http://www.twitter.com/robertsilver84/status/721154756912267264"
"721154753334370305 ","2016-04-16","01:54","Jodi McLean","JodiMcLean","FL Beach Girl & M Go Blue! Marketer, catalyst, published Intrapreneur and lover of entrepreneurs. I can connect you; better believe it.","Come on down to Bish's Yard Sale #GoBolts @ Tampa Bay Times Forum https://t.co/Ylic7nBZLA","1",,"27.9428","-82.45171999999999","US","Tampa, FL","http://pbs.twimg.com/profile_images/678994104865431555/95YfYYj3_normal.jpg","1354","1711","37","en","http://www.twitter.com/JodiMcLean/status/721154753334370305"
"721154752675979264 ","2016-04-16","01:54","Tony Goodtime","TonyGoodtime","I'm not a rapper. I'm a Songwriter | Recording Artist | Entrepreneur | Long Island NY | 516 | TwoEleven Ent. Booking Contact TonyGoodtimeTwoEleven@gmail.com","If you have not yet seen my #debut #music #video on #youtube Keep It Real the link is in my… https://t.co/8WNkLJbpoY",,,"40.7142","-74.0064","US","Manhattan, NY","http://pbs.twimg.com/profile_images/701978212901871617/bfyHGp_B_normal.jpg","464","293","13","en","http://www.twitter.com/TonyGoodtime/status/721154752675979264"
"721154752063651840 ","2016-04-16","01:54","Felipe Gonzalez","FelGui","Un comunicólogo en tierras publicitarias, Escribo lo que pienso en 140 caracteres. Depende el sapo la pedrada","Cena ex-coca's (@ Belmondo) https://t.co/moerKP5zyy",,,"19.43039394","-99.19994575","MX","Miguel Hidalgo, Distrito Federal","http://pbs.twimg.com/profile_images/575384016389476354/Rgh8z1Nt_normal.jpeg","493","862","12","it","http://www.twitter.com/FelGui/status/721154752063651840"
"721154752063516673 ","2016-04-16","01:54","Capdeville","MayorCapdeville","Comfort food, whiskey, rock.","All the drinks on a Friday night. @ Capdeville https://t.co/RvHMSagrCC","3",,"29.9472008","-90.06912989999999","US","New Orleans, LA","http://pbs.twimg.com/profile_images/545359544289738752/GzhTuRUg_normal.jpeg","3100","1031","152","en","http://www.twitter.com/MayorCapdeville/status/721154752063516673"
"721154750054535168 ","2016-04-16","01:54","Lee Elzy","leecharles__",,"Im sleepy",,,"30.46076233","-91.15058569","US","Baton Rouge, LA","http://pbs.twimg.com/profile_images/716381188928180224/SlqXPVbE_normal.jpg","271","374",,"en","http://www.twitter.com/leecharles__/status/721154750054535168"
"721154749437857793 ","2016-04-16","01:54","pyrello","pyrello","Iowa City native. Web geek. Previously worked with @Drupal A LOT and now working with @Laravelphp","Pillar Point, an unexpected good time #livemusic #missioncreek #mcf2016 @ Yacht Club https://t.co/mM3t3VfFSV",,,"41.6607399","-91.5319519","US","Iowa City, IA","http://pbs.twimg.com/profile_images/3448390816/9f111871271b0c8dfba4231e3a99838b_normal.png","90","255","10","en","http://www.twitter.com/pyrello/status/721154749437857793"
"721154747747672064 ","2016-04-16","01:54","Joshua James","JJQ104","Host of The Joshua James Show LIVE Monday through Friday 2pm - 7pm ON Q104 - 104.3FM - https://t.co/yYuHZA3FSY #1 FOR NEW COUNTRY #1 IN KANSAS CITY","👴🏻 Bald baby! #ShaveToSave @americancancer #vml @ Shave to Save… https://t.co/vFFEYhpHhU",,,"39.1008682","-94.5914993","US","Kansas City, MO","http://pbs.twimg.com/profile_images/705090046106308609/iGbXLcGh_normal.jpg","2715","464","37","en","http://www.twitter.com/JJQ104/status/721154747747672064"
"721154747105878016 ","2016-04-16","01:54","Noe Ramirez 1⃣9⃣⚽","Noe_Ramirez10","McAllen Tx,Monterrey NL •Regio• ⚽️","Huguito González 😳👏",,,"25.75458","-100.3530446","MX","Monterrey, Nuevo León","http://pbs.twimg.com/profile_images/718192606799204352/TjYAe8a5_normal.jpg","498","670","2","es","http://www.twitter.com/Noe_Ramirez10/status/721154747105878016"
"721154745142870017 ","2016-04-16","01:54","Bew Radley","BewRadley","Boogie from Bmore","When the #oystershooter too bomb.  #athomehappyhour #BaltimoreVsYallWhores #drinks @ Baltimore,… https://t.co/aYPDdoT4rx",,,"39.2903","-76.6125","US","Baltimore, MD","http://pbs.twimg.com/profile_images/538594714984136704/fri2smHp_normal.jpeg","830","732","37","en","http://www.twitter.com/BewRadley/status/721154745142870017"
"721154744392249344 ","2016-04-16","01:54","Claudia Renata","claudiazl","ecuameritalian","Duck la orange, my dinner tonight #westchestereats @ Nautilus Diner https://t.co/ixbfwZXsV4",,,"40.938759","-73.745257","US","Mamaroneck, NY","http://pbs.twimg.com/profile_images/191893406/daily_20_1__normal.JPG","123","222","1","en","http://www.twitter.com/claudiazl/status/721154744392249344"
"721154743540670466 ","2016-04-16","01:54","Nick Simpson","nsimpso2",,"Game 2 #worstroommateever #lgb @ Scottrade Center https://t.co/TozrH2VohF","1",,"38.62660555","-90.20275066000001","US","St Louis, MO","http://pbs.twimg.com/profile_images/1650757560/Mike_and_Nick_normal.jpg","118","425",,"en","http://www.twitter.com/nsimpso2/status/721154743540670466"
"721154742114717698 ","2016-04-16","01:54","PLAYGROUND DETROIT","PLAYDETROIT","PLAYGROUND DETROIT // catalyst for art + culture + music; empowering emerging artists + musicians in Detroit & beyond. CONTACT US // info@playgrounddetroit.com","Tim Schumack performing his original songs from his debut EP, I See Clear Skies at Kit &amp; Ace… https://t.co/cBQ0KDKA32",,,"42.3513107","-83.06353","US","Detroit, MI","http://pbs.twimg.com/profile_images/603307743462690816/p8oaxkBV_normal.jpg","3035","2750","118","en","http://www.twitter.com/PLAYDETROIT/status/721154742114717698"
"721154741867294721 ","2016-04-16","01:54","Jianikka Ferrer","jianikka","No I'm not that superstar but I got this shine in me.","Day 1 🎡 @ Coachella 2016 https://t.co/6aOeag2KY8",,,"33.67997","-116.23722","US","California, USA","http://pbs.twimg.com/profile_images/435998436597719040/v87jt-vU_normal.jpeg","635","197","27","en","http://www.twitter.com/jianikka/status/721154741867294721"
"721154741414334464 ","2016-04-16","01:54","Flip","ClaireWhizzy","24 Live in ATL / SanFran. native (Long Island)New Yorker♒ burning dollars to light my stove. baller, 2kplayer, NBA fanatic #KnicksTape #USFdons Student","#colourpopclueless #clueless #colourpop @ Pedro Arrupe Hall https://t.co/wurwEOXYSr",,,"37.7793712","-122.4639897","US","San Francisco, CA","http://pbs.twimg.com/profile_images/597169515332440064/b1QuaJah_normal.jpg","210","510","12","es","http://www.twitter.com/ClaireWhizzy/status/721154741414334464"
"721154740122427393 ","2016-04-16","01:54","Hannah Lott","hannah_lott3",,"Thanks for spontaneously skipping the movie to go see a baseball game with me and congrats on… https://t.co/fJpcjewpye",,,"41.07739","-81.52185","US","Akron, OH","http://pbs.twimg.com/profile_images/714222484908871685/_9kCD2QF_normal.jpg","686","207","1","en","http://www.twitter.com/hannah_lott3/status/721154740122427393"
"721154739749130240 ","2016-04-16","01:54","Buffalo Beer League","buffbeerleague","Drinking the world, one pint at a time. Grab your official membership today! https://t.co/pCcWQEtxE6. Email: buffalobeerleague@aol.com","Nice and fresh. - Drinking an I.P.W. by @upstatebrewing @ Machine Beer Works  — https://t.co/B5kxq2SzIB","1",,"42.8802","-78.8892","US","Buffalo, NY","http://pbs.twimg.com/profile_images/472986690554830849/_54xuI4U_normal.jpeg","1764","294","45","en","http://www.twitter.com/buffbeerleague/status/721154739749130240"
"721154739132497920 ","2016-04-16","01:54","The Horse","Nastythehorse","King of the Nutshot! As seen on Americas Got Talent // MTV Numbnuts // American Ninja Warrior // Horse Merch at http://t.co/j2Ex24MPXc // #THEYCALLMENASTY","I heart flips. #theycallmenasty #starkenergy @ Artistic Sports Academy Plus https://t.co/Y7c8P1O8gO",,,"40.32830658","-76.7546117","US","Pennsylvania, USA","http://pbs.twimg.com/profile_images/2549501777/iv9epz82ksl8qnougy8l_normal.jpeg","3095","309","24","en","http://www.twitter.com/Nastythehorse/status/721154739132497920"
"721154738650226689 ","2016-04-16","01:54","Dare2Draw","Dare2Draw","Dare2Draw is a 501(c)(3) nonprofit. Our mission is to help provide networking, mentoring for all cartoonists. Like us at https://t.co/idBuKEi7Oc","#nyc #dare2draw #IMAGINE @ John Lennon Memorial, Central Park https://t.co/7EYekiRxeB",,,"40.77580774","-73.97542610000001","US","Manhattan, NY","http://pbs.twimg.com/profile_images/720826934867832833/hJsu7ojX_normal.jpg","4635","2348","42","en","http://www.twitter.com/Dare2Draw/status/721154738650226689"
"721154738146971648 ","2016-04-16","01:54","Ari Becker Fashiontv","ARIBECKERF","PRESIDENTE FASHIONTV MEXICO. PRESIDENTE FASHION TV MEXICO","#Repost yessicahenao ・・・ modelsgroup #oceanprice @ Fashiontv Mexico https://t.co/zVAexCdKu8",,,"19.43724104","-99.18085412000001","MX","Miguel Hidalgo, Distrito Federal","http://pbs.twimg.com/profile_images/493541384381415424/RKS1dkga_normal.jpeg","755","927","9","en","http://www.twitter.com/ARIBECKERF/status/721154738146971648"
"721154737194856449 ","2016-04-16","01:54","Sara Orr","orrsara","youth minister","A fun night at the Game. Sorry I took this picture after some of you… https://t.co/Fa3iMgKFzY",,,"32.88861587","-96.72458862000001","US","Dallas, TX","http://pbs.twimg.com/profile_images/616445961330536448/UqyIpMsG_normal.jpg","190","183","3","en","http://www.twitter.com/orrsara/status/721154737194856449"
