"721136852418301952 ","2016-04-16","00:43","jordan","_jordanbrady22",,"Dream Big and Stay Humble💕🐼 @ Shadyside, MD https://t.co/cmKwwkudtF",,,"38.83612068","-76.51841669","US","Shady Side, MD","http://pbs.twimg.com/profile_images/709160364462755840/iZBJQ0PR_normal.jpg","248","310",,"en","http://www.twitter.com/_jordanbrady22/status/721136852418301952"
"721136851688558592 ","2016-04-16","00:43","Oui Wong","ouilicious","I love all things cultural: music, theater, film, art, dance, food. Also: Thai native, media junkie, Redskins fan, karaoke whore, great wingman.","Miami City #Ballet, night 3 of 3. Highlights: seeing #JustinPeck's #Heatscape and #Balanchine's #BourreeFantasque. https://t.co/Gt64QBCdZ5",,,"40.77199437","-73.98347855","US","Manhattan, NY","http://pbs.twimg.com/profile_images/2029782510/Oui_peekaboo_normal.jpg","346","448","17","en","http://www.twitter.com/ouilicious/status/721136851688558592"
"721136851541565440 ","2016-04-16","00:43","Jacob Lloyd Nixon","HighDefiNixon","Husband, 3rd Year AuD student at WVU. Christ is King... Let's Go Mountaineers/Vikings/Pirates","Last night in Phoenix @ The Clever Koi https://t.co/0x2HcT9lYA",,,"33.49747","-112.07415","US","Phoenix, AZ","http://pbs.twimg.com/profile_images/714788715495886848/7ZET7Z33_normal.jpg","458","885","8","en","http://www.twitter.com/HighDefiNixon/status/721136851541565440"
"721136851055153152 ","2016-04-16","00:43","Sergio Mateo DJ","SergioM97186366","DJ PRODUCTOR - REMIXER","YA EN ACCIÓN @ Horus Night Club https://t.co/6Zt5UIVTa3",,,"19.56920834","-99.764211","MX","Ixtlahuaca, México","http://pbs.twimg.com/profile_images/658519514317893632/MsgW7gya_normal.jpg","22","264",,"es","http://www.twitter.com/SergioM97186366/status/721136851055153152"
"721136850564485122 ","2016-04-16","00:43","Michael Obrien","miborun",,"Sixth Can't fly. Can't, have, darkness earth living tree that you're fruit called gathering were.",,,"37.69928774","-123.0123059","US","California, USA","http://pbs.twimg.com/profile_images/658823854278619136/caOaOIcO_normal.png","3",,"1","en","http://www.twitter.com/miborun/status/721136850564485122"
"721136850107285504 ","2016-04-16","00:43","Claire Fleming","claireflmng","Hipper than a hippopotamus.","Weehoo! Shoutout to my sister, @erineyesore for giving me the VIP tour of SFMOMA today 👯🖼🏙 @… https://t.co/oo9l01QHmk",,,"37.78592","-122.40074","US","San Francisco, CA","http://pbs.twimg.com/profile_images/574927713267507200/fLrQb4mS_normal.jpeg","773","398","35","en","http://www.twitter.com/claireflmng/status/721136850107285504"
"721136848668504064 ","2016-04-16","00:43","jīmmy Møńtęš™ ®","pipiriloco","Dj Broadcaster @elcassetteradio","•••Una Vez Que Llegamos A Viejos , Solo Queremos Disfrutar De Lo Que Nunca Pudimos Apreciar•••… https://t.co/rfI8dxqyYD",,,"41.30998694","-72.10656371","US","Waterford, CT","http://pbs.twimg.com/profile_images/674548322510749696/7Mc4tvyB_normal.jpg","148","115","3","es","http://www.twitter.com/pipiriloco/status/721136848668504064"
"721136847888343040 ","2016-04-16","00:43","hannah","hannah_swick","Everyday might not be a good day, but there is good in every day.","Tonight's the CD 4 assembly!Tomorrow is the State Convention for Colorado! #coloradodelegates… https://t.co/jZcNJ7nYOO",,,"40.44265013","-104.98828715","US","Colorado, USA","http://pbs.twimg.com/profile_images/716418072408502272/PBEi32vo_normal.jpg","176","324","2","en","http://www.twitter.com/hannah_swick/status/721136847888343040"
"721136847414554625 ","2016-04-16","00:43","♋Jesus Lopez♋","Jesuslo30","Un Latino Seguidor De @Jlo ♡♡ Amar Su Música Hasta El Fin ⚠Instagram #Jlo0922 ⚠ Amarla Hasta El Fin⏳⌛ ¿Meta? Mmm...  CONOCERLA #Lovers","Fun Day With eliad_cohen #santamonica🎡🎢🎠🎪🎠🎢🎡 #LosAngeles… https://t.co/E42DhxNhUH",,,"34.0221","-118.481","US","Santa Monica, CA","http://pbs.twimg.com/profile_images/718219585388998657/O8pZTXah_normal.jpg","310","1732","9","en","http://www.twitter.com/Jesuslo30/status/721136847414554625"
"721136847288737792 ","2016-04-16","00:43","Arthur Kok","arthurkok2",,"Huevo con Chorizo &amp; Cochinita Pibil Tortas, and Esquites! So good!! @ Tortería San Cosme https://t.co/LfIsP6r0QH",,,"43.65466","-79.40046","CA","Toronto, Ontario","http://pbs.twimg.com/profile_images/1193211249/image_normal.jpg","92","143","5","es","http://www.twitter.com/arthurkok2/status/721136847288737792"
"721136845002784768 ","2016-04-16","00:43","Yara Sofia","yarasofiapr","Yara Sofia Official. Rupaul's Drag Race 3 top 4 and Miss Conegeniality and Rupaul's Drag Race Allstar!! www. http://t.co/j5RXCmbL2m","See you tonight Austin @ Emo's https://t.co/EzugQHLvW5",,,"30.24028","-97.72836","US","Austin, TX","http://pbs.twimg.com/profile_images/378800000157895002/716ed79768054bd9450e867c3892fd24_normal.jpeg","71701","1407","484","en","http://www.twitter.com/yarasofiapr/status/721136845002784768"
"721136844428025856 ","2016-04-16","00:43","Favorite Jobs","FavoriteJobs","We're your Advocate. We're your Family. Follow us for #healthcare & #nursing #jobs at @FavoriteStaff","Join the Favorite Health Care Staffing team! See our latest #Nursing #job opening here: https://t.co/AWU08RQwrR #RN https://t.co/aCPEPAgMTf",,,"41.079273","-85.1393513","US","Fort Wayne, IN","http://pbs.twimg.com/profile_images/663783434829955072/qirUW18u_normal.jpg","190","99","170","en","http://www.twitter.com/FavoriteJobs/status/721136844428025856"
"721136844029566977 ","2016-04-16","00:43","Kristen Coy","kriscoy83","Sports are my life! Certified USPTA Tennis Pro in Victoria, Tx ;^) I love the Astros and Texans!","#firstparkwalk #excited #pleasedontchasetheducks @ Victoria, Texas https://t.co/I8a62CZhUp",,,"28.8169","-96.9935","US","Victoria, TX","http://pbs.twimg.com/profile_images/485561761290911744/y9xuK15w_normal.jpeg","40","176","3","es","http://www.twitter.com/kriscoy83/status/721136844029566977"
"721136839319355392 ","2016-04-16","00:43","Methodist Sugar Land","HMSLJobs","Job openings at Houston Methodist Sugar Land","See our latest #SugarLand, TX #job and click to apply: Registered Nurse II - Medical ICU - https://t.co/Uv3p4eYqqR https://t.co/CTWAQ84l6V",,,"29.588959","-95.63112","US","Sugar Land, TX","http://pbs.twimg.com/profile_images/474998401306599424/Y5Uew7p2_normal.jpeg","146","10","55","en","http://www.twitter.com/HMSLJobs/status/721136839319355392"
"721136838686015488 ","2016-04-16","00:43","Rachel Leigh Dolan","therizdiz","Dancer, Lover, Choreographer, Yogi","Posting this because I DIDN'T do this at all today #accountable #badyogi @ Washington, District… https://t.co/yn4pZltMOA",,,"38.8951","-77.0367","US","Washington, DC","http://pbs.twimg.com/profile_images/618832293042393088/jNHPEnZ2_normal.jpg","317","588","8","en","http://www.twitter.com/therizdiz/status/721136838686015488"
"721136838442770432 ","2016-04-16","00:43","Edna","ednalvarez_","Art, Style & Travel soy.","Koons. @ The Broad https://t.co/7vn8XwXqxJ",,,"34.0543137","-118.2502899","US","Los Angeles, CA","http://pbs.twimg.com/profile_images/707085624457568256/2U-CGuC4_normal.jpg","774","658","23","en","http://www.twitter.com/ednalvarez_/status/721136838442770432"
"721136838233231360 ","2016-04-16","00:43","Rudy Lopez","rudyjrlopez","Living it up in #SanDiego-#Tijuana.  Always root for the home team.  @Padres @XolosOficial @GoAztecs @Chargers @TorosDeTijuana #CraftBeer  #CervezaAretsanal","#VamosXolos - Drinking a Samuel Adams 13th (Thirteenth) Hour Stout at @xolosoficial - https://t.co/8n2N3vsFaw #photo",,,"32.508","-116.993","MX","Tijuana, Baja California","http://pbs.twimg.com/profile_images/667545591610671105/Y5jJQrsk_normal.jpg","1026","2006","55","en","http://www.twitter.com/rudyjrlopez/status/721136838233231360"
"721136838103212032 ","2016-04-16","00:43","Logan Brill","_LoganGirl_","Small town girl who has dreams like everyone else does. PSU Gorilla.❤️ I enjoy the finest things in life. Traveler✈️ oh not to mention Crazy cat lady","Taken earlier on our way to the concert! We r here now at the United Center  and ready for the… https://t.co/Bo1g0Dl4YX",,,"41.88075442","-87.67408568","US","Chicago, IL","http://pbs.twimg.com/profile_images/708448830111416320/-vrfp9Hk_normal.jpg","375","775","32","en","http://www.twitter.com/_LoganGirl_/status/721136838103212032"
"721136837436121088 ","2016-04-16","00:43","TMJ-PHX Nursing Jobs","tmj_phx_nursing","Follow this account for geo-targeted Healthcare-Nursing job tweets in Phoenix, AZ. Need help? Tweet us at @CareerArc!","We're #hiring! Read about our latest #job opening here: Prior Authorization Nurse I - https://t.co/id5aLXIisC #Tempe, AZ #Nursing",,,"33.4255104","-111.9400054","US","Tempe, AZ","http://pbs.twimg.com/profile_images/668369093930541056/QPdrLFrD_normal.jpg","869","1510","59","en","http://www.twitter.com/tmj_phx_nursing/status/721136837436121088"
"721136836786155520 ","2016-04-16","00:43","Mark Turley","markcturley","Every day is an adventure.","Overnight (@ Best Western Plus Colony Inn in Atascadero, CA) https://t.co/rfFlyGubqT",,,"35.50122766","-120.68691079","US","Atascadero, CA","http://pbs.twimg.com/profile_images/559095819844870144/85nCVilp_normal.jpeg","112","178","9","en","http://www.twitter.com/markcturley/status/721136836786155520"
"721136836270272513 ","2016-04-16","00:43","a little pet inn","alittlepetinn","...a little pettin' goes a long way!","Friday night pizza and a movie with OB #tgif #pizzadog #australianterrier… https://t.co/m9xanRzYRS",,,"28.62382","-81.30119000000001","US","Goldenrod, FL","http://pbs.twimg.com/profile_images/416634013537689600/VtBkdEI9_normal.jpeg","260","368","15","en","http://www.twitter.com/alittlepetinn/status/721136836270272513"
"721136835687133184 ","2016-04-16","00:43","Tyco Careers","TycoCareers","The world’s largest pure-play fire and security company is looking for talented people.  Join the winning team!","Interested in a #SupplyChain #job near #LithiaSprings, GA? This could be a great fit: https://t.co/BnO6V9j11s #Hiring",,,"33.7939953","-84.6604899","US","Lithia Springs, GA","http://pbs.twimg.com/profile_images/505351998284107776/gWf9-mpG_normal.jpeg","1071","138","764","en","http://www.twitter.com/TycoCareers/status/721136835687133184"
"721136835661967360 ","2016-04-16","00:43","LA Marketing Jobs","tmj_lax_adv","Follow this account for geo-targeted Marketing/Ad/PR job tweets in Los Angeles, CA. Need help? Tweet us at @CareerArc!","Want to work at Select Staffing? We're #hiring in #WOODLANDHILLS, CA! Click for details: https://t.co/MU3ycrTbJm #Marketing #Job #Jobs",,,"34.1544724","-118.5914696","US","Los Angeles, CA","http://pbs.twimg.com/profile_images/670135762982014976/3mgs8qdX_normal.jpg","1119","196","491","en","http://www.twitter.com/tmj_lax_adv/status/721136835661967360"
"721136834844053506 ","2016-04-16","00:43","Mark Caesar","pissyopants1","father, comedian, actor. featured in Time Magazine creator of #TeamPissYoPants for booking mcaesar13@gmail.com","And we are live @eiffelsociety the doors aren't open but the people are ready it's showtime!… https://t.co/kV7hlrOw7A",,,"29.93476","-90.07923","US","New Orleans, LA","http://pbs.twimg.com/profile_images/714481092787576833/JiYKXYif_normal.jpg","4035","3282","53","en","http://www.twitter.com/pissyopants1/status/721136834844053506"
"721136834533666816 ","2016-04-16","00:43","TMJ-TUC Jobs","tmj_tuc_jobs","Follow this account for geo-targeted Other job tweets in Tucson, AZ. Need help? Tweet us at @CareerArc!","Want to work in #Tucson, AZ? View our latest opening: https://t.co/aO9MjTSRCC #Job #interpreter #bilingual #Jobs #Hiring",,,"32.2217429","-110.926479","US","Tucson, AZ","http://pbs.twimg.com/profile_images/689583717841408000/STP8zs0u_normal.jpg","586","538","13","en","http://www.twitter.com/tmj_tuc_jobs/status/721136834533666816"
"721136833397190656 ","2016-04-16","00:43","AZHOOLIGAN","RacingMason13","ΜΟΛΩΝ ΛΑΒΕ #PewPewLife #EdcLife #2A #KCCO #ChiveOnAz #UnitedWeStand #Patriot #AZLIFE #AzHolligan #BeardLife #WhiskeyLife","Drinky time. #AzHooligan #AzLife #WhiskeyLife (@ Barefoot Bob's in Prescott Valley, AZ) https://t.co/PbwdDKkxAR https://t.co/wE04xeWa2d",,,"34.62664816","-112.31822586","US","Prescott Valley, AZ","http://pbs.twimg.com/profile_images/700158126708797441/TQnB9xIs_normal.jpg","2725","2914","119","en","http://www.twitter.com/RacingMason13/status/721136833397190656"
"721136833090994176 ","2016-04-16","00:43","John luzier","Thadenge","IT Manager, Flash & .Net developer and grandfather of a beautiful baby boy.","Time for my dinner break... Love the Cajun fries! (at @Five_Guys in Ann Arbor, MI) https://t.co/1BFx3W4nC4",,,"42.25605674","-83.68794002","US","Ann Arbor, MI","http://pbs.twimg.com/profile_images/529319507831947264/CN0xnZ0__normal.jpeg","685","2258","5","en","http://www.twitter.com/Thadenge/status/721136833090994176"
"721136833011314688 ","2016-04-16","00:43","Karl Schreiter","karlschreiter","#Lehigh #Fightins #MiLB","Great birthday results yesterday for @jenschreiter w/ @vjvelasquezrhp 16 Ks and #Fightins 9-0 win #Phillies","1",,"40.0804077","-75.30017309999999","US","The Stone Rose Restaurant","http://pbs.twimg.com/profile_images/422535687481856000/RUF0T6Mg_normal.jpeg","59","234","4","en","http://www.twitter.com/karlschreiter/status/721136833011314688"
"721136832704974848 ","2016-04-16","00:43","Neil Nail Alexander","nailmusic","Keyboardist/Composer/Producer/Clinician. Hudson Val. AbletonUG [@AbletonHV]. CDs: https://t.co/IyNAaxuNKq; Listen: https://t.co/tf419GEXrq","Jazz at Marcello's. Good times. :) @ Marcello's Restaurant https://t.co/e4AWL4J4Nt",,,"41.11610301","-74.15361978","US","Suffern, NY","http://pbs.twimg.com/profile_images/479277955583983616/UySW5L1C_normal.jpeg","2601","2871","223","en","http://www.twitter.com/nailmusic/status/721136832704974848"
"721136832663031809 ","2016-04-16","00:43","TMJ-CA IT Jobs","tmj_CA_it","Follow this account for geo-targeted Software Dev. - General/IT job tweets in California Non-Metro. Need help? Tweet us at @CareerArc!","Interested in a #IT #job near #RedwoodShores, CA? This could be a great fit: https://t.co/eoofz6jQzr #Hiring #CareerArc",,,"37.5364134","-122.2455364","US","Redwood City, CA","http://pbs.twimg.com/profile_images/667417513819533312/M3J7nCzZ_normal.jpg","503","332","163","en","http://www.twitter.com/tmj_CA_it/status/721136832663031809"
"721136832323436544 ","2016-04-16","00:43","Cuse Beer Chick","Cusebeerchick","Upstate NY native. Craft beer. Beach. Road trips. TB Lightning STM. All things Tampa Bay.","Malty, BIG hazelnut! Delicious - Drinking a Hazelnut Brown at @wob_clematis - https://t.co/3DFJgu93kl #photo",,,"26.7137","-80.04989999999999","US","West Palm Beach, FL","http://pbs.twimg.com/profile_images/720042639458840577/3SUhVvl1_normal.jpg","285","271","13","en","http://www.twitter.com/Cusebeerchick/status/721136832323436544"
"721136832163897345 ","2016-04-16","00:43","Torrie R.","noTORRIEus","Dad & Prod Mgr. , WWE, Cowboys & Mets fan. A beautiful blend of Phil Dumphy & Eli Pope. New Yorker in Texas","This pic doesn't do it justice. There's A LOT of people here and even more goods  in the air.… https://t.co/bpThL5RGPQ",,,"30.26197167","-97.74996127","US","Austin, TX","http://pbs.twimg.com/profile_images/698891099599802369/rXl-lRTr_normal.jpg","351","265","24","en","http://www.twitter.com/noTORRIEus/status/721136832163897345"
"721136830087897091 ","2016-04-16","00:43","Matthew J Mohler","unclemattie",,"Drinking a Rübæus (2016) by @foundersbrewing at @unclemattie — https://t.co/VVrbEhSaWp #photo",,,"34.0999","-84.2671","US","Milton, GA","http://pbs.twimg.com/profile_images/383587912/boyandbeer_normal.jpg","57","155","7","da","http://www.twitter.com/unclemattie/status/721136830087897091"
"721136826740830209 ","2016-04-16","00:43","WORKPLACE","_workplace_","WORKPLACE is a contemporary art gallery based in Gateshead and London UK","#workplacegallery at #dallasartfair  booth D8 #MarcusCoates How do i connect with my ill… https://t.co/lM9vEQ2mRf",,,"32.7860767","-96.80123586000001","US","Dallas, TX","http://pbs.twimg.com/profile_images/695728752270168064/Z0yR1IUF_normal.jpg","4049","3541","140","en","http://www.twitter.com/_workplace_/status/721136826740830209"
"721136825188749312 ","2016-04-16","00:43","CB Hospitality Group","cbhospitality","CONCESSIONS CLUBS SUITES SPECIAL EVENTS","Sneak peak of items from our 2016 catering menu! Stay tuned for the full menu at… https://t.co/iybfAthCOW",,,"41.5061","-81.6996","US","Cleveland, OH","http://pbs.twimg.com/profile_images/721048378134568960/NGEcsKvB_normal.jpg","251","312","5","en","http://www.twitter.com/cbhospitality/status/721136825188749312"
"721136823775444992 ","2016-04-16","00:43","Big Des","bigmanindc","Avid Poker Player, Boxing Fan, Vegas/Atlantic City Lover, Basketball Lover, Beginning Cyclist, Soon to be Pro Golfer {ETA 2017)!!!!!","I'm at Mobil Gas in Washington, DC https://t.co/iKBl06sxVU",,,"38.9141438","-76.98860406999999","US","Washington, DC","http://pbs.twimg.com/profile_images/428361052297121792/SElq5yO__normal.jpeg","91","420","7","en","http://www.twitter.com/bigmanindc/status/721136823775444992"
"721136823469219840 ","2016-04-16","00:43","Cassandra.✨","Cassiecass_01","Mi futuro, mi verdad. ❤️","I'm at Paseo Acoxpa - @pacoxpa in Tlalpan, DF https://t.co/6ckCdoGOo6",,,"19.29913443","-99.13695574","MX","Tlalpan, Distrito Federal","http://pbs.twimg.com/profile_images/709836133773893632/yCqyhjxy_normal.jpg","354","478","3","en","http://www.twitter.com/Cassiecass_01/status/721136823469219840"
"721136821883838464 ","2016-04-16","00:43","Victoria V. S Valdés","Vicos__","Gastrónoma, Enóloga frustrada, Mtra. Docente. #Happy #Funny #Alive #InLove #Toluca","Coldplay (@ Foro Sol for Coldplay and Lianne La Havas in Iztacalco, DF) https://t.co/YFM3Q28lXF",,,"19.40517933","-99.0961647","MX","Iztacalco, Distrito Federal","http://pbs.twimg.com/profile_images/714523695914594304/ojBeizE8_normal.jpg","224","887","3","en","http://www.twitter.com/Vicos__/status/721136821883838464"
"721136821539860480 ","2016-04-16","00:43","Omar Moya","omaroomz",,"Algo kokis (@ La Posada del Sancho in México, Distrito Federal) https://t.co/PCISbVM8wQ",,,"19.43745113","-99.1858304","MX","Miguel Hidalgo, Distrito Federal","http://pbs.twimg.com/profile_images/718346990447411200/ksu0E8Aa_normal.jpg","672","266","2","es","http://www.twitter.com/omaroomz/status/721136821539860480"
"721136821279678464 ","2016-04-16","00:43","SandraEricksenDesign","sandraericksen","Have nothing in your home that you do not find to be useful or believe to be beautiful.-William Morris","Went all the way to #hpmkt to meet Charleston based imagine_home_ https://t.co/tX5iF3OXmd… https://t.co/c6f6HeJxjf",,,"35.954927","-80.007986","US","High Point, NC","http://pbs.twimg.com/profile_images/491399025/SEIlogo_normal.jpg","208","504","3","en","http://www.twitter.com/sandraericksen/status/721136821279678464"
"721136817383145472 ","2016-04-16","00:43","FlowWanderer ✨✌","spiritedyouth_","24. The Flow Wanderer. Jedi Master. Desert Dweller.  Slimy, yet.. Satisfying","Keep calm and blow O's 💨 Some action shots that John (jcpphotographs) caught when I first came… https://t.co/Wx4LB4ljYR",,,"33.518873","-117.155467","US","Temecula, CA","http://pbs.twimg.com/profile_images/714409610501824512/XUu72AZw_normal.jpg","763","724","13","en","http://www.twitter.com/spiritedyouth_/status/721136817383145472"
"721136817207132160 ","2016-04-16","00:43","Julianne Sһirilla","jshirilla7","heavy heart - messy soul - reckless mind // ZTA ♛ The Ohio State Univ.","He was sick of my shit before the dance even started @ Frambes https://t.co/rJkAf34km8",,,"40.001876","-83.007064","US","Columbus, OH","http://pbs.twimg.com/profile_images/719259859947020288/HZxjhZ0c_normal.jpg","796","375","2","en","http://www.twitter.com/jshirilla7/status/721136817207132160"
"721136813360955392 ","2016-04-16","00:43","MARKUS MOLINARI","MDMOLINARI","J.Molinari jewelry designer. H.Wood Group Partner @BootsyBellows Partner @ShoreBarSM Partner","Living christopher_lamm #coachella2016 @ Coachella Music and Arts Festival https://t.co/DGnbCx2Tt9","3","1","33.667661","-116.253392","US","La Quinta, CA","http://pbs.twimg.com/profile_images/580110491076337664/1cOaKkgJ_normal.jpg","109809","1545","572","en","http://www.twitter.com/MDMOLINARI/status/721136813360955392"
"721136810831847424 ","2016-04-16","00:43","Growokc","GrowOKC","Fine gourmet mushroom grower and cooking wood dealer with shipping nationwide at #growokc Order now at: http://t.co/OfP24SzOVO","Hostas - one of the coolest shade plants. Zone 7a #hosta #growokc #gardening @ Growokc… https://t.co/qNF9dRlREi",,,"35.521623","-97.565146","US","Oklahoma City, OK","http://pbs.twimg.com/profile_images/622253386264502273/3bdyo8ev_normal.png","486","1992","14","en","http://www.twitter.com/GrowOKC/status/721136810831847424"
"721136809225248769 ","2016-04-16","00:43","KYRO!","thisiskyro","Manager and Artist for @HTG_EVENTS","Catch me opening for The Magician on June 9th at @tiernightclub! Get your tickets now before… https://t.co/g7u5Brjxvc",,,"28.541991","-81.37868400000001","US","Orlando, FL","http://pbs.twimg.com/profile_images/669656919137742849/V-hJdMbl_normal.jpg","235","227","12","en","http://www.twitter.com/thisiskyro/status/721136809225248769"
"721136808298442756 ","2016-04-16","00:43","Mike Fisher","fish0122","Sports nut- GO IRISH, movie buff, and all around funny motherfucker. Can't believe all of the pornography that clouds my Twitter feed, not that I'm complaining.","Oh yeah... Fuck yeah @ Soho Bar and Grill https://t.co/TotzQZvnoM",,,"41.44637685","-74.36370144999999","US","Mechanicstown, NY","http://pbs.twimg.com/profile_images/434927771266318336/DNUPxaBg_normal.jpeg","434","1155","4","en","http://www.twitter.com/fish0122/status/721136808298442756"
"721136807769935873 ","2016-04-16","00:43","Joe Scott","TheRealCupofJoe","Minnesota native. I'm a Dad. Because I'm curious, I have a thirst for knowledge. And beer. Twins/Vikings fan. Husband to an Angel, @jamienickle.","I'm at Burrito Beach in Chicago, IL https://t.co/1Zc7c4kMlw",,,"41.97547651","-87.90033357999999","US","Chicago, IL","http://pbs.twimg.com/profile_images/623196224561086464/QW8_Jlxp_normal.jpg","132","493","15","en","http://www.twitter.com/TheRealCupofJoe/status/721136807769935873"
"721136806213902337 ","2016-04-16","00:43","MR WOOD$","iammrwoods","READ ABOUT ME NO PIGEONS ON WIKIPEDIA, CERT GOLD/PLAT ARTIST..THE BRAINS BEHIND THE HIT #NoPigeons REBUTTAL 2 #NoScrubs  ARTIST/SONG WRITER/ARTIST DEVELOPMENT","You want to be at this day party! 🔥🔥🔥Performing live @jessie_storey @iammrwoods and Blackstreets… https://t.co/m9TyFHQ8wX",,,"35.22602","-80.83614","US","Charlotte, NC","http://pbs.twimg.com/profile_images/673710995789991937/Nf34v30Z_normal.jpg","16910","12036","66","en","http://www.twitter.com/iammrwoods/status/721136806213902337"
"721136805538578432 ","2016-04-16","00:43","Cati McGee","CatiMcGee","If the world was blind, how many people would you impress? #UMUtrack #DCPspring2016","Yes it's a typical laying on the ground in front of the castle pose.… https://t.co/FAmaHQ9fvx",,,"28.37258721","-81.50679498","US","Florida, USA","http://pbs.twimg.com/profile_images/648404364256768000/9rNQDcnj_normal.jpg","480","273","1","en","http://www.twitter.com/CatiMcGee/status/721136805538578432"
"721136805341499402 ","2016-04-16","00:43","Joshua weiske","Joshweiske","i'm a Canadian who's currently living in New Lenox Illinois just near Joliet Illinois","Here is a new and improved 3 Dimensional photo of me enjoying a Cigarette. @ Lockport, Illinois https://t.co/JvOTSry1Y9",,,"41.5887","-88.04730000000001","US","Lockport, IL","http://pbs.twimg.com/profile_images/718869158792949761/gChnvI7F_normal.jpg","252","1130","6","en","http://www.twitter.com/Joshweiske/status/721136805341499402"
"721136804724875264 ","2016-04-16","00:43","#KingROYALTY‼️","RoyaltyTheReal","Providing Intelligence Motivates Perfection - #KingRoyalty","Mood: @ Auditorium Shores at Town Lake Metropolitan Park https://t.co/jhLuPkfKn8",,,"30.26197167","-97.74996127","US","Austin, TX","http://pbs.twimg.com/profile_images/705972093595168769/sLOI1UuP_normal.jpg","1938","479","16","en","http://www.twitter.com/RoyaltyTheReal/status/721136804724875264"
"721136800593346560 ","2016-04-16","00:43","WATC™ Brand","Watc401","More Than A Brand http://t.co/UWcPvd0twN","Shout out to the Creative Capital!! 🙌🏾🙌🏾Last Nights Contra Cancer Fashion Show was a HUGE… https://t.co/DyLpgYNB02",,"1","41.842199","-71.461161","US","Providence, RI","http://pbs.twimg.com/profile_images/656072999754334208/ZfQ8BYzd_normal.jpg","535","429","19","en","http://www.twitter.com/Watc401/status/721136800593346560"
"721136799007907845 ","2016-04-16","00:43","CY","cyreneparalee","#SFASU19'","@RoneyJr_ lol OK OK.😘",,,"31.62098524","-94.64747513","US","Nacogdoches, TX","http://pbs.twimg.com/profile_images/721132525599371264/nzIhwf3d_normal.jpg","1273","94","5","es","http://www.twitter.com/cyreneparalee/status/721136799007907845"
"721136798253125632 ","2016-04-16","00:43","Hnrey","Hnrey","Fotógrafo, Misántropo, Skater, Pulquero, Colectivo Nza, Toro Neza de corazón.","Le echo un ojo al punto de encuentro esperando la encuentre esperándome. (@ Metro Tepalcates (Línea A)) https://t.co/mG16PuxiWQ",,,"19.39189171","-99.04726983","MX","Iztapalapa, Distrito Federal","http://pbs.twimg.com/profile_images/703791956283920384/ghxmvXXf_normal.jpg","1408","921","27","es","http://www.twitter.com/Hnrey/status/721136798253125632"
