"721137611855650816 ","2016-04-16","00:46","Face 2 Face V. I. P","lomas_anita1","Face 2 face Weave Lounge is the home for $60 quality sew in weaves in three location, We sell virgin & remhair all up to 30 all our weaves also come with hair.","Cookie will always be there by her x side no matter or who. Some bonds are unbreakerable @… https://t.co/VtvzDBBCPJ",,,"30.42610064","-89.09372767000001","US","Gulfport, MS","http://pbs.twimg.com/profile_images/566635207143731200/ZeC6o93Q_normal.jpeg","698","2271","3","en","http://www.twitter.com/lomas_anita1/status/721137611855650816"
"721137611348275200 ","2016-04-16","00:46","Matt Wilkison","MattieLegend","27, Gay, Engaged to @inkdlatntwnk!. I love enjoying life to the fullest. Live each day like it's your last. Like to drink and have a good time occasionally.","I'm at Food 4 Less Gas Station in Evanston, IL https://t.co/1HWvpkJPMW",,,"42.03342771","-87.70678578","US","Evanston, IL","http://pbs.twimg.com/profile_images/655856951625129984/xPLWpWXa_normal.jpg","272","559","20","en","http://www.twitter.com/MattieLegend/status/721137611348275200"
"721137610719170561 ","2016-04-16","00:46","Meredith Schramm","merbear121","• Sleepy girl with a busy life • University of Alabama '18 ❤ • TX || AL •","The best people in life are free ❤ @ The University of Alabama https://t.co/ESPsa93PVl",,,"33.209621","-87.54630699000001","US","Tuscaloosa, AL","http://pbs.twimg.com/profile_images/719286281906360321/JlzhnrDS_normal.jpg","258","268","7","en","http://www.twitter.com/merbear121/status/721137610719170561"
"721137610618380290 ","2016-04-16","00:46","SF Sales Jobs","tmj_sfo_sales","Follow this account for geo-targeted Sales job tweets in San Francisco, CA. Need help? Tweet us at @CareerArc!","We're #hiring! Read about our latest #job opening here: Vice President, Relationship Manager - https://t.co/cYBBHdHXNg #SanFrancisco, CA",,,"37.7749295","-122.4194155","US","San Francisco, CA","http://pbs.twimg.com/profile_images/667548490805805056/wwZ-KWHy_normal.jpg","607","372","174","en","http://www.twitter.com/tmj_sfo_sales/status/721137610618380290"
"721137610236661761 ","2016-04-16","00:46","Elijah","ElijahInUtility","Utility Clerk, so that means I clean up after people on the daily","The yard looks as though a professional mowed it because I'm a professional and I know this, man",,,"29.8649318","-95.2031116","US","Houston, TX","http://pbs.twimg.com/profile_images/719625726610178048/OoGDS2bu_normal.jpg","1815","394","44","en","http://www.twitter.com/ElijahInUtility/status/721137610236661761"
"721137608839942144 ","2016-04-16","00:46","Valley Health Jobs","ValleyHealthJob","STUDENT LOAN REPAYMENT PROGRAM OF UP TO $40,000 FOR FULL TIME PTS & SELECT FT OT OPENINGS! $24,000 SIGN-ON/RETENTION BONUS FOR FULL TIME HOME HEALTH PTS & OTS!","Valley Health: Hospitality Associate Retail #VirginiaHealthCareJobs (#Winchester, VA) https://t.co/w5o7bsyjYs #Healthcare #Job #Jobs",,,"39.1939977","-78.1933634","US","Winchester, VA","http://pbs.twimg.com/profile_images/461220922720935938/3ofljiWK_normal.jpeg","84","1","53","en","http://www.twitter.com/ValleyHealthJob/status/721137608839942144"
"721137607959130112 ","2016-04-16","00:46","OC, CA Health Jobs","tmj_cao_health","Follow this account for geo-targeted Healthcare job tweets in Orange County, CA. Need help? Tweet us at @CareerArc!","Can you recommend anyone for this #Healthcare #job? https://t.co/ZqYqkglhMj #HaciendaHeights, CA #Hiring #CareerArc",,,"33.9930677","-117.9686755","US","Hacienda Heights, CA","http://pbs.twimg.com/profile_images/669139243562721280/IBGdPKI-_normal.jpg","537","306","67","en","http://www.twitter.com/tmj_cao_health/status/721137607959130112"
"721137607900471296 ","2016-04-16","00:46","myTCjob.com","myTCjob","St. Paul Pioneer Press + http://t.co/2SZyS9vYN0 = the freshest job openings in the Twin Cities! (Jobs are live for 30 days) #MNjobs #TwinCitiesJobs #jobs #MN","We're #hiring! Read about our latest #job opening here: Jury Research Project - https://t.co/ulO3SyVdDr #SaintPaul, MN",,,"44.9513188","-93.0901841","US","St Paul, MN","http://pbs.twimg.com/profile_images/1394569748/MYTC_normal.JPG","294","412","95","en","http://www.twitter.com/myTCjob/status/721137607900471296"
"721137607774572544 ","2016-04-16","00:46","CA Cust. Srv. Jobs","tmj_CA_cstsrv","Follow this account for geo-targeted Customer Service job tweets in California Non-Metro. Need help? Tweet us at @CareerArc!","Can you recommend anyone for this #job? Customer Serv Assoc I/Loader - https://t.co/VveyZjLTGu #Visalia, CA #CustomerService #Hiring",,,"36.3302284","-119.2920585","US","Visalia, CA","http://pbs.twimg.com/profile_images/668037307337826304/yZRs8WeQ_normal.jpg","440","285","92","en","http://www.twitter.com/tmj_CA_cstsrv/status/721137607774572544"
"721137606889607168 ","2016-04-16","00:46","Join Philips","JoinPhilips","Live Job Feed for Philips opportunities. For Philips updates and to connect w/ Philips recruiters, follow @PhilipsJobsNA","Can you recommend anyone for this #Sales #job? https://t.co/GZKTQlcxHW #Irvine, CA #Hiring",,,"33.6839473","-117.7946942","US","Irvine, CA","http://pbs.twimg.com/profile_images/471685445105893376/vxkBcwN8_normal.jpeg","185",,"391","en","http://www.twitter.com/JoinPhilips/status/721137606889607168"
"721137606688247809 ","2016-04-16","00:46","TMJ-LAX Transp. Jobs","tmj_lax_transp","Follow this account for geo-targeted Transportation job tweets in Los Angeles, CA. Need help? Tweet us at @CareerArc!","#CareerArc #Transportation #Job alert: Class A Driver, OTR | May Trucking | #Irvine, CA https://t.co/XLpsf9ydbD #Jobs #Hiring",,,"33.6839473","-117.7946942","US","Irvine, CA","http://pbs.twimg.com/profile_images/670312660286595072/qBSAMEf1_normal.jpg","425","295","52","en","http://www.twitter.com/tmj_lax_transp/status/721137606688247809"
"721137606621339648 ","2016-04-16","00:46","Blade Craft","BladeCraftBA","Educating students in the art of straight razor shaves and men's grooming, all to refine the modern gentleman.","The moment Leila Bear captures her progress in fadage skill level 😍 @ Blade Craft Barber Academy https://t.co/2w7s1y5akQ",,,"32.7839691","-96.78394","US","Dallas, TX","http://pbs.twimg.com/profile_images/565177021404160000/0oohZpfk_normal.jpeg","43","42","2","en","http://www.twitter.com/BladeCraftBA/status/721137606621339648"
"721137605962768384 ","2016-04-16","00:46","digidigidigi","digidigidigi","music producer & audio engineer, donut enthusiast, pigeon ornithologist, pizza geek.houston,tx","Photo booth. #redbull #sugarfree #digidigidigi #digilovesdigi #audioengineer #musicproducer #hi… https://t.co/4nfLfWHucE",,,"29.77032","-95.41543","US","Houston, TX","http://pbs.twimg.com/profile_images/620434676616802306/k_60WzJm_normal.jpg","225","245","16","en","http://www.twitter.com/digidigidigi/status/721137605962768384"
"721137605631291392 ","2016-04-16","00:46","SONIC Jobs","SONICjobs","Check out our open positions to learn how you can WORK YOUR SPIRIT at #SONIC!","Want to work in #Cleveland, TN? View our latest opening: https://t.co/kO1HdM8Hgu #Hospitality #Job #Jobs #Hiring",,,"35.1977591","-84.8428031","US","Cleveland, TN","http://pbs.twimg.com/profile_images/542369912828604416/2N_NFwnN_normal.png","270","39","333","en","http://www.twitter.com/SONICjobs/status/721137605631291392"
"721137605132361729 ","2016-04-16","00:46","LegiScan TN","LegiScanTN","National public service for legislative tracking and data API; both free and subscription offerings with advanced monitoring, research, and reporting tools.","HJR0856 [Enroll] Cory Wells https://t.co/aAS0CV2KCE",,,"36.166011","-86.784297","US","Nashville, TN","http://pbs.twimg.com/profile_images/535693400251437057/CVTAXUZG_normal.png","136","1","16","en","http://www.twitter.com/LegiScanTN/status/721137605132361729"
"721137603890778113 ","2016-04-16","00:46","Cindy Shi","datswhutSHIsaid","eat•sleep•swim•starbucks #EDSFTG","Gorges or gorgeous? ☝🏼️#ithacaisgorges #lizziehotbunsXXI @ Robert H. Treman State Park https://t.co/CSzlWdshjE",,,"42.4","-76.574","US","New York, USA","http://pbs.twimg.com/profile_images/710300282110943232/3gYJAN6p_normal.jpg","205","223","2","en","http://www.twitter.com/datswhutSHIsaid/status/721137603890778113"
"721137603823681536 ","2016-04-16","00:46","Kennedy Lehew","KennedyLehew","UCO|ΑΓΔ https://t.co/7wcZSJEznb","Thankful I get to spend Double Rose with my bestfriend 🌹🌹 @ Alpha Gamma Delta https://t.co/gzICVm82g9",,,"35.659658","-97.47688599999999","US","Edmond, OK","http://pbs.twimg.com/profile_images/719563311742787586/PXNLz7EE_normal.jpg","1281","1152","4","en","http://www.twitter.com/KennedyLehew/status/721137603823681536"
"721137603118964736 ","2016-04-16","00:46","Barbara J. Perenic","FiveFootPhotog","photojournalist at the Columbus Dispatch. OU grad, triathlete, twin & dog mommy. Get busy living or get busy dying.","Country music star Garth Brooks performs in Value City Arena at the Jerome Schottenstein Center… https://t.co/H1YvfsAvdE",,,"40.00768944","-83.02498592000001","US","Columbus, OH","http://pbs.twimg.com/profile_images/2903335228/0c7fd864dba94b464b4cbd4b778068a9_normal.jpeg","974","956","81","en","http://www.twitter.com/FiveFootPhotog/status/721137603118964736"
"721137600635928576 ","2016-04-16","00:46","Dennis B.","idkmybffDennis","Fancy.","#fridayvibes #606 #chicago #spring  #collegefriends @ Bloomingdale Trail/the 606 https://t.co/Wmh0Cxi8ii",,,"41.91395","-87.70551","US","Chicago, IL","http://pbs.twimg.com/profile_images/446820744798806016/lekMBM9a_normal.jpeg","48","199","2","en","http://www.twitter.com/idkmybffDennis/status/721137600635928576"
"721137600036270080 ","2016-04-16","00:46","trishyness","trishyness","9-5er with a passion for writing. Check out my blog about dating in this digital time. http://t.co/IIloz9igCP","And so my #birthday weekend begins! #tgif #friday #birthdayweekend #mercedesladies #mercedesfam… https://t.co/VISoQCBTTH",,,"41.04490267","-74.05230152999999","US","Park Ridge, NJ","http://pbs.twimg.com/profile_images/702573860672167936/RuwVoQGL_normal.jpg","336","1103","20","en","http://www.twitter.com/trishyness/status/721137600036270080"
"721137599709057024 ","2016-04-16","00:46","kaitlynn","KaitlynnDelaney","it's simple if you let it be","Happy birthday J I love you so much, hope your day was great !!! ❤️❤️⭐️⭐️ @ Top Hibachi https://t.co/5ku0xCX83E",,,"41.3438402","-73.7604468","US","Somers, NY","http://pbs.twimg.com/profile_images/682304602046357506/KQPVaqdB_normal.jpg","290","148","2","en","http://www.twitter.com/KaitlynnDelaney/status/721137599709057024"
"721137597838462976 ","2016-04-16","00:46","elia(≖︿≖✿)","ily_b","Ｅｌｉａ王心, ☆彡, I'm always doing things ☆彡 #Music #Foodie #Travel #Adventures #StayTuned #Living","The Latina LC (@ Los Angeles Fashion District in Los Angeles, CA) https://t.co/tDNfEE6mdi",,,"34.03729768","-118.25559139","US","Los Angeles, CA","http://pbs.twimg.com/profile_images/705663262675718144/1VyImsLO_normal.jpg","1069","1292","45","en","http://www.twitter.com/ily_b/status/721137597838462976"
"721137597720969216 ","2016-04-16","00:46","SankofaVideoBks&Cafe","SankofaVideoBks","2714 Georgia Ave NW Wash. DC since '97. Cultural center for books, DVD's about people of African descent cultural activities, & community space. Great food too!","#alleyesondc with @sampkcollins at @SankofaVideoBks. 8-10pm, the show's just getting started. @… https://t.co/z8traqDgva",,,"38.92556","-77.02315","US","Washington, DC","http://pbs.twimg.com/profile_images/2106039270/sankofalogo_normal.jpg","1434","1954","39","en","http://www.twitter.com/SankofaVideoBks/status/721137597720969216"
"721137595586109440 ","2016-04-16","00:46","LegiScan TN","LegiScanTN","National public service for legislative tracking and data API; both free and subscription offerings with advanced monitoring, research, and reporting tools.","HJR0881 [Enroll] Brooke Bailey, Top 25 Senior, Cherokee High School https://t.co/rs99rXQrpg",,,"36.166011","-86.784297","US","Nashville, TN","http://pbs.twimg.com/profile_images/535693400251437057/CVTAXUZG_normal.png","136","1","16","en","http://www.twitter.com/LegiScanTN/status/721137595586109440"
"721137595091001344 ","2016-04-16","00:46","Arizona Nursing Jobs","tmj_az_nursing","Follow this account for geo-targeted Healthcare-Nursing job tweets in Arizona Non-Metro. Need help? Tweet us at @CareerArc!","#Bullhead, AZ #Nursing #Job: Registered Nurse (RN) / Intensive Care Unit (ICU) at Accountable Healthcare Staffing https://t.co/5QbPFvtvYv",,,"31.9050788","-110.9903413","US","Sahuarita, AZ","http://pbs.twimg.com/profile_images/670941029399322624/RWLBp56Z_normal.jpg","764","302","69","en","http://www.twitter.com/tmj_az_nursing/status/721137595091001344"
"721137592591208448 ","2016-04-16","00:46","Caro Pilarche.","caropilarch3","vivir","Aguante la playa, el mar y el all inclusive 🙄🌴 @ Hotel Riu Playacar Playa Del Carmen Cancun Mexico https://t.co/uFdYUZo89x",,,"20.6081337","-87.0900103","MX","Solidaridad, Quintana Roo","http://pbs.twimg.com/profile_images/710500615974199296/hsY8vUq4_normal.jpg","961","440",,"es","http://www.twitter.com/caropilarch3/status/721137592591208448"
"721137591819624448 ","2016-04-16","00:46","William Blackmon","williamblackmon","Cheerleader Dad going broke | Follower of Christ | US Marine | SaaS Enterprise Project Manager | PMP CSM CEO @ApogeeSMG | #SocialMedia nut","Forgives WILL set you free! @ C3 Church https://t.co/da4o6b85qw",,,"35.56785078","-78.51573205","US","North Carolina, USA","http://pbs.twimg.com/profile_images/718235483713748992/Lwd1eFco_normal.jpg","1037","93","67","en","http://www.twitter.com/williamblackmon/status/721137591819624448"
"721137589705682944 ","2016-04-16","00:46","Everett Hagen","yumamerle",,"Proud dad moment: We set up a turntable in the kid’s room, and I took them to pick out their… https://t.co/uSnyryLWCn",,,"34.7937299","-92.28737","US","North Little Rock, AR","http://pbs.twimg.com/profile_images/2802182902/c2d21bbcba062d0affd1bf4262e22109_normal.jpeg","181","255","1","en","http://www.twitter.com/yumamerle/status/721137589705682944"
"721137589701447682 ","2016-04-16","00:46","T Schlayer","ABruinGirl","Love My Man @dre23akind and my teams:   BRUINS - DODGERS - KINGS - LAKERS - CLIPPERS - BRONCOS  FAN!","Jackie Robinson Night #GoDodgers #BeatSF (@ Dodger Stadium - @mlb for @SFGiants vs @Dodgers in Los Angeles, CA) https://t.co/qYmsROJiQY",,,"34.07340846","-118.24019819","US","Los Angeles, CA","http://pbs.twimg.com/profile_images/718554985361969152/pU5WZkHp_normal.jpg","449","1237","16","en","http://www.twitter.com/ABruinGirl/status/721137589701447682"
"721137589013446656 ","2016-04-16","00:46","Brandon Reuter","BrandonReuter",,"#stewartsheating install from a while back! @ Stewart's Heating &amp;… https://t.co/FbOxtqR4Q0",,,"41.8458765","-89.5012097","US","Dixon, IL","http://pbs.twimg.com/profile_images/1628100833/8229_1218739301391_1016131794_685060_1494784_n_normal.jpg","59","195","3","en","http://www.twitter.com/BrandonReuter/status/721137589013446656"
"721137588854263809 ","2016-04-16","00:46","Christina Ochoa","ChristinaJOchoa","Founder of the chic Digital PR firm The Social Butterfly Gal•Helping creatives build savvy, sustainable digital strategies so their brand pops•Lifestyle Blogger","I got pinned! Thanks to one of SBG's favorite partners @yelpsanantonio for the fiesta medal!… https://t.co/S7Htn1qjSb",,,"29.4305801","-98.4895477","US","San Antonio, TX","http://pbs.twimg.com/profile_images/711595112715780096/Q7juK_b5_normal.jpg","1965","1565","325","en","http://www.twitter.com/ChristinaJOchoa/status/721137588854263809"
"721137588057210881 ","2016-04-16","00:46","KB.","whereesKB","The Simple Life: Working Girl Guide to Life & Style","dinner with my sisters @ Negril Caribbean Restaurant https://t.co/fNSyB8tklP",,,"40.74619","-74.00099","US","Manhattan, NY","http://pbs.twimg.com/profile_images/718476307118583808/ILfxWn9v_normal.jpg","1022","1014","17","en","http://www.twitter.com/whereesKB/status/721137588057210881"
"721137586832568320 ","2016-04-16","00:46","Ranny","djranny","One of the Top 10 DJs You Should Know (http://t.co/cHdJYTgJT8) and TOP 5 Billboard recording artist. Check me out on iTunes! http://t.co/juVR2QiXwD","Happiness is a day at the beach. #springbreak #socal #werkingit @ Carlsbad Beach https://t.co/Rd5YEuP9OB",,,"33.17640385","-117.35169149","US","Oceanside, CA","http://pbs.twimg.com/profile_images/709721742311301120/tlKifKfW_normal.jpg","3656","640","64","en","http://www.twitter.com/djranny/status/721137586832568320"
"721137586148941825 ","2016-04-16","00:46","LegiScan NJ","LegiScanNJ","National public service for legislative tracking and data API; both free and subscription offerings with advanced monitoring, research, and reporting tools.","A3662 [NEW] Rosa-Bonilla Family Act; concerns development of carbon monoxide poisoning educational program for ... https://t.co/TgTtN77Ugg",,,"40.22028","-74.77014","US","Trenton, NJ","http://pbs.twimg.com/profile_images/535687441718317056/eVth758T_normal.png","153","1","20","en","http://www.twitter.com/LegiScanNJ/status/721137586148941825"
"721137585507209216 ","2016-04-16","00:46","Heather Inglis","roxygirl416","I am 24. i love to be social and tweet, facebook, etc.. i love texting. i love makeup and fashion. tweet me!","Do you ever get lost on purpose and enjoy where you are? #clouds #vapefam #vapefriends… https://t.co/eUtESMnvQT",,,"39.16","-76.61060000000001","US","Glen Burnie, MD","http://pbs.twimg.com/profile_images/457024208636088320/Im5aUv3__normal.jpeg","147","185","22","en","http://www.twitter.com/roxygirl416/status/721137585507209216"
"721137583351275520 ","2016-04-16","00:46","Calvin R. Boyd","CRBTheComedian","Comedian Find me telling jokes and hosting my own show at the High Point Radisson Hotel for bookings 336 587-2047","July 9th it going down !!! Radisson Hotel Get them tickets this… https://t.co/XyFdSLPgVE",,,"35.95651993","-80.00509191","US","High Point, NC","http://pbs.twimg.com/profile_images/719013894191067136/PtcpFBY2_normal.jpg","320","129","3","en","http://www.twitter.com/CRBTheComedian/status/721137583351275520"
"721137581979746306 ","2016-04-16","00:46","Aleyda Ortiz","aleydaortizreal","Model, singer. Octava Reina de Nuestra Belleza Latina 2014. Puertorriqueña! Instagram: @aleydaortiz","Jugando con mi snapchat! 😂 #tipico #followme #esperandolanoche #aleydaortiz #aleyda @ Miami,… https://t.co/qx45lrr8r4","1",,"25.7877","-80.22410000000001","US","Miami, FL","http://pbs.twimg.com/profile_images/691057911091589120/p_0hZWeh_normal.jpg","23949","435","53","es","http://www.twitter.com/aleydaortizreal/status/721137581979746306"
"721137580650209280 ","2016-04-16","00:46","Therealpjsparks","TheRealPJSparks","Health and Wellness Coach (Herbaheroes)","EARN WHAT YOUR WORTH! This is not an ordinary lifestyle! Haters gon' hate, while I drink 14… https://t.co/G2ahk93Czp",,,"33.595894","-112.026026","US","Phoenix, AZ","http://pbs.twimg.com/profile_images/718575705366212608/5HJnOzdR_normal.jpg","3854","327","17","en","http://www.twitter.com/TheRealPJSparks/status/721137580650209280"
"721137578385219584 ","2016-04-16","00:46","Oh! Carolina","caroohm","Recordar es fácil para quien tiene memoria. Olvidar es difícil para quien tiene corazón... ♥","Por fin (@ Ret. Aldama in Ciudad de México, Distrito Federal) https://t.co/YW4OBJG5zS",,,"19.27788156","-99.12996122","MX","Xochimilco, Distrito Federal","http://pbs.twimg.com/profile_images/720665695407579136/30-5LAvY_normal.jpg","277","312","2","es","http://www.twitter.com/caroohm/status/721137578385219584"
"721137577957449728 ","2016-04-16","00:46","0marcus0","0marcus0","Enjoy life with a calming smile and a fire in your eyes!","I'm at @BoarDough Tasting Room in Agoura Hills, CA https://t.co/M8LpzGDcOZ",,,"34.14426245","-118.75659519","US","Agoura Hills, CA","http://pbs.twimg.com/profile_images/2158024762/image_normal.jpg","68","247","1","en","http://www.twitter.com/0marcus0/status/721137577957449728"
"721137576430727168 ","2016-04-16","00:46","LegiScan NJ","LegiScanNJ","National public service for legislative tracking and data API; both free and subscription offerings with advanced monitoring, research, and reporting tools.","A3638 [NEW] Establishes animal cruelty offense of animal hoarding; requires mental health counseling for all anim... https://t.co/BOLonsrXn2",,,"40.22028","-74.77014","US","Trenton, NJ","http://pbs.twimg.com/profile_images/535687441718317056/eVth758T_normal.png","153","1","20","en","http://www.twitter.com/LegiScanNJ/status/721137576430727168"
"721137574945755136 ","2016-04-16","00:46","Montreal Now","MontrealCP","Breaking news and weather updates from Montreal.","Hausser les dépenses publiques aiderait l'économie mondiale, dit Stephen Poloz https://t.co/S2bjxSYHxw",,,"45.50644992","-73.57086325","CA","Montréal, Québec","http://pbs.twimg.com/profile_images/690703616022216704/NZtwmVuk_normal.png","3130","73","171","fr","http://www.twitter.com/MontrealCP/status/721137574945755136"
"721137573721174017 ","2016-04-16","00:46","Ariana","ariana628","things change and people change but life goes on","Bffs and pirates🤗 @ PNC Park https://t.co/Vc5bGHsYrF",,,"40.44709673","-80.00615131000001","US","Pittsburgh, PA","http://pbs.twimg.com/profile_images/719600418314182656/XFQxP11Z_normal.jpg","1062","1985","6","en","http://www.twitter.com/ariana628/status/721137573721174017"
"721137573029113856 ","2016-04-16","00:46","PrettyNailsAddiction","JennyD1974","I am located at Studio Ten 301 Fairview St suite b Fountain Inn SC! Come see me for all your nail needs :)","#fillin #acrylicnails #nailart #nailartaddict #naildiva #nailswag #nailjunkie #naildesign… https://t.co/iVIeptsnm2",,,"34.69373942","-82.20157903","US","Fountain Inn, SC","http://pbs.twimg.com/profile_images/535443014047789056/j6EwW4hR_normal.jpeg","35","56","5","es","http://www.twitter.com/JennyD1974/status/721137573029113856"
"721137571766468608 ","2016-04-16","00:46","Detroit CP","DetroitCP","Detroit City And Press","Big goal for the Red Wings. Big goal for Dylan Larkin. https://t.co/fqcGgU7dVX","1",,"42.33312717","-83.04848769","US","Detroit, MI","http://pbs.twimg.com/profile_images/333129676/twitter-d_normal.gif","2876","4","139","en","http://www.twitter.com/DetroitCP/status/721137571766468608"
"721137571288522755 ","2016-04-16","00:46","Kara Lynn Hammel","Kardiardia","living every day to the fullest and enjoying life","My love!! @ Evans Orchard and Cider Mill https://t.co/1lRwmrl9bV",,,"38.2072631","-84.4776442","US","Kentucky, USA","http://pbs.twimg.com/profile_images/714154165845565440/dJqfHCVv_normal.jpg","136","186",,"en","http://www.twitter.com/Kardiardia/status/721137571288522755"
"721137571078778880 ","2016-04-16","00:46","wayne sanders","snakecellar",,"Super good quad. This baby aged in rum barrels would be amazing. - Drinking a SeDated at @bigdogsbrewing - https://t.co/iKmaU17i5B",,,"36.2425","-115.236","US","Las Vegas, NV","http://pbs.twimg.com/profile_images/1808684009/image_normal.jpg","30","19","6","en","http://www.twitter.com/snakecellar/status/721137571078778880"
"721137570055200769 ","2016-04-16","00:46","stefania rosini","StefaniaPJ",,"Finally a great song in the Media car!! Heading to Las Cruces, NM!!… https://t.co/Y0UxAUCxs8",,,"33.19967","-111.9053","US","Arizona, USA","http://pbs.twimg.com/profile_images/488997920771821568/wY1R_p8h_normal.jpeg","304","203","25","en","http://www.twitter.com/StefaniaPJ/status/721137570055200769"
"721137569979760640 ","2016-04-16","00:46","Chicago Now","Chicago_CP","Breaking news and weather updates from Chicago.","Baby shot in the head while riding in a car on Chicago's West Side https://t.co/Pa5EK7QIRJ",,,"41.88804564","-87.62626724","US","Chicago, IL","http://pbs.twimg.com/profile_images/529069377916633088/QukL-Om2_normal.png","5132","35","256","en","http://www.twitter.com/Chicago_CP/status/721137569979760640"
"721137569346379776 ","2016-04-16","00:46","Blue Crew SRH","BlueCrewSRH","SportsRoadhouse®, Dodgers Baseball Breaking news, Links, Encyclopedias","#Dodgers #ThinkBlue Dodgers option Barnes to Triple-A https://t.co/rBMKukDHAi #SportsRoadhouse",,,"34.07634021","-118.23927002","US","Los Angeles, CA","http://pbs.twimg.com/profile_images/485638409700925440/IA-ibGP7_normal.png","302","84","48","en","http://www.twitter.com/BlueCrewSRH/status/721137569346379776"
"721137568587386880 ","2016-04-16","00:46","Mex3Media","mex3media","Mex3Media Design & Print for more info call 347.528.5537","Follow me on the snap.  Shit is booming #joestejas #familyfirst @ Jose Tejas https://t.co/wb4GECG5iL",,"1","40.561237","-74.30117199999999","US","New Jersey, USA","http://pbs.twimg.com/profile_images/3596723700/81ec0a2b3b107e5e24d57351ea2a6fa2_normal.jpeg","2070","2153","28","en","http://www.twitter.com/mex3media/status/721137568587386880"
"721137568557830144 ","2016-04-16","00:46","Houston Press","Houston_CP","Latest news from Houston. Updates are frequent.","Harden named player of the month; Rockets preparing for playoffs (USATODAYSportsImages) https://t.co/oLA9wgSICh",,,"29.75523769","-95.3618441","US","Houston, TX","http://pbs.twimg.com/profile_images/531478600998862848/asNyZ27g_normal.png","3511","30","141","en","http://www.twitter.com/Houston_CP/status/721137568557830144"
"721137567152934912 ","2016-04-16","00:46","LegiScan NJ","LegiScanNJ","National public service for legislative tracking and data API; both free and subscription offerings with advanced monitoring, research, and reporting tools.","A3634 [NEW] Requires one member of board in charge of institution for persons with mental illness or developmenta... https://t.co/GdiY1wGYX5",,,"40.22028","-74.77014","US","Trenton, NJ","http://pbs.twimg.com/profile_images/535687441718317056/eVth758T_normal.png","153","1","20","en","http://www.twitter.com/LegiScanNJ/status/721137567152934912"
