"721146153593610240 ","2016-04-16","01:20","Kira","kjs0310","Face life with a little guts and lots of glitter.","The best way to watch baseball, courtesy of kfoote24. #myfenway @ Fenway Park https://t.co/FGvAM6fCjr","1",,"42.34644218","-71.0971914","US","Boston, MA","http://pbs.twimg.com/profile_images/3209608142/26d6931e83c535a4f447a9c6cccfac08_normal.jpeg","120","162","4","en","http://www.twitter.com/kjs0310/status/721146153593610240"
"721146151811084289 ","2016-04-16","01:20","••A.TraconisAmaro••","DirtyAbu","\\o//  Mis conejos = mi vida, ligeros toques de té que me liberan del estrés. |  @stephpompougnac 2/1/14 | Biólogo en proceso | Snap-Insta: AbuTraconis","I'm at Parque de la 10 https://t.co/cRMPeon3hA",,,"21.02856177","-89.64279061000001","MX","Mérida, Yucatán","http://pbs.twimg.com/profile_images/674687284709486592/Njg7xTFZ_normal.jpg","483","375","4","es","http://www.twitter.com/DirtyAbu/status/721146151811084289"
"721146151546826753 ","2016-04-16","01:20","Thom","ThomTom711","teacher, touch tunes addict","I'm here (at @WhiskeyBarMke in Milwaukee, WI) https://t.co/tMQtBQPYjx",,,"43.04099508","-87.90434213","US","Milwaukee, WI","http://pbs.twimg.com/profile_images/560847556788645889/InzeMviE_normal.jpeg","67","106","1","en","http://www.twitter.com/ThomTom711/status/721146151546826753"
"721146150095568896 ","2016-04-16","01:20","Terry Powner ☮✠☧","renwop","☮✠☧ “This world will try to beat you down. Only laughter can counteract that. Laughter is ammunition. Resupply often.” ☮✠☧","Happy #4sq365 (@ Powner Place in McDonough in McDonough, GA) https://t.co/9xIAAlNjrs",,,"33.48778788","-84.20152799","US","Stockbridge, GA","http://pbs.twimg.com/profile_images/620345219431727104/VFBflhUl_normal.jpg","112","238","18","en","http://www.twitter.com/renwop/status/721146150095568896"
"721146149915242496 ","2016-04-16","01:20","Kelly Moynahan","pic120_","things clearly seen                                                           ©Kelly Moynahan Photography","#booger @ Lexington, Kentucky https://t.co/zxO9s9Lpwj",,,"38.0297","-84.49469999999999","US","Kentucky, USA","http://pbs.twimg.com/profile_images/571341417138515968/0DAYRh7F_normal.jpeg","116","436","5","en","http://www.twitter.com/pic120_/status/721146149915242496"
"721146148308807681 ","2016-04-16","01:20","kenzye","kenzstone","LIM college | insta mackenziestonee","amazing show @ Intrepid Sea, Air &amp; Space Museum https://t.co/tDnPeYqqd6",,,"40.7646348","-73.99980526","US","Manhattan, NY","http://pbs.twimg.com/profile_images/717684967602520064/2z2NrEVD_normal.jpg","705","676","2","en","http://www.twitter.com/kenzstone/status/721146148308807681"
"721146146207305729 ","2016-04-16","01:20","holler","HALAbackk","diet mountain dew baby new york city","because #fomo yolacharbel @sheenacakes @ Coachella https://t.co/0fnj6gLcxD",,,"33.679974","-116.237221","US","California, USA","http://pbs.twimg.com/profile_images/656938271948189696/UQ0wQScu_normal.jpg","173","339","5","en","http://www.twitter.com/HALAbackk/status/721146146207305729"
"721146145637015552 ","2016-04-16","01:20","Justin","Jbaus28","| Don't let your struggle become your identity | GVSU '20","Wishing I was back in Florida with my girl ❤️ @ Orange Lake Resort… https://t.co/NEQPAFHnpt",,,"28.36389362","-81.60738412000001","US","Florida, USA","http://pbs.twimg.com/profile_images/721100274811727872/Al5L210y_normal.jpg","1195","797","2","en","http://www.twitter.com/Jbaus28/status/721146145637015552"
"721146145066651648 ","2016-04-16","01:20","Pat Carlson","hurontrader","Sailboat Racer, Cyclist, SAAS Sales - Stocks/Options RI - @EMUAlumni Huron! Commenting on your XTE while navigating the stormy seas of social media.","I'm at Bridgeport Art Center in Chicago, IL https://t.co/07pOp0yuoE",,,"41.83154601","-87.65618872","US","Chicago, IL","http://pbs.twimg.com/profile_images/549085561840218114/ePLtaFIG_normal.jpeg","1150","1991","50","en","http://www.twitter.com/hurontrader/status/721146145066651648"
"721146144697556992 ","2016-04-16","01:20","Bethany Fisher","befisher26","Best known for my suburban mom dance moves. The University of Akron PR. Proud ΚΚΓ and ΚΣ Sweetheart. OneGreek Rep.","Black is for Sisterhood, and I am part of the best one! 💙⚜🔑 @ Kappa Kappa Gamma https://t.co/LyqUS0UJiZ",,,"41.074602","-81.50604800000001","US","Akron, OH","http://pbs.twimg.com/profile_images/720705050176147456/wyHvMFir_normal.jpg","850","1205","7","en","http://www.twitter.com/befisher26/status/721146144697556992"
"721146144693297152 ","2016-04-16","01:20","Miguel A. Ramirez","MRamirez2181",,"team_vengeance integra_daily tegcity teggybandits @acura @ Chaparral… https://t.co/L7O7lQ17h5",,,"34.04512","-117.499932","US","Fontana, CA","http://pbs.twimg.com/profile_images/698256194192846848/EN_MOXF3_normal.jpg","34","73","4","en","http://www.twitter.com/MRamirez2181/status/721146144693297152"
"721146144584286208 ","2016-04-16","01:20","Scott Terry","Scottdoestattoo","Tattoo artist, master chef, and cool dad.","Pink flamingo, needs background. #newschool #flamingo #bird #art #drawing #coloredpencilart #wip… https://t.co/fkK4H9WVIS",,,"39.998","-75.1448","US","Philadelphia, PA","http://pbs.twimg.com/profile_images/717698549207670784/eDaBRrsk_normal.jpg","423","535","15","en","http://www.twitter.com/Scottdoestattoo/status/721146144584286208"
"721146143791382529 ","2016-04-16","01:20","Barshal Dhir","itsjusBarsh","I am just a Laid-Back, COOL dude. Just hit me if you wanna get to know me or want to find out where the most happening parties in the bay are going down!!!","THIS WILL BE THE BIGGEST @itsjusBarsh YET❗️ | #Balancoire | Hasan of facetstudio #Facetstudio… https://t.co/Ux28qKmaEw",,,"37.75605","-122.41878","US","San Francisco, CA","http://pbs.twimg.com/profile_images/3637962444/4eefed8367e24d194c6c79c7fb04ae46_normal.jpeg","936","1978","19","en","http://www.twitter.com/itsjusBarsh/status/721146143791382529"
"721146142491160576 ","2016-04-16","01:20","CompassUSAJobBoard","CompassJobBoard","Welcome to Compass Group USA's job board. To learn about our people and careers go to @CGCareersUSA","This #Healthcare #job might be a great fit for you: CLINICAL DIETITIAN / FRESNO, CA - https://t.co/cn4RgfY8TZ #jobhunt #Fresno, CA #Hiring",,,"36.7468422","-119.7725868","US","Fresno, CA","http://pbs.twimg.com/profile_images/707329171140116480/-MGVc2ty_normal.jpg","883","124","664","en","http://www.twitter.com/CompassJobBoard/status/721146142491160576"
"721146142193545216 ","2016-04-16","01:20","Police Calls 32828","orlpol32828","Unofficial. Calls to Orlando-area police, tweeted in near real-time.","#ParkingViolation at 850-899 Woodbury Road. #orlpol #ocso",,,"28.5527489","-81.1948342","US","Alafaya, FL","http://pbs.twimg.com/profile_images/611894655555399680/X3sRMNcx_normal.png","137","1","7","en","http://www.twitter.com/orlpol32828/status/721146142193545216"
"721146140482256896 ","2016-04-16","01:20","Police Calls 32818","orlpol32818","Unofficial. Calls to Orlando-area police, tweeted in near real-time.","#911emergency at 6800-6899 Hyland Oaks Dr. #orlpol #ocso",,,"28.6005938","-81.4771927","US","Pine Hills, FL","http://pbs.twimg.com/profile_images/612329602464247808/AnnbXpGT_normal.png","48","1","6","en","http://www.twitter.com/orlpol32818/status/721146140482256896"
"721146139299459074 ","2016-04-16","01:20","Police Calls 32809","orlpol32809","Unofficial. Calls to Orlando-area police, tweeted in near real-time.","#VerbalDisturbance at 2000-2299 W Oak Ridge Rd. #orlpol #ocso",,,"28.4724662","-81.4066792","US","Oak Ridge, FL","http://pbs.twimg.com/profile_images/611894647888158720/LBnxG-O1_normal.png","87","1","7","en","http://www.twitter.com/orlpol32809/status/721146139299459074"
"721146139165212672 ","2016-04-16","01:20","Eric Vessels","ericvessels","Entrepreneur, world traveler, photographer, craft beer & bourbon lover, poker player, disc golfer, vegan, Zen practitioner, father, & all around good guy.","Me and Chiricuzio. The fedora brothers. @ San Antonio, Texas https://t.co/MUTcE4BrXS",,,"29.4167","-98.5","US","San Antonio, TX","http://pbs.twimg.com/profile_images/631491563802218496/IRVY7Dha_normal.jpg","1111","846","38","en","http://www.twitter.com/ericvessels/status/721146139165212672"
"721146138288615424 ","2016-04-16","01:20","fernando castro","pulgastwitt","La vida son puras putas coincidencias...","I'm at @Cinemex for The Jungle Book in Disney Digital 3D in Tlalnepantla de Baz, Estado de México w/ @clausalarcon https://t.co/fEcgBJqEwB",,,"19.5246652","-99.2280221","MX","Tlalnepantla de Baz, México","http://pbs.twimg.com/profile_images/425097581543178240/KhH6NKC5_normal.jpeg","399","791","2","es","http://www.twitter.com/pulgastwitt/status/721146138288615424"
"721146138112475137 ","2016-04-16","01:20","Police Calls 32703","orlpol32703","Unofficial. Calls to Orlando-area police, tweeted in near real-time.","#AssistFireDept at 2501-2598 Forest Ave, Apopka, FL 32703. #orlpol #ocso",,,"28.6395011","-81.4589139","US","South Apopka, FL","http://pbs.twimg.com/profile_images/611894661163171840/VM1T6Fy9_normal.png","51","1","5","da","http://www.twitter.com/orlpol32703/status/721146138112475137"
"721146135893696513 ","2016-04-16","01:20","HaleyRae Cannell","HaleyRaeDancer","Facebook: https://t.co/4oucurb8xz Twitter: https://t.co/pGQMocIoxR Instagram: http://t.co/QhLF7qqfHT","Text (424) 382-7740 if you're interested in trying any of our products or becoming an ItWorks!… https://t.co/HsFHRdyka0",,,"34.07305556","-118.39944444","US","Beverly Hills, CA","http://pbs.twimg.com/profile_images/618353076684980224/gNgQFzx3_normal.jpg","1543","1481","31","en","http://www.twitter.com/HaleyRaeDancer/status/721146135893696513"
"721146134828199936 ","2016-04-16","01:20","Soy La Famosa Odes","Odeshc","born in 1991 Daydreaming about real love... Looking my way... #Followme instagram: @odeshc","love for myself is big...!! ❤️❤️😍👸🏼👑💋👣👙 #rockoflove #lovemyself #signsoflove #rockheart… https://t.co/cSDClwjafQ",,,"20.86959089","-105.44047285","MX","Bahía de Banderas, Nayarit","http://pbs.twimg.com/profile_images/598315153403215874/Z0mW3Vvi_normal.jpg","374","353","7","en","http://www.twitter.com/Odeshc/status/721146134828199936"
"721146134346010624 ","2016-04-16","01:20","Ebeid S. ElSayed","ebeid_elsayed","Computer Scientist who loves software engineering. Software Engineer, Father, Student, active learner, and good listener.","I'm at Pleasanton Barber Shop in Pleasanton, CA https://t.co/e4PXUrDm36",,,"37.65127702","-121.87930016","US","Pleasanton, CA","http://pbs.twimg.com/profile_images/720413930447900672/nI-T0voF_normal.jpg","834","2051","15","en","http://www.twitter.com/ebeid_elsayed/status/721146134346010624"
"721146132861091840 ","2016-04-16","01:20","Dr. Carly Willeford","therawdoctor","RAW UNPROCESSED Wife, Mother, Business Owner, DNP Medical Provider, Researcher, Activist, Philanthropy, Beauty, Athletics, Arts, Pastor!","Who remembers this song! To much #Collegiate #Talent in one room! Raising #Scholarships for… https://t.co/94xV3ht1rD",,,"33.79462805","-79.00936165","US","Red Hill, SC","http://pbs.twimg.com/profile_images/685725455610019840/_NAOjeMa_normal.jpg","239","531","24","en","http://www.twitter.com/therawdoctor/status/721146132861091840"
"721146131594391553 ","2016-04-16","01:20","Randy Madden","RandyMadden","I am a Profesional Hair Designer working in Old Town Pasadena California. I was on American Idol season 8 Also the lead hair designer for Affliction Clothing.","Today was a Good Hair Day!  Look at this transformation! @minniemelly (tag your niece)… https://t.co/S8Wqa1tYfh",,,"34.14385996","-118.15225106","US","Pasadena, CA","http://pbs.twimg.com/profile_images/685176265322541056/BRx826mu_normal.jpg","403","449","18","en","http://www.twitter.com/RandyMadden/status/721146131594391553"
"721146130994696193 ","2016-04-16","01:20","Don Harrington","ifly2ifly","Truck driver.  Budding high school band director.","I'm at Sideling Hill Service Plaza in Waterfall, PA https://t.co/VTe9MD8w6f",,,"40.05880133","-78.08191538","US","Pennsylvania, USA","http://pbs.twimg.com/profile_images/553415472083775488/5HpC99jK_normal.jpeg","47","79","17","en","http://www.twitter.com/ifly2ifly/status/721146130994696193"
"721146130646433792 ","2016-04-16","01:20","Abel Delgado Tallabs","abe_tallabs","LSC - UAEH Gobierno del Estado de Hidalgo México.","Coldplay! @ Foro Sol, Mexico D.F. https://t.co/gMBymFgbt8",,,"19.40511435","-99.09569378","MX","Iztacalco, Distrito Federal","http://pbs.twimg.com/profile_images/2229367177/avatar3_normal.png","82","110","2","es","http://www.twitter.com/abe_tallabs/status/721146130646433792"
"721146129526755329 ","2016-04-16","01:20","Nicole Hack","nikhak","Grad student of New Media Studies • Women's soccer advocate • @Section8Chicago's Communications Director #cf97 • addicted to iced tea & chocolate • ✌","Go, Hawks! (@ Cleo's Bar &amp; Grill in Chicago, IL) https://t.co/dATi9bTHTD",,,"41.89569184","-87.67603467000001","US","Chicago, IL","http://pbs.twimg.com/profile_images/659208492729827328/E8J96-aK_normal.jpg","1460","1200","76","en","http://www.twitter.com/nikhak/status/721146129526755329"
"721146129300107266 ","2016-04-16","01:20","Lucas Dias","LucasDias28","I'm MMA fighter and a have a big dream","It's the time #elevationfightteam @ Paramount Theatre (Denver) https://t.co/5rXWGl3uxf",,,"39.74441944","-104.99020833","US","Denver, CO","http://pbs.twimg.com/profile_images/719351286718574592/D-eNYz8Y_normal.jpg","337","1055","21","en","http://www.twitter.com/LucasDias28/status/721146129300107266"
"721146128834502656 ","2016-04-16","01:20","Carly Gillis","carlycg","photographer that enjoy's a medley of: health & wellness, cooking, snowboarding, boston sports, good wine, & lyrics w/a good beat","Happy birthday @kendkm ... A guy who lives his life as if it were #onebostonday everyday!  Be… https://t.co/aKsrqh8rlf",,,"42.34742","-71.09569500000001","US","Boston, MA","http://pbs.twimg.com/profile_images/378800000331940976/ce00e805926f024ae0dd028a3185144d_normal.jpeg","579","1284","16","en","http://www.twitter.com/carlycg/status/721146128834502656"
"721146128679497729 ","2016-04-16","01:20","Mark Wolnisty","Wolnisty","Although this is my personal twitter page-please check out MSdriverconsult on twitter. Or West Region Prepass. http://t.co/rG05l4ou3n","Good set up day. The show starts tomorrow (@ Hilton Garden Inn in Rancho Cucamonga, CA) https://t.co/zjRviXC617",,,"34.07889638","-117.55447734","US","Rancho Cucamonga, CA","http://pbs.twimg.com/profile_images/2224158954/marknorthbeach1_normal.jpg","181","490","18","en","http://www.twitter.com/Wolnisty/status/721146128679497729"
"721146128125677568 ","2016-04-16","01:20","LaNdY","LaNdyGoyA","SOY lo que estoy SIENDO, no lo que FUI ni lo que SERÉ.!!!","#coldplaymexico #colors pulserita de lucesitas!! Esto se va a poner bueno!! @ Foro Sol https://t.co/yZRE9IbVcr",,,"19.40519633","-99.09592342000001","MX","Iztacalco, Distrito Federal","http://pbs.twimg.com/profile_images/717971159686340608/hweZjhDk_normal.jpg","1301","1236","5","es","http://www.twitter.com/LaNdyGoyA/status/721146128125677568"
"721146127454605312 ","2016-04-16","01:20","TTN Las Vegas","TotalTrafficLV","Covering all your traffic needs throughout Greater Las Vegas.  Please call 702-238-7333 if you have any traffic tips.","Accident reported in #Clark on US 95 SB after Charleston Blvd #VegasTraffic https://t.co/5rmaMyCQ1w",,"1","36.15872","-115.0915","US","Sunrise Manor, NV","http://pbs.twimg.com/profile_images/439096018932469760/e-YFscMC_normal.png","2234","137","82","en","http://www.twitter.com/TotalTrafficLV/status/721146127454605312"
"721146127446179841 ","2016-04-16","01:20","Stephanie","EssBeeEff","born & raised chicagoan. ravenswood by way of garfield ridge. bears fan. marketing professional. petsitter extraordinaire. fruit fly. timberlake enthusiast.","my klutz (❤️❤️❤️❤️) is leaving me!!!! 😩😢 @ Sheffield's Beer and Wine Garden https://t.co/gS9mVqG39x",,,"41.94163614","-87.6543159","US","Chicago, IL","http://pbs.twimg.com/profile_images/683018366148329473/KUp-v4Ux_normal.jpg","1622","939","63","en","http://www.twitter.com/EssBeeEff/status/721146127446179841"
"721146125902852096 ","2016-04-16","01:20","Julio Ramiretz ","Julitiux","Invisible | Intento de desarrollador | Gaymer | Linux & Apple fan | Chelero & Cafetero","Coldplay ! (@ Foro Sol for Coldplay and Lianne La Havas in Iztacalco, DF w/ @arrshar03) https://t.co/RmFTOTdOY9",,,"19.40517933","-99.0961647","MX","Iztacalco, Distrito Federal","http://pbs.twimg.com/profile_images/688952521549713408/nEYPZEQP_normal.jpg","318","449","5","en","http://www.twitter.com/Julitiux/status/721146125902852096"
"721146125730910208 ","2016-04-16","01:20","Salisbury Elks #817","Elks817","Elkdom's Jewel of the Eastern Shore. Salisbury Elks Lodge #817 was founded in 1903 and has been serving the community ever since.","Such Fools channeling Little Feat... #elkstunes  #elksfun #elkslodge @ Elks Lodge https://t.co/qxnNUVVx4L",,,"38.359603","-75.58179","US","Salisbury, MD","http://pbs.twimg.com/profile_images/707594023964266496/HwRWqBud_normal.jpg","227","463","1","en","http://www.twitter.com/Elks817/status/721146125730910208"
"721146123491098624 ","2016-04-16","01:20","Gabriela GarzaOrigel","Ga_Ga_Or","#DramaQueen Lo que me mueve en la vida es el AMOR. Entusiasta del Fitness","Yo ya lo probé ... Y tu, que esperas ? (@ The Work Gym in Cuauhtémoc, Mexico city) https://t.co/PlR1B1b3Nm https://t.co/fGzAweuFYV",,,"19.41178529","-99.17224199","MX","Cuauhtémoc, Distrito Federal","http://pbs.twimg.com/profile_images/684225177870143490/8cfIlPiE_normal.jpg","323","724",,"es","http://www.twitter.com/Ga_Ga_Or/status/721146123491098624"
"721146122698362881 ","2016-04-16","01:20","▲ Chetto▲","Chetto19","Get rich or die trying","Se me olvidaron las llaves y pues..... (@ Parque Delta in Benito Juárez, DF) https://t.co/5I3Ziq7QNq",,,"19.4029733","-99.15433645","MX","Benito Juárez, Distrito Federal","http://pbs.twimg.com/profile_images/720053896119345154/1cV6BTz6_normal.jpg","415","510","4","es","http://www.twitter.com/Chetto19/status/721146122698362881"
"721146121612079104 ","2016-04-16","01:20","Middlemanfresh","MIDDLEMANFRESH","CEO and Style Director of Middlemanfresh Amassadior / Atliernshops styling a full service style agency proving wardrobe styling services for TV/Film, editorial,","@KeinonTheMaven #NEVERSOLDOPE  EVENT @10squaredpr  event planner @ Zucot Gallery https://t.co/isuHGSxpiy",,,"33.75234849","-84.39903160999999","US","Atlanta, GA","http://pbs.twimg.com/profile_images/527533360928022528/Rks81jQ4_normal.jpeg","2630","2469","50","en","http://www.twitter.com/MIDDLEMANFRESH/status/721146121612079104"
"721146121410752512 ","2016-04-16","01:20","Lalo Coronell","LaloCoronellMkt","Mas Xalapeño que el chile!! Mercadologo Egresado de la UASLP Ejecutivo Suzuki Xalapa","I'm at @Telcel CAC in Xalapa, Veracruz https://t.co/ZfSIFLvTGo",,,"19.51305761","-96.87828854","MX","Xalapa, Veracruz de Ignacio de la Llave","http://pbs.twimg.com/profile_images/559972340227129345/xcc63W7a_normal.jpeg","327","664","2","en","http://www.twitter.com/LaloCoronellMkt/status/721146121410752512"
"721146121372966912 ","2016-04-16","01:20","Bruce Proctor","3xsuperbowlchmp","father of 2 beautiful daughters. married 22yrs. redskins & O's fan. Saved Christian 2/3/91. love the Lord Jesus","@jfpilote softball. Aloha.",,,"38.0117982","-77.9030186","US","Virginia, USA","http://pbs.twimg.com/profile_images/417034974861484032/2GeCpoch_normal.jpeg","189","43","101","es","http://www.twitter.com/3xsuperbowlchmp/status/721146121372966912"
"721146121242828801 ","2016-04-16","01:20","Nevada City Weather","NevadaCountyWX","Nevada County Weather. Home of the only 24/7 Live weather station with twitter updates. Plan your day. Follow my weather discussion: http://t.co/mdsOJfCe3d","Wind 3.0 mph NNW. Barometer 30.116 in, Steady. Temperature 61.5 °F. Rain today 0.01 in. Humidity 25%",,,"39.24222222","-121.05444444","US","Grass Valley, CA","http://pbs.twimg.com/profile_images/1765139375/nevadacityfull_normal.jpg","204","59","9","en","http://www.twitter.com/NevadaCountyWX/status/721146121242828801"
"721146121133772800 ","2016-04-16","01:20","Fleck","FleckParking","Fleck is the app that lets you rent out your  driveway while you are not using it or reserve a driveway for you to park. That simple.","New parking space available at Mb,  https://t.co/Z6l6nUUhcY",,,"53.7608608","-98.8138763","CA","Division No. 21, Unorganized, Manitoba","http://pbs.twimg.com/profile_images/614455760626561024/9aPoOIuv_normal.png","2515","1798","13","en","http://www.twitter.com/FleckParking/status/721146121133772800"
"721146120387178496 ","2016-04-16","01:20","gio the great","giothegreat216","rapper / actor/ hip hop thats what i live on 2sixteen is my team aint nothin like us cleveland whats good for booking email giothegreatbooking@gmail.com","I think beast therefore I am a BEAST @ Virginia Beach, Virginia https://t.co/i6GCh2YZQY",,,"36.8345","-76.0872","US","Virginia Beach, VA","http://pbs.twimg.com/profile_images/684257791842844672/DoKaOHok_normal.jpg","875","1400","12","en","http://www.twitter.com/giothegreat216/status/721146120387178496"
"721146120286547969 ","2016-04-16","01:20","Lester Burnham","JackaryZones","You're perfect just the way you are. Nothing out of the ordinary. No Tom & Jerry shit.","@erickarcelliott @meechisdead @ZOMBIEJuicee @flatbushzombies didn't have much time for pictures… https://t.co/ZXoZ5cYlM2",,,"39.75434457","-104.97873065","US","Denver, CO","http://pbs.twimg.com/profile_images/702742422720122880/yPqhBP5y_normal.jpg","96","87","3","en","http://www.twitter.com/JackaryZones/status/721146120286547969"
"721146120068534272 ","2016-04-16","01:20","Katy, TX News","BLifeKaty","Katy BubbleLife features community news, photos and events. Share your business, organization or personal news and events at https://t.co/Bsyj4giXc9.","28110 John Clyde Dr, Katy, TX 77494, $360,000 4 beds, 3.5 baths https://t.co/bR2K7aTEXP",,,"29.74020004","-95.83020019999999","US","Cinco Ranch, TX","http://pbs.twimg.com/profile_images/530405709507084289/wlKtoFII_normal.jpeg","294","1103","5","es","http://www.twitter.com/BLifeKaty/status/721146120068534272"
"721146118403461120 ","2016-04-16","01:20","mazzie (╯°□°）╯︵ ┻━┻","mazzie","a measure ahead. she was a daughter of the revolution. black lives matter.","Our fair city @ Union Station, Washington D.C. https://t.co/EKETmodBN0",,,"38.898423","-77.00599723000001","US","Washington, DC","http://pbs.twimg.com/profile_images/716368623573590020/HWnO7esl_normal.jpg","1714","1042","99","en","http://www.twitter.com/mazzie/status/721146118403461120"
"721146118273257473 ","2016-04-16","01:20","Güendi","WendyLandia83","Amor, Cafe, Sexo, y Musica.","Today's coffee goes to this delicious Vietnamese Iced Coffee from #hiccups so good! My day is… https://t.co/Hsr3E5V64F",,,"33.79241157","-118.14227131","US","Long Beach, CA","http://pbs.twimg.com/profile_images/710973420905758720/V5bTQERU_normal.jpg","238","283","10","en","http://www.twitter.com/WendyLandia83/status/721146118273257473"
"721146118151749632 ","2016-04-16","01:20","Missouri City News","MissouriCityBL","Missouri City BubbleLife features community news, photos and events. Share your business, organization or personal news and events at https://t.co/1eYDudtR3a.","A$AP Bari &amp; A$AP Rocky Launch VLONE x Off-White Collaboration https://t.co/wEHv5blcYf",,,"29.52869987","-95.52919769","US","Missouri City, TX","http://pbs.twimg.com/profile_images/531854658973609985/TRcyCLiq_normal.jpeg","168","122","6","en","http://www.twitter.com/MissouriCityBL/status/721146118151749632"
"721146117879111684 ","2016-04-16","01:20","Ryan Jaimangal","DaColdOneIVS","Official Twitter of Ryan Jaimangal","w/@LeticiaVee &amp; #JulianRudolph @Beatles_Fest #FestChester #BeatlesFansUnite #TicketToRye https://t.co/fRfMgMFZOM",,,"41.00966667","-73.68804167","US","Rye Brook, NY","http://pbs.twimg.com/profile_images/644306507199303680/RSGjzm0p_normal.jpg","494","1033","9","es","http://www.twitter.com/DaColdOneIVS/status/721146117879111684"
"721146117728157696 ","2016-04-16","01:20","Inquebrantable","RaphaLeCoq","Future Lawyer. Altanero, Precioso y Orgulloso.","#friendsforever @ El Palacio De Los Palacios https://t.co/Zb7ysaxg7m",,,"19.4360163","-99.20149465","MX","Miguel Hidalgo, Distrito Federal","http://pbs.twimg.com/profile_images/720820599191285760/C654CW-l_normal.jpg","702","691","6","es","http://www.twitter.com/RaphaLeCoq/status/721146117728157696"
"721146114087522304 ","2016-04-16","01:20","B. Reed","bReedify","Some stupid guy, with a car. I enjoy comics and hockey more than the average meatbag. Constantly feelin the aster. Human customs still elude me.","First poutine experience. @ Penn Brewery https://t.co/GCfVhk5YwY",,,"40.45667402","-79.9915297","US","Pittsburgh, PA","http://pbs.twimg.com/profile_images/710853239529414656/cV6oOhGB_normal.jpg","523","400","16","en","http://www.twitter.com/bReedify/status/721146114087522304"
"721146113521250304 ","2016-04-16","01:20","chris cheers","cheerless","I am a dad to 2 wonderful girls and a husband to an awesome woman. love to ride bicycles and just having fun.","Drinking a Live by @stbcbeer @ Chris's Basement Pub — https://t.co/xWJpz5SeIW #photo",,,"39.4198","-84.2015","US","Lebanon, OH","http://pbs.twimg.com/profile_images/561941339840217088/sWpNtzP2_normal.jpeg","41","101","1","en","http://www.twitter.com/cheerless/status/721146113521250304"
