"721136404638642176 ","2016-04-16","00:41","Frederick Roth","FMR0662",,"With @justbesuzyq (@ TGI Fridays in Rockford, IL) https://t.co/OEnPkINaEm",,,"42.24095703","-88.97886157000001","US","Cherry Valley, IL","http://pbs.twimg.com/profile_images/1018417427/me_normal.jpg","414","1532","13","en","http://www.twitter.com/FMR0662/status/721136404638642176"
"721136401354518528 ","2016-04-16","00:41","Shannon ☕️","909coffeejunkie","Single mother, caffeine junkie, gamer, tattooed geek girl who can bake a mean pie and kick ass on COD! Kik-FoxieByte PSN-FoxieByte Xbox-FoxieByte","Managed to snag one of @target beauty boxes before they sold out online. Got some good stuff in… https://t.co/L99hEMCEJQ",,,"34.13309959","-117.64106444","US","Upland, CA","http://pbs.twimg.com/profile_images/710191642381189120/TgOu0ZKd_normal.jpg","181","331","6","en","http://www.twitter.com/909coffeejunkie/status/721136401354518528"
"721136399794233349 ","2016-04-16","00:41","Lena Hammond","Hamolena",,"https://t.co/q8WcX4SMmz",,,"37.69916313","-123.01142472","US","California, USA","http://pbs.twimg.com/profile_images/616668022883921924/DgL0vIR0_normal.jpg","5","4",,"es","http://www.twitter.com/Hamolena/status/721136399794233349"
"721136394329059328 ","2016-04-16","00:41","Wedding_Inspirations","Weddinginspi","Wedding Blogger Follow me on instagram @the_wedding_inspirations ❤️","@Lazaro_Bridal Finale! ⭐️ #bridalweek #nybfw #bridalfashionweek #theweddinginspirations @ 404 NYC https://t.co/4ZMGdR6sJR",,,"40.7539368","-73.99941250000001","US","Manhattan, NY","http://pbs.twimg.com/profile_images/441584746280538112/dNhCXjOJ_normal.jpeg","222","96","11","en","http://www.twitter.com/Weddinginspi/status/721136394329059328"
"721136393846657025 ","2016-04-16","00:41","Alan Ivey","alanthing","Senior Systems Administrator at @BAOSystems","Tomorrow... @ Electric Factory https://t.co/uNI9n3cKl0",,,"39.9592319","-75.15006200000001","US","Philadelphia, PA","http://pbs.twimg.com/profile_images/609088677281595392/_FW8UZFb_normal.jpg","324","356","9","en","http://www.twitter.com/alanthing/status/721136393846657025"
"721136393330761729 ","2016-04-16","00:41","Diana Pruett","dmcpruett","Never underestimate the importance of having fun.","I do believe those are some of the cutest puppies I've ever seen! https://t.co/XMwfo0xCjJ",,,"35.2043919","-78.7729456","US","North Carolina, USA","http://pbs.twimg.com/profile_images/719600655669858306/riXL92Ca_normal.jpg","78","434","1","en","http://www.twitter.com/dmcpruett/status/721136393330761729"
"721136388758843392 ","2016-04-16","00:41","Greg S.","Gucci805","Young, Black & Gifted","😎 Another great painting to add to the collection from my favorite artist @tifstarr… https://t.co/hvYFFuACg0",,,"34.1913","-119.182","US","Oxnard, CA","http://pbs.twimg.com/profile_images/1440077382/image_normal.jpg","163","154","5","en","http://www.twitter.com/Gucci805/status/721136388758843392"
"721136386204659712 ","2016-04-16","00:41","Un Giorno Nella Vita","UnGiornoNellaVi","IT NERD | PHOTOGRAPHER | BLOGGER | POET | WANDERLUST","I just couldn't resist! 😆 Hehehehe! 😜 #livelife #havefun #historic #WorldWarI #museum… https://t.co/CL4C2Ce91b",,,"39.08067614","-94.58608225","US","Kansas City, MO","http://pbs.twimg.com/profile_images/531847663310753793/CPWGRjVa_normal.jpeg","527","971","51","en","http://www.twitter.com/UnGiornoNellaVi/status/721136386204659712"
"721136382161256448 ","2016-04-16","00:41","CHOMP","CHOMPJobs","Community Hospital of the Monterey Peninsula is #hiring! Apply to our open #jobs here.","#Clerical alert: Senior Administrative Assistant - CE... | #CHOMP | #Monterey, CA https://t.co/TRNyn6M5D5 #NorCal https://t.co/c3vM3LiKNG",,,"36.5790057","-121.913238","US","Monterey, CA","http://pbs.twimg.com/profile_images/714929890181689344/tQ_UL1ID_normal.jpg","70","27","63","es","http://www.twitter.com/CHOMPJobs/status/721136382161256448"
"721136379598610432 ","2016-04-16","00:41","Michael T. Rose","MikeTRose","Solution engineer @salesforce, tech writer & editor, improviser, @heidihoover's spouse, dad. Tweets are not the opinion of my employer(s). @TUAW 2006-2015","Relocating @heidihoover's toe. (@ NYU Langone Medical Center Cobble Hill in Brooklyn, NY) https://t.co/0SjWuo5OnL","1","2","40.69004792","-73.99800161","US","Brooklyn, NY","http://pbs.twimg.com/profile_images/574686219105214464/TfcLEN4y_normal.jpeg","7109","4592","488","en","http://www.twitter.com/MikeTRose/status/721136379598610432"
"721136379447681024 ","2016-04-16","00:41","Johnny Cantrell","whipslanger",,"Too many to tag @rangers @ Texas Rangers Ballpark In Arlington https://t.co/5GwPh3CGrw",,,"32.75136143","-97.08281134000001","US","Arlington, TX","http://pbs.twimg.com/profile_images/666266582218215424/_qY8Tn6h_normal.jpg","435","1609","10","en","http://www.twitter.com/whipslanger/status/721136379447681024"
"721136379095191553 ","2016-04-16","00:41","Nikole","OsmaraNikole","Nada de lo que tuiteo es para tomarse en serio.       sn:osmaranikole","I'm at El Canto de las Sirenas in Cuauhtémoc, DF https://t.co/n8XsVmvBHH",,,"19.43950038","-99.16841407","MX","Miguel Hidalgo, Distrito Federal","http://pbs.twimg.com/profile_images/719861180227956736/RB1ZV4ea_normal.jpg","576","761","10","es","http://www.twitter.com/OsmaraNikole/status/721136379095191553"
"721136376364736512 ","2016-04-16","00:41","Robinette Farms","robinettefarms","Small scale diversified family farming: 5 acres of vegetables and honeybees!","Farm dog Moxie waiting with me while the irrigation lines pressurize. The building in the… https://t.co/2t20Q8qA00",,,"40.63712893","-96.7438877","US","Nebraska, USA","http://pbs.twimg.com/profile_images/3480502551/6da8be38e28980f53d34d82a9e069776_normal.jpeg","376","290","11","en","http://www.twitter.com/robinettefarms/status/721136376364736512"
"721136374775033856 ","2016-04-16","00:41","ExpressCareers","expresscareers","Love everything fashion and the latest trends and styles?  Why not mix business with pleasure - work at Express, we're hiring!","#Sales #Job in #Knoxville, TN: Sales Associate at Express https://t.co/XHk7H9G1CQ #express #Jobs #Hiring https://t.co/8d7eB2Iw9d",,,"35.9606384","-83.9207392","US","Knoxville, TN","http://pbs.twimg.com/profile_images/639785149958197248/oyETjbK6_normal.jpg","317","62","298","en","http://www.twitter.com/expresscareers/status/721136374775033856"
"721136373189775360 ","2016-04-16","00:41","Ms R Pittman","Lubibah","Philly Familys Connections LLC 1-888-454-4899 ( we keep families connected )","2 available seats for.Sci Greene on Sunday April 17 reserve at… https://t.co/5rV6ceyQlW",,,"39.998","-75.1448","US","Philadelphia, PA","http://pbs.twimg.com/profile_images/435675133429039106/G12hmrg6_normal.jpeg","113","192","5","en","http://www.twitter.com/Lubibah/status/721136373189775360"
"721136372900188162 ","2016-04-16","00:41","Jennifer","jmalo17","Happily living in D.C. Watching the Nats, enjoying the neighborhoods and working zero-carbon nuclear energy. If I am not around, I am probably reading.","#sparheels @ Raaga Restaurant &amp; Lounge https://t.co/JTM4dHf4pU",,,"35.9064977","-79.02196790000001","US","Chapel Hill, NC","http://pbs.twimg.com/profile_images/665218968093749248/vR6ljiJk_normal.jpg","33","319",,"es","http://www.twitter.com/jmalo17/status/721136372900188162"
"721136371889414145 ","2016-04-16","00:41","TMJ-AZ HRTA Jobs","tmj_az_hrta","Follow this account for geo-targeted Hospitality/Restaurant/Tourism job tweets in Arizona Non-Metro. Need help? Tweet us at @CareerArc!","We're #hiring! Read about our latest #job opening here: Cook - https://t.co/nacmzV3hfq #SONIC #BullheadCity, AZ #Hospitality #CareerArc",,,"35.0892134","-114.5975243","US","Bullhead City, AZ","http://pbs.twimg.com/profile_images/669380325152133120/B-jyftih_normal.jpg","332","291","32","en","http://www.twitter.com/tmj_az_hrta/status/721136371889414145"
"721136371797200896 ","2016-04-16","00:41","Eddie Landry","Landry_Photo","I am a part time photographer based out of Columbus, OH. I specialize in portrait, equine, and event photography.","New hobbles from western horseman co. Looking forward to taking the info learned from Doug… https://t.co/GzpBE8bsGm",,,"40.09777","-82.7539","US","Ohio, USA","http://pbs.twimg.com/profile_images/1453382377/smoke_normal.jpg","135","345","2","en","http://www.twitter.com/Landry_Photo/status/721136371797200896"
"721136371210010625 ","2016-04-16","00:41","Virginia Guillén.","virginiaguillen","Diseñadora Venezolana.Twitter:@virginiaguillen Facebook:Virginia Guillen Accesorios Instagram:@virginiamguillen @virginiaguillenaccesorios☎️0212-8826309","#Repost petris1977 with repostapp. ・・・ Con mi querida Barbie, estrenando su regalito que le… https://t.co/xEnZRW61Ne",,,"25.7877","-80.22410000000001","US","Miami, FL","http://pbs.twimg.com/profile_images/555265835632435200/T_5V-h7e_normal.jpeg","813","2030","8","es","http://www.twitter.com/virginiaguillen/status/721136371210010625"
"721136370480189440 ","2016-04-16","00:41","Amy Coletta","AmyColetta","Regional Manager for RE/MAX Results, lover of iThings, blogger, USMC mom, wife and dog owner. Oh-and food snob. #INFJ","Love the verdigris steeple. @ The Anchor Fish &amp; Chips https://t.co/Md4TC4M2KY",,,"45.00059","-93.2643499","US","Minneapolis, MN","http://pbs.twimg.com/profile_images/378800000772380915/8b00464592dc97e74ac064b7a1e60f53_normal.jpeg","2100","1711","62","en","http://www.twitter.com/AmyColetta/status/721136370480189440"
"721136370152935426 ","2016-04-16","00:41","TMJ-SAC Nursing Jobs","tmj_sac_nursing","Follow this account for geo-targeted Healthcare-Nursing job tweets in Sacramento, CA. Need help? Tweet us at @CareerArc!","#Nursing in #Roseville, CA: RN Case Manager - Roseville (Per diem-Days) at Sutter Health Sacramento Sierra ... https://t.co/JH7po70JVJ",,,"38.7521235","-121.2880059","US","Roseville, CA","http://pbs.twimg.com/profile_images/668515085598363648/ULFM04uB_normal.jpg","578","303","65","en","http://www.twitter.com/tmj_sac_nursing/status/721136370152935426"
"721136369620267008 ","2016-04-16","00:41","TMJ-CA HRTA Jobs","tmj_ca_hrta","Follow this account for geo-targeted Hospitality/Restaurant/Tourism job tweets in California Non-Metro. Need help? Tweet us at @CareerArc!","Want to work in #Tulare, CA? View our latest opening: https://t.co/KRSWyHcZso #Hospitality #Job #Jobs #Hiring #CareerArc",,,"36.2077288","-119.3473379","US","Tulare, CA","http://pbs.twimg.com/profile_images/666794831088234496/d0myNv4o_normal.jpg","451","297","112","en","http://www.twitter.com/tmj_ca_hrta/status/721136369620267008"
"721136369305722881 ","2016-04-16","00:41","LA Healthcare Jobs","tmj_lax_health","Follow this account for geo-targeted Healthcare job tweets in Los Angeles, CA. Need help? Tweet us at @CareerArc!","#Healthcare #Job in #LongBeach, CA: Specialist, Recruitment at Molina Healthcare https://t.co/rQiyCDVGSQ #Jobs #Hiring #CareerArc",,,"33.7700504","-118.1937395","US","Long Beach, CA","http://pbs.twimg.com/profile_images/666960686522761221/JK4S8PYO_normal.jpg","903","307","136","en","http://www.twitter.com/tmj_lax_health/status/721136369305722881"
"721136367565172736 ","2016-04-16","00:41","bob a palczynski jr","dj13905",,"Just posted a photo @ Watkins Glen State Park https://t.co/c9HB3nVSsO",,,"42.377059","-76.87168699999999","US","Watkins Glen, NY","http://pbs.twimg.com/profile_images/1170458652/image_normal.jpg","53","215",,"en","http://www.twitter.com/dj13905/status/721136367565172736"
"721136367175135232 ","2016-04-16","00:41","KFJ","kevinthejvr","If I'm being quiet, it just mean I have nothing nice to say.","I'm at Bennigans in Saginaw, MI https://t.co/T77SJfTM1u",,,"43.4794945","-83.97764795000001","US","Saginaw Township North, MI","http://pbs.twimg.com/profile_images/702663680706670592/9APlhe_H_normal.jpg","179","161","16","en","http://www.twitter.com/kevinthejvr/status/721136367175135232"
"721136367091216384 ","2016-04-16","00:41","Jorge Jiménez","zeroyorch","Snapchat / Instagram: zeroyorch","Sin miedo con los tiburones! #Isla #PlayaTiburones #Cancun @ Isla… https://t.co/9TJMezTXGD",,,"21.22327665","-86.73349555","MX","Isla Mujeres, Quintana Roo","http://pbs.twimg.com/profile_images/479856022538842113/KdGFeiI2_normal.jpeg","233","1579","9","es","http://www.twitter.com/zeroyorch/status/721136367091216384"
"721136366751342592 ","2016-04-16","00:41","Kyle Smith","Toolguy5700","Just a low level mountain bike racer trying to get faster.","#trekbikes #mtbrace #snowbasin #mtnbike @ Snowbird Mountain Resort https://t.co/btMW9UUX2z",,,"40.58106128","-111.65668272","US","Utah, USA","http://pbs.twimg.com/profile_images/683510801555042305/cTXqCYVR_normal.jpg","14","59","1","en","http://www.twitter.com/Toolguy5700/status/721136366751342592"
"721136366554386432 ","2016-04-16","00:41","NWS Severe Tstorm","NWSSevereTstorm","Official Twitter National Weather Service account used to distribute experimental severe thunderstorm impact graphics. Read more at: http://t.co/j1qyDV2Jw5","⚠️ Severe Thunderstorm Warning including Black Mesa Park OK, Kenton OK, Wheeless OK until 8:00 PM CDT https://t.co/eRDlGa2fC7",,"1","36.85208842","-102.80876158","US","Oklahoma, USA","http://pbs.twimg.com/profile_images/473926382393643009/vxIWpuvl_normal.png","11749",,"593","en","http://www.twitter.com/NWSSevereTstorm/status/721136366554386432"
"721136365694418945 ","2016-04-16","00:41","Mike LaShawn","mikelashawn","old musician, 22 yrs old, hailing from Cleveland, you'll find my music in my url, my name is Michael. Special things happen.(216) 203-8622 for iPhone repairs.","This all you need to know; Keep ya mouth closed.",,,"41.48621","-81.62707","US","Cleveland, OH","http://pbs.twimg.com/profile_images/718592971621416960/mrN7Ne7n_normal.jpg","971","357","3","en","http://www.twitter.com/mikelashawn/status/721136365694418945"
"721136364528517120 ","2016-04-16","00:41","Danielle C. Campbell","danicarocamp","#MSU Advertising. Affiliated w/ @MSU_Eship , @MSU_Innovation & @MSUHatch. IG: danicarocamp #LetItBe #GoGreen #DogMom to @thenameisbrody","Brody for Michigan Governor @ Michigan State Capitol https://t.co/0qVbAxpGrn",,,"42.73351592","-84.55470221","US","Lansing, MI","http://pbs.twimg.com/profile_images/700413228128403456/GDkjfzhE_normal.jpg","787","2117","12","en","http://www.twitter.com/danicarocamp/status/721136364528517120"
"721136362712215552 ","2016-04-16","00:41","Destination Jobs","DestinationJobs","The Destination Hotels collection includes award-winning hotels & resorts in premier vacation destinations around the U.S. Check here for open jobs. #hiring","Can you recommend anyone for this #Hospitality #job? https://t.co/B5qJeqIWrv #RanchoPalosVerdes, CA #Hiring",,,"33.7444613","-118.3870173","US","Rancho Palos Verdes, CA","http://pbs.twimg.com/profile_images/609368691415711744/AAI1ubpI_normal.jpg","304","2","454","en","http://www.twitter.com/DestinationJobs/status/721136362712215552"
"721136362015973376 ","2016-04-16","00:41","Montana Rose","MontanaRose06","Instagram: mrj_06","I spent $11 on a beer and it was worth it 🍻 @ Yankee Stadium https://t.co/Jd3rEFvr3Q",,,"40.82926679","-73.92657946999999","US","Bronx, NY","http://pbs.twimg.com/profile_images/718439873112379392/uYF4Uo0g_normal.jpg","505","937","7","en","http://www.twitter.com/MontanaRose06/status/721136362015973376"
"721136360321523712 ","2016-04-16","00:41","Melissa Brandon","MelissaLily5","surround yourself with the dreamers and the doers, the believers and the thinkers.","Watch us while we do our thang!💋 It's opening night everyone! Doors open at 7:30pm CGCC'S PAC… https://t.co/Va4UCa9ID9",,,"33.29430576","-111.79651022","US","Chandler, AZ","http://pbs.twimg.com/profile_images/712867515467169792/w9lOG_Xp_normal.jpg","94","69",,"en","http://www.twitter.com/MelissaLily5/status/721136360321523712"
"721136360124522497 ","2016-04-16","00:41","Melinda Linscott","dykademic","PhD candidate dissertating on early modern poetry at #IdahoState Professing literature and writing at #UIdaho and #SNHU. Mainiac. (tweets in own (in)capacity)","Before the boats #spring #chicago #chicagogram #instachicago #lakemichigan #greatlakes #marina @… https://t.co/NyGsvx5hjr",,,"41.88759347","-87.61383685","US","Chicago, IL","http://pbs.twimg.com/profile_images/515910145000624128/LgoPU_AP_normal.jpeg","1623","1887","59","en","http://www.twitter.com/dykademic/status/721136360124522497"
"721136358996209664 ","2016-04-16","00:41","Anthony J Barton","AnthonyJBarton","Fan of Formula 1 and Motogp .Check out my store. Alonso and Rossi Caps in stock ! #Sot  ΜΟΛΩΝ-ΛΑΒΕ #TGDN #UNITERIGHT #SOT","@vinodch8560 @leonalombaerts @1madwoman1962 @miguelgraug @FRISEEMYRIAM @RosaTrunk @nancyjsiebert @MARISADICICCO https://t.co/18f6WntO3v",,,"42.2786","-71.8408","US","Worcester, MA","http://pbs.twimg.com/profile_images/2630893056/a214518a5ba33afe2540306e4dccc35e_normal.jpeg","4755","819","95","es","http://www.twitter.com/AnthonyJBarton/status/721136358996209664"
"721136358517972992 ","2016-04-16","00:41","Igor J. Weisbrot","IgorWeisbrot","A True Original","#mustlovedogs❤️ #maxrulesthehouse #maxhatesselfies #silkyterrier @… https://t.co/msmhQecnEG",,,"26.1764","-80.14449999999999","US","Oakland Park, FL","http://pbs.twimg.com/profile_images/720243272430563330/wWr7QgIx_normal.jpg","53","219","15","es","http://www.twitter.com/IgorWeisbrot/status/721136358517972992"
"721136357817651201 ","2016-04-16","00:41","Stephii","geminirhymeorit","Life is in Love with ME!!","Corsi Seniors were lit!!! 💯💯💯👍👍 @ Corsi Senior Citizen Center https://t.co/rmAYZfdazH",,,"40.79693819","-73.93659017","US","Manhattan, NY","http://pbs.twimg.com/profile_images/615657768633135104/HPKORoAL_normal.jpg","144","312","1","it","http://www.twitter.com/geminirhymeorit/status/721136357817651201"
"721136357431750657 ","2016-04-16","00:41","Terry F Smith","Terry_Fng_Smith","Legend/figment in my own mind, comedy writer, actor, social media Guru, editor, thinker, funniest guy in room","Welcome to #hollywood now go fuck yourself. #GegoffmyYard #HollywoodSign #California… https://t.co/JCWWGPfCHj",,,"34.12863","-118.32157281","US","Los Angeles, CA","http://pbs.twimg.com/profile_images/525464727829245952/6uCmCzt8_normal.png","209","39","10","en","http://www.twitter.com/Terry_Fng_Smith/status/721136357431750657"
"721136355997130753 ","2016-04-16","00:41","flairlair","flairlair",,"Flowering #cacti @ Arroyo Verde Park https://t.co/GEtGw058pg",,,"34.28605607","-119.22584332","US","Ventura, CA","http://pbs.twimg.com/profile_images/461691467623174144/L6YYxpGJ_normal.jpeg","29","143","7","en","http://www.twitter.com/flairlair/status/721136355997130753"
"721136354797686785 ","2016-04-16","00:41","Lawrence F","Orderup34","pics are of my own food","Last one of Jezebel sound system @ Our Solitude https://t.co/JXI80yObmq",,,"33.82244234","-118.26506631","US","Carson, CA","http://pbs.twimg.com/profile_images/378800000532333046/e26a8622bde4cba0aa8ea12def064e29_normal.jpeg","217","693","10","en","http://www.twitter.com/Orderup34/status/721136354797686785"
"721136354021679104 ","2016-04-16","00:41","DeRon Juan","DeRonJuan","The Big Homie @102Jamz mixsquad DJ(M-W 10-11pm),I rock radio & clubs! BB is my everything and Gus is my dog.Instagram:DeRonJuan Send music 2 deronjuan@gmail.com","Headed to Raleigh like ....meet me at NOIR! @ I 85 https://t.co/wq7NWcp8hP",,,"36.06335382","-79.42791027","US","Burlington, NC","http://pbs.twimg.com/profile_images/626452712813629440/WZT2fsBw_normal.jpg","4409","986","41","en","http://www.twitter.com/DeRonJuan/status/721136354021679104"
"721136353786904577 ","2016-04-16","00:41","Dann.⚡️","DanLp2107","One step, one hit, and one round at a time. Snapchat : danlopz21","I'm at Pistos Pits santa Mónica in Jacarandas, Tlalnepantla Edo De Mexico https://t.co/S1cCrHqQE6",,,"19.53510952","-99.23295613000001","MX","Tlalnepantla de Baz, México","http://pbs.twimg.com/profile_images/720077875831934976/sf9sUue5_normal.jpg","181","635","3","es","http://www.twitter.com/DanLp2107/status/721136353786904577"
"721136352763322368 ","2016-04-16","00:41","Lauren Marie Pena","LaurenMariePena","Expat. Bohemian. Actress. Filmmaker. Yogi. Dancer. Astrology. Trendsetter. Transatlantic. Cubana-Boriqua. LA✖️MIA✖️LDN✖️USA✖️UK @udayayoga @rawkmantra","on set with the amazingly talented Álex González from España 🇪🇸🇪🇸🇪🇸 what a great experience !… https://t.co/PmsTL4JSin",,"2","34.0522","-118.243","US","Los Angeles, CA","http://pbs.twimg.com/profile_images/714643778280235008/QWLWryTC_normal.jpg","795","469","21","es","http://www.twitter.com/LaurenMariePena/status/721136352763322368"
"721136351987548160 ","2016-04-16","00:41","Alex Schlink","aschlink2","Katelyn Jeffrey is babe","Come check out the maricopacountyfair and come watch me and the superherostuntteam put on a… https://t.co/ikBeFw8c8u",,,"33.46809431","-112.09851711","US","Phoenix, AZ","http://pbs.twimg.com/profile_images/682118040192823297/qdZD91UW_normal.jpg","468","450","3","en","http://www.twitter.com/aschlink2/status/721136351987548160"
"721136350968299521 ","2016-04-16","00:41","Andrea.","AndieHdez","XXI. Cancún. ⚾️. ⚽️.","⚾️🐯 (@ Estadio Beto Ávila - @tigresqroficial in Cancún, QR) https://t.co/4j9HoEupNQ",,,"21.15215598","-86.83705329999999","MX","Benito Juárez, Quintana Roo","http://pbs.twimg.com/profile_images/717200506800750593/mn5IK9fF_normal.jpg","1647","171","34","es","http://www.twitter.com/AndieHdez/status/721136350968299521"
"721136350234296320 ","2016-04-16","00:41","kv","captainkarly","|| goal digger || FSU18 || All-Night Yahtzee Acappella ||","you a bad girl &amp; ya (best) friend's bad too ✌🏼️ @ Miami Lakes Ale House https://t.co/2XgXHlUTAz",,,"25.912847","-80.309185","US","Miami Lakes, FL","http://pbs.twimg.com/profile_images/709229973106774016/_W6k0kzL_normal.jpg","651","551","6","en","http://www.twitter.com/captainkarly/status/721136350234296320"
"721136349949136896 ","2016-04-16","00:41","Hager/Muse/Sales","CEKinders",,"Kindergarten loved Onebanc visiting us and teaching us how to save!!  Thank you Mrs. Christina https://t.co/7y3Egnguz0",,,"39.53713492","-86.77173547","US","Indiana, USA","http://pbs.twimg.com/profile_images/509338824112373761/CXTS6s_f_normal.jpeg","82","75",,"en","http://www.twitter.com/CEKinders/status/721136349949136896"
"721136349827325952 ","2016-04-16","00:41","Jobs at VA","JobsatVA","This is our #jobs feed. Follow @VACareers to connect.","Can you recommend anyone for this #Healthcare #job? https://t.co/Y7Yo95Wrpe #Columbia, SC #Veterans #Hiring https://t.co/OrUKIMQGSA",,,"34.0007104","-81.0348144","US","South Carolina, USA","http://pbs.twimg.com/profile_images/527141119344123904/_GQQe9Or_normal.png","661","1","633","en","http://www.twitter.com/JobsatVA/status/721136349827325952"
"721136349496098816 ","2016-04-16","00:41","Jess McDade","jessmcdade","They say I'm fat, I say I'm blessed. They want me to fail, I said I'm great. They want to finish me, they played themselves. #BlessUp","I'm gonna miss these bitties. ❤️ @ Emilianos Mexican Restau https://t.co/RvVSOACgPD",,,"40.42764735","-79.96846474","US","Pittsburgh, PA","http://pbs.twimg.com/profile_images/671559699783905280/8j48v8zj_normal.jpg","607","554","3","en","http://www.twitter.com/jessmcdade/status/721136349496098816"
"721136349340954624 ","2016-04-16","00:41","Erin Beal","ErinBeal8",,"Friday night ... @ Boise, Idaho https://t.co/a5dakDrAUR",,,"43.61666667","-116.2","US","Boise, ID","http://pbs.twimg.com/profile_images/720287254946578434/ATWvEtHA_normal.jpg","13","45",,"en","http://www.twitter.com/ErinBeal8/status/721136349340954624"
"721136349294804992 ","2016-04-16","00:41","Pinky All Day....","Pinky808","Count your blessings, not your burdens.","OMG!  Sooo good! #oreos #deepfried #dessert #fatshack #foco #colorado @ Fat Shack https://t.co/lwF0Q61nYx",,,"40.577695","-105.076922","US","Fort Collins, CO","http://pbs.twimg.com/profile_images/674100863015649280/oniYymBB_normal.jpg","446","365","13","en","http://www.twitter.com/Pinky808/status/721136349294804992"
"721136347692539904 ","2016-04-16","00:41","Marisol ","Zolimar","No es que este despeinada, es que mi cabello tiene libertad de expresión... jijiji","😍😍 (@ Wing's Army in Nuevo León) https://t.co/LkL2KZxURR https://t.co/JOhsF5b2KG",,,"25.77874108","-100.27599798","MX","General Escobedo, Nuevo León","http://pbs.twimg.com/profile_images/665035504887316481/Ju3K9IOY_normal.jpg","520","675","14","es","http://www.twitter.com/Zolimar/status/721136347692539904"
"721136347419959297 ","2016-04-16","00:41","lacavedechampignons","cavechampignons","La Cave De Champignons Brasserie","Really thin - Drinking a Guinness Draught by @GuinnessIreland @ La Cave De Champignons Brasserie  — https://t.co/F6nG8J83lL",,,"35.0835","-81.0947","US","Lake Wylie, SC","http://pbs.twimg.com/profile_images/572560848901840896/vG5dUIAE_normal.jpeg","197","504","16","en","http://www.twitter.com/cavechampignons/status/721136347419959297"
"721136346891489280 ","2016-04-16","00:41","Lindsay Sheridan","LindsayElizS","Emerging arts leader. Social entrepreneur. Violist. Coffee enthusiast. @wsmsdecorah founder, @cathedralchoral marketing.","I'm liking this view. #carminaweek @ The John F. Kennedy Center for the Performing Arts https://t.co/etEntiCshy",,,"38.89603298","-77.0555104","US","Washington, DC","http://pbs.twimg.com/profile_images/507372082166894593/2wdl9SUt_normal.jpeg","270","637","16","en","http://www.twitter.com/LindsayElizS/status/721136346891489280"
"721136346430115842 ","2016-04-16","00:41","Amy Bennett Coats","misskitcat","Project Manager","Just posted a photo @ Colombia Spanish Restaurant https://t.co/FhC1PmMBwb",,,"28.31793","-81.53925","US","Celebration, FL","http://pbs.twimg.com/profile_images/533007265922437120/3pNNmT72_normal.jpeg","844","978","42","en","http://www.twitter.com/misskitcat/status/721136346430115842"
