"721184432342700032 ","2016-04-16","03:52","Dr. Gregory Canillas","DrGJCanillas","Psychologist Assoc Professor Relationship/Parenting Expert International Speaker Commission for Youth & Children Writer Man about Town. Follow on IG: DrC9","Celebrating Tammy and Amaya's birthdays #Celebration #FunTimes #Philippes #philippechow… https://t.co/JU7mSDSa7a",,,"34.06579","-118.37899","US","Beverly Hills, CA","http://pbs.twimg.com/profile_images/524587815128952832/GJuMWQcF_normal.jpeg","2493","533","14","en","http://www.twitter.com/DrGJCanillas/status/721184432342700032"
"721184430518321152 ","2016-04-16","03:52","The Cylorian","Tyshaun_TLD","IG: Cyloral guitarist song writer and music composer https://t.co/deU5rLdWkN Cyloric Divinity","#msa #fasionshow #wsu #multiculturalfasionshow @ Westfield State University https://t.co/thEkTihroT",,,"42.13124299","-72.79443919000001","US","Westfield, MA","http://pbs.twimg.com/profile_images/691342875708243970/64ABiduv_normal.jpg","38","192","2","en","http://www.twitter.com/Tyshaun_TLD/status/721184430518321152"
"721184429410922496 ","2016-04-16","03:52","INSTITUTO  YITS'ATIL","InstitutoYitsa","Escuela bilingüe/Inteligencia emocional/Excelencia educativa Convenio con las mejores universidades del país KINDER PRE-FIRST  PRIMARIA SECUNDARIA PREPARATORIA","SECUNDARIA | Excursión Chichén Itzá 2016 Jueves 14 Abril. Noches de Kukulcán. El nuevo… https://t.co/rBj74Cirsw",,,"20.63382344","-87.07183084","MX","Solidaridad, Quintana Roo","http://pbs.twimg.com/profile_images/446354349858357248/IMTZVX-n_normal.png","297","180","11","es","http://www.twitter.com/InstitutoYitsa/status/721184429410922496"
"721184425896243200 ","2016-04-16","03:52","Jordan","JordanVardSmith",,"Day 1 .. #coachella @ Coachella Music and Arts Festival https://t.co/01TWfCFiV4",,,"34.02432516","-118.27613711","US","Los Angeles, CA","http://pbs.twimg.com/profile_images/618492762548105217/5SUb-ii4_normal.jpg","605","568","5","en","http://www.twitter.com/JordanVardSmith/status/721184425896243200"
"721184425464184833 ","2016-04-16","03:52","Kenny Pierce","PiercingKen","Founder of http://t.co/Yh3jpMch, Media Guru, Writer & Photographer. This is the Maestro behind the Metal curtain.","A beverage with Ambassador (@ Jimmy's Corner in New York, NY) https://t.co/bJvClifayp https://t.co/QKFBSYhmbR",,,"40.75682592","-73.98487676000001","US","Manhattan, NY","http://pbs.twimg.com/profile_images/833582053/DSC_2415_normal.jpg","280","53","9","en","http://www.twitter.com/PiercingKen/status/721184425464184833"
"721184422892929024 ","2016-04-16","03:52","freeDOM","Dom_DeMoss",,"The closest thing we have to a roommate picture 💁🏡 @ Cal Poly Rodeo Arena https://t.co/zD58ZRDTfj",,,"35.30882679","-120.67080859","US","California, USA","http://pbs.twimg.com/profile_images/677757939797508096/iTCTX9N3_normal.jpg","120","201",,"en","http://www.twitter.com/Dom_DeMoss/status/721184422892929024"
"721184422188474368 ","2016-04-16","03:52","Armando Flores Durón","mandofd13","Structural Engineer | Catholic | Honduran | Real Madrid Superfan Trying to change the world one person at a time!","Drinking a Fat Tire by @newbelgium @ Bus Stop — https://t.co/3lyJV81Mba",,,"34.0976","-84.611","US","Georgia, USA","http://pbs.twimg.com/profile_images/484749219757326337/g3pis834_normal.jpeg","186","345","12","en","http://www.twitter.com/mandofd13/status/721184422188474368"
"721184413418172416 ","2016-04-16","03:52","Eugene Griffin","egrifen",,"https://t.co/nBJaeovhtM",,,"37.69928462","-123.01212067","US","California, USA","http://pbs.twimg.com/profile_images/596711266875346944/fyYmgQ3L_normal.png","5",,"3","es","http://www.twitter.com/egrifen/status/721184413418172416"
"721184413040533504 ","2016-04-16","03:52","Ali V.","ThisIsAliV","My name is NOT Allison. I like sports. Sometimes I'll even write about it too. When I'm not doing that I sometimes plan events. I also love potatoes.","The Season Of The Bourbon! #CCSLBarCrawl @ South Philadelphia Tap Room https://t.co/GnALv9WrjW",,,"39.92714","-75.17149000000001","US","Philadelphia, PA","http://pbs.twimg.com/profile_images/499665017881382912/VtzqvcNX_normal.jpeg","174","874","7","en","http://www.twitter.com/ThisIsAliV/status/721184413040533504"
"721184412432494593 ","2016-04-16","03:52","Preeti","PreetoDorito","Penn State 2018.","Go best friend, that's my best friend.💩🇮🇳 @ University Terrace… https://t.co/kRprZpHGfB",,,"40.80044245","-77.84617253","US","State College, PA","http://pbs.twimg.com/profile_images/717560654975016960/1oudO6YZ_normal.jpg","813","538","3","en","http://www.twitter.com/PreetoDorito/status/721184412432494593"
"721184408984621057 ","2016-04-16","03:52","Christian Bomar ","christianxbomar","international playboy","I'm at a party and I wanna kill myself",,,"37.39140098","-79.18498891","US","Lynchburg, VA","http://pbs.twimg.com/profile_images/719222236792496128/oemdyYZ2_normal.jpg","300","216","1","en","http://www.twitter.com/christianxbomar/status/721184408984621057"
"721184408649277440 ","2016-04-16","03:52","Dan-D R.","drojasj23","Former Treasurer of RadioITAM; Economist-ish; Mañana empiezo la tesis mamá; Finance Lover. Nielsen Analyst.","Oops I did it again... (@ Bar 27 - @elveintisiete in México Df, Df) https://t.co/knNUapltVS",,,"19.35141642","-99.18776751","MX","Álvaro Obregón, Distrito Federal","http://pbs.twimg.com/profile_images/710584711941218304/zZS6eDwv_normal.jpg","184","159","4","es","http://www.twitter.com/drojasj23/status/721184408649277440"
"721184405155221504 ","2016-04-16","03:52","Jose Cota","josecota1078",,"Jose Luis cota saluditos https://t.co/TowojHD3i6",,,"32.5446","-116.8724887","MX","Tijuana, Baja California","http://abs.twimg.com/sticky/default_profile_images/default_profile_4_normal.png",,"3",,"es","http://www.twitter.com/josecota1078/status/721184405155221504"
"721184402336784384 ","2016-04-16","03:52","danielle stefanowicz","Dstefanowicz","Trying to put a smile on your face in 140 characters or less.","Hoboken... We meet again. 😈",,,"40.73928789","-74.03037266","US","Hoboken, NJ","http://pbs.twimg.com/profile_images/3249542182/85c15578c1875e3d9fef4d580f52bc26_normal.jpeg","220","294","2","en","http://www.twitter.com/Dstefanowicz/status/721184402336784384"
"721184399434194944 ","2016-04-16","03:52","Dinah Leffert","DinahLeffert","StandUp Comic/Actress. Seen on NBC, CBS, VH1, SXSW, is Director/Producer of GALÁCTICOS-11KIDS One Goal Featuring Landon Donovan (American Soccer Documentary).","Had a blast on @acomicslife with these knuckleheads mrsexcellence420 @shaunweiss Sandy and… https://t.co/frQiZxuSsI","4","2","34.1802","-118.328","US","Burbank, CA","http://pbs.twimg.com/profile_images/687519424656494593/KfOu71bI_normal.jpg","15325","9777","168","en","http://www.twitter.com/DinahLeffert/status/721184399434194944"
"721184398997983232 ","2016-04-16","03:52","M.","Mariacorrea97__","18, ¿Y tú?","¿Mejor amiga?, yo diría una hermana segunda. https://t.co/9jsA9ESUpK",,,"19.2982765","-99.077048","MX","Iztapalapa, Distrito Federal","http://pbs.twimg.com/profile_images/720089797046341632/v9-3LLNt_normal.jpg","358","69","3","es","http://www.twitter.com/Mariacorrea97__/status/721184398997983232"
"721184398545186816 ","2016-04-16","03:52","BeverlyHillsInsider","BevHillsInsider","Founder of @BevHillsInsider - A Beverly Hills Insider. Lover of all things #luxury #weddings #beverlyhills #style #fashion #pamper #RodeoDrive #indulgence","Armani Prive macarons. Yum! #thebeverlyhillsinsider #beverlyhills #armaniprive #neimanmarcus… https://t.co/N1S4r4YrzN",,,"34.066757","-118.406196","US","Beverly Hills, CA","http://pbs.twimg.com/profile_images/709899346297290753/6jB9C_QA_normal.jpg","493","378","19","en","http://www.twitter.com/BevHillsInsider/status/721184398545186816"
"721184396720648192 ","2016-04-16","03:52","Mark Young","airwolf28",,"I'm at Joe Collins Park in Union, NJ https://t.co/kbRP85arWS",,,"40.70731335","-74.29439553","US","Union, NJ","http://pbs.twimg.com/profile_images/359852464/Airwolf_logo_normal.jpg","1507","1982","105","en","http://www.twitter.com/airwolf28/status/721184396720648192"
"721184393205825536 ","2016-04-16","03:52","Grim Reaper","Laid_Thomas","Is there a heaven for a starving artist? #NewLazarus on iTunes now! #FailedMillionaires coming 5.6.16","I'm at Sidelines Sports Bar and Grill in Waterloo, IA https://t.co/8sAV8zg8gY",,,"42.47786945","-92.32328164","US","Waterloo, IA","http://pbs.twimg.com/profile_images/718089012141957120/Bj-KJ8WU_normal.jpg","12389","12459","78","en","http://www.twitter.com/Laid_Thomas/status/721184393205825536"
"721184393189060608 ","2016-04-16","03:52","Lady Craft✌️","ValeJustAname","Aspiring Ballerina.... Instagram: val_stm Periscope: valstvm","I'm at Linares Place https://t.co/Rkok3wLYPz",,,"19.41371744","-99.17329362","MX","Cuauhtémoc, Distrito Federal","http://pbs.twimg.com/profile_images/717325496652935169/r3eAzQTM_normal.jpg","156","144",,"en","http://www.twitter.com/ValeJustAname/status/721184393189060608"
"721184392958316544 ","2016-04-16","03:52","Michael Guerra","manwarmusic",,"The audacity of simplicity #commonprojects #mrporter @ South… https://t.co/kRGtuoCHAG",,,"34.11611111","-118.15027778","US","South Pasadena, CA","http://pbs.twimg.com/profile_images/638072918015021061/k6SkSahs_normal.jpg","26","52","2","en","http://www.twitter.com/manwarmusic/status/721184392958316544"
"721184385375055872 ","2016-04-16","03:52","Wade Osterhaus","wosterhaus","Enterprise Technologiy Management, IT consultant with Data Protection/Cloud architecture, Home Automation Designer Weather CW6682;  HAM call sign: KE7KLO; CCW","I'm at Chandler Community Center - @chandlerrec in Chandler, AZ https://t.co/cyV6unwoBo",,,"33.30311443","-111.83946457","US","Chandler, AZ","http://pbs.twimg.com/profile_images/1530015742/Self_normal.jpg","354","985","15","en","http://www.twitter.com/wosterhaus/status/721184385375055872"
"721184384276008961 ","2016-04-16","03:52","Deb Oswald","debikayo","Elementary and High School Art teacher, photographer, joy-giver....","Wait what??? This hive is Alive!! #bees #beekeeping #beesofinstagram #overwinter yay for our… https://t.co/LsKPOMOgXk",,,"45.92000008","-90.50264178","US","Wisconsin, USA","http://pbs.twimg.com/profile_images/624911360694980608/abfZ8ZWi_normal.jpg","279","320","41","en","http://www.twitter.com/debikayo/status/721184384276008961"
"721184384125153280 ","2016-04-16","03:52","Brookelynn","animatedvixen79","From South Carolina, live in Southern California, suffer from insanity, love sunshine, music, Britney Spears perfume, spaghetti, Zuul, and Tom Selleck.","California 💜. #california #sunset #huntingtonbeach #orangecounty @ Mama's on 39 https://t.co/fYFd3YTb08",,,"33.65734","-117.98711","US","Huntington Beach, CA","http://pbs.twimg.com/profile_images/378800000827239377/ea94dd8bca5a0740ea8dba2292db1bc0_normal.jpeg","133","733","3","en","http://www.twitter.com/animatedvixen79/status/721184384125153280"
"721184383164526593 ","2016-04-16","03:52","vooda","vooda1","pro-choice crusader, equal rights 4 all, democrat, President Obama supporter, #Hillary2016, love 2 laugh, love my family. I have ZERO time for trolls...BLOCKED!","@LarryJFJF Bullshit. We have socialist type of programs but our country will never go full socialist. Wake up",,,"40.17941399","-105.1511234","US","Longmont, CO","http://pbs.twimg.com/profile_images/713236833849573380/3qQbWKOG_normal.jpg","3433","3455","117","en","http://www.twitter.com/vooda1/status/721184383164526593"
"721184382870925312 ","2016-04-16","03:52","Pete Troast","Amorebettersn","I passed GO, but didn't collect $200...","This place makes me want to move to #Florida... 🤓🎮👾🍺 #nerd #beer #bar #vacation #drunk… https://t.co/l6NaSvFVvu",,,"28.38418245","-81.50328036000001","US","Florida, USA","http://pbs.twimg.com/profile_images/2670840110/df42823e82a46348f720f80b68318b81_normal.jpeg","80","98","22","en","http://www.twitter.com/Amorebettersn/status/721184382870925312"
"721184382741037056 ","2016-04-16","03:52","Sarah","swaggz_hard","Not everything that is faced can be changed, but nothing can be changed until it is faced. -Lucille Ball","Go where you feel alive ✨ @ Annapolis, Maryland https://t.co/QVOAkrkT2A",,,"38.9729","-76.5012","US","Annapolis, MD","http://pbs.twimg.com/profile_images/687881394568212480/gsGYMuil_normal.jpg","215","504","3","en","http://www.twitter.com/swaggz_hard/status/721184382741037056"
"721184379595317249 ","2016-04-16","03:52","Roberto Carlos","ROB_CAR_","Business Developer for Exquisitamente, a social media platform with editorial content for the gastronomy industry. Follow us on Instagram @ExquisitamenTV","En los Premios Actitud de Los Ángeles, invitados especiales de Tigo, apoyando a la comunidad de… https://t.co/oAv2bcHjFR",,,"34.03705907","-118.27706499","US","Los Angeles, CA","http://pbs.twimg.com/profile_images/540376674798284800/ro4lVDwR_normal.jpeg","297","682","27","es","http://www.twitter.com/ROB_CAR_/status/721184379595317249"
"721184378433445889 ","2016-04-16","03:52","Chelle","madbakertucson",,"Hello Kitty Cupcakes #hellokitty #hello #kitty #kids #strippers #birthdaygirl #birthday #party… https://t.co/sIjtKe5kVI",,,"32.218724","-110.811217","US","Tucson, AZ","http://pbs.twimg.com/profile_images/694967261254127616/yfpOWmR__normal.jpg","51","273","8","en","http://www.twitter.com/madbakertucson/status/721184378433445889"
"721184377019871232 ","2016-04-16","03:52","(Mr. Hinton)","AjonteAj","#Dedication #Skill #Success #Ambition #TrulyDedicated #BlackExcellence","@broken: caring too much is a bad habit of mine. Oh my god fucks my life up I swear",,,"39.7743385","-104.7985884","US","Denver, CO","http://pbs.twimg.com/profile_images/686587155829899264/4MDxZvId_normal.jpg","291","470",,"en","http://www.twitter.com/AjonteAj/status/721184377019871232"
"721184370900471808 ","2016-04-16","03:52","Lori Myers","lolorashel","Twirling Viking Warrior @twirlygirlspole; Co-producer of @polenorcal; #PoleDance is for everyBODY #plussizepole Brand Ambassador for @artistaaw #nerdintraining","Just posted a photo @ Bawdy Storytelling https://t.co/lUmGKJzKtM",,,"37.76344598","-122.40797486","US","San Francisco, CA","http://pbs.twimg.com/profile_images/719045030464200704/05vq22eo_normal.jpg","1972","1610","44","en","http://www.twitter.com/lolorashel/status/721184370900471808"
"721184368883056640 ","2016-04-16","03:52","Alec Da Kappz","alecdakappz","Live and learn • Uncle Shawn","My excuse is that we're young @ Basile's Italian Restaurant https://t.co/L54xv052QF",,,"40.249723","-74.27286599999999","US","Freehold, NJ","http://pbs.twimg.com/profile_images/721184564891226112/_OkubWYX_normal.jpg","820","474",,"en","http://www.twitter.com/alecdakappz/status/721184368883056640"
"721184368341815297 ","2016-04-16","03:52","Jobs at Continuum","JobsAtContinuum",,"#IT in #CranberryTownship, PA: Strategic Partner Specialist at Continuum Managed Services https://t.co/Xcwu3mm8sX https://t.co/EnBsoeWRHI",,,"40.7095316","-80.11836889999999","US","Cranberry, PA","http://pbs.twimg.com/profile_images/634087033774800896/fBt8ZmFQ_normal.png","108","42","125","en","http://www.twitter.com/JobsAtContinuum/status/721184368341815297"
"721184365171064833 ","2016-04-16","03:52","Jason Bastida","JasonBastida","UNC'13. Columbia University College of Dental Medicine 2017. Die hard Mets fan. Hater of all things Duke. No, I did not take a paper class. Work hard, play hard","Shoutout to @lookitsgraham for the phone call to make my uber pool that much less awkward.",,,"40.84548045","-73.94285881","US","Manhattan, NY","http://pbs.twimg.com/profile_images/605050356997992448/e-ysoAkr_normal.jpg","141","371","12","en","http://www.twitter.com/JasonBastida/status/721184365171064833"
"721184360649658368 ","2016-04-16","03:52","solo savage","SMGMS_Lake","Free all my niggaz ##HH4L","I shoulda stayed at Columbia High😂😂😂😂😂😂😂😂😂😂😂😂😂😂 @1future @ Eclipse… https://t.co/THVw0EhF9O",,,"33.83188","-84.36198","US","Atlanta, GA","http://pbs.twimg.com/profile_images/606902736693559296/eJyG5e-5_normal.jpg","1436","1464","2","en","http://www.twitter.com/SMGMS_Lake/status/721184360649658368"
"721184359848382464 ","2016-04-16","03:52","Brittany Carnero","bRitt_nyy","interested in nature, science, art.                     pisces","Galactic princess🌙✨ @ The Broad https://t.co/cBssf6b0uu",,,"34.0543137","-118.2502899","US","Los Angeles, CA","http://pbs.twimg.com/profile_images/653260306345385984/Gq9ZnxG__normal.jpg","393","292","3","en","http://www.twitter.com/bRitt_nyy/status/721184359848382464"
"721184357818441728 ","2016-04-16","03:52","Katie Cullen","Kiaxet","Writer, reader, AfterBuzz host, and IT professional. Have you turned it off and on again? #ABTVRebels #ABTVArrow #RWBYABTV #ABTVZNation #ABTVMuppets","Meanwhile, back on the bridge... @ImprovisedGen #TIGSeason2 #ImprovisedGen #Kiagram @ Impro Studio https://t.co/lVRbDkAsm0",,,"34.102305","-118.292172","US","Los Angeles, CA","http://pbs.twimg.com/profile_images/580447199278067712/eihTIPBb_normal.jpg","1863","724","49","en","http://www.twitter.com/Kiaxet/status/721184357818441728"
"721184357478764544 ","2016-04-16","03:52","Patrick Ekwall","Ekwall","Svårt.","Svårt möte i New York ikväll: difficultbyp  @paulsmithdesign och @crockettjones @ Gramercy Park… https://t.co/FzivfHdWJ5",,,"40.73854259","-73.98566448","US","Manhattan, NY","http://pbs.twimg.com/profile_images/2891309914/0e94db68619632e9425f31296fd2530f_normal.jpeg","113904","128","412","sv","http://www.twitter.com/Ekwall/status/721184357478764544"
"721184355167649792 ","2016-04-16","03:52","Kris","kris_noto","coffee enthusiast","Celebrating being back in The District 🍪🍦 @ Captain Cookie &amp; the… https://t.co/Lmi2abUh7t",,,"38.90074828","-77.04639739","US","Washington, DC","http://pbs.twimg.com/profile_images/679193926331428865/LntsUs2Y_normal.jpg","347","428","3","en","http://www.twitter.com/kris_noto/status/721184355167649792"
"721184353959546880 ","2016-04-16","03:52","Erika Jee","erikaIgarcia","21 year old from Texas trying to figure life out.","IM LOVING TODAY",,,"32.4258418","-99.78834790000001","US","Abilene, TX","http://pbs.twimg.com/profile_images/718301085056765952/h1q8o5P3_normal.jpg","349","542","4","en","http://www.twitter.com/erikaIgarcia/status/721184353959546880"
"721184353162661888 ","2016-04-16","03:52","aka:","ryan_snodgrass","lookin tough, bumpin Hard Knock Life 24/7. Videoboard Coordinator for @RockAviators (when that team existed)","@fatherjohnmisty gets a little #closer to us all. #Chicago #liveinchicago #livemusic #lovesong… https://t.co/y2UupXs5gr",,,"41.96871","-87.66019","US","Chicago, IL","http://pbs.twimg.com/profile_images/567891022282493952/gZaUHhDs_normal.jpeg","357","211","6","en","http://www.twitter.com/ryan_snodgrass/status/721184353162661888"
"721184349987676160 ","2016-04-16","03:52","Anna Stephens","Stphns","@LaRomaRecords || @adidasmx #allOriginalsMX || #Snapchat: annastphns || #AyAnnie || #ailurophile","I'm at @ElImperialClub in Ciudad de México, DF https://t.co/K3poC6TG7p","4","1","19.41676558","-99.16848242","MX","Cuauhtémoc, Distrito Federal","http://pbs.twimg.com/profile_images/710252177718030336/WVvf26v__normal.jpg","35530","1066","505","es","http://www.twitter.com/Stphns/status/721184349987676160"
"721200695097954304 ","2016-04-16","04:56","PhillyRockyHorror","TNPPhillyRHPS","Transylvanian Nipple Productions, Philly's own Rocky Horror Picture Show Shadowcast has been performing in the Philadelphia region since 1997! #TNPPhillyRHPS","Throw open the switches on the Sonic Oscillator! #TNPPhillyRHPS #RockyHorror… https://t.co/wEvfdpfZ0s",,,"39.94943","-75.1478","US","Philadelphia, PA","http://pbs.twimg.com/profile_images/627211715235717120/uqyQovWQ_normal.jpg","358","381","8","en","http://www.twitter.com/TNPPhillyRHPS/status/721200695097954304"
"721200694871646208 ","2016-04-16","04:56","Daniel Villalobos","ThundaDizan","Assistant to Charlie Craig, EP of Pretty Little Liars - Writer/Producer/Director - CO-Founder & CO-CEO of Primo Ent. Co-Founder of https://t.co/fOMvrU0XOP","2/4 of the #TheWayWeNerd s #IMAX 'ing it up for the #JungleBook I have a feeling #WaltDisney and… https://t.co/zr4uFvA1xj",,,"34.18191","-118.31197","US","Burbank, CA","http://pbs.twimg.com/profile_images/2440454054/m75fhq8uh1umklgdr2cc_normal.jpeg","1051","583","19","en","http://www.twitter.com/ThundaDizan/status/721200694871646208"
"721200694070521856 ","2016-04-16","04:56","mrdenny","mrdenny","Consultant, SQL DBA, SQL MVP, VMware vExpert, MCM SQL Server 2008, MCT, XBox 360 player, Motorcycle Rider. Wrote http://t.co/jIijdOtxsx","Because dinner, and there's less food than normal at home. (@ Stone Brewing Co. in San Diego, CA) https://t.co/3e5Kdha5tu",,,"32.7323014","-117.20406472","US","San Diego, CA","http://pbs.twimg.com/profile_images/534778558636244992/Bkc2BKpf_normal.jpeg","7472","939","486","en","http://www.twitter.com/mrdenny/status/721200694070521856"
"721200692296228865 ","2016-04-16","04:56","Monica olavarria","Monicaolavarria","love life, & fashion ❤","💃🏻💃🏻💃🏻✈️ @ Penny Lane https://t.co/05yRBSJ7mN",,,"19.38703914","-99.25199691","MX","Cuajimalpa de Morelos, Distrito Federal","http://pbs.twimg.com/profile_images/713993105813413888/mtZrggva_normal.jpg","147","311","2","es","http://www.twitter.com/Monicaolavarria/status/721200692296228865"
"721200689809108992 ","2016-04-16","04:56","Fefo PL","Pp_Fred","Cinéfilo y melómano, leal, sentido, sincero y también cínico, comelón que sueña dormido y también despierto, vulgar pero no corriente y enamorado (de la noche).","¡Vámonos! (@ Terminal de Autobuses de Pasajeros de Oriente (TAPO) - @tuado in Venustiano Carranza, DF) https://t.co/t7vb19IToJ",,,"19.42983569","-99.11223287","MX","Venustiano Carranza, Distrito Federal","http://pbs.twimg.com/profile_images/715026836397432832/Gya--fIg_normal.jpg","795","1063","7","es","http://www.twitter.com/Pp_Fred/status/721200689809108992"
"721200688139599872 ","2016-04-16","04:56","MacKenzie Price","mPRICE_is_Right","they say when it's raining, it pours I mean champagne showers of course","The first hour was free so we kept going 🏌 @ Virginia Beach Top Golf https://t.co/7ESDbbVyWk",,,"36.84340218","-76.17009268","US","Virginia Beach, VA","http://pbs.twimg.com/profile_images/673591911995822080/Yob1Ws9G_normal.jpg","575","427","2","en","http://www.twitter.com/mPRICE_is_Right/status/721200688139599872"
"721200683010154496 ","2016-04-16","04:56","Dr. Brett Jones","drbrettjones","On a mission to CONNECT - CEO of The Source Chiropractic - Adjusting Ninjas Founder - Rise to #Innateness - Be Inspired. Feel Supported. Take Action!!","Mandala's been 🏃🏾thru my mind... Loving this new piece designed by my good friend @DU3theDJ… https://t.co/MgJUtaO6tR",,,"37.8044","-122.271","US","Oakland, CA","http://pbs.twimg.com/profile_images/562853716844621826/MEM_VXEM_normal.jpeg","190","159","31","en","http://www.twitter.com/drbrettjones/status/721200683010154496"
"721200682674442240 ","2016-04-16","04:56","Winn-Dixie Careers","WDCareers","Join our WINN-ing team and help make the lives of our customers and fellow associates FUN! Winn-Dixie is one of the nation's largest food retailers.","If you're a #Retail professional in #PINELLASPARK, FL, check out this #job: https://t.co/iaVenYZLaE #Hiring",,,"27.866052","-82.7270432","US","Pinellas Park, FL","http://pbs.twimg.com/profile_images/636616310403653633/sIs1Iqbk_normal.png","527","252","334","en","http://www.twitter.com/WDCareers/status/721200682674442240"
"721200679784611841 ","2016-04-16","04:56","Tafsound","TAFSOUND","Producer Engineer DMV's Top Disc Jockey  Bookings n inquiries - bookings@tafsound1gmail.com","We live rite now @bosphorusbistro #DJTAFLIVEMIX adyamg #bosphorus #amgpromotion #DjDomo… https://t.co/gPBjLpgbxh",,,"39.359749","-76.610435","US","Baltimore, MD","http://pbs.twimg.com/profile_images/2657796583/8dc3dd90244659e5f9eddf03b304f054_normal.jpeg","1078","1565","10","en","http://www.twitter.com/TAFSOUND/status/721200679784611841"
"721200679365320704 ","2016-04-16","04:56","Brianna Corallo","BriannaCorallo","9|20|13   SJU 2020","Thanks for surviving this weekend w me (barely) 💃🏻 @ Omni Richmond… https://t.co/5YNdwn0g7F",,,"37.535753","-77.435214","US","Richmond, VA","http://pbs.twimg.com/profile_images/709531741988462592/WpC94xDa_normal.jpg","307","271","1","en","http://www.twitter.com/BriannaCorallo/status/721200679365320704"
"721200677448499200 ","2016-04-16","04:56","Elizabeth Cyr","queenof207","journalism studies . AP language . English language arts . 2015 SAEF teacher of the year . @nationaljea . @nspa . @mipamsu . @rcwp . @nwp . (tweets are my own)","LA lights! @ The Westin Bonaventure Hotel &amp; Suites, Los Angeles https://t.co/BteoWgil5t",,,"34.05256","-118.25601","US","Los Angeles, CA","http://pbs.twimg.com/profile_images/551027014581235712/sIjPrXq1_normal.jpeg","272","278","13","en","http://www.twitter.com/queenof207/status/721200677448499200"
"721200677158916097 ","2016-04-16","04:56","Dave Stein","thehund","a dem, in a red distric, in a blue state","I'm at Haskell Canyon Ranch community in Santa Clarita, Calif https://t.co/5KyWIH2UOs",,,"34.46306824","-118.51108304","US","Santa Clarita, CA","http://pbs.twimg.com/profile_images/378800000047001701/fc5cd10e3cdfa7550c17dd7a9588a097_normal.png","502","795","32","en","http://www.twitter.com/thehund/status/721200677158916097"
