"721160782680092672 ","2016-04-16","02:18","Bret Kallstrom","bret_ka",,"Every night when it's time to go to bed, she'll lay across my chest with one front paw over each… https://t.co/QOS77RZkom",,,"26.1358","-80.1418","US","Fort Lauderdale, FL","http://pbs.twimg.com/profile_images/717094819848388608/5pvA8kHc_normal.jpg","16","32","1","en","http://www.twitter.com/bret_ka/status/721160782680092672"
"721160781971099648 ","2016-04-16","02:18","iNopalzin","myheavynopal","MexCal Aztec","#trippinaway @ Salinas, California https://t.co/bDu6MbNPJu",,,"36.6778","-121.656","US","Salinas, CA","http://pbs.twimg.com/profile_images/3619815999/cbe05ec94f3af701c3ae2918580688de_normal.jpeg","1317","2191","32","es","http://www.twitter.com/myheavynopal/status/721160781971099648"
"721160781950103552 ","2016-04-16","02:18","VOICE","VOICEslc","A social sciences program that emphasizes culture, education, and social justice.","#VOICEBanquet @ Monterey Hill Restaurant https://t.co/nZQ4LjHH48",,,"34.06016328","-118.16302446","US","Monterey Park, CA","http://pbs.twimg.com/profile_images/700178318004326401/zGO595h3_normal.jpg","279","343","10","en","http://www.twitter.com/VOICEslc/status/721160781950103552"
"721160781182693379 ","2016-04-16","02:18","Matthew Daniel","mattjdaniel","htx✈️ PHOTOGRAPHER.","Here's that famous guy from that lya band. #vsco #vscocam #Orlando #NightOfHope @ Orlando,… https://t.co/3RkZd7QEnw",,,"28.5335","-81.3758","US","Orlando, FL","http://pbs.twimg.com/profile_images/718535772974919680/T4Vjeyaw_normal.jpg","448","157","10","en","http://www.twitter.com/mattjdaniel/status/721160781182693379"
"721160778259251200 ","2016-04-16","02:18","Clint Caruolo","ccaruolo","Craft Beer | IPA Guy | F15 Crew Chief | Italian | Married to an amazing women | Pizza Fanatic | Giants | 49ers | CAL |","That sticky icky!!! - Drinking  The Waldos' Special Ale (AKA Waldo's 420) (2016) at @acesandalestena - https://t.co/iBKTKhVcQy",,,"36.2114","-115.25","US","Las Vegas, NV","http://pbs.twimg.com/profile_images/3469391995/efbbca8ca9e51c48ec828240668c595d_normal.jpeg","87","289","4","en","http://www.twitter.com/ccaruolo/status/721160778259251200"
"721160778141736964 ","2016-04-16","02:18","IEMBot DDC","iembot_ddc","NWS Dodge City delivered products by the IEM. @akrherz is my father.","At 9:17 PM, 2 NE Wilburton [Morton Co, KS] TRAINED SPOTTER reports TORNADO #DDC https://t.co/uaS9RIZlhO",,,"37.09","-101.74","US","Kansas, USA","http://pbs.twimg.com/profile_images/185505624/bender-smoking2_normal.jpg","35",,"13","en","http://www.twitter.com/iembot_ddc/status/721160778141736964"
"721160777529495552 ","2016-04-16","02:18","Scott Childers","sachilders","I am not that other Scott Childers from Chicago!!","Drinking a Five Foot Freak by @biglugcanteen @ Big Lug Canteen — https://t.co/6puqGNhLZ2",,,"39.912","-86.13630000000001","US","Indianapolis, IN","http://pbs.twimg.com/profile_images/137073139/newcropped_normal.JPG","239","1457","3","en","http://www.twitter.com/sachilders/status/721160777529495552"
"721160774790615042 ","2016-04-16","02:18","Madeline","mchayne","Now, um, usually I don't do this but uh....","Just posted a photo @ Bottlefork https://t.co/XRO2mfXjn9",,,"41.890362","-87.63095300000001","US","Chicago, IL","http://pbs.twimg.com/profile_images/661542377899892736/KUQgKcsp_normal.jpg","429","247","1","en","http://www.twitter.com/mchayne/status/721160774790615042"
"721160774408757248 ","2016-04-16","02:18","Cirque Mechanics","CirqueMechanics","The American circus reinvented in timber, steel and ingenuity. The art of the circus on mechanical wonders.","Awesome audience tonight @insideclemson! Thank you!!! #cirquemechanics #pedalpunk #circus… https://t.co/Ufw4jHPywd",,,"34.673922","-82.836117","US","Clemson, SC","http://pbs.twimg.com/profile_images/1746527728/CMthumb2inch_normal.jpg","548","538","22","en","http://www.twitter.com/CirqueMechanics/status/721160774408757248"
"721160774354399232 ","2016-04-16","02:18","Matthew Jennings","matthewjennings","FOR VICE & VIRTUE. Father/Husband/Cook @townsmanboston","Brotherly love. Tucking my tired dudes in after an incredible week. Fell asleep in cab home and… https://t.co/sqhjKaYAQx","1",,"42.40777778","-71.15611111","US","Arlington, MA","http://pbs.twimg.com/profile_images/662673294080868352/9yW36GYk_normal.jpg","11839","914","432","en","http://www.twitter.com/matthewjennings/status/721160774354399232"
"721160770185269248 ","2016-04-16","02:18","Steven Fitzgerald","stevenmfitz","Livin' the dream. All Day. Everyday. Arsenal. Phils. Birds. Beer.","I seriously might drink this whole keg myself - Drinking a Vanilla Bean Buffalo Sweat at @unochicagogrill - https://t.co/4AdNUf8Amr",,,"39.9374","-74.97069999999999","US","Maple Shade, NJ","http://pbs.twimg.com/profile_images/640219855715717121/Rz-lM7vL_normal.jpg","159","757","2","en","http://www.twitter.com/stevenmfitz/status/721160770185269248"
"721160767790325760 ","2016-04-16","02:18","jorge","LegendofJorge","Can't break the broken // Your senpai","@emma1370 Being alone is great",,,"39.53051188","-74.65182152","US","Egg Harbor City, NJ","http://pbs.twimg.com/profile_images/717789800426782721/Km_I8EEO_normal.jpg","633","343","11","en","http://www.twitter.com/LegendofJorge/status/721160767790325760"
"721160766783623168 ","2016-04-16","02:18","KEEPLOVE? FOLKSTEP","Keeplovedetroit","#NORTHERNWAYS my debut full length #FOLKSTEP album is out now on @SUPERxBEST via @FOLKSTEPco stream at below link","Great shot of #live #folkstep by #keeplove? by #barbaralorene #superbestrecords… https://t.co/72Lvt9QmS4",,,"42.95561504","-85.63343379","US","Grand Rapids, MI","http://pbs.twimg.com/profile_images/712457865735360517/Tj43s3ux_normal.jpg","4237","393","34","en","http://www.twitter.com/Keeplovedetroit/status/721160766783623168"
"721160761817636866 ","2016-04-16","02:18","almcmf","GorillaAirK424","Painter Street Art  Airbrush Ect","DNA stream, modge podge ,egg shells, hot glue #mixmedia #southpaw #painting #acrylic #modgepodge… https://t.co/X99sa2hnvf",,,"42.632","-83.2897","US","Pontiac, MI","http://pbs.twimg.com/profile_images/640731164483809280/be6vq55d_normal.jpg","265","859","21","en","http://www.twitter.com/GorillaAirK424/status/721160761817636866"
"721160761368801280 ","2016-04-16","02:18","Armando Zea M. ","SoyElTachaz","Apasionado de la radio, de la música, y los CDs; sencillo, honesto y sociable; fiel seguidor de facebook, twitter, de mi iPad…y ahora de mi iPhone.","Saludando al Sr. San José #pidiendoporminuevaaventuralaboral @ Santa Iglesia Catedral de Cd.… https://t.co/hJNSxXPuyb",,,"19.70375592","-103.46322306","MX","Zapotlán el Grande, Jalisco","http://pbs.twimg.com/profile_images/709425587316600832/EnocH3qP_normal.jpg","730","2047","13","es","http://www.twitter.com/SoyElTachaz/status/721160761368801280"
"721160758982258688 ","2016-04-16","02:18","MWRIGHT","maddiewrightt","Ao1 Hebrews 11:1 Belmont Basketball '20","what else can you expect from a prom pic? @ Chattanooga, Tennessee https://t.co/0eg8pVPOEa",,,"35.0455","-85.26730000000001","US","Chattanooga, TN","http://pbs.twimg.com/profile_images/716783911192371200/tc8iBh2c_normal.jpg","680","993","4","en","http://www.twitter.com/maddiewrightt/status/721160758982258688"
"721160758751395841 ","2016-04-16","02:18","katie","katieseaton22","Pour yourself a drink, put on some lipstick, and pull yourself together NCHS'18//Swim//John 3:1","@KayleeMorris13 @haleyxkennedy @ErinMNeal11 @bwilson__20 you guys are literally all that matter 💜💝","1",,"37.9122614","-85.3289212","US","Kentucky, USA","http://pbs.twimg.com/profile_images/720717386970583041/jnYFK4sK_normal.jpg","300","189",,"en","http://www.twitter.com/katieseaton22/status/721160758751395841"
"721160757900128256 ","2016-04-16","02:18","Calli Burkart","calliburkart","Graphic Designer. Printmaker. Food Lover. Runner. Sports Enthusiast. Duke Fan. Lit Geek. @UWM Alum. Currently working for @QuadGraphics.","I SAW PANDAS TODAY 😄🐼 @ National Smithsonian Zoo https://t.co/1LO99W0qIe",,,"38.93152344","-77.05231585999999","US","Washington, DC","http://pbs.twimg.com/profile_images/626137257574072320/RX0hQJE__normal.jpg","59","121","6","en","http://www.twitter.com/calliburkart/status/721160757900128256"
"721160750765453313 ","2016-04-16","02:18","HMSHost Jobs","HMSHostCareers","HMSHost is part of the world’s largest provider of food & beverage services for travelers. Explore our various hourly and management positions in US & Canada!","#Montvale, NJ #Hospitality #Job: Barista Montvale at HMSHost https://t.co/z5YpvQq3WG #barista #Jobs #Hiring",,,"41.0467635","-74.0229173","US","Montvale, NJ","http://pbs.twimg.com/profile_images/701776933395243008/YHEZAae-_normal.jpg","279","221","133","es","http://www.twitter.com/HMSHostCareers/status/721160750765453313"
"721160750723497984 ","2016-04-16","02:18","Laura Shipman","laurasshipman","Mom to a red head girl and twin blonde boys. I teach Special Needs students. Love music, love to read and love people watching!","Watching https://t.co/vGN4vJeovW #bullriding #bullfighting  teampbr @ Haywood County https://t.co/7a5zTjfcF6",,,"35.55307505","-82.85043378","US","Canton, NC","http://pbs.twimg.com/profile_images/718439232155619328/_Vd-Ykc-_normal.jpg","108","202","4","en","http://www.twitter.com/laurasshipman/status/721160750723497984"
"721160749817667584 ","2016-04-16","02:18","Morgan Guerra","therealmorgue","i like long walks to the fridge","update: failed to find NBC's Chicago Fire star taylorkinney111 /: @ Chicago Fire Department… https://t.co/jAwcHva1Ye",,,"41.8641586","-87.65625","US","Chicago, IL","http://pbs.twimg.com/profile_images/716316981704531968/V-YrNejz_normal.jpg","634","430","5","en","http://www.twitter.com/therealmorgue/status/721160749817667584"
"721160748949311488 ","2016-04-16","02:18","Face 2 Face V. I. P","lomas_anita1","Face 2 face Weave Lounge is the home for $60 quality sew in weaves in three location, We sell virgin & remhair all up to 30 all our weaves also come with hair.","Why is this @ Gulfport Mississipi https://t.co/9v4CXWy7SI",,,"30.42610064","-89.09372767000001","US","Gulfport, MS","http://pbs.twimg.com/profile_images/566635207143731200/ZeC6o93Q_normal.jpeg","698","2271","3","en","http://www.twitter.com/lomas_anita1/status/721160748949311488"
"721160748529885185 ","2016-04-16","02:18","Philip McLaughlin","philip07304",,"At NJT - Richard Street Light Rail Station — https://t.co/XcmwZ2pRMF",,,"40.69633","-74.08219","US","Jersey City, NJ","http://pbs.twimg.com/profile_images/712154452816433154/oot_6V3g_normal.jpg","554","2019","20","en","http://www.twitter.com/philip07304/status/721160748529885185"
"721160747858989056 ","2016-04-16","02:18","Sara","la_francezitha","Licenciada en Relaciones Comerciales #ESCA #IPN. #RRPP, Carismática, loca, coqueta y altanera. Jeune et jolie","Shi shii (@ King's Pub in Cuauhtémoc, Mexico) https://t.co/uuoNiXmbha",,,"19.41171631","-99.17200685","MX","Cuauhtémoc, Distrito Federal","http://pbs.twimg.com/profile_images/712593995809972224/s6OOOGzP_normal.jpg","823","376","13","es","http://www.twitter.com/la_francezitha/status/721160747858989056"
"721160747783491585 ","2016-04-16","02:18","Killian Bundy","WyldeKill","I'm Killian. I work at Black Water Tattoo and Design in Sterling VA","Convention lighting makes it hard to get good pictures!  Thanks @calluna_flower for sitting like… https://t.co/fxS61fLPtk",,,"39.28559","-76.61622","US","Baltimore, MD","http://pbs.twimg.com/profile_images/608144445230456833/aJI8Y0Ej_normal.jpg","113","240","3","en","http://www.twitter.com/WyldeKill/status/721160747783491585"
"721160747687010304 ","2016-04-16","02:18","FERNANDO ROSALES","Fertzzz",,"Amigos invisibles (@ Hipódromo de las Américas in Miguel Hidalgo, DF w/ @giorivo) https://t.co/JcLjt51TK6",,,"19.43859002","-99.22186375","MX","Miguel Hidalgo, Distrito Federal","http://pbs.twimg.com/profile_images/3704384105/feb8b6ebb05aa65e7a59a59d215211be_normal.jpeg","164","455",,"es","http://www.twitter.com/Fertzzz/status/721160747687010304"
"721160747133366272 ","2016-04-16","02:18","Sierra McKenzie","Sierra_McKenz","Ummm...what can I say? I'm a fan of craft beer, work at a library, and I'm probably weird. :)","Drinking a Roots Ginger Beer by @listermann @ Listermann Brewing Co. — https://t.co/NQxOu37MiK",,,"39.1462","-84.4723","US","Norwood, OH","http://pbs.twimg.com/profile_images/711718112362688513/mjI-0rZY_normal.jpg","70","247","3","en","http://www.twitter.com/Sierra_McKenz/status/721160747133366272"
"721160745182859264 ","2016-04-16","02:18","Aranza❁","AranzaSanchez6","Maravillosamente imperfecta, escandalosamente feliz✨","Odio que fumen enfrente de mi😷",,,"25.44870262","-101.01881478","MX","Saltillo, Coahuila de Zaragoza","http://pbs.twimg.com/profile_images/717912724320026624/qed2l9DI_normal.jpg","422","478","2","es","http://www.twitter.com/AranzaSanchez6/status/721160745182859264"
"721160744558030848 ","2016-04-16","02:18","K Jacobson","MistressKofOs","Endurance athlete, outdoor enthusiast, motorcyclist, punk rawker, metalhead, occasional hooligan and huge freakin' dork. Human powered adventures rule.","I was out walking 3.00 km with #Endomondo #endorphins https://t.co/lX0RKWH60z",,,"43.396096","-80.375713","CA","Cambridge, Ontario","http://pbs.twimg.com/profile_images/378800000833307322/d537112bbcdd517a4c2254829ea7f242_normal.jpeg","356","397","51","en","http://www.twitter.com/MistressKofOs/status/721160744558030848"
"721160742813188096 ","2016-04-16","02:18","DJ7L","DJ_7L","https://t.co/lggGi3dgEV","tomorrow #recordstoreday (this record is incredible) @ Record Exchange https://t.co/8zSwvyIK0Z",,,"42.51778","-70.89424","US","Salem, MA","http://pbs.twimg.com/profile_images/1524318902/images_normal.jpg","5426","471","85","en","http://www.twitter.com/DJ_7L/status/721160742813188096"
"721160741626232833 ","2016-04-16","02:18","Aliciaa.","aliciajoerger","I get my sass from @ChristinaCIM ✨ ~Everything happens for a reason ~Trust yourself https://t.co/CjAnyFQ31D","Louisiana can be pretty despite the alligators @ Bossier City,… https://t.co/KfF5wcnQuQ",,,"32.5177","-93.6914","US","Bossier City, LA","http://pbs.twimg.com/profile_images/720059597646663682/iv6TNnqC_normal.jpg","60","117","3","en","http://www.twitter.com/aliciajoerger/status/721160741626232833"
"721160741613543424 ","2016-04-16","02:18","Diana Gonzales","trojanchick99","Just your average resident of Los Angeles who is obsessed with all things USC, U2, and watches way too much TV.","Børns! Woohoo! #coachella @ Coachella https://t.co/gt65QgMJgl","1",,"33.679974","-116.237221","US","California, USA","http://pbs.twimg.com/profile_images/690245110500470784/G2W-l6Pq_normal.png","417","689","39","da","http://www.twitter.com/trojanchick99/status/721160741613543424"
"721160740858699776 ","2016-04-16","02:18","Mark Ingraham","image_ingy","Image Perspective is a Chicagoland Brand Design & Advertising Firm. We tell your compelling story. Tweeting  Marketing, Pop Culture, Music, Sports, Life.","I'm at The Happ Inn in Northfield, IL https://t.co/jX5JArrpba https://t.co/0F73goGPTo",,,"42.1","-87.768556","US","Northfield, IL","http://pbs.twimg.com/profile_images/566198536027398144/lvvF8rPb_normal.jpeg","873","2049","49","en","http://www.twitter.com/image_ingy/status/721160740858699776"
"721160740783177728 ","2016-04-16","02:18","Daniel Cifuentes","ArchitectDC","Spanish Architect/Designer in Phoenix, AZ looking to design unlikely futures! Christ follower! Volunteer for http://t.co/pmY9nhzWto.","#CifuentesStudio keeping the tenants happy. #AdeptPainting keeping it OG by installing new T&amp;G… https://t.co/3bdmUvVAcc",,,"33.41101742","-111.95650031","US","Tempe, AZ","http://pbs.twimg.com/profile_images/1005427086/P5111382ED_normal.jpg","212","196","20","en","http://www.twitter.com/ArchitectDC/status/721160740783177728"
"721160738690179073 ","2016-04-16","02:18","David","finsfan13ot","Occupational Therapist, Proud Father of two beautiful little girls... Love good beer","Great IPA! Wow. Go O's! - Drinking a Beer I by @mainebeerco @ House Of The Damned  — https://t.co/j21ltrNXMh #photo",,,"37.3067","-79.8913","US","Roanoke, VA","http://pbs.twimg.com/profile_images/473259568802586624/eku9r8yy_normal.jpeg","50","408","4","en","http://www.twitter.com/finsfan13ot/status/721160738690179073"
"721160735892639744 ","2016-04-16","02:18","nullrend","nullrend",,"@_TaliaKnight_ no",,,"44.9564227","-93.2778845","US","Minneapolis, MN","http://pbs.twimg.com/profile_images/623774841900904448/dvV7-Hrf_normal.jpg","1517","1624","98","es","http://www.twitter.com/nullrend/status/721160735892639744"
"721160734944661504 ","2016-04-16","02:18","Jesús","alejandrotello","| @SomosBlanks | sé algo de comunicación política | y escribo una columna sobre el deporte blanco, el tenis |","I'm at La Kalaka Bar in Guadalajara, Jalisco https://t.co/P7ezLEWz6E",,,"20.676067","-103.358041","MX","Guadalajara, Jalisco","http://pbs.twimg.com/profile_images/712709138745167872/mGx3qjT6_normal.jpg","687","631","29","es","http://www.twitter.com/alejandrotello/status/721160734944661504"
"721160733912875008 ","2016-04-16","02:18","young crumpette","shitchynnasays","Gravity is just a theory ☄","Same same but different 👯 @ Palm Desert, California https://t.co/GxzGhnnBOF",,,"33.7255","-116.369","US","Palm Desert, CA","http://pbs.twimg.com/profile_images/708453443061452801/LVGSyJJO_normal.jpg","664","66","5","en","http://www.twitter.com/shitchynnasays/status/721160733912875008"
"721160733111775234 ","2016-04-16","02:18","LaVintage Decor","LavintageDecor","Central Pennsylvania's only Vintage and Repurposed Design Company","Dad and child team up to paint a special canvas sure to please mom on her special day. (Mother's… https://t.co/xfdkEUhKz0",,,"40.537626","-78.38230299999999","US","Pennsylvania, USA","http://pbs.twimg.com/profile_images/479024791190372352/r2cw5pzw_normal.jpeg","50","89",,"en","http://www.twitter.com/LavintageDecor/status/721160733111775234"
"721160732642045954 ","2016-04-16","02:18","Alejandra Lluch","alelluch","La comunicación, mini empresaria, le hago a la cantada, bailada, actuada y modelada. Mi debilidad los tacos, el sushi y café. Instagram y snapchat: alelluch","I'm at Guanabana in Long Beach, CA https://t.co/hA92byC3RY https://t.co/JbifXO4WtW",,,"33.8010203","-118.21530405","US","Long Beach, CA","http://pbs.twimg.com/profile_images/702925845266956288/I0HuMzm4_normal.jpg","203","108","2","en","http://www.twitter.com/alelluch/status/721160732642045954"
"721160732570710016 ","2016-04-16","02:18","PCBS46","PCBS46","CBS 46 Atlanta Managing Editor; Emmy/Peabody winner-- news tweeter, Motown native, STILL believes Trammell should be in HOF","@Braves win 1st game after 9 losses in a row. .@cbs46","1",,"33.8309168","-84.4932532","US","Smyrna, GA","http://pbs.twimg.com/profile_images/77627359/PaulCaron_1__normal.jpg","5477","3325","185","en","http://www.twitter.com/PCBS46/status/721160732570710016"
"721160731698143232 ","2016-04-16","02:18","Funk It Blog","FunkItBlog","live audio, live video, always funky.      Funk It is a blog dedicated to live funk recordings, past and present. Audio, video, downloads, and streaming.","Billy Corgan taking us to a cemetery disco or something. @LvillePalace #SmashingPumpkins ?? @… https://t.co/EMaeKqslaN",,,"38.24794427","-85.75773764","US","Louisville, KY","http://pbs.twimg.com/profile_images/2417196805/xarpq1mmiqptdgniwjzb_normal.gif","2283","1241","78","en","http://www.twitter.com/FunkItBlog/status/721160731698143232"
"721160731379556353 ","2016-04-16","02:18","Brandon R. Lott","gazellewc","Gentleman, Entrepreneur, Consultant, Adventurer, and Mensch!","I'm at Old Town Tavern in Carmel, IN https://t.co/zCuseQzucB",,,"39.978352","-86.127881","US","Carmel, IN","http://pbs.twimg.com/profile_images/674714236224864256/7JSA3P8q_normal.jpg","520","615","29","en","http://www.twitter.com/gazellewc/status/721160731379556353"
"721160729492119552 ","2016-04-16","02:18","Gerardo BC","gerardobc7","Ingeniero Fisico especializado en Fisica Medica Clinica y Seguridad Radiologica / Radioterapia, Medicina Nuclear y Rayos X","Salud!! 🍻 (@ Bubba Gump Shrimp Co. - @bgcancun in Cancún, QR w/ @vaniagomez) https://t.co/SnxTXHUQb4",,,"21.11868593","-86.75765857","MX","Benito Juárez, Quintana Roo","http://pbs.twimg.com/profile_images/584879579745030145/ysU4J_tf_normal.jpg","145","252","2","es","http://www.twitter.com/gerardobc7/status/721160729492119552"
"721160729370443776 ","2016-04-16","02:18","Lala Galindo","_lalagalindo","Colombian. UI/UX/Graphic Designer. Pixel Freak. TwoDots Addict. I miss the 90's. MS Fighter","😍 #greenbenchbrewing @ Green Bench Brewing Co. https://t.co/DljxTEmRat",,,"27.7717094","-82.6506577","US","St Petersburg, FL","http://pbs.twimg.com/profile_images/657657326300712961/KXQlYCh7_normal.jpg","200","224","27","en","http://www.twitter.com/_lalagalindo/status/721160729370443776"
"721160727319441409 ","2016-04-16","02:18","Rich","FlatbushPapi","Henny Gawd x Navy God Got Us. Snapchat/Instagram: Flatbushpapi #TKIISTKIY","Gotta take em in moderation beloved 😂",,,"40.653806","-73.947844","US","Brooklyn, NY","http://pbs.twimg.com/profile_images/720740748359049216/kB_gEYPo_normal.jpg","513","457","13","en","http://www.twitter.com/FlatbushPapi/status/721160727319441409"
"721160727193497603 ","2016-04-16","02:18","Stephanie","stephazilla","Veggies and beer and beards. Parent to #CashewThePit.  SDSU MS.  Whittier BA.","The best life has to offer #baseball and #craftbeer @ Petco Park https://t.co/VGTRw5cFBM","1",,"32.7059194","-117.1572173","US","San Diego, CA","http://pbs.twimg.com/profile_images/715248112562929664/kN7Cst4q_normal.jpg","770","798","29","en","http://www.twitter.com/stephazilla/status/721160727193497603"
"721160724689588224 ","2016-04-16","02:18","Gustavo Rivera","gurevat",,"https://t.co/vX7Omcuqfa",,,"37.69917725","-123.01220132","US","California, USA","http://pbs.twimg.com/profile_images/616741116914761728/WhnNiUYz_normal.jpg","4","4","1","es","http://www.twitter.com/gurevat/status/721160724689588224"
"721160723041271809 ","2016-04-16","02:18","hektor","hectorbass","Whiskey Life Coach,Leica Cameras, Spontaneous Art,Real Madrid and San Diego Sports ( #Chargers #Padres #Gulls #Aztecs)","Lets go Gulls! (@ Valley View Casino Center - @vvcasinocenter in San Diego, CA) https://t.co/reBS5hKaBA",,,"32.74983535","-117.20907927","US","San Diego, CA","http://pbs.twimg.com/profile_images/693344359547207680/kY2fIsxR_normal.jpg","1143","927","68","en","http://www.twitter.com/hectorbass/status/721160723041271809"
"721160716913258496 ","2016-04-16","02:18","donnie kruse","stanimaldonnie","straw that stirs the drink","Saturday, Stanley's Kitchen &amp; Tap, Pancakes are Always on Special, C'mon down and have a… https://t.co/4H7963u6ru",,,"41.9176481","-87.6381358","US","Chicago, IL","http://abs.twimg.com/sticky/default_profile_images/default_profile_2_normal.png","370","747","7","en","http://www.twitter.com/stanimaldonnie/status/721160716913258496"
"721160716271661056 ","2016-04-16","02:18","Eric Rickets","PartyonBro","This happens to be a $100 minimum bet table. Perhaps you would feel more comfortable at one of our lower stakes tables.","#Taco @ Hot's Kitchen https://t.co/3tSrraj0wS",,,"33.85994166","-118.39924741","US","Hermosa Beach, CA","http://pbs.twimg.com/profile_images/613419807430475776/0sfKMrTD_normal.png","254","134","14","en","http://www.twitter.com/PartyonBro/status/721160716271661056"
"721160716187611136 ","2016-04-16","02:18","Katrina H","woohoo_TRINKY21","This is not the end, this is not the end. We can make it, you know it, you know ❤One Direction❤ ❤Backstreet Boys❤ ❤O-Town❤","It's times like this❤❤ #Firewords @ Tri-Fest Downtown Henderson https://t.co/8Rm3a9VAJu","1",,"37.84149485","-87.59107772999999","US","Henderson, KY","http://pbs.twimg.com/profile_images/715589414811000832/4cGQv1CV_normal.jpg","486","579","4","en","http://www.twitter.com/woohoo_TRINKY21/status/721160716187611136"
"721160715533447168 ","2016-04-16","02:18","Addison Zane","addison_mills17","Assistant Director of Admissions at the University of Kentucky - Lexington/25/@addison_mills17/Insta: @addisonzane","Sooooo this is a terrible pic but this is me and mom at the Aronoff hanging out with… https://t.co/GvPHgheGFB",,,"39.10358","-84.51174","US","Cincinnati, OH","http://pbs.twimg.com/profile_images/583631723973443584/o0YvORS__normal.jpg","226","200","8","en","http://www.twitter.com/addison_mills17/status/721160715533447168"
"721160715189542913 ","2016-04-16","02:18","Stem E. Berry","STEM08","Founding member of the  #WestEndZoneCrew. #TheU #craftbeer #FAU #dfs #DISNEY","It's raining 🐀🐀🐀",,,"28.6408496","-81.17890874","US","Oviedo, FL","http://pbs.twimg.com/profile_images/680086506111909888/KHxPg_Nq_normal.jpg","1233","582","57","en","http://www.twitter.com/STEM08/status/721160715189542913"
"721160714530873344 ","2016-04-16","02:18","Geo Cortes  ✖","geo_cortes","La palabra Nadie es perfecto dejo de existir el 5 de marzo de 1996 ❤","@mariobautista_  Me dio tanta emocion al ver esto 😭😭❤ ya quiero que se llegue  ❤ literal grite cuando vi! https://t.co/tLbi68dWvn",,,"19.5699553","-97.2421911","MX","Xalapa, Veracruz de Ignacio de la Llave","http://pbs.twimg.com/profile_images/720400308820553728/6NGebVn-_normal.jpg","546","502","4","es","http://www.twitter.com/geo_cortes/status/721160714530873344"
"721160713054633986 ","2016-04-16","02:18","AryTun","arylukis","•Lic. en Enfermería • Mi cabeza sí vino amueblada •Duermo poco •  • ☕️ • #AzulCrema #12 #GGMU #NYG -ei-","I'm at Estadio Carlos Iturralde in Mérida, YUC w/ @capnluis https://t.co/2aK1wrkbs0 https://t.co/rKLKdh98RJ",,,"20.94580944","-89.59413241999999","MX","Mérida, Yucatán","http://pbs.twimg.com/profile_images/595105410509475840/rfx3IvQ2_normal.jpg","1514","847","32","es","http://www.twitter.com/arylukis/status/721160713054633986"
