"721116673915371520 ","2016-04-15","23:23","Crystal A.","mscrystallee","Knitter, Hiker,Yogi, Feminist, Lover of Beer/Certified Beer Server & Collector of Art. Healthcare Privacy & Compliance. Working on my MSJ in Health Law.","Make and Take Terrarium (@ Union Street Yoga in Worcester, MA) https://t.co/9DYpomnmlZ https://t.co/eechWJmfAr",,,"42.26960038","-71.79815472","US","Worcester, MA","http://pbs.twimg.com/profile_images/662026380708872192/jRJfoFWa_normal.jpg","659","1358","39","en","http://www.twitter.com/mscrystallee/status/721116673915371520"
"721116672262692864 ","2016-04-15","23:23","Kilam Nahsar","4r3alBlackMyth","Head of dat Crack Music Family and definitely not the guy you wanna try #CMFDAT","Me and my bruh @isaiahgilbert3 off our ballhead shit 😎😎😎 #BRICKS… https://t.co/6jneccydNf",,,"40.73208","-74.20264","US","Newark, NJ","http://pbs.twimg.com/profile_images/703034651208601600/WqnX-sE6_normal.jpg","6867","1521","17","en","http://www.twitter.com/4r3alBlackMyth/status/721116672262692864"
"721116670668853249 ","2016-04-15","23:23","Hermosa Design","hermosadsn","Design Shop: contemporary beach lifestyle inspired by Scandinavian design.","#fbf to Wednesday nights #happyhourHD. Thank you for all those who attended and for our partners… https://t.co/TdGdtOGYYJ",,,"33.85873","-118.39512","US","Hermosa Beach, CA","http://pbs.twimg.com/profile_images/551828711759048704/1Rlm6Nhc_normal.jpeg","133","275","19","en","http://www.twitter.com/hermosadsn/status/721116670668853249"
"721116670056669184 ","2016-04-15","23:23","robert davenport","e13venb",,"Arts extravaganza @ Champion Central Elementary School https://t.co/iHyppepuSt",,,"41.30988","-80.85024","US","Champion Heights, OH","http://pbs.twimg.com/profile_images/476541468015079424/Hg5ttWBX_normal.jpeg","73","348",,"en","http://www.twitter.com/e13venb/status/721116670056669184"
"721116668315832321 ","2016-04-15","23:23","Pop punk dad","Eljpope","Pizza and khaki shorts and friends and stickers","This is my life  https://t.co/QfiuQieh4y",,,"32.28183137","-95.27975642","US","Tyler, TX","http://pbs.twimg.com/profile_images/711644092854247424/LXOcO_HE_normal.jpg","263","272","5","en","http://www.twitter.com/Eljpope/status/721116668315832321"
"721116667330301952 ","2016-04-15","23:23","Tim R Alcoser Jr","Timsierramist","Marine, Iraq War Veteran and full-time public servant. @disney geek. Proud Conservative and INFIDEL. Sympathetic to Animal Causes. Unapologetic. #bluelivesmater","I'm at Stoneridge Apts in upland, CA https://t.co/WktHha8F5D",,,"34.09133981","-117.67898548","US","Upland, CA","http://pbs.twimg.com/profile_images/720411978964013056/3U2DD2cF_normal.jpg","369","683","19","en","http://www.twitter.com/Timsierramist/status/721116667330301952"
"721116667317649409 ","2016-04-15","23:23","Noodles Careers","NoodlesCareers","We're looking for people who have a passion for restaurants and a mind for business. If you're looking for a career with us, you’re in the right place!","https://t.co/wuZawMRbrS: Team Member (#EASTBRUNSWICK, NJ) https://t.co/d0nPsI5Ei8 #Hospitality #MadeDifferent #Job https://t.co/fvS3WvJw7R",,,"40.4303776","-74.38562829999999","US","East Brunswick, NJ","http://pbs.twimg.com/profile_images/665277382278840320/vxTYa7JC_normal.jpg","439","456","205","en","http://www.twitter.com/NoodlesCareers/status/721116667317649409"
"721116666231435264 ","2016-04-15","23:23","Mere Street","MeredithStreet","Graphic designer and Marketing Director by day, robot by night. Love iced coffee, tattoos, sticker art, all breakfast errything, and beards. Preferably on men.","Damn. Good. Drink. 👌🏻👌🏻 | #vscocam #vscogood #cocktails #happyhour #urbanfarmer #phillydrinks… https://t.co/XxfFJq2kV5",,,"39.9571889","-75.169713","US","Philadelphia, PA","http://pbs.twimg.com/profile_images/441673678980272128/h1s0Bg5V_normal.jpeg","270","221","62","en","http://www.twitter.com/MeredithStreet/status/721116666231435264"
"721116666151575552 ","2016-04-15","23:23","TMJ-SLC HRTA Jobs","tmj_slc_hrta","Follow this account for geo-targeted Hospitality/Restaurant/Tourism job tweets in Salt Lake City, UT. Need help? Tweet us at @CareerArc!","See our latest #LAYTON, UT #job and click to apply: Restaurant Co-worker (Franchise) - https://t.co/4rqh2akqnh #Hospitality #Hiring",,,"41.0843083","-111.9853725","US","Layton, UT","http://pbs.twimg.com/profile_images/668373794654818304/1Ez1rLG-_normal.jpg","334","291","45","en","http://www.twitter.com/tmj_slc_hrta/status/721116666151575552"
"721116665086394368 ","2016-04-15","23:23","p_wog","highfalutindad","twister was the first dvd","Drinking a Lemon-Lime King of Hop  by @starrhill @ Miss You Paul — https://t.co/xzsMYPg0Pk",,,"37.3917","-77.6966","US","Virginia, USA","http://pbs.twimg.com/profile_images/715531220050792448/wZV-Whe0_normal.jpg","62","234","6","en","http://www.twitter.com/highfalutindad/status/721116665086394368"
"721116663412752384 ","2016-04-15","23:23","Cintas Careers","CintasCareers","Looking for a career, and not just another job? Consider Cintas, where the spirit is the difference. Follow us for our latest career opportunities.","Can you recommend anyone for this #job? Stockroom Utility - https://t.co/V4WKcBtfvN #cintasjobs #Tecumseh, ON https://t.co/K80Sv7hzrN",,,"42.3117966","-82.8857592","CA","Tecumseh, Ontario","http://pbs.twimg.com/profile_images/760490442/cintas_careers_logo_normal.jpg","305","2","359","en","http://www.twitter.com/CintasCareers/status/721116663412752384"
"721116661986803716 ","2016-04-15","23:23","Quinton Aaron","QuintonAaron","Star of the Oscar Nominated family movie of the year The Blind Side... I plan on continuing living my dream and being the man my mama raised me to be...","This water is hot as hell and she tickling my feet lol! @ L'acqua Nail Spa Lounge https://t.co/CeJ55hmiho",,,"32.87043633","-96.7686631","US","Dallas, TX","http://pbs.twimg.com/profile_images/713504443669438464/XjOAUBiQ_normal.jpg","29293","3853","352","en","http://www.twitter.com/QuintonAaron/status/721116661986803716"
"721116659650408448 ","2016-04-15","23:23","hart.","_kingjane","I'm just here for entertainment. Tolerating no fuck shit. Disclaimer: my statements and opinions do not reflect those of my employer. don't go there.","Rude.  https://t.co/Voi6wIk1cJ",,,"32.59047543","-96.67963201000001","US","Wilmer, TX","http://pbs.twimg.com/profile_images/719418465090560000/_wR8yITh_normal.jpg","1547","871","70","en","http://www.twitter.com/_kingjane/status/721116659650408448"
"721116659101130753 ","2016-04-15","23:23","Lawrence Pickard","lpickard64","Just a man in search of a good ship and a star to steer her by...","Charlie Jo with her GiGi and great uncle Kevin! @ Dave's Place https://t.co/1Vqmg3Xvth",,,"34.7468999","-92.27319","US","Little Rock, AR","http://pbs.twimg.com/profile_images/453313879968202752/vs5gKr8e_normal.jpeg","137","186","2","en","http://www.twitter.com/lpickard64/status/721116659101130753"
"721116657599418368 ","2016-04-15","23:23","Ashley","ashleyarmas16","fc softball | @axel_a1","2016 Season ⚾️💙 #protectthenest @ John Glenn High School (California) https://t.co/8BKlfg1O95",,,"33.90861111","-118.05416667","US","Norwalk, CA","http://pbs.twimg.com/profile_images/670062927307784192/e5JEV4Pq_normal.jpg","535","331",,"en","http://www.twitter.com/ashleyarmas16/status/721116657599418368"
"721116657393872897 ","2016-04-15","23:23","Lian Kimia","LianKimia","Community builder @PritzkerVC in LA. Formerly co-founder @AxisInnovation TLV. #Startupista. Adventure Capitalist. Eager traveler. Cafe enthusiast.","Today we did something pretty awesome: we organized a roundtable with Secretary of Commerce… https://t.co/SkNLzB3FMG",,,"33.97991409","-118.40613104","US","Los Angeles, CA","http://pbs.twimg.com/profile_images/625761307896090624/2ozJ0a5f_normal.jpg","289","699","17","en","http://www.twitter.com/LianKimia/status/721116657393872897"
"721116657188540417 ","2016-04-15","23:23","every lot la","everylotla","Every parcel in Los Angeles, in tax ID order. by @fitnr","23059 Lanark Street https://t.co/ZghFd2PLHT",,,"34.21716","-118.62959","US","Los Angeles, CA","http://pbs.twimg.com/profile_images/678686348455354368/jZwcq7ln_normal.png","129","4","11","en","http://www.twitter.com/everylotla/status/721116657188540417"
"721116657054167041 ","2016-04-15","23:23","Speedway Jobs","SpeedwayJobs","Rethink Speedway. It's more than a convenience store... It's your career opportunity!","Speedway: Customer Service Representative-Retail Sales (#Norwalk, OH) https://t.co/sPrRSUR0Pi #CustomerService #Job #Jobs #Hiring",,,"41.2425531","-82.6157331","US","Norwalk, OH","http://pbs.twimg.com/profile_images/588378982485110784/CoHZRLK7_normal.png","218","27","381","en","http://www.twitter.com/SpeedwayJobs/status/721116657054167041"
"721116654969565184 ","2016-04-15","23:23","Join BAYADA","JoinBAYADA","BAYADA employs more than 18,000 nurses, home health aides, therapists, medical social workers, managers, and other health care professionals across the country.","Can you recommend anyone for this #job? https://t.co/iXQatdDsaA #ForestHill, MD #Hiring",,,"39.5850754","-76.3877289","US","Bel Air North, MD","http://pbs.twimg.com/profile_images/521653094073896960/S288SKQw_normal.jpeg","312","29","314","en","http://www.twitter.com/JoinBAYADA/status/721116654969565184"
"721116654894231552 ","2016-04-15","23:23","Mindy Languirand","melindasaurus","till we find our place; on the path unwinding; snapchat: melinds","Camp 💜😍 #finally @ Sanborn Shore Acres Campground https://t.co/ePxH89Luqd",,,"42.88200845","-71.19527492","US","Hampstead, NH","http://pbs.twimg.com/profile_images/610180542521151489/8d8B6PyB_normal.jpg","189","204","3","en","http://www.twitter.com/melindasaurus/status/721116654894231552"
"721116654239891456 ","2016-04-15","23:23","lentäminen","lentaminen","a little travel experiment, Tweeting current US airport delays, as reported by the FAA","A ground stop is in place at #MIA due to WEATHER / THUNDERSTORMS #flightdelay https://t.co/iyWjQl3hoP",,,"25.796","-80.278234","US","Miami, FL","http://pbs.twimg.com/profile_images/693683711234088960/C2nHe_Od_normal.png","21","79","18","en","http://www.twitter.com/lentaminen/status/721116654239891456"
"721116654218776576 ","2016-04-15","23:23","TTN Las Vegas","TotalTrafficLV","Covering all your traffic needs throughout Greater Las Vegas.  Please call 702-238-7333 if you have any traffic tips.","Accident - on ramp in #Clark on US 95 SB at Eastern Ave #VegasTraffic https://t.co/5rmaMyCQ1w",,,"36.16798","-115.1157","US","Las Vegas, NV","http://pbs.twimg.com/profile_images/439096018932469760/e-YFscMC_normal.png","2234","137","82","en","http://www.twitter.com/TotalTrafficLV/status/721116654218776576"
"721116653841485824 ","2016-04-15","23:23","Ciραcтli♡Melissα","Cipactli_M","Drama Queen con piel canela ♛ ... Cada quien tiene su propia pelicula y por que no hasta con soundtrack :) //snap: cipactli_m","I'm at Ciudad de México in Ciudad de México, Mexico City https://t.co/2UJbcxbofX",,,"19.41816575","-99.14377488","MX","Cuauhtémoc, Distrito Federal","http://pbs.twimg.com/profile_images/715591356102483968/a9toFbx9_normal.jpg","778","545","8","es","http://www.twitter.com/Cipactli_M/status/721116653841485824"
"721116653631635456 ","2016-04-15","23:23","Wonwoo","saew00","Filmmaker","0416 @ Baltimore, Maryland https://t.co/RB8ZeZr2ge",,,"39.2903","-76.6125","US","Baltimore, MD","http://pbs.twimg.com/profile_images/703455928016711680/1SxGh5O7_normal.jpg","1762","1139","55","en","http://www.twitter.com/saew00/status/721116653631635456"
"721116653547819008 ","2016-04-15","23:23","A$Ħ МǺĐӀ$0N","UnofficialMayor","•Official embroiderer of the Dave Rothenberg show• •Part Time Rapper• •Sapiosexual• •Author• •Comedian• •Actor• •Plus Size Model• •1/2 of @CULTUreCaps•","America's pastime. #yankeestadium @ Yankee Stadium https://t.co/pXCWZcyGDK",,,"40.82926679","-73.92657946999999","US","Bronx, NY","http://pbs.twimg.com/profile_images/589785394377596928/70l2PXfJ_normal.jpg","430","215","6","en","http://www.twitter.com/UnofficialMayor/status/721116653547819008"
"721116653312991232 ","2016-04-15","23:23","THE COUGAR OF COMEDY","JillieReil","#PegBundy is my hero. #CrazyDogLady #BoxedWineAficionado #LubeLady #SmutPeddler Sometimes I tell #DirtyJokes & portray #Bimbos ...Mom cries.","Jillie to the #Willie #OnTheRoadAgain #MyJam @ Austin, Texas https://t.co/B7GM98EHNd",,,"30.2672","-97.76390000000001","US","Austin, TX","http://pbs.twimg.com/profile_images/496682088641200129/qJbymOUp_normal.jpeg","1633","1371","30","en","http://www.twitter.com/JillieReil/status/721116653312991232"
"721116652650106880 ","2016-04-15","23:23","Fort Collins Nursing","tmj_ftc_nursing","Follow this account for geo-targeted Healthcare-Nursing job tweets in Fort Collins, CO. Need help? Tweet us at @CareerArc!","We're #hiring! Click to apply: Night Shift LPN-Corrections - https://t.co/rnCYuRRBNH #Nursing #Greeley, CO #Job #Jobs #CareerArc",,,"40.4233142","-104.7091322","US","Greeley, CO","http://pbs.twimg.com/profile_images/719712238429286400/GACIElkm_normal.jpg","349","256","25","en","http://www.twitter.com/tmj_ftc_nursing/status/721116652650106880"
"721116650905292800 ","2016-04-15","23:23","Las Vegas Healthcare","tmj_las_health","Follow this account for geo-targeted Healthcare job tweets in Las Vegas, NV. Need help? Tweet us at @CareerArc!","See our latest #LasVegas, NV #job and click to apply: Emergency Department - EM Physician - https://t.co/WqYXaZNnT8 #EmergencyMedicine",,,"36.1699412","-115.1398296","US","Las Vegas, NV","http://pbs.twimg.com/profile_images/668207825907159040/Svu0jX1__normal.jpg","821","303","100","en","http://www.twitter.com/tmj_las_health/status/721116650905292800"
"721116650813071361 ","2016-04-15","23:23","TTN Denver","TotalTrafficDEN","Your number one source for traffic updates throughout Colorado. If you see a Traffic Problem, call our Tipline! 303-713-8618 #COTraffic","Closed due to accident in #Park on Hwy 285 SB between CR-62 and Kenosha Pass #COtraffic https://t.co/gWR42BYOmJ",,,"39.45968","-105.6631","US","Colorado, USA","http://pbs.twimg.com/profile_images/439092558551982081/aXId7-en_normal.png","1004","796","57","en","http://www.twitter.com/TotalTrafficDEN/status/721116650813071361"
"721116649714126849 ","2016-04-15","23:23","California Education","tmj_CA_EDU","Follow this account for geo-targeted Education/Teaching job tweets in California Non-Metro. Need help? Tweet us at @CareerArc!","This #Education #job might be a great fit for you: Behavior Support Companion - https://t.co/I4BJ9MhfL0 #ShermanOaks, CA #Hiring #CareerArc",,"1","34.1489719","-118.451357","US","Los Angeles, CA","http://pbs.twimg.com/profile_images/668580240831082496/DWfAV9Jw_normal.jpg","406","237","88","en","http://www.twitter.com/tmj_CA_EDU/status/721116649714126849"
"721116649663938560 ","2016-04-15","23:23","Adri Robles","hotbiscuit13",,"Happy Social Hour! #cheers #socialhour #fancycocktails… https://t.co/zBDcwV9X3g",,,"25.817824","-80.12240300000001","US","Miami Beach, FL","http://pbs.twimg.com/profile_images/711703445766430720/yOWADDYf_normal.jpg","38","135","7","en","http://www.twitter.com/hotbiscuit13/status/721116649663938560"
"721116648610992128 ","2016-04-15","23:23","CO Physician Jobs","CO_physician","Follow this account for geo-targeted Physician job tweets in Colorado Non-Metro. Need help? Tweet us at @CareerArc!","#Physician #Job in #ColoradoSprings, CO: PRN- Urgent Care- Physician Job at Centura Health https://t.co/uEIHU4ks7p #Jobs #Hiring #CareerArc",,,"38.8338816","-104.8213634","US","Colorado Springs, CO","http://pbs.twimg.com/profile_images/670695424752152576/JqRP5dTv_normal.jpg","170","133","25","en","http://www.twitter.com/CO_physician/status/721116648610992128"
"721116647939907586 ","2016-04-15","23:23","California Auto.","tmj_CA_auto","Follow this account for geo-targeted Automotive job tweets in California Non-Metro. Need help? Tweet us at @CareerArc!","Love's Travel Stops &amp; Country St...: Maintenance Technician - Tire Care (#LostHills, CA) https://t.co/GZlqhcOKGt #Automotive #Job #Jobs",,,"35.616349","-119.6942941","US","California, USA","http://pbs.twimg.com/profile_images/671766179229204480/QSnVQ2ME_normal.jpg","206","134","58","en","http://www.twitter.com/tmj_CA_auto/status/721116647939907586"
"721116647860207616 ","2016-04-15","23:23","TMJ-LAX HRTA Jobs","tmj_lax_hrta","Follow this account for geo-targeted Hospitality/Restaurant/Tourism job tweets in Los Angeles, CA. Need help? Tweet us at @CareerArc!","Want to work in #ShermanOaks, CA? View our latest opening: https://t.co/ndBTVtUOiM #Hospitality #restaurantjobs #Job #Jobs #Hiring",,,"34.1423899","-118.4571974","US","Los Angeles, CA","http://pbs.twimg.com/profile_images/666930533297864704/xfFx5CSs_normal.jpg","485","295","85","en","http://www.twitter.com/tmj_lax_hrta/status/721116647860207616"
"721116647818285056 ","2016-04-15","23:23","De Anne Russell","deannerussell","Are U looking for #job in #Healthcare? #Dignityhealth is where it is at! #RNJOBS, #AlliedHealthJobs #AzJOBS, NVJOBS #hellohumankindness","#Physician #Job in #Phoenix, AZ: Division Chief at St Josephs Hospital &amp; Med Center https://t.co/PFX4h06EwZ #Jobs #Hiring",,,"33.5080943","-112.0863874","US","Phoenix, AZ","http://pbs.twimg.com/profile_images/629701914716803072/eRprCTM__normal.jpg","849","61","101","en","http://www.twitter.com/deannerussell/status/721116647818285056"
"721116646979608576 ","2016-04-15","23:23","Unfufu","lilunfufu","Born and raised in the city of THA Bang-Bang. CEO of Bang'em Ent. Recording artist,actor,and more. For booking contact: bangement@gmail.com","Wyoming this morning. 4/15/16. Now Iowa then to Denver. Rolling Stone not pocket full of stones.… https://t.co/7WIVyWxj8A",,,"41.6682424","-106.36825638","US","Wyoming, USA","http://pbs.twimg.com/profile_images/709344756296519681/Nn7fBjC-_normal.jpg","760","2001","13","en","http://www.twitter.com/lilunfufu/status/721116646979608576"
"721116646861963265 ","2016-04-15","23:23","Total Traffic Austin","TotalTrafficAUS","Your up to the minute #traffic updates! Stuck in Traffic? Tell us all about it! Tweet us or call the Total Traffic Tipline 684-7389 #Austin #KeepAustinWeird","Injury accident in #Austin on Parmer Ln near Avery Ranch Blvd #ATXtraffic https://t.co/8laei8AmfZ",,,"30.49796","-97.77567000000001","US","Austin, TX","http://pbs.twimg.com/profile_images/439088193237815296/nujzvGjR_normal.png","3318","169","93","en","http://www.twitter.com/TotalTrafficAUS/status/721116646861963265"
"721116645700300800 ","2016-04-15","23:23","Nigel Mouncey","LordMounce",,"Drinking a Fisticuffs by @cedarcreekbeer at @speakeasyindy — https://t.co/ozH4xsYcnX",,,"39.8488","-86.1414","US","Indianapolis, IN","http://pbs.twimg.com/profile_images/489470758/image_normal.jpg","160","435","14","en","http://www.twitter.com/LordMounce/status/721116645700300800"
"721116644102258688 ","2016-04-15","23:23","Brandon Cormier","BrandonCormier","Son of God| Husband & Father| New Life Church Youth Pastor| Worship Leader| Consumed w/reaching my generation for Jesus| ORU Alumnus","My first born princess. Determined more than ever to make sure she KNOWS she is loved by both… https://t.co/CBZP8uV9V6",,,"38.8634","-104.792","US","Colorado Springs, CO","http://pbs.twimg.com/profile_images/712408360167976960/_uwTtxth_normal.jpg","2110","596","43","en","http://www.twitter.com/BrandonCormier/status/721116644102258688"
"721116643481358336 ","2016-04-15","23:23","CO Non-Metro Jobs","tmj_co_usa_jobs","Follow this account for geo-targeted Other job tweets in Colorado Non-Metro. Need help? Tweet us at @CareerArc!","We're #hiring! Click to apply: Business Process Transformation - https://t.co/ib7ZA3US87 #Job #LoneTree, CO #Jobs",,,"39.5360997","-104.8963682","US","Carriage Club, CO","http://pbs.twimg.com/profile_images/668831770809253888/Bz73B5CZ_normal.jpg","791","533","42","en","http://www.twitter.com/tmj_co_usa_jobs/status/721116643481358336"
"721116919466762241 ","2016-04-15","23:24","WitchyWoman","GoodwinHH6","IndepenConservaPagan, Gray Witch. Adult ICU RN for past 31 yrs. Army wife. Husband is 3rd ID soldier-combat medic. Tweets are always my own opinion. #ROTM","I'm at Home of the Goodwins in Fort Stewart, GA https://t.co/VprShrPGRP",,,"31.88036852","-81.60898731","US","Fort Stewart, GA","http://pbs.twimg.com/profile_images/684472374272626688/pnMk66vX_normal.jpg","5448","5281","246","en","http://www.twitter.com/GoodwinHH6/status/721116919466762241"
"721116918250221568 ","2016-04-15","23:24","Cindy C","RoadtoFnHealth","To motivate and inspire, to be motivated and inspired, by people, for a future of better health in mind, body, & soul. #health #fitness #motivation #gym #food","#fridayfrolic You Are Cordially Invited To A Pop-Culture Wine Tasting https://t.co/jVzOkypD7R #fitness #health #motivation #gym",,,"45.5085485","-73.8209928","CA","Montréal, Québec","http://pbs.twimg.com/profile_images/714636744575094785/qfxzgpJK_normal.jpg","31","8","19","en","http://www.twitter.com/RoadtoFnHealth/status/721116918250221568"
"721116917273124865 ","2016-04-15","23:24","Gail Burke","wormsmom","“Sing like no one's listening, love like you've never been hurt, dance like nobody's watching, and live like its heaven on earth.”  Mark Twain","Amazing sights you see in small Iowa towns.....@michaellondra @… https://t.co/pTczcYzVah",,,"42.01916667","-93.45166666999999","US","Nevada, IA","http://pbs.twimg.com/profile_images/430917006997467136/eqBNDMV3_normal.jpeg","422","449","32","en","http://www.twitter.com/wormsmom/status/721116917273124865"
"721116916723556353 ","2016-04-15","23:24","Norie One","NorieOne","It is, what it is!","When you have to find that 1 parking spot in the whole lot to fit your land yacht so it won't… https://t.co/7xOju7DpHH",,,"37.9358147","-122.35559158","US","Richmond, CA","http://pbs.twimg.com/profile_images/512629150415192065/DHrvPqjM_normal.jpeg","99","22","9","en","http://www.twitter.com/NorieOne/status/721116916723556353"
"721116916325036032 ","2016-04-15","23:24","SlagleBOMB","theSlagleBOMB","Amanda.Bean.Leo.Artist.Photog.Makeup.Graphic Design.Sucker Punch. A beautiful girl with Bettie eyes living in a World of secrets and lies.","Just another first. What seems like a random act to some, might feel… https://t.co/xLIUfXuMiW",,,"34.12253255","-83.60563802","US","Jefferson, GA","http://pbs.twimg.com/profile_images/624093595641978884/9F-AXW7K_normal.jpg","54","267","1","en","http://www.twitter.com/theSlagleBOMB/status/721116916325036032"
"721116916283088896 ","2016-04-15","23:24","Deborah Glad","debDANGITglad",,"@julesgina @friedalive sorry..had to go. Lisa called..said they were leaving in about 10 minutes..so..ur probably in BED now!TalkLaterIHope",,,"44.99463085","-93.24993584000001","US","Minneapolis, MN","http://abs.twimg.com/sticky/default_profile_images/default_profile_3_normal.png","124","114","13","en","http://www.twitter.com/debDANGITglad/status/721116916283088896"
"721116915905658880 ","2016-04-15","23:24","Denver Hospitality","tmj_den_hrta","Follow this account for geo-targeted Hospitality/Restaurant/Tourism job tweets in Denver, CO. Need help? Tweet us at @CareerArc!","General Manager - SONIC Drive-In: (#Thornton, CO) https://t.co/ethm5wXlRz #Hospitality #SONIC #Job #Jobs #Hiring #CareerArc",,,"39.885496","-104.9433332","US","Thornton, CO","http://pbs.twimg.com/profile_images/667176116407242752/yGt1Qudy_normal.jpg","523","293","65","en","http://www.twitter.com/tmj_den_hrta/status/721116915905658880"
"721116915800743937 ","2016-04-15","23:24","Vitamin Shoppe Jobs","VSIcareers","At #VitaminShoppe we are lovers of fitness, health, vitamins, helping you on your wellness journey and motivating others. Apply to our #jobs below.","Want to work at The Vitamin Shoppe? We're #hiring in #SanJose, CA! Click for details: https://t.co/gGnaXrpF4M #Job #Jobs",,,"37.251121","-121.858335","US","San Jose, CA","http://pbs.twimg.com/profile_images/497122335518769153/S7vPUx1I_normal.png","602","96","608","en","http://www.twitter.com/VSIcareers/status/721116915800743937"
"721116914399911936 ","2016-04-15","23:24","Ryder Jobs","Ryderjobs","Ryder System, Inc. is a FORTUNE 500 provider of transportation  and supply chain management solutions. View our job openings and Get All You Need to Succeed.","See our latest #LOSANGELES, CA #job and click to apply: Ryder Now Hiring/Railroad yard/Intermodal Truck... - https://t.co/rbLgZtBzAF",,,"34.0522342","-118.2436849","US","Los Angeles, CA","http://pbs.twimg.com/profile_images/778086964/Ryder_126x126_normal.jpg","792","8","400","en","http://www.twitter.com/Ryderjobs/status/721116914399911936"
"721116912566992896 ","2016-04-15","23:24","TMJ-SJC HRTA Jobs","tmj_sjc_hrta","Follow this account for geo-targeted Hospitality/Restaurant/Tourism job tweets in San Jose, CA. Need help? Tweet us at @CareerArc!","We're #hiring! Click to apply: Barista (US) - https://t.co/gri8aarjvj #Hospitality #Veterans #Job #Jobs #CareerArc",,,"37.2525161","-121.8630003","US","San Jose, CA","http://pbs.twimg.com/profile_images/667452663005446144/TnF_CFp4_normal.jpg","382","295","56","en","http://www.twitter.com/tmj_sjc_hrta/status/721116912566992896"
"721116912474689536 ","2016-04-15","23:24","SunnyLa81","sunnylablaz",,"Family got the club pack like it's Friday night @ Society 2201 https://t.co/sG0WaJvLO9",,,"41.8856201","-87.6819611","US","Chicago, IL","http://pbs.twimg.com/profile_images/706289839356964864/XDeCK73h_normal.jpg","88","478","1","en","http://www.twitter.com/sunnylablaz/status/721116912474689536"
