"721139601176264704 ","2016-04-16","00:54","93.","RobertAnthonyyy","22. God. Family. Money. Astros. Red Nation. Texans Nation. May the lord give guidance to the lost souls. #RIPCheet #RIPBigNunc","Damn",,,"29.7182285","-95.2804019","US","Houston, TX","http://pbs.twimg.com/profile_images/679534335339311104/I9Nv-dDT_normal.jpg","1800","1517","12","en","http://www.twitter.com/RobertAnthonyyy/status/721139601176264704"
"721139600576626689 ","2016-04-16","00:54","Justin McQueen","TheJoker46","Great cook, just a good guy, what can I say ask someone.They will tell you the same.","Drinking an IPA by @westsixth @ The Lagoon Saloon — https://t.co/3mM6rZDTAN",,,"39.086","-84.55889999999999","US","Ludlow, KY","http://pbs.twimg.com/profile_images/378800000530875687/6bcfcbab7e7708746383e01f86629a5e_normal.jpeg","192","564","4","en","http://www.twitter.com/TheJoker46/status/721139600576626689"
"721139600501170176 ","2016-04-16","00:54","Hannah Roy","HannahGRoy14",,"Beautiful evening for a picnic! #instadfw @ Lake Cliff Park, Dallas https://t.co/m9u7M6aKSd",,,"32.7560273","-96.82153771","US","Dallas, TX","http://pbs.twimg.com/profile_images/698738700130193408/7FCUTftb_normal.jpg","157","345",,"en","http://www.twitter.com/HannahGRoy14/status/721139600501170176"
"721139598282203136 ","2016-04-16","00:54","Dan Moret","DanHitman","Professional Mixed Martial Arts fighter and Boxer. Instagram @HITMANMORET","Anthony with the big win via strikes from mount. 3-0 after his first @rfafighting appearance.… https://t.co/Wng3bg92z2",,"1","43.59150054","-96.75491133","US","Sioux Falls, SD","http://pbs.twimg.com/profile_images/441636891255767040/gcpth2NJ_normal.jpeg","860","209","21","en","http://www.twitter.com/DanHitman/status/721139598282203136"
"721139597665636353 ","2016-04-16","00:54","TMJ-SAN Cleric. Jobs","tmj_san_cler","Follow this account for geo-targeted Office/Clerical job tweets in San Diego, CA. Need help? Tweet us at @CareerArc!","This #Clerical #job might be a great fit for you: Data Entry Clerk needed in south bay San Diego - https://t.co/dvNBfr6PDb #ChulaVista, CA",,,"32.6762339","-116.9440313","US","Chula Vista, CA","http://pbs.twimg.com/profile_images/679023948370063360/2YTvTmrH_normal.jpg","306","200","24","en","http://www.twitter.com/tmj_san_cler/status/721139597665636353"
"721139596591955969 ","2016-04-16","00:54","Kindred Jobs","Kindred_Jobs","Kindred Healthcare, named a Fortune Magazine Most Admired Company, is the largest provider of post-acute care services in the United States.","Interested in a #Healthcare #job near #Dallas, Texas? This could be a great fit: https://t.co/tSg7JEpIJT #Hiring",,,"32.7766642","-96.7969879","US","Dallas, TX","http://pbs.twimg.com/profile_images/881390226/twitter_logo_bigger_normal.jpg","824",,"413","en","http://www.twitter.com/Kindred_Jobs/status/721139596591955969"
"721139596013084673 ","2016-04-16","00:54","Memorial Hermann TA","MHTalent","Dedicated to presenting career related info and job opportunities with Memorial Hermann Health System.  Come join this amazing family of professionals!","Interested in a #Healthcare #job near #Houston, TX? This could be a great fit: https://t.co/uT8QmMNrm7 #Hiring",,,"29.6926157","-95.5187201","US","Houston, TX","http://pbs.twimg.com/profile_images/378800000335902586/a4ac2b8452eaa67a043aebc216c88eb5_normal.png","421","67","142","en","http://www.twitter.com/MHTalent/status/721139596013084673"
"721139593093844992 ","2016-04-16","00:54","MouseBrew","MouseBrew","Unofficial beer guide, California Adventure","Live from the moderntimesbeer beverage seminar #disneycaliforniafoodandwine #mousebrew… https://t.co/dudJaAmNBw",,,"33.806473","-117.920094","US","Anaheim, CA","http://pbs.twimg.com/profile_images/703092410339831808/j8_sO_fZ_normal.jpg","353","258","6","en","http://www.twitter.com/MouseBrew/status/721139593093844992"
"721139592385015808 ","2016-04-16","00:54","Einstein Bros. Jobs","WorkAtEBB","For more information on careers at Einstein Bros. visit http://t.co/ubcIWQVess","#Hospitality #Job in #Aurora, CO: Shift Leader at Einstein Bros. Bagels https://t.co/Yw02NPX2SF #Veterans #Jobs #Hiring",,,"39.7724385","-104.797079","US","Denver, CO","http://pbs.twimg.com/profile_images/535151849095983104/3w3BD3pJ_normal.png","236","38","276","de","http://www.twitter.com/WorkAtEBB/status/721139592385015808"
"721139591919570944 ","2016-04-16","00:54","Lourdes Vazquez","LuluNews","Former crime/politics reporter for @DallasNews' @AlDiaTX. Investigative journalism is my passion. Chicagoan, News-junkie, Runner, TXAPME, @ColumAlum","We are less than 24 hours away from dfwhispanic gala! #latjournoedu purchase your tickets today!… https://t.co/ukfBqxMmiB",,,"32.7873001","-96.794281","US","Dallas, TX","http://pbs.twimg.com/profile_images/533281712386482176/A4wbeoA4_normal.jpeg","1089","1025","55","en","http://www.twitter.com/LuluNews/status/721139591919570944"
"721139591797977089 ","2016-04-16","00:54","Melissa Teal","MelissaaTeal","Tweeting as a potential crazy-dog lady. Basically, my life in a tweet shell. #MustLovePugs","Got the boy out getting his hands dirty today.. jasen_nassif #instalove #wisteria #instagrow… https://t.co/jUv3J2fCkl",,,"36.1313","-95.93729999999999","US","Tulsa, OK","http://pbs.twimg.com/profile_images/713149858547236864/69TfOTUt_normal.jpg","428","352","12","en","http://www.twitter.com/MelissaaTeal/status/721139591797977089"
"721139591697317888 ","2016-04-16","00:54","J-Mart","ItsMaarty","I'm posted at the Derek up on Westheimer. Hit me when you done ya shift.","I'm at @PFChangs in Dublin, OH https://t.co/ban1VB0mNG",,,"40.0767357","-83.13308632","US","Columbus, OH","http://pbs.twimg.com/profile_images/698549163915616257/24Fp9795_normal.jpg","511","231","18","en","http://www.twitter.com/ItsMaarty/status/721139591697317888"
"721139590120083457 ","2016-04-16","00:54","Scoular Careers","scoularcareers","The Scoular Company manages commodity supply-chain risk for customers in growing segments of food, feed and renewable fuel markets.","We're #hiring! Click to apply: Merchandiser - https://t.co/WvIsW4HIuI #Job #Charleston, SC #Jobs",,,"32.7764749","-79.9310512","US","South Carolina, USA","http://pbs.twimg.com/profile_images/672149657930330116/eYRHDiHd_normal.jpg","141","93","129","en","http://www.twitter.com/scoularcareers/status/721139590120083457"
"721139589155581952 ","2016-04-16","00:54","fcgamboav","fcgamboav","Buena onda, estricto, enojón, alegre, dedicado, muy responsable y ambicioso.","I'm at @NextelMx in Monterrey, NL https://t.co/MBrlXyANwG",,,"25.73156036","-100.39546967","MX","Monterrey, Nuevo León","http://pbs.twimg.com/profile_images/559772790614523904/7kCkPWbj_normal.jpeg","108","325","9","en","http://www.twitter.com/fcgamboav/status/721139589155581952"
"721139589113626624 ","2016-04-16","00:54","Tori-Jo","CallMeTori81","God will either move your mountain or give you the strength to climb it.","First alumni event in the books. #nycliving #workinghard… https://t.co/4X3ODJ27Wx",,,"40.770683","-73.988625","US","Manhattan, NY","http://pbs.twimg.com/profile_images/717556565964943360/zAl3T5HR_normal.jpg","142","261","6","en","http://www.twitter.com/CallMeTori81/status/721139589113626624"
"721139588241166336 ","2016-04-16","00:54","Cheryl Puterbaugh","cputerbaugh","At work: internal communication and organizational learning.  At play: Wine, food, travel, Tampa Bay Lightning, Newcastle United.  And cats.","@TheRevTy I freaking love Cally on the PK.",,,"27.945821","-82.45105700000001","US","Tampa, FL","http://pbs.twimg.com/profile_images/644983171449229312/ZpcWgfNi_normal.jpg","215","735","22","en","http://www.twitter.com/cputerbaugh/status/721139588241166336"
"721139587289063424 ","2016-04-16","00:54","Dr. Gaucher","zam_0ra","Twitter es como el altavoz de mi mente. Insta: herejezamora. No one can stop us now. 'Cause we are all made of stars","nueva materia, nueva maestra 😍 este mes estará con madre! (@ UVM Campus Monterrey Norte) https://t.co/SJRvxwkBl0",,,"25.71746842","-100.25014658","MX","San Nicolás de los Garza, Nuevo León","http://pbs.twimg.com/profile_images/704778351097982976/bmsDhm0u_normal.jpg","280","295","4","es","http://www.twitter.com/zam_0ra/status/721139587289063424"
"721139585036582913 ","2016-04-16","00:54","keels☄","keeleygolden","well, when life gives u lemons.....","flippin loved this @ Devil's Den https://t.co/ZMxgHznT3L",,,"39.79126","-77.24215","US","Pennsylvania, USA","http://pbs.twimg.com/profile_images/697890215088648192/OMBxcyOL_normal.jpg","467","434","1","en","http://www.twitter.com/keeleygolden/status/721139585036582913"
"721139584797581312 ","2016-04-16","00:54","Finesser Da Plug","MalachiPrater","25 yr old MMA fanatic and the realest nigga u never met studies shown thick women are the leading cause of happiness among black men..It's  science my nigga","That might be thee motto now If fight pass is good enough for Anderson Silva then it's good for you","1",,"38.6896806","-90.2374391","US","St Louis, MO","http://pbs.twimg.com/profile_images/562873282987167744/3e1kJd4b_normal.jpeg","617","448","18","en","http://www.twitter.com/MalachiPrater/status/721139584797581312"
"721139583346278401 ","2016-04-16","00:54","Leo GrecoOk","LeooGreco","Amante del fútbol.Tuve mil dolores de cabeza mil momentos de tristeza y una culpa equivalente a un millón*JRR*CR7*SF*C.A.B.J *PAUL WALKER 0DESCEN AmoComprarRopa","Mi cable a 🌍. Mi lugar en el mundo 🛁. Mi segunda 🏡. #motivationfitness  ✌ @ Apple Fitness Center https://t.co/4envvQ1DXb",,,"37.33176","-122.034831","US","Cupertino, CA","http://pbs.twimg.com/profile_images/689961374768873473/ImXchfRZ_normal.jpg","659","405","10","es","http://www.twitter.com/LeooGreco/status/721139583346278401"
"721139581068910592 ","2016-04-16","00:54","♡Evelyn Cruz♡","guccigirl1977","Wife, mom and daughter of a King!","CocoLoco donut. Heaven on Earth!!! #DonutCrazy #FamilyTime @ Donut… https://t.co/0Oun57ZfdU",,,"41.265153","-73.09402677999999","US","Shelton, CT","http://pbs.twimg.com/profile_images/636717226154979328/klNWD2Sd_normal.jpg","72","176",,"en","http://www.twitter.com/guccigirl1977/status/721139581068910592"
"721139580993273856 ","2016-04-16","00:54","GoldenWestManagement","GoldenWestMgmt","Affordable Property Management and Investment Property Sales in Las Vegas, Phoenix and San Diego!","I would love to show you my #listing at 5251 E. 4th St. #Tucson #AZ https://t.co/0YXB1KE1Qj #realestate https://t.co/w2WaahGeMA",,,"32.230965","-110.880345","US","Tucson, AZ","http://pbs.twimg.com/profile_images/344513261583268869/60d4c4ff82c97336311c6bbee6d52ceb_normal.jpeg","1334","1152","28","en","http://www.twitter.com/GoldenWestMgmt/status/721139580993273856"
"721139579974205445 ","2016-04-16","00:54","OVERTIME™","overtimestore","Where The Sneaker Game Starts Over","Thank you to everyone that stopped by today and showed love. We are now officially closed.… https://t.co/AXVvrPQtlT",,,"41.8854065","-87.653038","US","Chicago, IL","http://pbs.twimg.com/profile_images/677983026425389056/g-I4X5l9_normal.jpg","208","90","12","en","http://www.twitter.com/overtimestore/status/721139579974205445"
"721139578925481984 ","2016-04-16","00:54","Spotter Network Inc","spotternetwork","Spotter Network Reports ; This is an unmanned account. Do not expect a reply.","Spotr 3 miles SE of EVA, OK @ 12:50AM UTC TOR&gt;-Stovepipe tornado formed approx 5 miles SW of Eva, OK, moving essentially north, at time of",,"2","36.762","-101.864","US","Oklahoma, USA","http://pbs.twimg.com/profile_images/555245150/download_normal.jpeg","7897","2","431","en","http://www.twitter.com/spotternetwork/status/721139578925481984"
"721139578711638016 ","2016-04-16","00:54","Megan Harrington","MegEHarrington","Owl Enthusiast, Media Geek, Foodie, Ocean Activist... Save The Bees, Save Us All...","Cheers to Friday! #ihavethisthingwithfloors  #viewfromabove rickdlo8 @ Mecha Noodle bar https://t.co/edSSCe6Zpl",,,"41.09887358","-73.41721381000001","US","Norwalk, CT","http://pbs.twimg.com/profile_images/2894758742/f7882d19490a9a5d0b7221f97966d529_normal.jpeg","197","671","6","en","http://www.twitter.com/MegEHarrington/status/721139578711638016"
"721139578321641473 ","2016-04-16","00:54","Kendall⚓️","kendallongg","wmu alum | kesha & gaga follow | ❂snapchat:kendallongg","Happy birthday to my beautiful mother who hasn't aged a day 🌸💜💗 @… https://t.co/tbVeBQoCdo",,,"42.2447701","-84.40052799999999","US","Jackson, MI","http://pbs.twimg.com/profile_images/709917859405651969/qNF8hZW0_normal.jpg","1395","445","9","en","http://www.twitter.com/kendallongg/status/721139578321641473"
"721139576912392197 ","2016-04-16","00:54","๑ ๑Miki Kawabata๑ ๑","miikiikz","comunicóloga . . . de sangre mexicana y japonesa","I'm at Sam's Club in Benito Juárez, Distrito Federal https://t.co/dTRWw2iMJL",,,"19.36961096","-99.16425526","MX","Benito Juárez, Distrito Federal","http://pbs.twimg.com/profile_images/691698204656562176/U01bzsNW_normal.jpg","324","584","5","es","http://www.twitter.com/miikiikz/status/721139576912392197"
"721139574626480128 ","2016-04-16","00:54","Chris Hintz","Pinnacleprodj",,"Tonight's Office!  What a beautiful view! #blackhills #djchrishintz #djlife #pinnacleproductions… https://t.co/sRZtwrB0iV",,,"43.87645366","-103.45461226","US","South Dakota, USA","http://pbs.twimg.com/profile_images/443758273506705408/2QR9spjT_normal.jpeg","566","421","9","en","http://www.twitter.com/Pinnacleprodj/status/721139574626480128"
"721139572722286592 ","2016-04-16","00:54","⚓Pirate's Life⚓️","hectorzido","★gadgets-android-musica-video juegos-party-beer-fan de Salvador Dali★","I'm at Bravucón Brewing House https://t.co/AeI5Cc4Wv7",,,"32.54394819","-116.9240353","MX","Tijuana, Baja California","http://pbs.twimg.com/profile_images/2344194623/tigre_normal.jpg","992","332","54","es","http://www.twitter.com/hectorzido/status/721139572722286592"
"721139572139118597 ","2016-04-16","00:54","MadHouse Comedy Club","MadHouseComedy","Mad House Comedy Club Open 7 Days A Week! Call Our Box Office at (619) 702-6666.","Our HILARIOUS lineup for tonight!! @ Mad House Comedy Club https://t.co/O40GJc0wB9",,,"32.71332291","-117.16357878","US","San Diego, CA","http://pbs.twimg.com/profile_images/356756936/Mad_House_Stacked_01_normal.jpg","2427","1029","68","en","http://www.twitter.com/MadHouseComedy/status/721139572139118597"
"721139571807772674 ","2016-04-16","00:54","sambajoy","SambajoyArt","Brazilian family based in Vancouver, traveling the world to shoot beautiful weddings ❤️","🌿 #fbf a Summer in #ny @ The High Line https://t.co/dVmURFTxNb",,,"40.7406616","-74.0067978","US","Manhattan, NY","http://pbs.twimg.com/profile_images/634877990917115904/6-_Rqhhg_normal.jpg","636","99","36","en","http://www.twitter.com/SambajoyArt/status/721139571807772674"
"721139571589849090 ","2016-04-16","00:54","Paul Knox","DJPaulKnox","DJ/MC/Entertainer @ SCE Event Group : The House DJ for BravoTV's Real Housewives of NJ and HGTV's Dina's Party. https://t.co/8hpHpXfTgv","Congratulations Amanda &amp; Daniel.!! #SCEWeddings #sceeventgroup #DJPaulKnox @sceeventgroup… https://t.co/eBZW6gPMkw",,,"40.8750381","-74.0608292","US","Hackensack, NJ","http://pbs.twimg.com/profile_images/718509102830391296/084-zD7S_normal.jpg","594","814","11","fr","http://www.twitter.com/DJPaulKnox/status/721139571589849090"
"721139569639481344 ","2016-04-16","00:54","lexy sobczak","_lexxxy27","Holy Name & Greenwood Swimming","COLOR WARS 🚨🍎👠🍒❣❤️ @ Holy Name Central Catholic High School https://t.co/iTo60cHk6B",,,"42.24222222","-71.78416667","US","Worcester, MA","http://pbs.twimg.com/profile_images/711604681101942784/_6oiuweM_normal.jpg","301","243","2","en","http://www.twitter.com/_lexxxy27/status/721139569639481344"
"721139567357792256 ","2016-04-16","00:54","Bill Ellis","EllisWSSL","The Ellis and Bradley Show on WSSL 100","We went for pizza....s. @ Sidewall Pizza Company https://t.co/DYoaLEvGUh",,,"34.96538739","-82.44136336","US","Travelers Rest, SC","http://pbs.twimg.com/profile_images/639160596202659840/tO-eysd4_normal.jpg","485","866","4","en","http://www.twitter.com/EllisWSSL/status/721139567357792256"
"721139566384705537 ","2016-04-16","00:54","Amy Hintosh","outrageousinker","God and family first; animal lover, craft queen, redneck. Pet stylist and dog trainer.","New goodie. Cord tamer. #crochetersofinstagram #crochet #cordkeeper… https://t.co/CT087lNcSs",,,"38.8803","-77.1083","US","Arlington, VA","http://pbs.twimg.com/profile_images/689814013996331008/PhgVaP3l_normal.jpg","66","392","4","en","http://www.twitter.com/outrageousinker/status/721139566384705537"
"721139566263054337 ","2016-04-16","00:54","Bahby Banks","bahbybanks","Empowerment Speaker. Research and Evaluation Consultant. Entrepreneur.","Congratulations to the winners tonight! An amazing celebration of… https://t.co/vfrsTm3l1m",,,"35.8356","-78.67352","US","Raleigh, NC","http://pbs.twimg.com/profile_images/448173114879250432/Xmu1p3Lu_normal.jpeg","1066","2271","17","en","http://www.twitter.com/bahbybanks/status/721139566263054337"
"721139565378015232 ","2016-04-16","00:54","Jose Luis D.G.","JL_DG",,"I'm at Cantina La No. 20 Santa Fe in Cuajimalpa, DF https://t.co/HwqSuH9cma",,,"19.36131612","-99.27366257","MX","Cuajimalpa de Morelos, Distrito Federal","http://pbs.twimg.com/profile_images/1280900992/IMG00379-20110310-1227_normal.jpg","172","508","2","es","http://www.twitter.com/JL_DG/status/721139565378015232"
"721139564861984768 ","2016-04-16","00:54","Doggers","NoodleBeast","Random Thoughts/DailyLife/Gaming/And a Not So Safe For Work pup~ Expect lots of doodles! Some of them NSFW! Header Image by Obba on FA!","@Taggzzz Which helmet is that? Don't think I'm familiar with it.",,,"33.9236187","-118.0784777","US","Norwalk, CA","http://pbs.twimg.com/profile_images/716472726530076673/CBljduo4_normal.jpg","1921","197","23","en","http://www.twitter.com/NoodleBeast/status/721139564861984768"
"721139564518068225 ","2016-04-16","00:54","Martín Santos","brendancrowks","Dios conmigo....","Puro dormir y encima de mi 😜 @ La Romana, Tlalnepantla Edo. De México https://t.co/6170iRJrm8",,,"19.55101732","-99.19315838","MX","Tlalnepantla de Baz, México","http://pbs.twimg.com/profile_images/641024594367791104/gk_TCkH-_normal.jpg","779","2071","1","es","http://www.twitter.com/brendancrowks/status/721139564518068225"
"721139564429971456 ","2016-04-16","00:54","Jorge Ordaz","jorge_ordaz","Selling Houston Real Estate is my passion, living, loving and playing here is a plus.","My pals at Byz #liveinhoustonproperties @ Byzantio https://t.co/p7ULyQu4BH",,,"29.753262","-95.386713","US","Houston, TX","http://pbs.twimg.com/profile_images/659058694773051392/vG5Nlyeu_normal.jpg","458","1944","19","es","http://www.twitter.com/jorge_ordaz/status/721139564429971456"
"721139563893121024 ","2016-04-16","00:54",":Donna Herrera","dyh9950","Pro-Choice, Student, Marxist-Feminist (part of a two person band called Igor and Papabitch with Julio as recorder, I play the kazoo and tambourines)","Today's visit... https://t.co/qP2GSUJAHX",,,"26.3054533","-98.1815098","US","Edinburg, TX","http://pbs.twimg.com/profile_images/676807614483660800/132s8ZPK_normal.jpg","171","257","6","en","http://www.twitter.com/dyh9950/status/721139563893121024"
"721139563150880768 ","2016-04-16","00:54","Jazelle Morris","Jazelle352","14K Captain '09-'10, BCU & Fullsail University Alumna. *Happily Married* Tau Beta Sigma National Honorary Band Sorority Inc. Life Univ Chiropractic Student.","Today's workout #jazellegazellefitness #fitpregnancy #kissmybabybump 😘😂 👶🏾🍼 @ Rockledge Atlanta… https://t.co/rySQF6XyJp",,,"33.90217775","-84.44990266000001","US","Georgia, USA","http://pbs.twimg.com/profile_images/483967821475758080/WHS3Ipbv_normal.jpeg","901","561","15","en","http://www.twitter.com/Jazelle352/status/721139563150880768"
"721139562827882496 ","2016-04-16","00:54","Jon♑Jon","Almondy_Stuff","#Pretty&Paid #Glamour&Glitter #Fashion&Fame I AM #TRULYOUTRAGEOUS , A #FANTASY #BrilliantlyWeird #HIPPIE Not even close 2 Human #Hybrid #Lougarou #Vampire","#BlueDream @ The Bronx NYC https://t.co/eL0iK3NkkQ",,,"40.85070841","-73.89415799","US","Bronx, NY","http://pbs.twimg.com/profile_images/693711608758034432/BFLvWUIW_normal.jpg","562","1181","11","en","http://www.twitter.com/Almondy_Stuff/status/721139562827882496"
"721139561980633088 ","2016-04-16","00:54","tara","lafitara","two worlds: fitness & social media. | content curator. digital marketer. expert wanderluster.","There is new goodness on @biffitgear (dot com) - you're going to want to see it. I promise. 💪🏼… https://t.co/Hes8MrCoki",,,"39.74948","-105.01866","US","Denver, CO","http://pbs.twimg.com/profile_images/699642639235158016/NcY5DdPS_normal.jpg","1398","950","228","en","http://www.twitter.com/lafitara/status/721139561980633088"
"721139558704934913 ","2016-04-16","00:54","Campanela","campa_nela",,"💄 (@ Liverpool in Ciudad de México, DF w/ @dirakman) https://t.co/IUtPvkjAbI",,,"19.43363374","-99.18266796","MX","Miguel Hidalgo, Distrito Federal","http://pbs.twimg.com/profile_images/622770298824163330/Wbm2TNLJ_normal.jpg","281","551","2","es","http://www.twitter.com/campa_nela/status/721139558704934913"
"721139556762939393 ","2016-04-16","00:54","Kevin Martin","bilco1331",,"Drinking a Raspberry by @SchrammsMead @ E. K. Powe Elementary — https://t.co/VmKZADcVyP #photo",,,"36.0126","-78.92310000000001","US","Durham, NC","http://pbs.twimg.com/profile_images/494956932591923200/Gri7LYnV_normal.jpeg","55","133","10","en","http://www.twitter.com/bilco1331/status/721139556762939393"
"721139556574212101 ","2016-04-16","00:54","Muzule","OrlandoMuzule","Allá ustedes. Yo aquí.","Antes de todo... (@ Camellon Plutarco E.Calles in Cuidad de Mexico, Distrito Federal.) https://t.co/1QD04rN8d8",,,"19.39783251","-99.10693645000001","MX","Iztacalco, Distrito Federal","http://pbs.twimg.com/profile_images/699448780706320385/8Q8q0rWy_normal.jpg","221","221","2","es","http://www.twitter.com/OrlandoMuzule/status/721139556574212101"
"721139556196573185 ","2016-04-16","00:54","DineHere.us","dine_here","The simple dining guide","Try https://t.co/rEF6iSb9La Fried Buffalo Chicken Wings #Fried #menu",,,"25.9781743","-80.14052775","US","Hallandale Beach, FL","http://pbs.twimg.com/profile_images/1657084315/simps_normal.jpg","4386","876","708","en","http://www.twitter.com/dine_here/status/721139556196573185"
"721139552732119040 ","2016-04-16","00:54","El Siglo de Torreón","torreon","Periódico Regional. Defensor de la Comunidad Lagunera, noticias de Coahuila y Durango. Miembro de la AEE","#editorial Tener mujeres taxistas es un avance - No hagas cosas buenas... (ENRIQUE IRAZOQUI) https://t.co/UwGQMTyBQX",,,"25.540505","-103.460398","MX","Torreón, Coahuila de Zaragoza","http://pbs.twimg.com/profile_images/660846385797857280/R9kqeK_3_normal.png","108361","2202","726","es","http://www.twitter.com/torreon/status/721139552732119040"
"721139552543449089 ","2016-04-16","00:54","Yellow magicband","JJbonezzi","All our dreams can come true, if we have the courage to pursue them- Walt Disney","It was the wrong usher.....still Soooooo cute. @ Medina Performing… https://t.co/ApXJTFfCZ8",,,"41.14438","-81.84782","US","Medina, OH","http://pbs.twimg.com/profile_images/654662708063637506/OfGZuju7_normal.jpg","325","153","6","en","http://www.twitter.com/JJbonezzi/status/721139552543449089"
"721139552434458624 ","2016-04-16","00:54","Martin Pons","pons00",,"#day341 lil nuggets got a new bean bag. bob seems to be enjoying it also. in the background is… https://t.co/xU1rwloULb",,,"40.6935196","-73.9833908","US","Brooklyn, NY","http://pbs.twimg.com/profile_images/612357760844496896/wRgeJbf9_normal.jpg","60","102","7","en","http://www.twitter.com/pons00/status/721139552434458624"
"721139551226318848 ","2016-04-16","00:54","Tony","bkgoat20","From Butler, PA",".@dougducey @GovBrewer you two are both pieces of garbage and deserve to go to hell, and I don't feel bad one bit for saying that",,,"32.251793","-110.8615737","US","Tucson, AZ","http://pbs.twimg.com/profile_images/551050992012500992/PuhXNY1d_normal.jpeg","157","107","2","en","http://www.twitter.com/bkgoat20/status/721139551226318848"
"721139551159365632 ","2016-04-16","00:54","Whitley Hamlin","QueenCityStyle","Stylist to Charlotte's Hardworking, Smart and Well-Mannered, Tastemaker. Tar Heel.  Oh, and I've kissed a Wellesley girl. https://t.co/FgSZJ8XeuB","@houseoflandor ✨ +royricephotography 💞 Stay tuned🎻 @ House of Landor https://t.co/HRcFwCD5NV",,,"35.8087","-78.62350000000001","US","Raleigh, NC","http://pbs.twimg.com/profile_images/634174428293799937/Ruhm81ip_normal.jpg","1377","765","38","en","http://www.twitter.com/QueenCityStyle/status/721139551159365632"
"721139549976584194 ","2016-04-16","00:54","Saúl Franco","saulfrancoz","Comunicologo(PUBLICISTA) ,Community Manager, mexicano (DFño) living in SD ✌️SNAPCHAT:saulfrancoz","I'm at Fashion Valley in San Diego, CA https://t.co/pcTa83vbhv",,,"32.76786063","-117.16717978","US","San Diego, CA","http://pbs.twimg.com/profile_images/666755843803578368/RozQpwL6_normal.jpg","578","305","24","en","http://www.twitter.com/saulfrancoz/status/721139549976584194"
"721139549284474881 ","2016-04-16","00:54","Romo","AlRomoMed","Regio de Corazón y Hueso Colorado","Otro más!!! (at @PalNorteOficial in Monterrey, NLE, Nuevo León) https://t.co/gOsREZx9qU",,,"25.68144681","-100.28321799","MX","Monterrey, Nuevo León","http://pbs.twimg.com/profile_images/629792474618134532/eIzEK4uQ_normal.jpg","468","818","7","es","http://www.twitter.com/AlRomoMed/status/721139549284474881"
