"721161205763686400 ","2016-04-16","02:20","Charlotte York","juualvarez","Esto no es una biografía.","Vinimos a ver el libro de la selva solamente. Pero los gorditos no bos podemos resistir 🍔🍟 @… https://t.co/nTMjheSa1I",,,"20.5756673","-100.40727764","MX","Querétaro, Querétaro Arteaga","http://pbs.twimg.com/profile_images/499700604856332289/GXOUyij6_normal.jpeg","401","502","4","es","http://www.twitter.com/juualvarez/status/721161205763686400"
"721161204979380225 ","2016-04-16","02:20","Aaron Robertson","robertsonaa","Charlotte, NC. Composition/scoring, Keys, Programming, Remixes, Tracks, etc.  Elevation Worship","Three strikes you're out!!  @jonsal09 @ St Louis Cardinals, Busch Stadium https://t.co/VdkhhaPaAr",,,"38.6236075","-90.1929937","US","St Louis, MO","http://pbs.twimg.com/profile_images/489061593997512704/hj4HPdtn_normal.jpeg","633","163","6","en","http://www.twitter.com/robertsonaa/status/721161204979380225"
"721161202966138880 ","2016-04-16","02:20","Alex J. Tamsula","AlexTamsula",,"Somebody wants to play.",,,"40.44696024","-79.99223052000001","US","Pittsburgh, PA","http://pbs.twimg.com/profile_images/587400500619841536/msGxMdy9_normal.jpg","15","2","6","en","http://www.twitter.com/AlexTamsula/status/721161202966138880"
"721161202374701056 ","2016-04-16","02:20","Sacrifice","Berserker1","Manager of VILLA Flint. #GoBlue #RaiderNation","I'm at McDonald's in Owosso, MI https://t.co/orH3vEmu4l",,,"42.99722046","-84.17886077999999","US","Owosso, MI","http://pbs.twimg.com/profile_images/640657990765400065/SCNqB9PY_normal.jpg","82","149","7","en","http://www.twitter.com/Berserker1/status/721161202374701056"
"721161202345189376 ","2016-04-16","02:20","Jon Feverston","JFeverston","I do not have a big mouth, just an assertive tone.","Luka surprised us for the show tonight! @ St. Francis DeSales High School, Columbus, OH https://t.co/GTC8dMgji8",,,"40.05299","-82.9758911","US","Columbus, OH","http://pbs.twimg.com/profile_images/715312979537969153/ZBY66axt_normal.jpg","123","292","1","en","http://www.twitter.com/JFeverston/status/721161202345189376"
"721161201493917697 ","2016-04-16","02:20","Mario Becko","YoSoyBecko","Locutor de @INTV_radio en @LaFieska, Programacion musical @elhijodelcuervo sigeme en https://t.co/5cwnXHmtlh , llámame BECKO","Tengan un buen viernes de quincena godin 😎😎 @ Hijo del Cuervo https://t.co/at2oA0Bh0y",,,"19.34960474","-99.16374196","MX","Coyoacán, Distrito Federal","http://pbs.twimg.com/profile_images/714591219737821184/tkVS5v01_normal.jpg","2886","163","8","es","http://www.twitter.com/YoSoyBecko/status/721161201493917697"
"721161197676941312 ","2016-04-16","02:20","Mouton Cove Weather","moutoncovewx","Live 10-minute weather data from a personal weather station in Mouton Cove, Abbeville, LA.","69.9F (Feels: 69.9F) - Humidity: 86% - Wind: 5.4mph SE - Gust: 7.6mph - Pressure: 1007.9mb - Rain: 0.09 #weather https://t.co/75yzNJjEvP",,,"29.875016","-92.218675","US","Louisiana, USA","http://pbs.twimg.com/profile_images/851524619/12_normal.png","222","18","12","en","http://www.twitter.com/moutoncovewx/status/721161197676941312"
"721161197211529216 ","2016-04-16","02:20","Cismontane Brewing","Cisbrewco","We are a microbrewery dedicated to making great beers that reflect the unique culture and natural phenomena of Southern California. Come join us in our tasting","#cismontanebrewing #industrialsunset #dtsa #ocbeer time for a pint! @ Cismontane Brewing Co. https://t.co/VegZJYblYa",,,"33.71638","-117.85177","US","Santa Ana, CA","http://pbs.twimg.com/profile_images/647215967286652928/SueK5qI2_normal.jpg","3451","292","150","en","http://www.twitter.com/Cisbrewco/status/721161197211529216"
"721161196016156672 ","2016-04-16","02:20","AleksandraZabkiewicz","aleksandrafilip",,"😍😍😍#sanantonio #texas #lavillita @ La Villita https://t.co/LPDV0VRDdq",,,"29.42027778","-98.48888889","US","San Antonio, TX","http://pbs.twimg.com/profile_images/435817764570148864/1gjH42cR_normal.jpeg","19","60",,"es","http://www.twitter.com/aleksandrafilip/status/721161196016156672"
"721161195110166530 ","2016-04-16","02:20","IVANQ","ivanqr","Ingeniero Industrial","I'm at Papi Fun Bar in Cuauhtémoc, D.f. https://t.co/Ss7ndOGO8A",,,"19.42650028","-99.16569463","MX","Cuauhtémoc, Distrito Federal","http://pbs.twimg.com/profile_images/542354492789121024/2ORzjenD_normal.jpeg","268","157","9","es","http://www.twitter.com/ivanqr/status/721161195110166530"
"721161192652210176 ","2016-04-16","02:20","Ebb Tide Bot","ebbtidebot","Ebb Tide app for #iOS and #AppleWatch","@ebbtideapp Tide in Point Barrow, Texas 04/16/2016 Low  1:23am  0.8 High  6:06am  0.9 Low 12:19pm  0.3 High  8:30pm  1.1",,,"29.7333","-94.83329999999999","US","Texas, USA","http://pbs.twimg.com/profile_images/687371798309023744/jgZJZzzy_normal.png","72","1","37","en","http://www.twitter.com/ebbtidebot/status/721161192652210176"
"721161192568451072 ","2016-04-16","02:20","Deer Tick","deertickmusic","In a van somewhere. Opinions expressed here do not necessarily reflect the opinions of anybody or anything, anytime, any place??????","Festival Fever @ Old Settlers Music Festival https://t.co/ZwchGEifVn","1",,"30.13186","-98.018147","US","Texas, USA","http://pbs.twimg.com/profile_images/553222192792485889/Stt5XCfP_normal.jpeg","26096","480","785","en","http://www.twitter.com/deertickmusic/status/721161192568451072"
"721161187900002306 ","2016-04-16","02:20","Diana♥","dyaanice","Imperfection is beauty, madness is genius, and it´s better to be absolutely ridiculous than absolutely boring.","Como quieras, como lo decidas....",,,"19.3837954","-99.0774553","MX","Iztapalapa, Distrito Federal","http://pbs.twimg.com/profile_images/720429778306617345/aS-t5Bpq_normal.jpg","35","314","2","es","http://www.twitter.com/dyaanice/status/721161187900002306"
"721161465852338176 ","2016-04-16","02:21","sassy assleigh♡","ash_bolton8898","it's just you and me against the world ♡","absolutely, positively done.",,,"42.1799196","-84.43273511","US","Jackson, MI","http://pbs.twimg.com/profile_images/720716791165497344/fShbXv6I_normal.jpg","214","449","2","en","http://www.twitter.com/ash_bolton8898/status/721161465852338176"
"721161463717609473 ","2016-04-16","02:21","Jeff Zeltwanger","jeffzeltwanger","Father, husband, KC Royals fan, runner. Oh, and I kind of sort of like craft beer. That sums up 90% of my tweets. Views are my own.","Drinking a War Hammer Imperial IPA by @4handsbrewery @ Beer Fridge By HFD — https://t.co/A3cGuaygk3",,,"39.2661","-94.5284","US","Kansas City, MO","http://pbs.twimg.com/profile_images/640640510164512768/fSuLj0iN_normal.jpg","259","674","8","en","http://www.twitter.com/jeffzeltwanger/status/721161463717609473"
"721161463239426049 ","2016-04-16","02:21","CESAR TORRES","CZR_TWR",,"A cenar (@ La Choperia in Coacalco, México) https://t.co/TzRwCFjBDP",,,"19.63396433","-99.09683115","MX","Coacalco de Berriozábal, México","http://pbs.twimg.com/profile_images/649565412095492096/b3oSiW7F_normal.jpg","481","2104","2","es","http://www.twitter.com/CZR_TWR/status/721161463239426049"
"721161462475988992 ","2016-04-16","02:21","DAVID MAGDAEL","nice1dave","PRECIOUS - i'm hungry!!!","#worldpremiere #memoriesOfAPenitentHeart #amazing and moving #tribeca2016 #CeciliaAldarondo… https://t.co/BKefz0V2On",,,"40.74534246","-73.99872544","US","Manhattan, NY","http://pbs.twimg.com/profile_images/635024293630312448/kUFWR_X3_normal.jpg","1093","720","79","en","http://www.twitter.com/nice1dave/status/721161462475988992"
"721161460068577280 ","2016-04-16","02:21","mattcastellan","mattcastellan","Marketer, marathoner, Domer, New Yorker, generally good guy. Brand Partnerships for Bryant Park. Views my own.","I'm at South Bend International Airport (SBN) - @sbnairport in South Bend, IN https://t.co/bF0Rw4p9xf",,,"41.70092243","-86.31206989","US","South Bend, IN","http://pbs.twimg.com/profile_images/711955258256130049/RMKrdFfF_normal.jpg","364","1987","10","en","http://www.twitter.com/mattcastellan/status/721161460068577280"
"721161457719750656 ","2016-04-16","02:21","Turru Gominola ★","TUNOERESPOP","En otro tiempo tenía perros salvajes en mi bodega pero al final se transformaron en pájaros y amables cantoras. Fan de @DavidBowieReal","😋😋 (@ Cenaduria La paloma w/ @ernestodoza) https://t.co/Vi67FKcO78",,,"22.154419","-100.991927","MX","San Luis Potosí, México","http://pbs.twimg.com/profile_images/720595508562014208/rEv6x-kB_normal.jpg","3256","213","20","es","http://www.twitter.com/TUNOERESPOP/status/721161457719750656"
"721161456012505088 ","2016-04-16","02:21","#OneOfOne OUT NOW!!!","LandstripChip","Booking & Features: LandstripBooking@gmail.com","Young. Wild. Free. 💫 @ Clark Atlanta University https://t.co/yurGUjha36",,,"33.74988617","-84.41236481999999","US","Atlanta, GA","http://pbs.twimg.com/profile_images/680638683611963392/RzOvtexA_normal.jpg","6481","1758","46","en","http://www.twitter.com/LandstripChip/status/721161456012505088"
"721161455807164417 ","2016-04-16","02:21","Margot","BrillaLaMar","Traveler, yogini & dream chaser. Mamá de @cocotierapparel. Mujer enamorada del Mar. Gitana, bruja y hasta pirata en otra vida. Instagram | brillalamar.","FASHION + ART Series at thompsonplayadelcarmen: @labikineria. Qué lindo que estuvo!! ~ #love… https://t.co/ZeAV31QCSY",,,"20.6339709","-87.0730193","MX","Solidaridad, Quintana Roo","http://pbs.twimg.com/profile_images/708292483256422400/g2Dh-iAU_normal.jpg","2047","2081","65","es","http://www.twitter.com/BrillaLaMar/status/721161455807164417"
"721161455807148032 ","2016-04-16","02:21","DJ7L","DJ_7L","https://t.co/lggGi3dgEV","tomorrow #recordstoreday @ Turntable Lab https://t.co/LnO4akBAfi",,,"40.72628","-73.9843099","US","Manhattan, NY","http://pbs.twimg.com/profile_images/1524318902/images_normal.jpg","5426","471","85","en","http://www.twitter.com/DJ_7L/status/721161455807148032"
"721161455144296448 ","2016-04-16","02:21","karen  de rivera","Karenvalde94","soy de mi amor eddy rivera","@SomosCoder   pero no puedo lo tienen privado",,,"22.3018483","-97.89176670000001","MX","Tampico, Tamaulipas","http://pbs.twimg.com/profile_images/720858534175383553/_1U25g6P_normal.jpg","311","750","4","es","http://www.twitter.com/Karenvalde94/status/721161455144296448"
"721161454154555392 ","2016-04-16","02:21","Henri Bendel","HenriBendel","Follow the Bendel Girls for The New & The Next in fashion accessories! Take 20% off your next purchase with our Email sign-up: http://t.co/m8ilBc8XAA","When it's time to dress for #Coachella you bring along a Soho Fringe Crossbody 🌵 @ The Saguaro… https://t.co/oeTj4qUTuQ",,,"33.802105","-116.527149","US","Palm Springs, CA","http://pbs.twimg.com/profile_images/2733517584/13d81e8cc67ef74a127fcee5610d5732_normal.png","44468","980","758","en","http://www.twitter.com/HenriBendel/status/721161454154555392"
"721161453554778113 ","2016-04-16","02:21","Lindsay","linzzz3","ambitious, witty & driven. #LikeAGirl #KSUSASA #FishKSU","First game of the season ❤⚾🍻 just missing mattyvale14 😢#FamilyNight #RollTribe #Windians… https://t.co/eAJfJGnhkF",,,"41.49602653","-81.68533882","US","Cleveland, OH","http://pbs.twimg.com/profile_images/587459676234715136/rbvGl4ou_normal.jpg","369","259","6","en","http://www.twitter.com/linzzz3/status/721161453554778113"
"721161451977637889 ","2016-04-16","02:21","V-Flex Sports","VflexSports","Applying Neuroscience Fundamentals in the Real World...          V-Flex","@GatorsSB it is truly amazing what @_TimWalton and staff has accomplished over the past four years. An even brighter future lies ahead.",,,"36.32714116","-83.37539366","US","Tennessee, USA","http://pbs.twimg.com/profile_images/648251001225527296/Dv1M5gIB_normal.jpg","755","722","10","en","http://www.twitter.com/VflexSports/status/721161451977637889"
"721161450182549504 ","2016-04-16","02:21","Julian Benton","KenpoVelo","Home inspector, avid Road Cyclist and Kenpo Practitioner.","Impromptu date night with Jatt. (@ East West Cafe in Santa Rosa, CA) https://t.co/tyYEdgBaAa",,,"38.45322743","-122.67104387","US","Santa Rosa, CA","http://pbs.twimg.com/profile_images/3755746744/0c03513b9716d414d293e50887db33ad_normal.jpeg","426","506","29","en","http://www.twitter.com/KenpoVelo/status/721161450182549504"
"721161446286041089 ","2016-04-16","02:21","I Just Want To Eat","ijustwanttoeat","I love food and want to share my experience!","Something old, a drink made with bacon 🤔 @brazenfoxnyc   #nyceats #nycfood #food #foodpic… https://t.co/btr8FzX0cK",,,"40.73281","-73.98784000000001","US","Manhattan, NY","http://pbs.twimg.com/profile_images/1654411763/image_normal.jpg","351","48","35","en","http://www.twitter.com/ijustwanttoeat/status/721161446286041089"
"721161445552037888 ","2016-04-16","02:21","Hayley Wilhelm","hayleywilhelm","|Fashion Blogger| #UNCP19 { KΔ- Epsilon Zeta } @jordanwalshaw❤️","Relay for Life was a blast with these lovely ladies 💕 @ UNC Pembroke https://t.co/ianmssPOb9",,,"34.68835403","-79.20091587","US","Pembroke, NC","http://pbs.twimg.com/profile_images/721010328730013696/-WiAGrRS_normal.jpg","1536","544","14","en","http://www.twitter.com/hayleywilhelm/status/721161445552037888"
"721161445363290112 ","2016-04-16","02:21","Carlos Ramirez","clsram","QFB ..... observador.... incredulo....fotografo","I'm at Infield Hipodromo De Las Américas https://t.co/ruuWNt8SLh",,,"19.4385365","-99.2206798","MX","Miguel Hidalgo, Distrito Federal","http://pbs.twimg.com/profile_images/675193406033932288/JLv_6QfF_normal.jpg","94","828","3","es","http://www.twitter.com/clsram/status/721161445363290112"
"721161444734210049 ","2016-04-16","02:21","Persia Nicole","PersiaNicole","Mid-Day Radio Personality Mon-Fri 10am-2pm 92.3 FM RadioOne|TvOne|#92Q Instagram: PersiaNicole #MidDayChick","The party is officially on now! We're broadcasting live from @oxygenbaltimore on @92qjamsbmore 😝… https://t.co/v2CCI5trkj",,,"39.28923481","-76.61262125","US","Baltimore, MD","http://pbs.twimg.com/profile_images/705190093234040832/CjbzlliZ_normal.jpg","9716","941","17","en","http://www.twitter.com/PersiaNicole/status/721161444734210049"
"721161443895308288 ","2016-04-16","02:21","M@rio Gomez","mario_ggomez",,"I'm at Tacos Popo's in San Nicolás de los Garza, Nuevo León https://t.co/JSHEa0pNqP",,,"25.74336714","-100.31009821","MX","San Nicolás de los Garza, Nuevo León","http://pbs.twimg.com/profile_images/3166631894/835c418293bb09baab1063d22dd0aa4f_normal.jpeg","241","670","4","es","http://www.twitter.com/mario_ggomez/status/721161443895308288"
"721161443119239172 ","2016-04-16","02:21","~Singing|Sensation~","Nigel_Tubbs","Im just trying to do right","Cried real hard tonight! Haha #victory @ God's House of Restoration… https://t.co/THP3U8e9fs",,,"35.712059","-86.393478","US","Tennessee, USA","http://pbs.twimg.com/profile_images/716852298702581760/PBgJaNbj_normal.jpg","729","990","1","en","http://www.twitter.com/Nigel_Tubbs/status/721161443119239172"
"721161440472788992 ","2016-04-16","02:21","Eduardo Micha","Miedito",,"Transformación.... @ Colonia Condesa https://t.co/G30zMNXcSS",,,"19.40974564","-99.17433613999999","MX","Cuauhtémoc, Distrito Federal","http://pbs.twimg.com/profile_images/378800000054606727/1cc0a315ea5b786c9d8847a314af2ce4_normal.jpeg","5505","358","10","es","http://www.twitter.com/Miedito/status/721161440472788992"
"721161438094602240 ","2016-04-16","02:21","Kevin Martin","bilco1331",,"Drinking a Limited Edition Oude Kriek (2013) by @BreweryMartin @ E. K. Powe Elementary — https://t.co/GeRaoMtokg #photo",,,"36.0126","-78.92310000000001","US","Durham, NC","http://pbs.twimg.com/profile_images/494956932591923200/Gri7LYnV_normal.jpeg","55","133","10","en","http://www.twitter.com/bilco1331/status/721161438094602240"
"721161934242979840 ","2016-04-16","02:22","Megan P","mnhockeyfan","Lover of hockey, beer, & all things MN! Opinions are mine and mine only. Doing good things w/ @InsightBrewing @barleysangelsmn @twins @bbs_mn & @wild","Drinking a Wild Sour Series: Dry-Hopped Sour by @DESTIHLBrewery at @destihlnormal — https://t.co/RrszfDgbtF",,,"40.5045","-88.95699999999999","US","Normal, IL","http://pbs.twimg.com/profile_images/1217590882/Frankilden_Reception___Sally_s_023_normal.JPG","1171","1647","48","en","http://www.twitter.com/mnhockeyfan/status/721161934242979840"
"721161933630672896 ","2016-04-16","02:22","Eric Rickets","PartyonBro","This happens to be a $100 minimum bet table. Perhaps you would feel more comfortable at one of our lower stakes tables.","#burger @ Hot's Kitchen https://t.co/IvjH9lObXk",,,"33.85994166","-118.39924741","US","Hermosa Beach, CA","http://pbs.twimg.com/profile_images/613419807430475776/0sfKMrTD_normal.png","254","134","14","en","http://www.twitter.com/PartyonBro/status/721161933630672896"
"721161932779208704 ","2016-04-16","02:22","Pokin' the Bear","warrenhaight","Crazy about my #HABS and those #BRONCOS too. Can't we all just get along here?  Feline Diabetes expert.","We are in Freeport Bahamas! Woo hoo. @ Freeport, Bahamas https://t.co/svDzRWcNUK",,,"26.5333","-78.7","BS","Bahamas","http://pbs.twimg.com/profile_images/595671033300054016/S8emJ75A_normal.jpg","345","1115","10","en","http://www.twitter.com/warrenhaight/status/721161932779208704"
"721161932670021632 ","2016-04-16","02:22","DJ MADDOG","iamdjmaddog","Local DJ, Radio host, and Professional Wrestling encyclopedia.","Beer flight @ Unruly Brewing https://t.co/Hjr3tJk6F8",,,"43.23607","-86.2526","US","Muskegon, MI","http://pbs.twimg.com/profile_images/706097870621966337/donH5YC3_normal.jpg","395","1838","19","en","http://www.twitter.com/iamdjmaddog/status/721161932670021632"
"721161931948716033 ","2016-04-16","02:22","Angelica Horton","horongela",,"https://t.co/XgGTiIffYv",,,"37.6994129","-123.01177984","US","California, USA","http://pbs.twimg.com/profile_images/641122162678476801/Puu4B7fp_normal.jpg","4",,"2","es","http://www.twitter.com/horongela/status/721161931948716033"
"721161931617341440 ","2016-04-16","02:22","Abby","aberator","Parent. Baha'i. Mets Fan. Albany NY resider. Thirty- something","Mother daughter dance tonight. Selfie level - master. @ Albany School Of Humanities https://t.co/uEKgU3RFoW",,,"42.64142919","-73.79000322","US","New York, USA","http://pbs.twimg.com/profile_images/484149821838987265/W_4DkSte_normal.jpeg","187","412","5","en","http://www.twitter.com/aberator/status/721161931617341440"
"721161931092922368 ","2016-04-16","02:22","Magical Mermaid♡","iRapunzel_","Mermaids are real.","Me lleva la veeeeerrrrrggaaa",,,"25.4104847","-101.019026","MX","Saltillo, Coahuila de Zaragoza","http://pbs.twimg.com/profile_images/700325147396296705/wXTCb4PK_normal.jpg","671","106","4","es","http://www.twitter.com/iRapunzel_/status/721161931092922368"
"721161930292006912 ","2016-04-16","02:22","Anna Mf'n Banana","ParanormalAnna","Goofy - Creepy Macabre Blogger✒ Oddity Collector, Dark Traveler I post my animals, ALOT. ❤ Blunt, Real Shit, No Sugar Coating.","Just waiting for the sun to go down. 🌅🎥🎬 #WestWindDriveIn #SacramentoDriveIn @ West Wind… https://t.co/lvOjDAQPer",,,"38.56701","-121.33913","US","La Riviera, CA","http://pbs.twimg.com/profile_images/699024805022961664/S1PhNQRy_normal.jpg","2821","363","48","en","http://www.twitter.com/ParanormalAnna/status/721161930292006912"
"721161929545359360 ","2016-04-16","02:22","Natural Selection","JacquesHerviou","Carbon balanced, wind powered wine agency of certified Biodynamic organic wines","#ILoveNY. I really do. @ World trade Center Observation deck https://t.co/YnTvR31e1j",,,"40.71318661","-74.01383379000001","US","Manhattan, NY","http://pbs.twimg.com/profile_images/616300436086108162/5bzCFztO_normal.jpg","74","77","2","en","http://www.twitter.com/JacquesHerviou/status/721161929545359360"
"721161927834148864 ","2016-04-16","02:22","Ericka Sandoval","hEryckaSandoval","Practicante de Kundalini Yoga y ferviente creyende de q existe el karma.Se ríe de sí misma https://t.co/WA3OPoNYB3…","Reflejo del #MuseoJumex en #PlazaCarso #cdmx2016 #mexico #day #instamexico #lovecdmx #Instagram… https://t.co/bowaLJzWcm",,,"19.44025","-99.20403","MX","Miguel Hidalgo, Distrito Federal","http://pbs.twimg.com/profile_images/712680653423124480/B0Yvf7CU_normal.jpg","164","401","6","es","http://www.twitter.com/hEryckaSandoval/status/721161927834148864"
"721161927465021440 ","2016-04-16","02:22","Scotty","2Hawty","Write or wrong. More yin than yang. @Jaguars.","Drinking a Driftwood Ale by @montauk_brewing @ Clairmont Reserve — https://t.co/MyUeU497TG",,,"33.8005","-84.3078","US","Druid Hills, GA","http://pbs.twimg.com/profile_images/690173874873462784/_fZo8yHt_normal.jpg","480","1738","7","en","http://www.twitter.com/2Hawty/status/721161927465021440"
"721161924344422400 ","2016-04-16","02:22","Julio Solis","s0lis_1","Ingeniero en sistemas computacionales","I'm at Estadio Kukulcán in Mérida, YUC https://t.co/VqbpDs3gSv",,,"20.94045911","-89.59608007","MX","Mérida, Yucatán","http://pbs.twimg.com/profile_images/671978438207520768/GsKGM5oo_normal.jpg","373","601","3","es","http://www.twitter.com/s0lis_1/status/721161924344422400"
"721161924294098949 ","2016-04-16","02:22","Rodolfo Sanchez","2rude18",,"Pepe Aguilar night - Drinking a Hefeweizen by @GBBrewingCo at @sanjosecivic  — https://t.co/NwkDTbNdkd #photo",,,"37.3309","-121.89","US","San Jose, CA","http://pbs.twimg.com/profile_images/657703845540204544/N9sipGiW_normal.png","332","635","27","en","http://www.twitter.com/2rude18/status/721161924294098949"
"721161923195224064 ","2016-04-16","02:22","Kari","_kaaaarii","Intenta vivir el presente y verás lo que se siente.","👌🏼😌 (@ Gym7 in Xochimilco, D.f) https://t.co/bGSxLvtqyX",,,"19.24971477","-99.05800244","MX","Xochimilco, Distrito Federal","http://pbs.twimg.com/profile_images/720476910569046016/35YFg3dV_normal.jpg","276","253","1","es","http://www.twitter.com/_kaaaarii/status/721161923195224064"
"721161922318626817 ","2016-04-16","02:22","katie burke","katie_burkie","fc'16 // vt'20 // lax // wgr ∞","still stomped stuart tho @ J. E. B. Stuart High School https://t.co/vpfJoypERT",,,"38.85680278","-77.14947222000001","US","Lake Barcroft, VA","http://pbs.twimg.com/profile_images/699132846628335616/cOK27Tg0_normal.jpg","818","787","2","en","http://www.twitter.com/katie_burkie/status/721161922318626817"
"721161921689477120 ","2016-04-16","02:22","Stanley Lumax","stanleylumax","Family/Photo/BBall/NYC  Looks determined without being ruthless. Theres something heroic about his manner. Comes across so calm. Full of passion.","I don't meet a lot of people from the same village in Volta Region,… https://t.co/TnGw3rkF02",,"1","40.7121","-73.95312","US","Brooklyn, NY","http://pbs.twimg.com/profile_images/689915228822310912/RDgsWUCu_normal.jpg","892","185","24","en","http://www.twitter.com/stanleylumax/status/721161921689477120"
"721161921165135872 ","2016-04-16","02:22","Richard Moody","RichardTMoody","I AM Thankful 4 Life","#nitetime #eating #burgerbreak #beerbreak #foodbreak #chilling #freshair #livingLife #outdoors… https://t.co/dtxXKF3hxl",,,"44.9481964","-93.29811100000001","US","Minneapolis, MN","http://pbs.twimg.com/profile_images/127223814/moody_twitter_normal.jpg","2287","2525","104","es","http://www.twitter.com/RichardTMoody/status/721161921165135872"
"721161918350827521 ","2016-04-16","02:22","Hiram Diaz","HiramDiazPorras",,"I'm at @WalmartMexico in Leon, GTO w/ @andhy_ortega https://t.co/xYhFhtcRvk",,,"21.16143124","-101.69116974","MX","León, Guanajuato","http://pbs.twimg.com/profile_images/1181029292/Foto_4_normal.jpg","145","554","3","en","http://www.twitter.com/HiramDiazPorras/status/721161918350827521"
"721161918120128514 ","2016-04-16","02:22","CeeLo","WelldamnFranko","FRANKO","Haven't recorded in too long",,,"42.0809546","-71.0379373","US","Brockton, MA","http://pbs.twimg.com/profile_images/720293804314607616/-zPMSvec_normal.jpg","460","257","3","en","http://www.twitter.com/WelldamnFranko/status/721161918120128514"
"721161917864288257 ","2016-04-16","02:22","Francesco","francescomaceri","Follow a singer-songwriter's cross-country journey. Donate: https://t.co/RoL3c8ajaq Watch me live at https://t.co/3SCqZ87jWr","Mission Inn. #missioninn #cali #PeriforniaTour #picoftheday #instagram #instagood #cali #travel… https://t.co/gNPDNPHjli",,,"33.98281","-117.37309","US","Riverside, CA","http://pbs.twimg.com/profile_images/684594257408077824/nLGEs1t9_normal.jpg","556","770","48","en","http://www.twitter.com/francescomaceri/status/721161917864288257"
"721161917037850624 ","2016-04-16","02:22","AWENDOWSKI PHOTO","AWendowskiPhoto","✈️AVAILABLE FOR TOUR: Photo/Video/VIP/Assistant TM✈️ Email: andrewphtgrphy@aol.com - Instagram: @AWendowskiphoto https://t.co/iLAm89JZqt","@abrband in their hometown of PA tonight at the @fillmorephilly | #abr #augustburnsred… https://t.co/KvEffqyawn",,,"39.9656906","-75.1354218","US","Philadelphia, PA","http://pbs.twimg.com/profile_images/638179870472830977/FguCpPgt_normal.jpg","817","2080","15","en","http://www.twitter.com/AWendowskiPhoto/status/721161917037850624"
"721161913346826240 ","2016-04-16","02:22","LA QuakeBot","earthquakesLA","I am a robot that tells you about earthquakes in Los Angeles as they happen. Built by @billsnitzer. Data is from the USGS. Get prepared: http://t.co/VtCEbuw6KH","1.8 mag earthquake occurred 1.24mi WSW of View Park-Windsor Hills, California. Details: https://t.co/CeXpof35ez Map: https://t.co/KXs6QZ0sV0",,"4","33.9864998","-118.3653336","US","Ladera Heights, CA","http://pbs.twimg.com/profile_images/195602280/Picture_3_normal.png","158614","6","1424","en","http://www.twitter.com/earthquakesLA/status/721161913346826240"
