"721183073694384128 ","2016-04-16","03:46","colleen","collmah_","You spend your life trying to get people to like you. Then you run over one person, not even a popular one, and everybody gets on your case. Ridley '16 NU '20","boys n roses #jprom #srynick!!!! @ Springfield Country Club https://t.co/I8L2YnQwoL","1",,"39.9260922","-75.35065698","US","Springfield, PA","http://pbs.twimg.com/profile_images/719733314769190912/jgpdSGwY_normal.jpg","1229","772","3","en","http://www.twitter.com/collmah_/status/721183073694384128"
"721183072675192834 ","2016-04-16","03:46","Tyler LaPier","TylerLaPier",,"@nashoverstreet @realjoeyfatone @lancebass @alloutvacations @royalcaribbean #awesome #cover &amp;… https://t.co/xtsizxEFG2",,,"26.08776522","-80.11999682","US","Hollywood, FL","http://pbs.twimg.com/profile_images/378800000546271175/60a10bbb3c002d6ae2ad9bf6c54badc1_normal.jpeg","22","41","5","es","http://www.twitter.com/TylerLaPier/status/721183072675192834"
"721183072067194880 ","2016-04-16","03:46","Cyril Secretaria","CyrilSecretaria","Instagram && snapchat: cyrilchesney","Serendipity (n) finding something good without looking for it ✨ @ Serendipity 3 https://t.co/hW5S8ZnC5e",,,"40.76183367","-73.96511781","US","Manhattan, NY","http://pbs.twimg.com/profile_images/715867719254589440/NXk-RXHa_normal.jpg","606","334","3","en","http://www.twitter.com/CyrilSecretaria/status/721183072067194880"
"721183070951317505 ","2016-04-16","03:46","JeaniBeani","jeanimurray","Hawkeye State transplant. Consultant. Works for the little fellers, not the Rockefellers. H /T Sen. Wellsone.","fun times with Kylie Boo!  #flashbackfriday waltdisneyworld #somuchfun #mickeymouse… https://t.co/LfGKjx8BNv",,,"28.41529704","-81.58061202","US","Florida, USA","http://pbs.twimg.com/profile_images/576022734938869761/ECzUKzgQ_normal.jpeg","448","623","6","en","http://www.twitter.com/jeanimurray/status/721183070951317505"
"721183068896280576 ","2016-04-16","03:46","Willyberto","Picaiola",,"Ahí va de nuevo estoy en polanco y está bien chido (@ Polanco Restaurante in Guadalajara) https://t.co/LrzcDh2EAu",,,"20.6794119","-103.3911632","MX","Guadalajara, Jalisco","http://pbs.twimg.com/profile_images/583012726093455361/47Xw3jMd_normal.jpg","379","890","8","es","http://www.twitter.com/Picaiola/status/721183068896280576"
"721183067231166464 ","2016-04-16","03:46","Adrian juarez ️","Adrizzy310",,"It's been a while 😊 #disneyland #Nikonnofilter #NikonD5500… https://t.co/y9STVmbKJX",,,"33.81021891","-117.92116033","US","Anaheim, CA","http://pbs.twimg.com/profile_images/711133867818627072/2eKkPPu3_normal.jpg","160","182","3","en","http://www.twitter.com/Adrizzy310/status/721183067231166464"
"721183063447838721 ","2016-04-16","03:46","Сtив.爪ҳ","_seditio_","Following Fitness, Science, Camgirls and T-girls!.. Most RTs are NSFW!!!!! Follow at your own peril","@GinaStarrStudio @GinaStarr69 he is very lucky, no doubt!",,,"34.2010012","-118.4693794","US","Los Angeles, CA","http://pbs.twimg.com/profile_images/491418324577034240/h__0V1mG_normal.jpeg","640","971","46","en","http://www.twitter.com/_seditio_/status/721183063447838721"
"721183062629957632 ","2016-04-16","03:46","Sarah","sosarahsays","East Coast girl in a West Coast world. Viking. MBA cand. Insatiably curious. Armchair philosopher. Outdoor adventurer. Endless explorer. Gluten-full. ENTP. n=1","The Gateway to the West has become the Gateway to the Rest of My Life!! 🙌🏼😊💯 #EMBA45 @ St. Louis https://t.co/abNfsDgvjs",,,"38.6272","-90.1978","US","St Louis, MO","http://pbs.twimg.com/profile_images/470729479103725568/5zrFALTe_normal.jpeg","2810","2957","200","en","http://www.twitter.com/sosarahsays/status/721183062629957632"
"721183061031919616 ","2016-04-16","03:46","DJ BDO","DJ_BDO","DJ BDO OFFICIAL PAGE. DJ, dueño de The Beat Bro's, residente en ALDA RECORDS. .::DJ BDO::. Snapchat: dj_bdo Instagram: @DJ_BDO","I'm at jerry's house 💀👅💦🍻 w/ @oswaldomendooza @dimejerry @brendaviloria_ @tanniasa https://t.co/Oodx1ko1hQ https://t.co/UY4nv1SKcM",,,"19.37379193","-99.10636031","MX","Iztapalapa, Distrito Federal","http://pbs.twimg.com/profile_images/667431127628558336/gbg3hcgs_normal.jpg","642","285","7","en","http://www.twitter.com/DJ_BDO/status/721183061031919616"
"721183060641914880 ","2016-04-16","03:46","Jonathan Strobel","JonathanStrobel","Jonathan Strobel is a graduate of Monmouth University, I majored in Comm-TV/Radio. I am always in the search for new opportunities (Internship, Freelance, Job)","I'm at BOCA POINTE SECURITY GATE- PALMETTO &amp; POWERLINE in Boca Raton, FL https://t.co/AlercoW0mx",,,"26.33606503","-80.16392906999999","US","Boca Raton, FL","http://pbs.twimg.com/profile_images/476864153227763713/RHoIpxAy_normal.jpeg","483","2062","15","it","http://www.twitter.com/JonathanStrobel/status/721183060641914880"
"721183060448808961 ","2016-04-16","03:46","LoUlOu.15","perez_louie66","living life and loving it..., Aries I Am Talk about or be about it If You Wanna know me Just ask  Senior at Devine High","But the real question is does she miss me #LLL",,,"29.1828506","-98.8451652","US","Natalia, TX","http://pbs.twimg.com/profile_images/628654499758895104/057JpkZE_normal.jpg","639","1466","2","en","http://www.twitter.com/perez_louie66/status/721183060448808961"
"721183059127578626 ","2016-04-16","03:46","Winn-Dixie Careers","WDCareers","Join our WINN-ing team and help make the lives of our customers and fellow associates FUN! Winn-Dixie is one of the nation's largest food retailers.","Join the Winn Dixie team! See our latest #Retail #job opening here: https://t.co/SVktrsLINQ #BRUNSWICK, GA #Hiring",,,"31.1915348","-81.4845112","US","Brunswick, GA","http://pbs.twimg.com/profile_images/636616310403653633/sIs1Iqbk_normal.png","527","252","334","en","http://www.twitter.com/WDCareers/status/721183059127578626"
"721183058037084160 ","2016-04-16","03:46","AdventistaTx","LewisvilleSDA",,"#másesperanza #adventista #bautizo #celebrating @ Iglesia Hispana Adventista del Septimo Dia de… https://t.co/B9FtrLS9Sz",,,"33.03668972","-97.01107183000001","US","Lewisville, TX","http://pbs.twimg.com/profile_images/378800000544106141/5800e663d3eca8e0ae662187ccc42517_normal.png","25","38","1","es","http://www.twitter.com/LewisvilleSDA/status/721183058037084160"
"721183056615383040 ","2016-04-16","03:46","Valeria Luna","velv14","Old soul","I'm at Aeropuerto Internacional de la Ciudad de México (MEX) - @aicm3 in Venustiano Carranza, DF https://t.co/IrtfdyzD5A",,,"19.43001034","-99.08041477","MX","Venustiano Carranza, Distrito Federal","http://pbs.twimg.com/profile_images/2367680891/image_normal.jpg","210","557","7","es","http://www.twitter.com/velv14/status/721183056615383040"
"721183050340634624 ","2016-04-16","03:46","Stefanie von Pfetten","stefanievon","Actor. You might know me from CBC's CRACKED among other shows. Dog-rescuer living in LA under the Hollywood sign.","Friday Night vibes #allanparsonsproject #eyeinthesky #music @ Beachwood Cafe https://t.co/h1vDkA4smP",,,"34.12009","-118.32124","US","Los Angeles, CA","http://pbs.twimg.com/profile_images/653783143971876864/mzpdp65Z_normal.jpg","1387","321","26","en","http://www.twitter.com/stefanievon/status/721183050340634624"
"721183050084691968 ","2016-04-16","03:46","ʈɑʈʈɨɲɠɕɦɨɕ","TattingChic","lacemaker, poet, lover of beauty, & muse.....","The soil is the great connector of lives, the source and destination of all. It is the healer… https://t.co/OKWy07L3cL",,,"40.635378","-111.863902","US","Cottonwood West, UT","http://pbs.twimg.com/profile_images/552947899907051521/tYuPPupG_normal.jpeg","541","504","43","en","http://www.twitter.com/TattingChic/status/721183050084691968"
"721183049094938624 ","2016-04-16","03:46","Linda Thi Le","Linda_Thi_Le","Twenty-two. Bay area native. Oldest sibling out of three kids. Redditor. I own a Sony Xperia Z1.","I'm at Ánh Hồng in San Francisco, CA https://t.co/NHRkRwPe71",,,"37.78632902","-122.41659393","US","San Francisco, CA","http://pbs.twimg.com/profile_images/720405594318970880/L7Kxh1YT_normal.jpg","159","673","10","es","http://www.twitter.com/Linda_Thi_Le/status/721183049094938624"
"721183049057222656 ","2016-04-16","03:46","SavorToothTiger","djimpulse","one half of Alfa Paare/ Skratch Makaniks Crew The Music Trust Snapchat- Djimpulse","Running tunes tonight at Bond inside of the cosmopolitan_lv 💃🏻🍾🔊 @ The Cosmopolitan of Las Vegas https://t.co/COgHUQ02Ew",,,"36.1096802","-115.174166","US","Paradise, NV","http://pbs.twimg.com/profile_images/632231827780927488/Kga3TB17_normal.jpg","2203","454","58","en","http://www.twitter.com/djimpulse/status/721183049057222656"
"721183046322393088 ","2016-04-16","03:46","Lee Edwards, CS, CSW","ledbeverages","Midwest Sales Representative for Haus Alpenz, LLC: Haymans. Dolin. Cocchi. Rothman&Winter. Rancio Wine. Cappelletti. Miro. also #WPS","One more @houndmouth pic from last night.  Solo encore by Matt before the rest of the band… https://t.co/H1q8HO98QE",,,"39.09886","-94.5836","US","Kansas City, MO","http://pbs.twimg.com/profile_images/485941572643463169/grmnjXJ2_normal.jpeg","1381","1116","60","en","http://www.twitter.com/ledbeverages/status/721183046322393088"
"721183046037164032 ","2016-04-16","03:46","DSM","mcmurrygram",,"Tomato gardening East Nashville style w/Joe🤔 #urbanfarm #farmlife… https://t.co/fEcDoAsTAg",,,"36.1725","-86.7597","US","Nashville, TN","http://pbs.twimg.com/profile_images/709928900239953924/j_WjKZLM_normal.jpg","95","552","5","en","http://www.twitter.com/mcmurrygram/status/721183046037164032"
"721183043789070339 ","2016-04-16","03:46","Jazzy B","bhunt29",,"THE V CHARLOTTE WE OUT HERE  BROADCASTING LIVE 10p-12a$5 FRIDAYS PRESENTS COCONUT AFFAIR.… https://t.co/02yLaIuT2M",,,"35.2314161","-80.84586731","US","Charlotte, NC","http://pbs.twimg.com/profile_images/546899758015860736/DZ3Kb2bW_normal.jpeg","261","457","8","en","http://www.twitter.com/bhunt29/status/721183043789070339"
"721183042014842880 ","2016-04-16","03:46","Sarah♕","_5arah","Dishing out on all things about my epicurious life while capturing cool and meaningful functions of tweets","There's more to Vietnamese soups than Pho! The abundance of ingredients in this #noodlebowl… https://t.co/DdDcsu6hnQ",,,"34.20184","-118.58849","US","Los Angeles, CA","http://pbs.twimg.com/profile_images/3389436577/c44e72614d746a6b942e82343763b154_normal.jpeg","39","39","4","en","http://www.twitter.com/_5arah/status/721183042014842880"
"721183041431871490 ","2016-04-16","03:46","Bits & Pieces","badside562","Our duty is to inform the public about the Most High God. We attempt to obtain this goal through the use of educational materials and other merchandise.","Watch “The Messiahs Resurrection” on YouTube https://t.co/RR5SybWAyQ https://t.co/21M6otyM3P",,,"33.770776","-118.187826","US","Long Beach, CA","http://pbs.twimg.com/profile_images/487997299788767232/M1EAKtJc_normal.jpeg","2323","2036","25","en","http://www.twitter.com/badside562/status/721183041431871490"
"721183040022585345 ","2016-04-16","03:46","SpotCrime","SpotCrime2","Mapping crime all the time","Other on 4800 BLOCK OF SPHINX WAY, Las Vegas, NV (via https://t.co/ClB2sZWs13): PERSON WITH A GUN https://t.co/YJZN7hnvRq",,,"36.2249886","-115.06861","US","Sunrise Manor, NV","http://pbs.twimg.com/profile_images/566445517/Spotcrime_robber_iconj_normal.jpg","52",,"46","en","http://www.twitter.com/SpotCrime2/status/721183040022585345"
"721183039984898048 ","2016-04-16","03:46","qrene'!©","qrene","Successful people are willing to do what  unsuccessful people are not.","Just posted a video @ Reunion Tower https://t.co/NWoFL8lyOt",,,"32.774957","-96.8099469","US","Dallas, TX","http://pbs.twimg.com/profile_images/378800000713971078/726e590389657e2bae9c7afe4cb187e7_normal.jpeg","41","24","6","en","http://www.twitter.com/qrene/status/721183039984898048"
"721183038097514496 ","2016-04-16","03:46","Joseph V. Lazo","LazoFitness","•Peace, Love, & Healthiness •Fashionisto of BravoTV's WorkOut NY •IG: LazoFitness •Info@LazoFitness.com •FB: Joe Lazo •YouTube: https://t.co/txN2jOYtNr","Game... #LazoLifestyle #Winner #Pool #NYC #Skills #PicOfTheDay #InstaPic #ItsAJob… https://t.co/KlqOcgSxqC",,,"40.761311","-74.00067900000001","US","Manhattan, NY","http://pbs.twimg.com/profile_images/661735404362735616/tG4OGj1l_normal.jpg","1291","272","26","en","http://www.twitter.com/LazoFitness/status/721183038097514496"
"721183035379593216 ","2016-04-16","03:46","Clau Jacobo","ClauJacobo","My door is always open so... feel free to leave","11 meses 😍😍😍 @javierosante (@ Hacienda Xcanatún - @hotelxcanatun in Mérida, YUC) https://t.co/XoHrotp7vn",,,"21.07503112","-89.62795758999999","MX","Mérida, Yucatán","http://pbs.twimg.com/profile_images/500603256264224768/rj-76T_Z_normal.jpeg","493","198","1","es","http://www.twitter.com/ClauJacobo/status/721183035379593216"
"721183034116939776 ","2016-04-16","03:46","TTWN Baltimore","TotalTrafficBWI",,"Disabled bus cleared in #BaltimoreCity on I-95 NB at Fort Mchenry Tunl and before Fort Mchenry Tunl Toll Plz, slo... https://t.co/tc9zsvnYIi",,"4","39.26418","-76.58936","US","Baltimore, MD","http://pbs.twimg.com/profile_images/439089670861770753/CqfFRxIM_normal.png","579","78","49","en","http://www.twitter.com/TotalTrafficBWI/status/721183034116939776"
"721183033672470529 ","2016-04-16","03:46","Mike Satterfield","TheGentRacer","Photographer, Designer, Blogger, & Entrepreneur.   https://t.co/rfuIygWLba","Enjoying the Long Beach Grand Prix. #longbeach #longbeachgrandprix #mazda #drivingmatters… https://t.co/XiSlAy7eEi",,,"33.7643558","-118.1857364","US","Long Beach, CA","http://pbs.twimg.com/profile_images/571911506956324864/SPWlyvyY_normal.jpeg","17572","889","154","en","http://www.twitter.com/TheGentRacer/status/721183033672470529"
"721183031843684353 ","2016-04-16","03:46","Brittany Ray","brittanyaray",,"Fun night! @ Point Clear Inn (Tennis and Swim) Club https://t.co/sJfqY2RbLs",,,"30.47346337","-87.90586175999999","US","Point Clear, AL","http://pbs.twimg.com/profile_images/523689134246752256/p_y_7NCl_normal.jpeg","200","143","1","en","http://www.twitter.com/brittanyaray/status/721183031843684353"
"721183030354665472 ","2016-04-16","03:46","Aparna Mukherjee","aparnamuk","Heart born, lost + found in NYC | Presently @PaleyMC | Priors @NYTimes @Business @CNBC @WSJ @AP | 1st social ed @McKinsey | @Columbia Bagehot @BrynMawrCollege","It's always almost 8 o'clock somewhere! #GNLMNO Turns 40 kicks off @ The McKittrick Hotel https://t.co/Wtp2wW5GDu",,,"40.750633","-74.00386","US","Manhattan, NY","http://pbs.twimg.com/profile_images/647792731/CenturyPlazaPose_Jan10_normal.jpg","3569","4191","373","en","http://www.twitter.com/aparnamuk/status/721183030354665472"
"721183030291865600 ","2016-04-16","03:46","Gebb Barrientos","GEBBadiah","Hey... How you doin'? For more info about what I'm passionate about, please visit:   http://t.co/ur2fg6rGef","Waka...Waka...Waka... ☺ @ ToysRUs https://t.co/s1H9cQB5fk",,,"33.85741679","-118.0916551","US","Cerritos, CA","http://pbs.twimg.com/profile_images/435601521040822273/r3KcoO_m_normal.jpeg","176","198","14","es","http://www.twitter.com/GEBBadiah/status/721183030291865600"
"721183029356531714 ","2016-04-16","03:46","囧 Daryll ︻┳═一","daryllORdie","(•̪●)=ε/̵͇̿̿/’̿’̿ ̿ ̿̿ ̿ ̿””","🚶🏼 @ Toronto, Ontario https://t.co/Y1ZSWXXDDl",,,"43.7166","-79.3407","CA","Toronto, Ontario","http://pbs.twimg.com/profile_images/686125665997983744/bKoW6yei_normal.jpg","92","91","4","pt","http://www.twitter.com/daryllORdie/status/721183029356531714"
"721183028974723072 ","2016-04-16","03:46","AHCStaff","AccountableHS","Accountable #Healthcare Staffing is a top rated national staffing corporation. We provide #PerDiem #Locums #PRMContract #travelnursing & #travelhealthcare","Interested in a #Nursing #job near #Newark, NJ? This could be a great fit: https://t.co/l7Ge1k1CKE #Hiring https://t.co/tBuyraVGSn",,,"40.735657","-74.1723667","US","Newark, NJ","http://pbs.twimg.com/profile_images/690612439960842244/IssUyFCG_normal.jpg","777","167","481","en","http://www.twitter.com/AccountableHS/status/721183028974723072"
"721183028379303937 ","2016-04-16","03:46","Lou Amdur","LouOnWine","I sell wine to thirsty people.","Shelf of DRY Sherries for tomorrow's Sherry fest. There are more wines, but they won't fit in… https://t.co/u7s3hzAfYh","1",,"34.1056533","-118.2875449","US","Los Angeles, CA","http://pbs.twimg.com/profile_images/720661866200965120/jkCoroez_normal.jpg","3456","946","186","en","http://www.twitter.com/LouOnWine/status/721183028379303937"
"721183026818846722 ","2016-04-16","03:46","Natalia","marita_anl","Me gusta mi estilo de vida y al que nooo que lastima, soy una chica xl curvy","Me siento malitaaaaa:(",,,"19.4590682","-99.2568816","MX","Naucalpan de Juárez, México","http://pbs.twimg.com/profile_images/684876768591790081/TfjxLTrt_normal.jpg","299","666","1","es","http://www.twitter.com/marita_anl/status/721183026818846722"
"721183026596581377 ","2016-04-16","03:46","Coral Dannatt","coralcarlcarol","20 • KSU • VCD • I rock the skull & crossbones, but still look good in pearls #EverForward | snap: coralcarlcarol","#SparkleSensations #✨ #TSNL2016 @ Kent Student Center https://t.co/QjNXEEW8Vt",,,"41.14717642","-81.34335966","US","Kent, OH","http://pbs.twimg.com/profile_images/713470230643798018/H_kLxsUu_normal.jpg","553","545","7","en","http://www.twitter.com/coralcarlcarol/status/721183026596581377"
"721183025044832256 ","2016-04-16","03:46","Chris Crush","permacrush","Stuntman & Frontman of Permacrush. SD California. Liberal and Bernie Supporter. A champion of marijuana. Hater of the New England Patriots. 80's Hair Band Fan.","😈 @ Oceanside, California https://t.co/ciNMU2Gnv8",,,"33.2116","-117.326","US","Oceanside, CA","http://pbs.twimg.com/profile_images/598183055220576256/v1PTcSrp_normal.jpg","4576","1685","28","es","http://www.twitter.com/permacrush/status/721183025044832256"
"721183023824248832 ","2016-04-16","03:46","CHEWPACABRA","chewpacabra","One half of @SATpodcast and one quarter of @FourColorPod L.A. Galaxy, ACB, Manchester United, Metal, Comedy, Comic Books, Nerd.","Drinking a DBA (Double Barrel Ale) by @FirestoneWalker at @hondacenter — https://t.co/FrBO3HUcgR","1",,"33.8079","-117.877","US","Anaheim, CA","http://pbs.twimg.com/profile_images/452930541948379136/0YRxeeCz_normal.jpeg","197","187","18","en","http://www.twitter.com/chewpacabra/status/721183023824248832"
"721183018870644736 ","2016-04-16","03:46","Karina R","dangerous_krock","I don't like wedding planning. Let me skip the planning and head straight to the wedding.","If you haven't tried the pretzel sandwiches at malted barely, you have no idea what you're… https://t.co/skxJlNGqd9",,,"41.8216349","-71.4141108","US","Providence, RI","http://pbs.twimg.com/profile_images/631607042160074752/RQn9oSLh_normal.jpg","158","349","12","en","http://www.twitter.com/dangerous_krock/status/721183018870644736"
"721183017616564224 ","2016-04-16","03:46","Shn.De.","pgh1934",,"Just posted a photo @ Roscoe's Chicken and Waffles https://t.co/cFKOXjx1JW",,,"33.9598999","-118.2742081","US","Los Angeles, CA","http://pbs.twimg.com/profile_images/2667482756/64e482dee97753e798e8157dc38e0393_normal.jpeg","131","200","30","en","http://www.twitter.com/pgh1934/status/721183017616564224"
"721183010851332096 ","2016-04-16","03:46","Shawn Thomas","sho_time1","Web developer, fan of real hip hop music and good laughs. Social media specialist, RNR Events Coordinator. (IG: @rnr_events) IG: @kryptonshawn","One more sleep to go! We've got what you need Saturday night - lots of R&amp;B and 'nuff reggae and… https://t.co/IHowETYB5E",,,"49.9","-97.13330000000001","CA","Winnipeg, Manitoba","http://pbs.twimg.com/profile_images/1002110800/DSC_1610_normal.jpg","256","596","14","en","http://www.twitter.com/sho_time1/status/721183010851332096"
"721183009777565696 ","2016-04-16","03:46","Robert O' Trebor","Otreborock","Productor de siniestros, caos y riesgos diversos. EN QUE TE PUEDO AYUDAR?","Comiendo #dogstyle @ Pizza del Perro Negro Guadalajara https://t.co/Jzt7oKvvaL",,,"20.67227733","-103.36822299","MX","Guadalajara, Jalisco","http://pbs.twimg.com/profile_images/613981886738665472/G5odWGpa_normal.jpg","183","852","5","es","http://www.twitter.com/Otreborock/status/721183009777565696"
"721183006187241473 ","2016-04-16","03:46","Kayla Hare","withlovekaylaaa",,"We love @andrewcecil_ace so you should too. 💗 @ PNC Park https://t.co/uKccbFnBDa",,,"40.44709673","-80.00615131000001","US","Pittsburgh, PA","http://pbs.twimg.com/profile_images/703619285814345729/CHWleGdR_normal.jpg","654","856","1","en","http://www.twitter.com/withlovekaylaaa/status/721183006187241473"
"721183006149500928 ","2016-04-16","03:46","Missy Rae","missyrae333","voiceover artist & chihuahua mama! these boots were made for stompin' https://t.co/WNCZQQ7ldU https://t.co/M1FaPRkJIV","i've got the pleasure of seeing some living legends tonite!! #ironmaiden #bookofsoulsworldtour… https://t.co/Ni0t9sTDU4",,,"33.9583","-118.34186","US","Inglewood, CA","http://pbs.twimg.com/profile_images/3312466217/b393f4358a030a35902ff8f5818c205f_normal.jpeg","58","149","1","en","http://www.twitter.com/missyrae333/status/721183006149500928"
"721183005264494592 ","2016-04-16","03:46","Smartacus","DrunknfistofDMV","I don't tweet much so probably not worth the follow. I'm really just here to laugh at the funny folks #Giants.  Yup,  dem my kids in the header","YES RT @NIGNORAMUS: 🔥 🔥 🔥 RT @Manny_Bodega: NEW RED DEAD REDEMPTION GAME IS IN DEVELOPMENT!!!!!!",,,"38.9009009","-76.98194341999999","US","Trinidad, Washington","http://pbs.twimg.com/profile_images/689668535899959296/vz8ji8_F_normal.jpg","116","224","6","en","http://www.twitter.com/DrunknfistofDMV/status/721183005264494592"
"721183001447657476 ","2016-04-16","03:46","Katie Cullen","Kiaxet","Writer, reader, AfterBuzz host, and IT professional. Have you turned it off and on again? #ABTVRebels #ABTVArrow #RWBYABTV #ABTVZNation #ABTVMuppets","I do like to make an entrance. @ImprovisedGen #TIGSeason2 #ImprovisedGen #Kiagram @ Impro Studio https://t.co/8naN6UTF2i",,,"34.102305","-118.292172","US","Los Angeles, CA","http://pbs.twimg.com/profile_images/580447199278067712/eihTIPBb_normal.jpg","1863","724","49","en","http://www.twitter.com/Kiaxet/status/721183001447657476"
"721183000503914496 ","2016-04-16","03:46","Alyssa Nicole","AlyssaNicole76",,"😀😊😄 Now, I'm watching the mid to ending of the 2009 Thriller/Horror movie The New... https://t.co/jWTckAGl9Z https://t.co/kaD5ebqDxY",,,"29.88667871","-95.54597871","US","Houston, TX","http://pbs.twimg.com/profile_images/717567243609964544/T__9Kkhw_normal.jpg","62","98","1","en","http://www.twitter.com/AlyssaNicole76/status/721183000503914496"
"721183000210354176 ","2016-04-16","03:46","Lisa Kaess","Feminomics","Lisa Kaess is founder and producer of Feminomics®, focusing on issues impacting women today - with a money twist.","Disco Fever!  Old School rules the dance floor tonight!! @ West Gate Lounge https://t.co/T7tduilsFc",,,"41.09296203","-73.93039637","US","Nyack, NY","http://pbs.twimg.com/profile_images/542085058547306496/Yl9sUuGm_normal.jpeg","284","325","6","en","http://www.twitter.com/Feminomics/status/721183000210354176"
"721182996624052224 ","2016-04-16","03:46","Notorious Ph.D.","Dr_BryantBest","Finding creative solutions to education's pressing policy issues. Founder of Community Conscious. NC ➡️ DC. Tweets are my own.","I wish I had a kid with me so I could have an excuse to fly too lol @ Universal Studios Hollywood https://t.co/R2PenJaMqu",,,"34.136518","-118.356051","US","Los Angeles, CA","http://pbs.twimg.com/profile_images/678623646013870080/bbu4kY_L_normal.jpg","973","962","16","en","http://www.twitter.com/Dr_BryantBest/status/721182996624052224"
"721182991121297408 ","2016-04-16","03:46","Marcela Cid","marceetweets",,"Black and white snaps. Nite peeps! Snapchat: marciinasnap 👻 Nite🌟🌟🌟 #miamibeach  #fitnessmodel… https://t.co/npFs9GLQCN",,,"25.84816527","-80.11974072","US","Miami Beach, FL","http://pbs.twimg.com/profile_images/666331474388525060/IQi-tvXP_normal.jpg","53","54","19","en","http://www.twitter.com/marceetweets/status/721182991121297408"
"721182990466834433 ","2016-04-16","03:46","Gonzalo Quintero","GonzaQuiLo","Venezolano residente en Orlando Florida, Especialista en area de transporte y turismo, practico escalada, excursionismo, hikking y trekking!","#indoorclimbing #climbing #climber #boulderinggym #bouldering #boulder #escalada #rockclimbing… https://t.co/8oPTROV1NR",,,"28.66788034","-81.20193227","US","Oviedo, FL","http://pbs.twimg.com/profile_images/718208596971008000/bPrrt8Up_normal.jpg","748","758","11","es","http://www.twitter.com/GonzaQuiLo/status/721182990466834433"
"721182989464379393 ","2016-04-16","03:46","Favorite Jobs","FavoriteJobs","We're your Advocate. We're your Family. Follow us for #healthcare & #nursing #jobs at @FavoriteStaff","Can you recommend anyone for this #Nursing #job? https://t.co/wWWaHF0gwn #ICU #RN #StaffordSprings, CT #Hiring https://t.co/8nIWhOToMg",,,"41.9542632","-72.3023022","US","Stafford Springs, CT","http://pbs.twimg.com/profile_images/663783434829955072/qirUW18u_normal.jpg","190","99","170","en","http://www.twitter.com/FavoriteJobs/status/721182989464379393"
"721182989351317504 ","2016-04-16","03:46","Allison Broz","Missallie3","Animal lover, bookworm, music nerd.","Drinking an El Kabong by @DuClawBrewing at @odonolds — https://t.co/nlbNXagGot",,,"41.1011","-80.7748","US","Austintown, OH","http://pbs.twimg.com/profile_images/707053764604239872/fkZLmEME_normal.jpg","111","330","1","en","http://www.twitter.com/Missallie3/status/721182989351317504"
