"721146667018223616 ","2016-04-16","01:22","David Chavez","davidchavez85","Wardrobe stylist/ Runway producer ass. Follow me on insta @davidchavez85","Outdoor shoot with great @calumwinsor Stylist/Groominng by me @davidchavez85 Photo by… https://t.co/zapqCmjTWe",,,"40.7142","-74.0064","US","Manhattan, NY","http://pbs.twimg.com/profile_images/623134653910794240/8-GabRYu_normal.jpg","61","109","12","en","http://www.twitter.com/davidchavez85/status/721146667018223616"
"721146666993246213 ","2016-04-16","01:22","Kim Schaper","kim_schaper","PT, nutrition coach, lover of life, health food junkie, proud doodle owner,total optimist, and queen of ass kicking!","Watching my mothers documentary @asisterscall never gets old.  I'm so dang proud of her for all… https://t.co/jtHGIL6o61",,,"34.30019426","-88.70526038","US","Tupelo, MS","http://pbs.twimg.com/profile_images/1643076610/kim2_normal.JPG","148","42","18","en","http://www.twitter.com/kim_schaper/status/721146666993246213"
"721146666493947904 ","2016-04-16","01:22","SF311 Reports","SF311Reports","This is account is not monitored and is used to post service request update information. To communicate with SF311, please use our main account 'SF311'","Opened Graffiti request via android at Intersection of Commercial St &amp; Grant Ave https://t.co/qQIBgv4twa. 766 clay. https://t.co/eq0ssWVnJq",,,"37.793736","-122.406255","US","San Francisco, CA","http://pbs.twimg.com/profile_images/378800000255346636/324671de53605fa795ab03eb73a7b0b5_normal.png","126",,"30","en","http://www.twitter.com/SF311Reports/status/721146666493947904"
"721146664916877312 ","2016-04-16","01:22","Kenya (Robinson)","kenya_9",,"Thanks for the suggestion #robynEnglish (gracethegreeneyedgrape) @ Greene Grape https://t.co/rHJSUlEe77",,,"40.68617","-73.97410000000001","US","Brooklyn, NY","http://pbs.twimg.com/profile_images/421749987/K_Rob__normal.jpg","510","269","18","en","http://www.twitter.com/kenya_9/status/721146664916877312"
"721146664593928192 ","2016-04-16","01:22","Andrea Rodriguez","2810_andrea","Soy BAUTISTER ❤ #SiMeDasTuCorazon|Mario me dio un Like el 12/12/15 ||Lucha por lo que quieres||","Me encantas @mariobautista_",,,"20.65809","-103.454345","MX","Zapopan, Jalisco","http://pbs.twimg.com/profile_images/710572966971486210/JyvpAEEB_normal.jpg","383","393","7","es","http://www.twitter.com/2810_andrea/status/721146664593928192"
"721146663902048256 ","2016-04-16","01:22","Rogelio L. Leal","rogeritboy","Lic. Administración. Escritor novato. No tienes que ser bueno para ser perfecto.","I'm at @Cinemex for The Jungle Book in Apodaca, Nuevo León https://t.co/FqkHGYwSLv",,,"25.78522649","-100.22779006","MX","Apodaca, Nuevo León","http://pbs.twimg.com/profile_images/720694432186503168/Cilp7shA_normal.jpg","1277","575","23","es","http://www.twitter.com/rogeritboy/status/721146663902048256"
"721146661809045504 ","2016-04-16","01:22","Stef Bones ","mem0rabilia","*Radiohead-Sigur Rós-Damien Rice-Arofnosky-Chelsea-Mannschaft*","☝️😌 (@ Nexo Restaurante in Polanco, Distrito Federal) https://t.co/gE3gtjBecq https://t.co/xy8xSaL0QU",,,"19.42810963","-99.19217930000001","MX","Miguel Hidalgo, Distrito Federal","http://pbs.twimg.com/profile_images/713485933983752193/I5KkO8nD_normal.jpg","392","305","15","it","http://www.twitter.com/mem0rabilia/status/721146661809045504"
"721146661179953152 ","2016-04-16","01:22","Dave Melton","_DaveMelton","Freelance sports writer in NW Indiana on the high school and college scenes. Chicago sports dork. Craft beer enthusiast.","Drinking a Wahnsinn by @NewOberpfalz @ Set 'Em Up Bowl — https://t.co/6MXdtywMKq",,,"41.5242","-87.42740000000001","US","Griffith, IN","http://pbs.twimg.com/profile_images/683170310217052161/l1WcfYr6_normal.jpg","872","961","28","en","http://www.twitter.com/_DaveMelton/status/721146661179953152"
"721146660924104705 ","2016-04-16","01:22","Lori Adams","insuremissouri","CEO, wife & mom. A Financial Coach with a passion for changing peoples lives, one conversation at a time.","Starved to death! (at @JackintheBox in Wentzville, MO) https://t.co/DqB24FmKSe",,,"38.81322259","-90.87418178999999","US","Wentzville, MO","http://pbs.twimg.com/profile_images/663212706606936064/22xRcWcR_normal.jpg","1452","2684","36","en","http://www.twitter.com/insuremissouri/status/721146660924104705"
"721146659938242560 ","2016-04-16","01:22","fulltimeGiGS Jobs","FTGiGSJobs","All #jobs all the time! Apply today!  Follow our official account @fulltimeGiGS for #jobsearch tips and career advice.","This #BusinessMgmt #job might be a great fit for you: Continuous Improvement Engineer... - https://t.co/DJk6rKlse3 https://t.co/F47n5Ojb85",,,"41.0586002","-94.3613474","US","Creston, IA","http://pbs.twimg.com/profile_images/657211104746061824/ABgu_N9n_normal.png","256","126","427","en","http://www.twitter.com/FTGiGSJobs/status/721146659938242560"
"721146659258941440 ","2016-04-16","01:22","✨βΩSS✨","x_nefertiti_x","January13. Capricorn. Kiss me, I'm Irish. Ambitious!! Freelance MUA C.Ω.L.Ω.U.R.S Young. Wild. Free.","Keep it cute.. 💁🏽😈😏 @ Lake Hico Park https://t.co/hpCkj6hs9n",,,"32.36826","-90.19276000000001","US","Jackson, MS","http://pbs.twimg.com/profile_images/683581767786299394/s4r6-_L-_normal.jpg","1065","1022","2","en","http://www.twitter.com/x_nefertiti_x/status/721146659258941440"
"721146658247999489 ","2016-04-16","01:22","Tyco Careers","TycoCareers","The world’s largest pure-play fire and security company is looking for talented people.  Join the winning team!","Tyco: Test Engineering Technician II (Brownsville, TX) TRS (#Brownsville, TX) https://t.co/NZrcbzifZF #Engineering #Job #Jobs #Hiring",,,"25.9017472","-97.4974838","US","Brownsville, TX","http://pbs.twimg.com/profile_images/505351998284107776/gWf9-mpG_normal.jpeg","1070","138","764","en","http://www.twitter.com/TycoCareers/status/721146658247999489"
"721146655223877632 ","2016-04-16","01:22","Jeff Foley","JeffFoleyPhoto","Photographer. Storyteller. Former Arena Football League player (Albany Firebirds). Former rapper (Kid Soul).","#lasvegas has a lot to offer. I get the feeling we will spend more time here in the future.… https://t.co/lNJczjdY1i",,,"36.17041412","-115.14368704","US","Las Vegas, NV","http://pbs.twimg.com/profile_images/1479051058/foley1web_normal.png","546","427","38","en","http://www.twitter.com/JeffFoleyPhoto/status/721146655223877632"
"721146652745154560 ","2016-04-16","01:22","Arnoldo Vasquez","ArnoldoVasquez8","PUMA EXPRESS","Just posted a photo @ Cancún, Q.R., México https://t.co/L3j9z4npJU",,,"21.11378041","-86.75888334","MX","Benito Juárez, Quintana Roo","http://pbs.twimg.com/profile_images/660934934568153088/hivBEUlc_normal.jpg","612","2789","2","es","http://www.twitter.com/ArnoldoVasquez8/status/721146652745154560"
"721146651969253376 ","2016-04-16","01:22","Erin Bates","CELEBATES","I create video content & throw parties. I wanna make you laugh while making you think. erinmariebates@gmail.com","candy girl @ Parker Palm Springs https://t.co/l22uMMRJEK",,,"33.79568806","-116.5002714","US","Palm Springs, CA","http://pbs.twimg.com/profile_images/702553262243782656/H9Uz6KYL_normal.jpg","2749","1617","63","en","http://www.twitter.com/CELEBATES/status/721146651969253376"
"721146651327524865 ","2016-04-16","01:22","Steve Flack","VitaminSteve","Hypocrite, Film/TV Editor, T-Shirt Connoisseur (http://t.co/fSQP2RzR6E), Lego Building Competition Winner (http://t.co/qcR6tr7syo)","@jannazagari no spoilers!",,,"40.7687687","-73.98187430999999","US","Manhattan, NY","http://pbs.twimg.com/profile_images/720409618669821956/SxXHCHTP_normal.jpg","307","651","22","en","http://www.twitter.com/VitaminSteve/status/721146651327524865"
"721146650442493952 ","2016-04-16","01:22","Prentice___XIII","jwprentice13",,"#crew #oneoldonenew #737 #AA #goodrimes @ Ronald Reagan Washington National Airport https://t.co/cyL6Z132W1",,,"38.85251035","-77.04247622","US","Arlington, VA","http://pbs.twimg.com/profile_images/532979136617529344/BnMdaQ0I_normal.jpeg","196","300","24","en","http://www.twitter.com/jwprentice13/status/721146650442493952"
"721146650366976004 ","2016-04-16","01:22","Tony Patton","TonyPatton2","Entrepreneur, Traveler, Music Trivia Specialist, Guitar Player, Social Enthusiast, and I try to be funny. Albuquerque Native. ABQ | SEA | SLC","House of Bae's in the Washington Neighborhood! #BowTieLife #TeamKillinIt #FirstNightOutc @ The… https://t.co/arlW2wvbx0",,,"38.89787989","-77.03598538999999","US","Washington, DC","http://pbs.twimg.com/profile_images/658167492926287872/8cyB-Cuw_normal.jpg","273","472","9","en","http://www.twitter.com/TonyPatton2/status/721146650366976004"
"721146650144698368 ","2016-04-16","01:22","Alina Vandenberghe","alinutzav","Passionate about life, brain science, tech, everything mobile-my tweets are a mashup of all the above.","I'm at @WeWork Dumbo Heights (Prospect) in Brooklyn, NY https://t.co/x0gjRTD4I5",,,"40.70068362","-73.98747081","US","Brooklyn, NY","http://pbs.twimg.com/profile_images/592207012961849344/8lfS5Cpx_normal.jpg","970","727","78","en","http://www.twitter.com/alinutzav/status/721146650144698368"
"721146649028890624 ","2016-04-16","01:22","JT Dorsey","JTDFoundation","The JT Dorsey Foundation is a non-profit organization that provides services to at risk youth and their families in the areas of education and wellness.","Another fantastic game day @JTDFoundation #soccerforsuccess @ussoccerfndn @ Camp Curtin YMCA https://t.co/ROypKijrdY",,,"40.28183","-76.89067","US","Pennsylvania, USA","http://pbs.twimg.com/profile_images/673818718/logo_normal.png","455","109","21","en","http://www.twitter.com/JTDFoundation/status/721146649028890624"
"721146648676577280 ","2016-04-16","01:22","Veggiebox","Veggiebox1","I love to garden!","Just posted a video @ 3rd &amp; Lindsley Nashville https://t.co/9pt9qNIsux",,,"36.1523","-86.7700607","US","Nashville, TN","http://pbs.twimg.com/profile_images/2157552767/image_normal.jpg","54","141","2","en","http://www.twitter.com/Veggiebox1/status/721146648676577280"
"721146648576057344 ","2016-04-16","01:22","Mitch Boivin","MitchJB",,"@GrahamDeLaet  you are going to win this season, I'm sensing it big time, cheering for you, hang in there.",,,"45.34721616","-75.68576757","CA","Ottawa, Ontario","http://pbs.twimg.com/profile_images/3000727280/0caf7e743227a8e5560d576cfe4adfc0_normal.jpeg","20","196",,"en","http://www.twitter.com/MitchJB/status/721146648576057344"
"721146647560986625 ","2016-04-16","01:22","ℓуѕѕ◡̈","AlyssaArnieri","chill","leave it all on the field @ Delran High School https://t.co/cB8XwxoOKP",,,"40.0139","-74.9427","US","Delran, NJ","http://pbs.twimg.com/profile_images/719707439512293378/4Dzn8qId_normal.jpg","1072","709","6","en","http://www.twitter.com/AlyssaArnieri/status/721146647560986625"
"721146646625538048 ","2016-04-16","01:22","Leanardo","RealLeadster","Find yourself worthy despite occasional human imperfection.","Listen to Can't Catch a Break by Masashi Hamauzu on @AppleMusic. https://t.co/djIREAkfyV https://t.co/dlBtxhTBzZ",,,"34.185336","-118.589075","US","Los Angeles, CA","http://pbs.twimg.com/profile_images/720590738099032064/fPJQ4xey_normal.jpg","1165","1617","14","en","http://www.twitter.com/RealLeadster/status/721146646625538048"
"721146646374039552 ","2016-04-16","01:22","Victoria Oscari","VictoriaOscari","Founder of Crafthouse SA, mother of dragons, lover of puns.","A San Antonio love affair #oyster bake #sanantonio #satx #chickenonastick #fiestasa @ Fiesta… https://t.co/h11Owbu9oe",,,"29.45288765","-98.56436841999999","US","San Antonio, TX","http://pbs.twimg.com/profile_images/643483443649581060/abC4erA5_normal.jpg","45","110",,"en","http://www.twitter.com/VictoriaOscari/status/721146646374039552"
"721146646344687616 ","2016-04-16","01:22","Kristina Coyne","TallBlondeXtina","Eastern Michigan University Track & Field Team. EMU Love Your Melon Vice Captain ❤️","Meant To Be A Cali Girl🤘🏼 #LoveYourMelon @ Seal Beach Calif. https://t.co/remP3a8V6Y","1",,"33.74427259","-118.10127625","US","Seal Beach, CA","http://pbs.twimg.com/profile_images/707373465200893952/zvzm4Ws6_normal.jpg","769","740","2","en","http://www.twitter.com/TallBlondeXtina/status/721146646344687616"
"721146643458826240 ","2016-04-16","01:22","LaNdY","LaNdyGoyA","SOY lo que estoy SIENDO, no lo que FUI ni lo que SERÉ.!!!","#coldplaymexico que empiece la noche!!! @ Foro Sol https://t.co/2GRaX38i9n",,,"19.40519633","-99.09592342000001","MX","Iztacalco, Distrito Federal","http://pbs.twimg.com/profile_images/717971159686340608/hweZjhDk_normal.jpg","1301","1236","5","es","http://www.twitter.com/LaNdyGoyA/status/721146643458826240"
"721146643354152960 ","2016-04-16","01:22","asaleacado♍","asaleahh","people misspell my name a lot","My mom: NAH WE'RE NOT GOING TO EAT My sister: WHY NOT? ARE YOU MAD BC I DIDN'T PAY FOR YOUR EYEBROWS??? Me: #FamilyClapBack","1",,"34.0795624","-117.1863992","US","Redlands, CA","http://pbs.twimg.com/profile_images/719683154395594752/adjRHPMo_normal.jpg","1031","679","8","en","http://www.twitter.com/asaleahh/status/721146643354152960"
"721146643249262593 ","2016-04-16","01:22","Alex Lynford","awlynford",,"I'm at @Walmart in White Plains, NY https://t.co/8YnXE2N67n",,,"41.03343165","-73.76565789999999","US","White Plains, NY","http://pbs.twimg.com/profile_images/543806693/n57600046_30196757_2746_normal.jpg","239","1132","2","en","http://www.twitter.com/awlynford/status/721146643249262593"
"721146642632728576 ","2016-04-16","01:22","Armando Arellano","_armandoarell","Introspectivo | Futuro mercadólogo | snap: ARMFX","Something different (@ Cineteca Nacional - @cinetecamexico in Benito Juárez, Distrito Federal) https://t.co/3NEACEvUb6",,,"19.36045574","-99.16390656999999","MX","Benito Juárez, Distrito Federal","http://pbs.twimg.com/profile_images/712161640104366080/nfKfhioE_normal.jpg","351","209","13","es","http://www.twitter.com/_armandoarell/status/721146642632728576"
"721146641332494336 ","2016-04-16","01:22","Hook Line & Schooner","HookLineSmyrna","New ambitious Seafood Coastal Tavern in the heart of Smyrna. We serve an array of the Fresh Seafood, Steaks, Salads, & Sandwiches.","Key lime pie. #treatyoself @ Hook Line &amp; Schooner https://t.co/MLhcUMRhd3","1",,"33.84388255","-84.48960669","US","Georgia, USA","http://pbs.twimg.com/profile_images/671132146589933568/fKW-zh6-_normal.jpg","465","1283","5","en","http://www.twitter.com/HookLineSmyrna/status/721146641332494336"
"721146640837558272 ","2016-04-16","01:22","Ms.Bogangles/stripes","EA_Stripes","Relatively Lovable. Intellectual Badass. Triathlete. Cat Enthusiast. Bacon Hoarder. Minnesota❤️, Louisiana state of mind Lovin'PURPLE & Livin'GOLD #KCCO","Always find a reason to smile even when you don't have any bacon!  #puppylove #myaussie #mygirl… https://t.co/oxCWyph3lw",,,"29.95171943","-90.1212489","US","New Orleans, LA","http://pbs.twimg.com/profile_images/519178272110682112/2ZC7srrd_normal.jpeg","6924","537","76","en","http://www.twitter.com/EA_Stripes/status/721146640837558272"
"721146640690765825 ","2016-04-16","01:22","Brian Ibarra","SaintDelfino89","sarcastic loveable jerk enjoying college student life at CSUS...tend to crack a joke or two","I'm at @SUBWAY in Sacramento, CA https://t.co/d2fQjIRPFd",,,"38.54741841","-121.35908546","US","Rosemont, CA","http://pbs.twimg.com/profile_images/708774724541657088/QG5cX_NT_normal.jpg","125","528","2","en","http://www.twitter.com/SaintDelfino89/status/721146640690765825"
"721146636639072256 ","2016-04-16","01:22","christielli","christielli","City girl, traveller, music lover, reader, educator, runner on hiatus, Blue Jays fan, cat person, and eternal optimist.","And we get to see the Edwing for the second time tonight! #OurMoment #BlueJays",,,"43.70961484","-79.38535901","CA","Toronto, Ontario","http://pbs.twimg.com/profile_images/656653502907858944/HezBKgH6_normal.jpg","177","262","10","en","http://www.twitter.com/christielli/status/721146636639072256"
"721146635669995521 ","2016-04-16","01:22","Simone Castello","simonecastello","Multi-platform journalist & digital content strategist. Online comms & marketing gal for @makeawishca. Travel enthusiast. Word nerd. Tweets are my own.","What is old is new. What is new is old. #uoft #universityoftoronto… https://t.co/NSrIZCNcTU",,,"43.66501","-79.39660000000001","CA","Toronto, Ontario","http://pbs.twimg.com/profile_images/662669277284012032/G8j8vgA2_normal.jpg","1015","807","45","en","http://www.twitter.com/simonecastello/status/721146635669995521"
"721146634231554048 ","2016-04-16","01:22","Dillon","Fullypaced15","I rep the bay. I'm a die hard Star Wars, Niners, Giants, Sharks, Warriors fan.","I'm at Bernal Heights in San Francisco, CA https://t.co/NYuO6l7xC6",,,"37.7390067","-122.41528988","US","San Francisco, CA","http://pbs.twimg.com/profile_images/706698859112562688/A8DZrtO8_normal.jpg","61","662","38","en","http://www.twitter.com/Fullypaced15/status/721146634231554048"
"721146633614991362 ","2016-04-16","01:22","League City, TX News","BLifeLeagueCity","League City BubbleLife features community news, photos and events. Share your business, organization or personal news and events at https://t.co/Ew7CTPM7Zf.","A$AP Bari &amp; A$AP Rocky Launch VLONE x Off-White Collaboration https://t.co/y6LhXFJInA",,,"29.51160049","-95.08709717000001","US","League City, TX","http://pbs.twimg.com/profile_images/530784239747215360/g-HJgtJs_normal.jpeg","159","122","3","en","http://www.twitter.com/BLifeLeagueCity/status/721146633614991362"
"721146633522692096 ","2016-04-16","01:22","Joe Mango","jmango72",,"Drinking a Hopslam Ale by @BellsBrewery @ Theman's Bar — https://t.co/1VEOyyWUIO",,,"40.4468","-80.2042","US","Imperial, PA","http://pbs.twimg.com/profile_images/2331335388/evuge30giyg739vt9d8f_normal.jpeg","30","108","1","en","http://www.twitter.com/jmango72/status/721146633522692096"
"721146632927125504 ","2016-04-16","01:22","Matt Jines","jngle24",,"Drinking a Reclaimed Rye by @creaturebeer at @creaturebeer — https://t.co/8HfKZM1k7W",,,"33.9591","-83.3801","US","Athens, GA","http://pbs.twimg.com/profile_images/528037326329368577/kHEl8y5__normal.jpeg","39","74","4","en","http://www.twitter.com/jngle24/status/721146632927125504"
"721146632268619776 ","2016-04-16","01:22","Pearland, TX News","BLifePearland","Pearland BubbleLife features community news, photos and events. Share your business, organization or personal news and events at https://t.co/FiJ3OvI9Ut.","Another Colorway Of The Nike Air More Uptempo Is Hitting Shelves https://t.co/f2UMY2eOyz",,,"29.5428009","-95.34570313","US","Pearland, TX","http://pbs.twimg.com/profile_images/532218263975899136/3mbBtE-3_normal.jpeg","169","122","1","en","http://www.twitter.com/BLifePearland/status/721146632268619776"
"721146630959992832 ","2016-04-16","01:22","Summerwood, TX News","SummerwoodBL","Summerwood BubbleLife features community news, photos and events. Share your business, organization or personal news and events at https://t.co/RFKZzJIewB.","Another Colorway Of The Nike Air More Uptempo Is Hitting Shelves https://t.co/gKot4YN0Cu",,,"29.90589905","-95.17030334","US","Texas, USA","http://pbs.twimg.com/profile_images/533017287981142016/efnemuUn_normal.jpeg","156","122","1","en","http://www.twitter.com/SummerwoodBL/status/721146630959992832"
"721146630854934528 ","2016-04-16","01:22","Michael","cypresstreeman","On a quest for Spirituality & Health & to help others Stay Positive Alter the mind to see the good in everything /|\","Just posted a photo @ Anytime Fitness Bossier City https://t.co/1DKYD592nW",,,"32.5607414","-93.71137643","US","Bossier City, LA","http://pbs.twimg.com/profile_images/683686672085549056/EVh9dPy1_normal.jpg","26","44",,"en","http://www.twitter.com/cypresstreeman/status/721146630854934528"
"721146630318198789 ","2016-04-16","01:22","LIVin","livpaloscio","keep what you love","spending my 16th with the ginger I've spent ten years with💗… https://t.co/gBZkUX0syI",,,"40.858342","-73.097919","US","Centereach, NY","http://pbs.twimg.com/profile_images/718918564019875840/odFfRuYN_normal.jpg","400","315","4","en","http://www.twitter.com/livpaloscio/status/721146630318198789"
"721146628825067520 ","2016-04-16","01:22","Jill Klucher","jillklucher","Living in the Live Music Capital of the world!","Getting ready... #arthritiswalk #arthritiswalk2016 Next Saturday 23Apr!! @ Academy Sports +… https://t.co/EdxcveVLfO",,,"30.42589","-97.75591","US","Austin, TX","http://pbs.twimg.com/profile_images/1393557625/Jill_10Jun_normal.jpg","232","512","8","en","http://www.twitter.com/jillklucher/status/721146628825067520"
"721146627939938304 ","2016-04-16","01:22","Loyola Athletics","LoyolaWolfpack","Loyola University New Orleans Athletics, Follow us on Facebook at http://t.co/5QUyPE3c1v and on Instagram -http://t.co/tdSBMs1Aya","BB: Wolf Pack drop Game 1 to Mobile, 11-1 in eight innings. Games 2 &amp; 3 will start tomorrow at 1:00 pm #backthepack",,"1","29.9751056","-90.2003232","US","Metairie, LA","http://pbs.twimg.com/profile_images/692869309308100608/VzpTAAb__normal.png","1766","1570","38","en","http://www.twitter.com/LoyolaWolfpack/status/721146627939938304"
"721146626631409664 ","2016-04-16","01:22","Kristen M. Clausell","Sugafree4","Married with children......Trying to make the best out of life, with any situation.....Cooking is my stress relief..*pass me a gin and tonic, with a lime twist*","I've been waiting for this moment... #cartablanca @ El Cerro Mexican… https://t.co/IrwODyEMgN",,,"34.85814","-76.89597000000001","US","Havelock, NC","http://pbs.twimg.com/profile_images/586037647757418496/522npzA__normal.jpg","161","244","3","en","http://www.twitter.com/Sugafree4/status/721146626631409664"
"721146625800957952 ","2016-04-16","01:22","ʜᴀɴɴʏ","danghanny","ℓιfє ιѕ ωнαт уσυ мαкє ιт тσ вє","These my bestfriends my bestfriends @ Sherlock's Addison! https://t.co/wKyyzJijLT",,,"32.95239462","-96.81994356","US","Addison, TX","http://pbs.twimg.com/profile_images/692529943289450496/WYouzQYb_normal.jpg","197","388","2","en","http://www.twitter.com/danghanny/status/721146625800957952"
"721146624051933190 ","2016-04-16","01:22","Pablo Valencia","Pablitohardy",,"I'm at Estadio Kukulcán in Mérida, YUC https://t.co/SpL475ibH2",,,"20.94045911","-89.59608007","MX","Mérida, Yucatán","http://pbs.twimg.com/profile_images/2381369995/ikkj9w77l54082mmpaj8_normal.jpeg","214","335","2","es","http://www.twitter.com/Pablitohardy/status/721146624051933190"
"721146624018354176 ","2016-04-16","01:22","Valeriia Vorobeva","Valskate88","Russian single and pair figure skater. ICE shows.Work in @Russianicestars","#mexico#mexicocity#aguascalientes#swimmingpool#firstdayinmecico#iceshow#illusiononice @ LQ Hotel… https://t.co/1WrAb3PpZX",,,"21.75558662","-102.27642059","MX","Aguascalientes, México","http://pbs.twimg.com/profile_images/705563858082078721/rv7MjASA_normal.jpg","222","161","10","en","http://www.twitter.com/Valskate88/status/721146624018354176"
"721146623208857601 ","2016-04-16","01:22","Jessica Maye","jchianese826","dancing to the beat of my own drum ✌️","Wow that is strong...crazy strong coffee taste that lingers but is... (Special Double Cream Stout) https://t.co/7Tw51tHkfV",,,"41.3167","-75.82810000000001","US","Exeter, PA","http://pbs.twimg.com/profile_images/604546845222780928/jGkfWuQ3_normal.jpg","245","255",,"en","http://www.twitter.com/jchianese826/status/721146623208857601"
"721146619102674945 ","2016-04-16","01:22","El Tal Ivan","IvancitoMavelk","Hay infinitos más grandes que otros infinitos. Él se enamoró de mis demonios, yo de su oscuridad; somos el infierno perfecto. https://t.co/l3ZaoMgkAN","¿Cómo decían? Ah sí,  ¡REGRESO TRIUNFAL! (@ La Purísima - @la_purisima in Cuauhtémoc, DF w/ @i_rob3rtoo) https://t.co/VM9FDTO8ET",,,"19.43747257","-99.13888362","MX","Cuauhtémoc, Distrito Federal","http://pbs.twimg.com/profile_images/718076152317747200/Rg0S4Qy1_normal.jpg","1442","755","9","es","http://www.twitter.com/IvancitoMavelk/status/721146619102674945"
"721146618217676801 ","2016-04-16","01:22","Bryan Lawton","bryan_lawton","Owner and Founder of BSick Fitness Apparel","BSick @ the Ballpark⚾️ @ Phillies Game @ Citizen's Bank Park https://t.co/P8wDlSUNZf",,,"39.90586081","-75.16654487","US","Philadelphia, PA","http://pbs.twimg.com/profile_images/662828600262066176/JbBkiyI1_normal.jpg","234","1089","16","en","http://www.twitter.com/bryan_lawton/status/721146618217676801"
"721146617412210688 ","2016-04-16","01:22","Rhythmless Fly Girl","2CrazySexyCruel",,"🇲🇽Mexico owes me nothing. I had the time of my life with these two… https://t.co/xUqWGrX352",,,"20.31840119","-87.35698643000001","MX","Quintana Roo, México","http://pbs.twimg.com/profile_images/712643448159907840/hU3eW4jk_normal.jpg","1364","553","12","en","http://www.twitter.com/2CrazySexyCruel/status/721146617412210688"
"721146614258081792 ","2016-04-16","01:22","SIMON Careers","SimonCareers","Follow us for job tweets about available positions with Simon across all of our various mall and office locations around the country.","#CustomerService #Job alert: Guest Services Representative -... | Simon | #Pleasanton, CA https://t.co/rBLQMFpgpn https://t.co/m3bubINE1H",,,"37.6624312","-121.8746789","US","Pleasanton, CA","http://pbs.twimg.com/profile_images/469461462767792128/Ss_5Np4J_normal.jpeg","1300","1607","422","it","http://www.twitter.com/SimonCareers/status/721146614258081792"
"721146613830459392 ","2016-04-16","01:22","Raj Gupta","dr_rajgupta","Anesthesiologist. Photographer. Husband. Father. Educator. Inventor. Podcaster. App Developer.  Tweets are my own & not medical advice.","Our paper made this list. Check it out! https://t.co/6VFryUbqGU",,,"36.15305898","-86.79581098","US","Nashville, TN","http://pbs.twimg.com/profile_images/534914822748401664/BXm8n9uA_normal.jpeg","332","233","19","en","http://www.twitter.com/dr_rajgupta/status/721146613830459392"
