"721162259800727552 ","2016-04-16","02:24","PHILIP GERBER","P_Gerber","———————––– Est. 1997 ———————––———–———— I play hockey ——————––———————– I play lacrosse ——————– —————––– Carolina Forest '16 —————–","This ball went from 0 to 100(mph) real quick. Photo Cred📷: @mercedesnw @ Carolina Forest High… https://t.co/lCQcqzo5AR","1",,"33.77665799","-78.97382519999999","US","Red Hill, SC","http://pbs.twimg.com/profile_images/709556744918274049/rgoSFhLV_normal.jpg","413","305",,"en","http://www.twitter.com/P_Gerber/status/721162259800727552"
"721162259020541952 ","2016-04-16","02:24","Shannon Jones","shanhayjo","Take me to the beach. Oh, and bring me a beer.","My 'hood✌🏽#aududonpark #lightupaudubon #dogwoodfestival #Louisville #ky #sterlingbeer @ Audobon… https://t.co/t8acdYPYBo",,,"38.20835955","-85.72790728","US","Audubon Park, KY","http://pbs.twimg.com/profile_images/704047053643636736/dijj6S9w_normal.jpg","76","411","5","en","http://www.twitter.com/shanhayjo/status/721162259020541952"
"721162258873606144 ","2016-04-16","02:24","King Of Facetious","JaPharii757","CEO @SickWittedEnt |Model | Dancer | Drummer | Marketing Consultant | Talent Manager | Comic | Host | IG JaPharii757 #Gemini | /G\ JaPharii.SickWitted@gmail.com","#LIVEVideo TONIGHT!  #AnAriesAffair @ Vertigo we 🔥🔥 celebrating @TheRealDJHavoc @EyeLOVEbEcky &amp;… https://t.co/XkW4O5r9yw",,,"36.81129371","-76.07278966","US","Virginia Beach, VA","http://pbs.twimg.com/profile_images/689424763505143808/DwvX4IFi_normal.jpg","4099","758","145","en","http://www.twitter.com/JaPharii757/status/721162258873606144"
"721162257359446017 ","2016-04-16","02:24","Corey Cross","ccrossphotog","Dad, husband, uncle, consultant, photog...just grinding the best I can!","arsenal_04_teal + Brookey #azarsenalsc #soccergirlsrock #arsenal04 @ Cheesecake Factory https://t.co/S7KCj7seZM",,,"33.39111","-111.68881","US","Mesa, AZ","http://pbs.twimg.com/profile_images/480854594810294272/hSsl4EZY_normal.jpeg","188","338","2","en","http://www.twitter.com/ccrossphotog/status/721162257359446017"
"721162251969937412 ","2016-04-16","02:24","Bahamian Connection","philipingraham","Authenitic Bahamian Cusine at it finest. Family own and operated in south florida 40 years. Best Boil Fish N Grits you ever had period.","Stew Grouper Fresh/ peas and johnny cake/ not the best no pay! TRY ME! @ Bahamian Connection… https://t.co/XXqX9oDmWs",,,"25.8168201","-80.199913","US","Miami, FL","http://pbs.twimg.com/profile_images/582996286254813184/jk5x3iJY_normal.jpg","174","667","1","en","http://www.twitter.com/philipingraham/status/721162251969937412"
"721162249339940864 ","2016-04-16","02:24","Nick Burton","SaucinSights","Traverse City Hounds alum #11 WCC ACHA #11 snapchat: saucinsights instagram: saucinsights","Hockey time @ Kensington Valley Ice House https://t.co/6SHb2NErJm",,,"42.51965381","-83.74386223","US","Brighton, MI","http://pbs.twimg.com/profile_images/378800000703453750/513eb059ac8835bdd00bedfcb63f587e_normal.jpeg","319","373",,"en","http://www.twitter.com/SaucinSights/status/721162249339940864"
"721162249151389700 ","2016-04-16","02:24","Cookie Fiend - Tony","tARCz4","[Gamer/Goofball/Goon] Father to a fantastic 5 year old boy [DND-Game.on.4.18.16.8pmEST]Friendly Neighborhood - Libertarian Egalitarian","Stout-Tastic @ The Official San Antonio Flying Saucer https://t.co/anMWw65WIr",,,"29.54797751","-98.57735599999999","US","San Antonio, TX","http://pbs.twimg.com/profile_images/717115599537577984/P7JU8ps7_normal.jpg","424","666","23","en","http://www.twitter.com/tARCz4/status/721162249151389700"
"721162247532376066 ","2016-04-16","02:24","Woody Chandler","WoodyChandler","Pittsburgh Sports Fan, Movie Buff, Beer Pest, USN (Ret.)","Took some Pils with this Friendly Greek czich and put some smooooth jaz... (Turntable Pils) https://t.co/Rz7j07gjZv #photo",,,"40.048","-76.295","US","Lancaster, PA","http://pbs.twimg.com/profile_images/1897434604/64315_3042525895008_1018898586_2785386_1177249644_n_normal.jpg","805","1999","33","en","http://www.twitter.com/WoodyChandler/status/721162247532376066"
"721162247507218432 ","2016-04-16","02:24","Emily Halem","EmilyHSweet16","My favorite colors is pink and purple and light blue.Food and I love BTR, JB, and many more!!✨❤️✨Mahomie✨Arianator✨R5 Family. CHW'17","Had fun tonight at Night At the Oscars Dance!😊💗💃🏼 @ Cherry Hill High School West https://t.co/OZyXd5Jo04",,"1","39.9288","-75.02","US","Cherry Hill, NJ","http://pbs.twimg.com/profile_images/679391122762899456/_FiewFZ0_normal.jpg","212","976","3","en","http://www.twitter.com/EmilyHSweet16/status/721162247507218432"
"721162247452626944 ","2016-04-16","02:24","Jon Webb","jonathanleewebb","Christ Follower, Husband, Father, Worship Pastor..in that order","Some of the best barbecue I've ever tasted. Appropriate our #lovelikejesus  series concludes… https://t.co/qm8z1k8bk6",,,"39.0574","-94.598178","US","Kansas City, MO","http://pbs.twimg.com/profile_images/561238293321236480/TYiUM2mL_normal.jpeg","552","553","26","en","http://www.twitter.com/jonathanleewebb/status/721162247452626944"
"721162240775307265 ","2016-04-16","02:24","jorge","LegendofJorge","Can't break the broken // Your senpai","@emma1370 Destined to be single and I'm okay with that",,,"39.53051188","-74.65182152","US","Egg Harbor City, NJ","http://pbs.twimg.com/profile_images/717789800426782721/Km_I8EEO_normal.jpg","633","343","11","en","http://www.twitter.com/LegendofJorge/status/721162240775307265"
"721162240393670656 ","2016-04-16","02:24","Terri","tmgerrn",,"Always her baby. 💗💙 @ Ohio Wesleyan University https://t.co/a9HTluC5EN",,,"40.29601","-83.06621","US","Delaware, OH","http://pbs.twimg.com/profile_images/557403091176140800/BS0km-wp_normal.jpeg","35","101","4","en","http://www.twitter.com/tmgerrn/status/721162240393670656"
"721162239579807744 ","2016-04-16","02:24","Sunrise Careers","Sunrise_Careers","We are always seeking exceptional people with a passion for working with seniors, and dedicated to caring for others.","Sunrise Senior Living #Healthcare : 13410300 - Wellness Nurse - 63073 (#SevernaPark, MD) https://t.co/5AReJTqP7O https://t.co/GekJ3XgFwr",,,"39.070388","-76.5452409","US","Severna Park, MD","http://pbs.twimg.com/profile_images/487328569106771968/MxGaQxH-_normal.jpeg","378","9","452","en","http://www.twitter.com/Sunrise_Careers/status/721162239579807744"
"721162236895576065 ","2016-04-16","02:24","CÉSAR FLORES","EMPERADOR_CESAR","tsss... De Sangre Azul (Soccer) y Cuervo (Football) a morir!!","Que comience la rumba.... (at @Bar-nies Bar in Fuentes de Aragon, Ecatepec, México) https://t.co/hIPHEkfwCI https://t.co/zq90bjtSKS",,,"19.516127","-99.02862500000001","MX","Ecatepec de Morelos, México","http://pbs.twimg.com/profile_images/524157847819784192/iG9RrkGI_normal.jpeg","313","947","2","es","http://www.twitter.com/EMPERADOR_CESAR/status/721162236895576065"
"721162235540807681 ","2016-04-16","02:24","Ginamarie Materese","GiGiMarie113",,"#Spooning #pinkberry @ Assembly Row at Assembly Square https://t.co/scVZ7psReP",,,"42.39449355","-71.08099778","US","Somerville, MA","http://pbs.twimg.com/profile_images/712116527336660993/-0DPfzZ8_normal.jpg","37","222","1","en","http://www.twitter.com/GiGiMarie113/status/721162235540807681"
"721162232977993729 ","2016-04-16","02:24","INSTITUTO  YITS'ATIL","InstitutoYitsa","Escuela bilingüe/Inteligencia emocional/Excelencia educativa Convenio con las mejores universidades del país KINDER PRE-FIRST  PRIMARIA SECUNDARIA PREPARATORIA","SECUNDARIA | Excursión Chichén Itzá 2016 Jueves 14 Abril. Actividades BE MAYA. Clase de Cocina… https://t.co/MJvSnUBJ2F",,,"20.63382344","-87.07183084","MX","Solidaridad, Quintana Roo","http://pbs.twimg.com/profile_images/446354349858357248/IMTZVX-n_normal.png","297","180","11","es","http://www.twitter.com/InstitutoYitsa/status/721162232977993729"
"721162232411910144 ","2016-04-16","02:24","Molly","mcferns21","I am a ginger.","Day one in NOLA and we already got a shrimp and grit titty @ Cafe Amelie https://t.co/gVDtLiQcNu",,,"29.9598217","-90.0629196","US","New Orleans, LA","http://pbs.twimg.com/profile_images/541772980905189376/HiB3uu_F_normal.jpeg","192","240","2","en","http://www.twitter.com/mcferns21/status/721162232411910144"
"721162231627390976 ","2016-04-16","02:24","Alfonso'Ponchi'Duque","xoxmino","Real Estate Professional","#bisonburger #lettucebuns #tomato #avocado #homemade #mayo #mustard… https://t.co/D2Q9r18orr",,,"32.71302374","-117.16072101","US","San Diego, CA","http://pbs.twimg.com/profile_images/2999820553/0bc9e251459f9ca1f048f4740886b590_normal.jpeg","159","208","8","es","http://www.twitter.com/xoxmino/status/721162231627390976"
"721162230826418181 ","2016-04-16","02:24","Steph Rountree","sfrountree","family.. Craig, Gray, Coop, Tate= LOVE!","W! #wvhsbaseball @ Anderson County High School https://t.co/3FctEiFo6C",,,"36.16046134","-84.09484913","US","Hillvale, TN","http://pbs.twimg.com/profile_images/481062142578151424/gu2X3whd_normal.jpeg","332","633","2","en","http://www.twitter.com/sfrountree/status/721162230826418181"
"721162230096482305 ","2016-04-16","02:24","Gb♡","_frannsgb","EA$Y COME, EA$Y GO. ♥ 18 for evaaaaaa! ♥","Tal vez tú nunca entiendas lo mucho que te quiero y lo bien que me haces.",,"1","19.4556522","-99.10590240000001","MX","Gustavo A. Madero, Distrito Federal","http://pbs.twimg.com/profile_images/716478915477286913/jG6mRA6i_normal.jpg","40","41","1","es","http://www.twitter.com/_frannsgb/status/721162230096482305"
"721162229798813696 ","2016-04-16","02:24","NickZumba","Nick_Za4","Fanático de la velocidad extrema! Llevo en la sangre la locura de la tecnología!!","#statueofliberty #libertyisland #newyork #peruviantraveler… https://t.co/XrK8u0PPqh",,,"40.68956811","-74.0456657","US","New York, NY","http://pbs.twimg.com/profile_images/706248004374638592/iJ-uNCAh_normal.jpg","129","314","3","es","http://www.twitter.com/Nick_Za4/status/721162229798813696"
"721162228632842240 ","2016-04-16","02:24","Cristopher Vzz","Cristophervzz","Tienes que aprender a hacer lo que no te gusta para terminar haciendo lo que te gusta. Me gustan los panditas y los tacos :D Multimedios Televisión • Monterrey","👀🔊🎼 (@ Facultad de Contaduría Pública y Administración UANL - @facpyaoficial in San Nicolas de los Garza, NL) https://t.co/wR77tVfsi3",,,"25.72769432","-100.30910254","MX","San Nicolás de los Garza, Nuevo León","http://pbs.twimg.com/profile_images/712484720659935232/PaDVTcrH_normal.jpg","226","332","10","es","http://www.twitter.com/Cristophervzz/status/721162228632842240"
"721162227303063553 ","2016-04-16","02:24","Andew Johnson","ajohnson_nsn","Thirty something owner of a successful IT firm in Blue Ash. Happily married father of three boys, and closet DJ.","The Banshee sleeps @donhelbig kingsislandofficial @ Kings Island https://t.co/bSvA7NtBYX",,,"39.34399607","-84.26784369000001","US","Mason, OH","http://pbs.twimg.com/profile_images/458028517851029504/s2zEBCzV_normal.jpeg","167","700","4","en","http://www.twitter.com/ajohnson_nsn/status/721162227303063553"
"721162222651752448 ","2016-04-16","02:24","6th And Detroit","6thAndDetroit","Vintage Home Decor","I couldn't have asked for a better neighbor 💃🏻💃🏻 Love you ayquevintage ! We are here until 6pm… https://t.co/YJKANuLYv1",,,"33.7682964","-118.1864849","US","Long Beach, CA","http://pbs.twimg.com/profile_images/595969254626754560/BF6SmfMx_normal.jpg","27","31","8","en","http://www.twitter.com/6thAndDetroit/status/721162222651752448"
"721162221028552708 ","2016-04-16","02:24","Don_Cerati","Don_Cerati","Life :: Music :: Travels :: Roots :: Craft Beers :: Cigars :: Nature :: Family :: Photography :: DJing! LIFE IS BEAUTIFUL NO MATTER WHAT!...","Not a fan of Kolsch, but this one hit the spot. - Drinking a Super Kölsch at @rockawaybrewco - https://t.co/pnXOHFJOVD",,,"40.747","-73.95489999999999","US","Queens, NY","http://pbs.twimg.com/profile_images/378800000775700841/a00fc9894fd438a69400a91b062ea0a8_normal.jpeg","335","310","30","en","http://www.twitter.com/Don_Cerati/status/721162221028552708"
"721162219455651842 ","2016-04-16","02:24","Dan","djvecellio","@penn_state and @TexasTech graduate. @TAMU PhD student. @OnwardState and @BSDtweet alumnus. Science and sports and writing and beer.","Drinking an Alamo Pilsner by @alamobeerco @ Carney's Pub — https://t.co/MOImZAvbPk",,,"30.6364","-96.35599999999999","US","Bryan, TX","http://pbs.twimg.com/profile_images/709560139963969537/M1_m3T0j_normal.jpg","1111","594","69","en","http://www.twitter.com/djvecellio/status/721162219455651842"
"721162219187122176 ","2016-04-16","02:24","Constantine Maroulis","marouli",,"#republicfridays with k_r_i_s_p @djchristopherc republicastoria tonight spinning the best in… https://t.co/32KuHMruDd",,,"40.770237","-73.914655","US","Queens, NY","http://pbs.twimg.com/profile_images/78601985/greece_06_normal.jpg","275","186","8","en","http://www.twitter.com/marouli/status/721162219187122176"
"721162218155323392 ","2016-04-16","02:24","Mary Mcginty","MaryMcginty5",,"@ForestWhitaker @UN_Women",,,"29.8867826","-95.1466276","US","Texas, USA","http://abs.twimg.com/sticky/default_profile_images/default_profile_1_normal.png","4","16",,"es","http://www.twitter.com/MaryMcginty5/status/721162218155323392"
"721162217090101248 ","2016-04-16","02:24","em","EmilyKurman","carolina born ☀️ philly raised ✊","Happy birthday beautiful!! Thank you for always being someone I can… https://t.co/SbGZhKpmKy",,,"40.038297","-76.342266","US","Pennsylvania, USA","http://pbs.twimg.com/profile_images/719624096103993345/ksIf0cqL_normal.jpg","686","602","1","en","http://www.twitter.com/EmilyKurman/status/721162217090101248"
"721162216939003904 ","2016-04-16","02:24","DeathMonkey","DeathMonkeyMMA","Faith, Family, and Fighting→MMA. Heavy Metal Cowboy.  Outlaw Country.   UFC.  Embracing the grind. Everyday I Fight-Chael P  #Cruz2016","lil' weekend humor... @NatalieCarternb 👊🍻😃 https://t.co/o3j8V5dO83",,,"45.5282231","-93.4550564","US","Minnesota, USA","http://pbs.twimg.com/profile_images/661364655810478080/A1iBxrzJ_normal.jpg","1330","1742","26","en","http://www.twitter.com/DeathMonkeyMMA/status/721162216939003904"
"721162215714398208 ","2016-04-16","02:24","claire♡","clairestuder","fths junior","uh, this that prom sh*t @ Woodlake Country Club https://t.co/yKPal5TwmN",,,"40.09022721","-74.17107296","US","Lakewood, NJ","http://pbs.twimg.com/profile_images/721117552408150016/78T_HNcL_normal.jpg","742","630","2","en","http://www.twitter.com/clairestuder/status/721162215714398208"
"721162214548353024 ","2016-04-16","02:24","The Stress Factor","Stress_Factor86","The Stress Factor is New England's best metal radio show. 91.5 FM WUML and http://t.co/cgbVKB8fNZ every Thursday from 6 to 9 PM ET","Live from the Citadel still killing on 91.5 WUML Lowell. #wuml #stressfactor… https://t.co/c33UyouDlB",,,"42.6527596","-71.3253021","US","Lowell, MA","http://pbs.twimg.com/profile_images/643971456729251840/uk9_zeg6_normal.jpg","267","934","15","en","http://www.twitter.com/Stress_Factor86/status/721162214548353024"
"721162213009027072 ","2016-04-16","02:24","Cesar Pulgar","Cesarpulgar","Ing. en Informatica, egresado de la URBE.","Just posted a photo @ The Woodlands, Texas https://t.co/3AGXnIJDIa",,,"30.1774","-95.5038","US","The Woodlands, TX","http://pbs.twimg.com/profile_images/483966843590156288/0K41EDq8_normal.jpeg","43","82","1","en","http://www.twitter.com/Cesarpulgar/status/721162213009027072"
"721162210437951492 ","2016-04-16","02:24","Robyn LaJoya","RobynLaJoya","Robyn LaJoya, youngest daughter of 12 to the late Ray Charles Robinson, is currently pursuing a career in music, radio, television, and non-profit.","Stance on #fleek @ The Pizza Spot https://t.co/HbbkUg2hLG",,,"33.79915","-84.51386599999999","US","Mableton, GA","http://pbs.twimg.com/profile_images/695036916966768640/E1Uzvhfa_normal.jpg","533","790","5","en","http://www.twitter.com/RobynLaJoya/status/721162210437951492"
"721162208349196288 ","2016-04-16","02:24","Vision Photography","VisionLookbook","We are a super chic Photography Studio in the heart of Colorado! We love creating beautiful images for our clients! Call us at 303.217.5280 for more info!","When you not only look amazing, but also have the sweetest personality ever! 😍 {Taylor}… https://t.co/clf8cvAsZI",,,"39.7392","-104.984","US","Denver, CO","http://pbs.twimg.com/profile_images/606907081099083776/iM5DjWqO_normal.jpg","277","129","17","en","http://www.twitter.com/VisionLookbook/status/721162208349196288"
"721162206797279232 ","2016-04-16","02:24","Monika George","reggaekimono","planet moon","Let me make you a dreamy lychee cocktail on this beautiful Friday night ✨🌓 #titosvodka #vodka… https://t.co/lUQElUNfwA",,,"33.50046221","-112.07416322","US","Phoenix, AZ","http://pbs.twimg.com/profile_images/699280248471289858/nVc_cfmd_normal.jpg","32","206","3","en","http://www.twitter.com/reggaekimono/status/721162206797279232"
"721162206751154176 ","2016-04-16","02:24","Stephen Day","darthweef","I'm this guy that loves craft beer, Disneyland & a guy named Kad.  JW in a past life, now free to think for myself. Advocate for equality.","Obligatory standing in line for a dole whip #selfie. #disneyland #DisneyBear @ Enchanted Tiki Room https://t.co/xx0t7BWWzS",,,"33.81177712","-117.91961451","US","Anaheim, CA","http://pbs.twimg.com/profile_images/718861735914909697/PVVISXWl_normal.jpg","2278","215","246","en","http://www.twitter.com/darthweef/status/721162206751154176"
"721162203672535041 ","2016-04-16","02:24","Israel!! ®  ⚽","IsraelZaragoza","Alegre, Fiestero, Trabajador, Amoroso. Pambolero Amante del Futbol Nacional e Internacional. Chivas, Barca, NFL, Steleers. Ron, Whisky ¡VIVA MEXICO! 1983","Nos corren muy tempra. (@ Fisher's Nápoles - @fishersmexico in Benito Juárez, DF) https://t.co/qlpcPNGEyg",,,"19.38901348","-99.17664864","MX","Benito Juárez, Distrito Federal","http://pbs.twimg.com/profile_images/552653306729078784/TFqFSaee_normal.jpeg","224","470","4","es","http://www.twitter.com/IsraelZaragoza/status/721162203672535041"
"721162203408293888 ","2016-04-16","02:24","David Landeros","DodgerDavid27","DODGERS FAN SINCE 87'","#mylife #hissmile #iloveyousomuch #spoiledrotten #dadsbaby @… https://t.co/Godh3oWXKv",,,"34.0528","-117.628","US","Ontario, CA","http://pbs.twimg.com/profile_images/494930110756057088/eU-x2Wz3_normal.jpeg","287","960","8","es","http://www.twitter.com/DodgerDavid27/status/721162203408293888"
"721162202846257152 ","2016-04-16","02:24","Lindsay Lords","LindsayLords",,"We may need to add a C before hunk on this outfit. 😉💙 #elilords @… https://t.co/vm9AYCmeJp",,,"34.4103714","-119.6866678","US","Santa Barbara, CA","http://pbs.twimg.com/profile_images/636183363963875328/VrjPLv5k_normal.jpg","84","138","3","en","http://www.twitter.com/LindsayLords/status/721162202846257152"
"721162198869880833 ","2016-04-16","02:24","DAVID MAGDAEL","nice1dave","PRECIOUS - i'm hungry!!!","We here!! #LaurynHill in #Broklyn #flatbush #kingstheatre #NYC #LBoogie @ Kings Theatre https://t.co/ZgsKKok489",,,"40.6459389","-73.9572678","US","Brooklyn, NY","http://pbs.twimg.com/profile_images/635024293630312448/kUFWR_X3_normal.jpg","1094","720","79","en","http://www.twitter.com/nice1dave/status/721162198869880833"
"721162196869345280 ","2016-04-16","02:24","Ashleigh Livingston","Ashleigh702","NPC Bikini Competitor. UNLV Personal Trainer. Kinesiology Major. @lennylarrys Ambassador. IG: ashleigh.livingston  Email: alivingstonfit@gmail.com","What up #fitfam?! I haven't posted in a while, I had to take a week break off of social media… https://t.co/r6lBCA5QoA",,,"36.14448034","-115.26509455","US","Las Vegas, NV","http://pbs.twimg.com/profile_images/653806014970490880/TpqH1_zU_normal.jpg","532","552","13","en","http://www.twitter.com/Ashleigh702/status/721162196869345280"
"721162196760309761 ","2016-04-16","02:24"," Zamora (°__°)","L_Daniel_Zamora","Amante del jugo de manzana, del chocolate, de la vida, la Tecnologia y de la historia / viajero por el mundo y futuro ing en TIC's y experto en java o(^_-)O","Godines time!! (@ Little Caesars Pizza in Aguascalientes, AGS) https://t.co/o7cEWpDOrj",,,"21.86567468","-102.30300944","MX","Aguascalientes, México","http://pbs.twimg.com/profile_images/622409385537482753/XhmOFMzF_normal.jpg","169","537","2","en","http://www.twitter.com/L_Daniel_Zamora/status/721162196760309761"
"721162196349112320 ","2016-04-16","02:24","GooGuns Lulz","googuns_lulz","@victor_zheng","bc218ecd031b20debb086ea2edd2548f97b8eed06960282c73dfbde1bf7097db88b0ba37598169ccc1d1a1264533c845c93cdb45c1e8aceb33d8cb827dab01bf695cfb000000",,,"53.55434019","-91.54235748000001","CA","Kenora, Unorganized, Ontario","http://pbs.twimg.com/profile_images/569542720855629824/zW4n8dog_normal.png","158","1","196","fr","http://www.twitter.com/googuns_lulz/status/721162196349112320"
"721162194646204416 ","2016-04-16","02:24","Brown Miller","brownmiller","http://t.co/2cfy1Q7Fho    you get SOCIAL   we handle the MEDIA","A Day of Hope – 3rd Annual House of Hope Event https://t.co/UA4TOzR1N9 https://t.co/DMz2S8sC7l",,,"33.964893","-116.575004","US","Desert Hot Springs, CA","http://pbs.twimg.com/profile_images/477552735693197312/Yh2EbjYh_normal.png","179","421","5","en","http://www.twitter.com/brownmiller/status/721162194646204416"
"721162194067537920 ","2016-04-16","02:24","Louis D Reyes","LDR_Visions","Garifuna Nugia","Me and my sis, mother of the bride. @ Henderson, Nevada https://t.co/kbgn1siqJw",,,"36.0292","-115.025","US","Henderson, NV","http://pbs.twimg.com/profile_images/133007912/IMG_3045re_normal.jpg","336","466","2","en","http://www.twitter.com/LDR_Visions/status/721162194067537920"
"721162193979449345 ","2016-04-16","02:24","i⚽ballistikmanny✌","ballistikmanny","Married to a wonderful woman☆  Goldblooded☆God Fearing Man☆Redeemed☆God is Great","Can't wait to see barbershop with my best friend my wifey you… https://t.co/P07Ly6aPLs",,,"37.7337367","-120.952178","US","Riverbank, CA","http://pbs.twimg.com/profile_images/539558382324035584/gZqBoQES_normal.jpeg","145","716","1","en","http://www.twitter.com/ballistikmanny/status/721162193979449345"
"721162193119625217 ","2016-04-16","02:24","Andrey Ogrenich","ogrenator23",,"Drinking a Two Hearted Ale by @BellsBrewery @ The Goat — https://t.co/maE3X2Dbtp",,,"40.0609","-82.8488","US","Columbus, OH","http://pbs.twimg.com/profile_images/540898664211042304/0M27dRd2_normal.jpeg","114","284",,"en","http://www.twitter.com/ogrenator23/status/721162193119625217"
"721162694028587008 ","2016-04-16","02:25","Sam, Sam","jezzsb_16","And good things are wild and free.","I'm at Parque Lindavista in Gustavo A. Madero, DF, México D.F. https://t.co/AGOeEH0uBO",,,"19.48617472","-99.13092613000001","MX","Gustavo A. Madero, Distrito Federal","http://pbs.twimg.com/profile_images/720341134896029701/OwTX3T6B_normal.jpg","119","167","3","es","http://www.twitter.com/jezzsb_16/status/721162694028587008"
"721162692661243904 ","2016-04-16","02:25","Jen Sherlock","JennyBentley","I'm an entrepreneur, a TV reporter, a PR queen, a Yo Philly host, and an event planner.  I love dogs, running & Philly sports.  I try to do it all!","First dip in Key West. @ Southernmost Beach Resort https://t.co/mU3R5ENFsv","1",,"24.54749562","-81.79576029","US","Key West, FL","http://pbs.twimg.com/profile_images/1564829773/BeSquared_Three_for_twitter_normal.jpg","3244","1811","106","en","http://www.twitter.com/JennyBentley/status/721162692661243904"
"721162689419075585 ","2016-04-16","02:25","Rich","FlatbushPapi","Henny Gawd x Navy God Got Us. Snapchat/Instagram: Flatbushpapi #TKIISTKIY","@alexxandraaher honestly if ya pops was saying that it's probably cuz he was busting cheeks everywhere and don't want you to be like him lol",,,"40.653728","-73.947857","US","Brooklyn, NY","http://pbs.twimg.com/profile_images/720740748359049216/kB_gEYPo_normal.jpg","513","457","13","en","http://www.twitter.com/FlatbushPapi/status/721162689419075585"
"721162687405621248 ","2016-04-16","02:25","IG:Trav Filmz","TravFilmz","| Creative Director | Brand Manager | Filmmaker | Marketing Pro. |","escolevi in studio #203 Studio dub sessions open spots link up for… https://t.co/28SbZIzppU",,,"40.7257","-74.2321","US","Irvington, NJ","http://pbs.twimg.com/profile_images/674972584056877056/oPOSTWje_normal.jpg","764","1243","35","en","http://www.twitter.com/TravFilmz/status/721162687405621248"
"721162687372201984 ","2016-04-16","02:25","Ty Everson","Ty_Everson","@3M Dedicated Driver for @TAdrivers. Huge @NASCAR, @Giants, and @OhioStFootball fan. @usairforce veteran and husband to @Angie_Everson.","All of today's bugs cleaned off and ready to kill some more tomorrow! @ The Everson Pad https://t.co/ZnMubbjICr",,,"38.75507245","-93.76374405","US","Warrensburg, MO","http://pbs.twimg.com/profile_images/720071918980706305/CXdaqeRI_normal.jpg","424","1258","18","en","http://www.twitter.com/Ty_Everson/status/721162687372201984"
"721162687120556034 ","2016-04-16","02:25","J. Victoria P.","JayVeePea","I love art, music and traveling. I hate traffic...A. Lot. I also dj a little on @ktru: https://t.co/VvcUh6J4IK","#4eversampson2016 @ New Orleans, Louisiana https://t.co/RaLcRCnbCh",,,"29.9728","-90.059","US","New Orleans, LA","http://pbs.twimg.com/profile_images/472353214671499264/LtkRPSy__normal.jpeg","384","477","27","en","http://www.twitter.com/JayVeePea/status/721162687120556034"
